vid,start,end,text
18fwz9Itbvo,940680,943510,"Yes, the traditional British style of beer"
18fwz9Itbvo,943510,945950,actually finishes its fermentation in the cask.
18fwz9Itbvo,945950,947640,"It's called cask-conditioned beer,"
18fwz9Itbvo,947640,950460,and you need to serve it out within three or four days
18fwz9Itbvo,950460,951650,once you've breached it.
18fwz9Itbvo,951650,953240,"If you don't serve it out that fast,"
18fwz9Itbvo,953240,955040,it can turn sour and flat.
18fwz9Itbvo,955040,956320,And nobody likes that.
18fwz9Itbvo,956320,957860,So it is a thing.
18fwz9Itbvo,957860,959560,"If you don't take care of your beer,"
18fwz9Itbvo,959560,961327,you might have to toss them out.
18fwz9Itbvo,961327,964087,"@JhoiraArtificer asked, ""Are hazy IPAs"
18fwz9Itbvo,964087,967407,"""just beer for people who would rather be drinking juice,"
18fwz9Itbvo,967407,969910,"""but wanna say they love IPAs?"""
18fwz9Itbvo,969910,971879,"Hmm, yes."
18fwz9Itbvo,971880,974270,"Basically, if you don't like big bitter beers,"
18fwz9Itbvo,974270,976490,you could still go for the hazy juicy style
18fwz9Itbvo,976490,980237,"and have your fruitiness, but not so much bitterness."
18fwz9Itbvo,980237,984677,"@rwilliams3 asked, ""With FDA laws so tough,"
18fwz9Itbvo,984677,986677,"""how do beer, wine, liquor makers"
18fwz9Itbvo,986677,989257,"""get away with not listing the ingredients?"
18fwz9Itbvo,989257,991840,"""What's really in my adult beverage?"""
18fwz9Itbvo,991840,993400,That is a good question.
18fwz9Itbvo,993400,997760,The answer to that is that we are not allowed to tell you
18fwz9Itbvo,997760,1000780,"what is in the beer, to a certain extent."
18fwz9Itbvo,1000780,1003610,It is strangely not legal in the United States
18fwz9Itbvo,1003610,1007079,"for us to publish, for example, nutritional information,"
18fwz9Itbvo,1007080,1008730,"even if it's 100% true,"
18fwz9Itbvo,1008730,1012079,"people worry that in the alcohol context,"
18fwz9Itbvo,1012080,1014170,you might try to gain advantage
18fwz9Itbvo,1014170,1017120,"by saying that your beer is, say, full of vitamins,"
18fwz9Itbvo,1017120,1018010,even if it is.
18fwz9Itbvo,1018010,1019900,One of those things that's just a weird thing
18fwz9Itbvo,1019900,1021750,about United States laws.
18fwz9Itbvo,1021750,1023400,"If you go to some other countries,"
18fwz9Itbvo,1023400,1025150,you might be required to actually
18fwz9Itbvo,1025150,1026410,put those things on the label.
18fwz9Itbvo,1026410,1028277,And I think it would be a pretty good idea.
18fwz9Itbvo,1028277,1033277,"@pattonsmith says, these anti-IPA tweets peaked in 2015."
18fwz9Itbvo,1034510,1037300,Who even makes super-hop-forward IPAs anymore?
18fwz9Itbvo,1037300,1039689,"Everything is hazy, fruity, citrus."
18fwz9Itbvo,1039689,1042360,"Log off Twitter and learn about beer, nerds."
18fwz9Itbvo,1042360,1043620,I think we might learn to be
18fwz9Itbvo,1043620,1044829,a little bit more inclusive here.
18fwz9Itbvo,1044829,1046130,There are a lot of people who like
18fwz9Itbvo,1046130,1049400,"the hazy, fruity, juicy, modern version,"
18fwz9Itbvo,1049400,1052090,and people who like the traditional sharp version.
18fwz9Itbvo,1052090,1053000,Drink what you like.
18fwz9Itbvo,1053000,1054740,That's the most important part of beer.
18fwz9Itbvo,1054740,1056318,We're here to have fun.
18fwz9Itbvo,1056318,1058901,[upbeat music]
18fwz9Itbvo,1060980,1062130,It's pretty good stuff.
