vid,start,end,text
69dLyztc-As,1766250,1771710,business how you insure your different  risks well first of all which are your
69dLyztc-As,1771710,1776840,risk you need to know your risk you need  to understand your risk you need to
69dLyztc-As,1776840,1783080,measure them in the last piece you need  to manage them or insure them with
69dLyztc-As,1783080,1788300,marketing again you may have many  different courses you can specialize in
69dLyztc-As,1788300,1794630,advertising take a separate course on  advertising you can get a separate  course on sales okay a lot of people in
69dLyztc-As,1794630,1800030,marketing they just do sales like a car  salesman or phone salesman or whatever
69dLyztc-As,1800030,1806780,you're selling okay  you could be product design how do we  make it better how do we make it more
69dLyztc-As,1806780,1811910,user-friendly what do they like  you know that's product design and of
69dLyztc-As,1811910,1817820,course marketing management how you  manage the marketing operations and
69dLyztc-As,1817820,1825980,there could be a bunch of other  marketing courses and with management  first how we manage people
69dLyztc-As,1825980,1831710,it's called Personnel Management how we  manage inventory called
69dLyztc-As,1831710,1838160,inventory management how we manage the  marketing marketing management very
69dLyztc-As,1838160,1844370,popular course is supply chain  management how you manage the supply
69dLyztc-As,1844370,1852260,chain there is another course sometimes  in here sometimes a separate course  called operations management how you
69dLyztc-As,1852260,1857750,manage your business operations whatever  you're doing okay you may be managing a
69dLyztc-As,1857750,1863920,hotel or a restaurant or a car  manufacturer and of course any other
69dLyztc-As,1863920,1868960,management so to summarize business
69dLyztc-As,1868960,1874640,specializations these are the four main  the four primary specializations after
69dLyztc-As,1874640,1882289,you've done your core you  take four or five of these within one  specific area and then you specialize in
69dLyztc-As,1882289,1889120,those there is an alternative  specialization which is instead of
69dLyztc-As,1889120,1894280,accounting business specializing it  could it be specializing in it
69dLyztc-As,1894280,1901909,international business right this is  what you're I understand doing and there
69dLyztc-As,1901909,1907250,is no difference between saying  international business and global
69dLyztc-As,1907250,1914419,business international Global means the  same so if you're studying in your case
69dLyztc-As,1914419,1922580,maybe a global business what do I think  is a good global business education how
69dLyztc-As,1922580,1928640,do we structure it well very simple you  will have or should have a course in
69dLyztc-As,1928640,1933770,International Economics in other words  the first course we had microeconomics
69dLyztc-As,1933770,1939700,and macroeconomics now you're going to  get international trade and
69dLyztc-As,1939700,1945799,international finance so International  Economics deals with international trade
69dLyztc-As,1945799,1952730,and finance a subject which is very  important for export oriented country
69dLyztc-As,1952730,1959260,like Korea again the next course is  accounting you're going to get a
69dLyztc-As,1959260,1965049,specialization international accounting  how you do accounting for we call this
69dLyztc-As,1965049,1971690,global accounting accounting for a  company that has global operations in
69dLyztc-As,1971690,1978950,many different countries how you take  the accounting of five different  countries and put it all together how
69dLyztc-As,1978950,1986390,you deal with currencies and currencies  going up and down in other words  accounting for global corporations is a
69dLyztc-As,1986390,1993980,little trickier and you learn those  tricks here similarly you take a finance
69dLyztc-As,1993980,2000000,and finance for global corporations we  call these multinational corporations
69dLyztc-As,2000000,2005110,has its own tricks has its own  complications you just call it
69dLyztc-As,2005110,2012540,international finance okay  or how you manage the finances of
69dLyztc-As,2012540,2019270,multinational corporations  similarly with marketing not with you
69dLyztc-As,2019270,2025600,take each of the four cores core courses  accounting and into international
69dLyztc-As,2025600,2030700,accounting finance get international  finance marketing you do international
69dLyztc-As,2030700,2036160,marketing in management you know  International Management and I would
69dLyztc-As,2036160,2043030,think maybe not necessary but it's nice  it's very good and it's very helpful if
69dLyztc-As,2043030,2050530,you do an extra course international law  if you're doing business understanding
69dLyztc-As,2050530,2059110,at least some law is helpful is nice  it's important so this is my view of how
69dLyztc-As,2059110,2064179,I would structure an international sorry
69dLyztc-As,2064179,2071260,yeah international business program of  course you can add more courses  international politics and all sorts of
69dLyztc-As,2071260,2077919,other things but this is the basics now
69dLyztc-As,2077919,2083740,what other extensions you may have what  are not what you've done your core
69dLyztc-As,2083740,2088780,you've done our specialization but if  you want to get a little further and
69dLyztc-As,2088780,2096669,there is usually time in a business  school you may study some programming  languages especially important is to
69dLyztc-As,2096669,2102850,learn at least one statistical  programming language in other words you
69dLyztc-As,2102850,2108910,have many statistical softwares and the  statistical software usually have a
69dLyztc-As,2108910,2114400,basics of non basic meaning some simple  programming language so that you can
69dLyztc-As,2114400,2120970,learn how to program statistical  software so learning some programming
69dLyztc-As,2120970,2127660,languages is very helpful especially  statistical type languages there are
69dLyztc-As,2127660,2132730,many statistical packages maybe one or
69dLyztc-As,2132730,2140140,two of those is helpful next database  systems it always helps to know and
69dLyztc-As,2140140,2149559,understand  databases information is what you need  to manage and make decisions and
69dLyztc-As,2149559,2155660,information is usually stored in  databases so understanding databases and
69dLyztc-As,2155660,2162890,database systems is always helpful not  necessary but it's a good idea
69dLyztc-As,2162890,2169220,well one way that it's done or another  little broader subject which is usually
69dLyztc-As,2169220,2177680,done in most business schools in the  world is called Mis management  information systems and part of
69dLyztc-As,2177680,2186920,information system will include of  course database systems but it will  include security connectivity it's going
69dLyztc-As,2186920,2192609,to include whatever is related to  technology and technology being used in
69dLyztc-As,2192609,2200690,businesses it's a fairly helpful course  to have and it's a separate you may have
69dLyztc-As,2200690,2205730,web systems or internet systems how to  use the internet for marketing
69dLyztc-As,2205730,2212480,management or whatever the things are  that you may do and of course in general
69dLyztc-As,2212480,2217759,I'm talking about  also general languages whether it's
69dLyztc-As,2217759,2226359,English which is today the language of  all business around the world and of  course tourism now the rising star is
69dLyztc-As,2226359,2235759,Chinese Japanese has been always popular  and possibly Arabic which is more exotic
69dLyztc-As,2235759,2241539,okay so these are business extensions
69dLyztc-As,2243289,2249209,okay you may have a business extension  in law you may study a little bit
69dLyztc-As,2249209,2255449,further law like introduction to law  it's nice to have it's also very nice to
69dLyztc-As,2255449,2262679,have business law again it's not part of  the core but it's a nice extension you
69dLyztc-As,2262679,2268739,may have specifically contract law how  to make and manage contracts this one is
69dLyztc-As,2268739,2275939,tricky because contract law in Japan is  going to be different from Korea  different from China different from
69dLyztc-As,2275939,2281369,Bulgaria different from America so  contract law is not the same around the
69dLyztc-As,2281369,2290029,world and maybe some international law  so you may extend into the area of law
69dLyztc-As,2291289,2297569,so I'm trying now to summarize I've  already discussed all of these things
69dLyztc-As,2297569,2303749,this is a simple table that you're  having you may have within the field so
69dLyztc-As,2303749,2312179,you're going to have let's say for an  international business what would you at  least study is the basics well for
69dLyztc-As,2312179,2319380,quantitative stuff business math and  statistics maybe you can take a third  course maybe not maybe you can take
69dLyztc-As,2319380,2325619,statistical packages and statistical  programming is number three it's not on
69dLyztc-As,2325619,2333269,there next for economics microeconomics  macroeconomics and international
69dLyztc-As,2333269,2339630,economics which includes international  finance and trade accounting financial
69dLyztc-As,2339630,2344789,accounting managerial accounting and  international or global accounting I'm
69dLyztc-As,2344789,2352589,just putting it all together this is  just the same information in one table  for convenience finance financial
69dLyztc-As,2352589,2357630,management maybe financial management  tool or investments international
69dLyztc-As,2357630,2365900,finance marketing one maybe advertising  or marketing to international marketing
69dLyztc-As,2365900,2370970,management management one personnel  management international manager
69dLyztc-As,2370970,2377720,and possibly for others you may include  some Mis or maybe business law or maybe
69dLyztc-As,2377720,2384770,international law that's again the core  you can extend in different ways up to
69dLyztc-As,2384770,2392079,your choices or up to the goals of the  university or the goals of the
69dLyztc-As,2392079,2399560,administration let's see what else we  have I should be okay that's my last
69dLyztc-As,2399560,2405530,section well I've been teaching both  Business and Economics for about 15
69dLyztc-As,2405530,2414770,years in eight different countries and  I've seen a lot of programs fail or a
69dLyztc-As,2414770,2421369,lot of programs aren't doing very well a  lot of programs are mediocre of course
69dLyztc-As,2421369,2427430,some Pro programs succeed so what are  the typical problems what really you
69dLyztc-As,2427430,2432800,have to be careful about or watch about  or what are the common mistakes number
69dLyztc-As,2432800,2438770,one  it's very simple weak foundations they  study a lot of business but they don't
69dLyztc-As,2438770,2443990,know basic accounting well they somehow  study accounting but don't learn
69dLyztc-As,2443990,2449510,anything about the counting okay  that's the most common mistake they
69dLyztc-As,2449510,2457819,study accounting to actually pass the  exam they pass the exam and they forgot
69dLyztc-As,2457819,2464569,about it this is known in education is  the toilet flush you know it's a toilet
69dLyztc-As,2464569,2470030,right you know what's a flush students  study study study study learn when the
69dLyztc-As,2470030,2477260,exam comes they pass they flush and  everything goes down the toilet and they  forget everything don't remember
69dLyztc-As,2477260,2483890,anything anymore okay so weak  foundations they don't understand basic
69dLyztc-As,2483890,2490310,finance that's very common they just say  oh I'm a marketing guy I don't need to
69dLyztc-As,2490310,2496460,know finance and that's a very common  mistake of thinking culture and
69dLyztc-As,2496460,2504610,mentality especially of an 18 or 19  year old kid you know when you're 30 say
69dLyztc-As,2504610,2513330,oh I should have learned better  accounting I should have learned better  finance so don't underestimate the
69dLyztc-As,2513330,2520570,foundation that's the first one the  second common mistake and that's very  common I've seen it everywhere is many
69dLyztc-As,2520570,2527890,fancy course fancy course is a course  which sounds very nice it sounds very
69dLyztc-As,2527890,2534310,modern it's got a little bit of a  contact contents but it's not big enough
69dLyztc-As,2534310,2539890,it's not broad enough they just feature  a little bit about this and that's it
69dLyztc-As,2539890,2548080,like promotion strategies and that's a  whole course well that stuff you study  for a week or two so instead of another
69dLyztc-As,2548080,2554200,let me emphasize focusing on the  foundations in the core they provide a
69dLyztc-As,2554200,2562330,lot of little courses that only look at  a few things the third one which I've
69dLyztc-As,2562330,2568630,seen a lot and I mean a lot almost  everywhere is few course chapters they
69dLyztc-As,2568630,2574650,study accounting in the study five  chapters oh five chapters is not enough
69dLyztc-As,2574650,2583570,studying five chapters you're not going  to learn a lot of accounting you're  going to learn some but it's little when
69dLyztc-As,2583570,2590040,I was studying at one University and we  teach finance students study four
69dLyztc-As,2590040,2597250,chapters in financial management in one  semester and then four chapter in the
69dLyztc-As,2597250,2602410,next semester well how far you're going  to go so then financial management one
69dLyztc-As,2602410,2610390,two three and four and for two years  they study one textbook that has 16
69dLyztc-As,2610390,2616420,chapters  well that's not exactly good education  where a textbook that is taught in one
69dLyztc-As,2616420,2623110,or two semesters you spread over four  semesters you need to cover on average
69dLyztc-As,2623110,2629800,about ten chapters per semester whether  its marketing management accounting good
69dLyztc-As,2629800,2636960,universities will typically cover 15 in  bad universities will cover  or seven but teaching we're studying
69dLyztc-As,2636960,2643910,three four or five chapters is a joke  and that's very common around the world
69dLyztc-As,2643910,2649470,the next one which I've seen is too many  project it's like the marketing teacher
69dLyztc-As,2649470,2655859,loves to give students a project right  so it gives them a project but  management teacher also gives them a
69dLyztc-As,2655859,2661950,project oh and the finance teacher gives  them a project and suddenly every
69dLyztc-As,2661950,2667559,teacher gives them a project and the  students like I have five five projects
69dLyztc-As,2667559,2672569,and they're doing the project copy the  projects and they forgot what they're
69dLyztc-As,2672569,2677940,about and they forgot that they gotta  actually sit and learn and understand so
69dLyztc-As,2677940,2683730,the learning is not very important it's  about make the project deliver the
69dLyztc-As,2683730,2689809,project and of course with the projects  come presentations and students focus on
69dLyztc-As,2689809,2695700,ten minute presentation so the whole  semester they study to make a ten minute
69dLyztc-As,2695700,2701940,presentation all right on the project  instead of learning all the important
69dLyztc-As,2701940,2707630,stuff so that's actually not fault for  the students that's fall for the
69dLyztc-As,2707630,2714480,teachers in the department in general  that's fault of the organization same
69dLyztc-As,2714480,2719539,thing heavily weighted projects heavily  weighted project means the project is
69dLyztc-As,2719539,2724950,fifty percent of the grade and again  when it's 50 percent do you have similar
69dLyztc-As,2724950,2731039,courses now here you got a course and  half of the grade is on the project well
69dLyztc-As,2731039,2737880,when half the grade is on the project  the students focus on the project and  they ignore the other stuff if you get
69dLyztc-As,2737880,2743249,the project well then you make your  presentation you're going to get most of  your grade you don't have to study the
69dLyztc-As,2743249,2751140,rest well that's a common design problem  well it's actually designed to make
69dLyztc-As,2751140,2756680,students pass quickly and easily in  students pass and they get good grades
69dLyztc-As,2756680,2762779,but they don't learn much it's not about  learning it's not passing the grades and
69dLyztc-As,2762779,2770250,making it easy for students well II  it is not necessarily good let me see
69dLyztc-As,2770250,2775830,what else yes same thing poor and easy  exams again this is mostly a fault of
69dLyztc-As,2775830,2782070,the professors and of course the last  one is everyone's passing nobody is
69dLyztc-As,2782070,2788250,failing if you know that you're not  going to fail because we don't fail  anybody the result is you don't study
69dLyztc-As,2788250,2794910,much let's see what else cuz I'm running  out of time ok these are very quickly
69dLyztc-As,2794910,2800400,maybe you some maybe use many of these  the most common one is called memorizing
69dLyztc-As,2800400,2808170,you sit and you memorize right before  the exam the night before the exam you
69dLyztc-As,2808170,2815130,do this now in Thailand they don't study  the night before the exam they studied  the morning before the exam so the
69dLyztc-As,2815130,2824640,example is 11 o'clock they started 9 in  10 o'clock  quickly they come on the exam you don't  learn a lot by memorizing and cramming
69dLyztc-As,2824640,2829770,usually whatever you learn by the  afternoon it's all forgotten ok the next
69dLyztc-As,2829770,2837270,one is study from PowerPoint very common  students loved PowerPoint and then they
69dLyztc-As,2837270,2844460,just read the PowerPoint and said you  cannot get education from PowerPoint
69dLyztc-As,2844460,2851160,PowerPoint is not meant for study  PowerPoint is meant for presentation to
69dLyztc-As,2851160,2859320,make a presentation easier but you can't  study you can't get an education from  PowerPoint of course not reading the
69dLyztc-As,2859320,2865890,textbook most students around the world  especially in poor what meaning low
69dLyztc-As,2865890,2871710,quality business programs they don't  read the textbook well if you want to
69dLyztc-As,2871710,2877050,learn you gotta read it's simple as that  the only way to learn is with good
69dLyztc-As,2877050,2882240,reading you need to train your skills to  read to analyze and all the other things
69dLyztc-As,2882240,2890280,you're just thinking oh if I listen to  the lecture if I take notes no you need  to read the book not enough exercises
69dLyztc-As,2890280,2895500,this applies mainly for accounting  accounting needs exercises for each
69dLyztc-As,2895500,2903089,chapter you need to solve five or ten  problems ok  very important next one is big group
69dLyztc-As,2903089,2908200,exercises they give you an exercise and  they put six people on the group what
69dLyztc-As,2908200,2913359,happens is one student works in the  other one play the phone or chatting or
69dLyztc-As,2913359,2919390,talking or you know that's that's a  group should be two people at maximum
69dLyztc-As,2919390,2925630,three four or more is usually one or two  the students don't really work that much
69dLyztc-As,2925630,2931420,and that's the same thing as group free  writing free writing is you get the
69dLyztc-As,2931420,2939430,benefit without doing the work so for  example the four of you work on the same  project and maybe two or three work hard
69dLyztc-As,2939430,2947200,and one will don't work hard okay of  course too much fun too much party
69dLyztc-As,2947200,2953640,that's already known too much internet  too much Facebook too much chatting okay
69dLyztc-As,2953640,2958890,so now I'm asking my students in Kyllo  how much time you spend on average on
69dLyztc-As,2958890,2966490,Facebook four hours well when do you  study well you know there I might put on
69dLyztc-As,2966490,2973000,a lot of time to study okay  so too much fun and another one study
69dLyztc-As,2973000,2978519,for grades only you started just to get  a well that's you know you don't need
69dLyztc-As,2978519,2985930,that in grades it's not as important  it's the knowledge is understanding the  business and finally I've seen it a lot
69dLyztc-As,2985930,2992049,I don't know why but it's a problem more  of an Asian phenomenon as opposed to
69dLyztc-As,2992049,2998890,European or American kids go to business  because mom and dad think it's a good
69dLyztc-As,2998890,3004380,idea so mom and dad want you to study  business you go and study business to
69dLyztc-As,3004380,3011460,make parents happy maybe you don't care  about business maybe you like I don't  know drawing or painting or photography
69dLyztc-As,3011460,3019079,or art or history or something else you  like but you don't go to study what you  like you study what your parents want
69dLyztc-As,3019079,3025710,you to study so this makes for poor  motivation students are not motivated go
69dLyztc-As,3025710,3032810,let me try and finish before  can all right conclusion business study
69dLyztc-As,3032810,3039830,is general not easy people think it's  easy but it's not there are too many
69dLyztc-As,3039830,3048230,business programs everywhere around the  world and the field is competitive and  maybe in career more than 100 business
69dLyztc-As,3048230,3053540,programs in general I mean I know in  Thailand there are 100 I know in Taiwan
69dLyztc-As,3053540,3059780,during 100 so you gotta be good because  if you're not good someone else will be
69dLyztc-As,3059780,3066290,and will have a job for you and a lot of  times students underestimate reality oh  they just want a little bit of marketing
69dLyztc-As,3066290,3072680,I'm ok well short answer is you're  probably not going to be ok so most
69dLyztc-As,3072680,3078290,students fail meaning they graduate they  didn't learn much and what they do they
69dLyztc-As,3078290,3085450,go for a master's degree ok ok just  waste more time next one
69dLyztc-As,3085450,3090590,most students when they graduate they  can't get a job meaning they can't get a
69dLyztc-As,3090590,3096410,good well-paying job yes they get a job  and they become a bartender they get a
69dLyztc-As,3096410,3102050,job and become a secretary but again do  you study for 4 years in business to be
69dLyztc-As,3102050,3110030,a secretary or to be a bartender or to  be a waiter  ok or to be a hotel receptionist and the
69dLyztc-As,3110030,3115850,answer is no we don't study four years  for that but that's what most people do
69dLyztc-As,3115850,3121040,and I heard it and I've been in many  countries the same thing oh there are no
69dLyztc-As,3121040,3126170,jobs there are no jobs when we graduate  and I heard especially this in Bahrain
69dLyztc-As,3126170,3133700,they said oh there are no jobs doesn't  matter what in the short answer is no  there are plenty of jobs but the jobs
69dLyztc-As,3133700,3138770,are only for the skilled people so it  turns out that especially when I was
69dLyztc-As,3138770,3145310,teaching in Bahrain but in other places  for the good students let's say I have a  class of fifty maybe six or seven will
69dLyztc-As,3145310,3150500,be top students these six or seven will  already get a good well-paying job
69dLyztc-As,3150500,3155690,waiting for them and the others don't  have a job at all in other words for the
69dLyztc-As,3155690,3160880,good students there are always good  well-paying job
69dLyztc-As,3160880,3170030,and for the poor students there's simply  no jobs and I would like to conclude by
69dLyztc-As,3170030,3176960,wishing you good luck in your business  education and we have a little bit of
69dLyztc-As,3176960,3184700,time if you have any questions maybe you
69dLyztc-As,3184700,3190160,have some questions please don't be shy  don't worry you've any questions or
69dLyztc-As,3190160,3196960,concerns or you're curious about  something please don't hesitate to ask
69dLyztc-As,3198010,3208040,yes it's very simple good students study
69dLyztc-As,3208040,3215810,regularly consistently throughout the  semester and the good student reads the
69dLyztc-As,3215810,3221840,textbook and of course pays attention in  the best student just the bad student  they just come to class they look
69dLyztc-As,3221840,3227000,quickly they prepare before the exam and  of course the big difference is what
69dLyztc-As,3227000,3232430,they remember two weeks after the exam  two weeks after the exam the good
69dLyztc-As,3232430,3237440,student remembers most of the stuff and  the bad student doesn't the other big
69dLyztc-As,3237440,3246920,difference is good students try to  understand and bad students just  memorize its primary difference more
69dLyztc-As,3246920,3251770,questions on the back
69dLyztc-As,3252309,3259039,in this area I haven't been able to  actually spend it looks at you any
69dLyztc-As,3259039,3265309,questions no yeah
69dLyztc-As,3265309,3272420,that's very common here especially in  Asian students don't ask questions  they just sit quietly well if you got a
69dLyztc-As,3272420,3279229,question you got to learn to ask you got  to learn to ask questions you got to  learn to be active you got to learn to
69dLyztc-As,3279229,3286450,be proactive you got to be curious any  other questions
69dLyztc-As,3289359,3294559,yes please  I personally don't know what which thing
69dLyztc-As,3294559,3301150,is the important thing which is not  important thing so I think they were  writing it though
69dLyztc-As,3301150,3306319,no the short answer is definitely not we
69dLyztc-As,3306319,3312049,have done this long time ago  memorization was the way of education of
69dLyztc-As,3312049,3318130,"the West 2,000 years ago we did that"
