vid,start,end,text
69dLyztc-As,0,8610,it's been actually exactly 25 years  since I began business that is like you
69dLyztc-As,8610,17130,marketing in management I started on  October 1 of 1990 that's when I began to
69dLyztc-As,17130,23430,study and back then of course I had no  idea what I will study what I am
69dLyztc-As,23430,30000,supposed to study or what these studies  will provide me or give me what kind of
69dLyztc-As,30000,38399,opportunities I will have well now I'll  try to do that for you
69dLyztc-As,38399,46039,today's lecture will have the following  topics first I will discuss some
69dLyztc-As,46039,55670,foundation courses then business core  courses then business specializations
69dLyztc-As,55670,63769,business extensions and because I've had  over 15 years of teaching experience
69dLyztc-As,63769,72000,education problems how in why business  programs mostly fail around the world
69dLyztc-As,72000,79320,and then I'll have a short conclusion  for you I understand that I have about
69dLyztc-As,79320,84930,45 to 50 minutes to present this and
69dLyztc-As,84930,92909,maybe 15 20 minutes for questions and  discussion now I did not originally know
69dLyztc-As,92909,101939,and I want to make very clear that today  I talk about business education and I
69dLyztc-As,101939,107670,will talk specifically about global  business and global business is very
69dLyztc-As,107670,114240,different from Global Studies global  business is a small field of Global
69dLyztc-As,114240,121680,Studies  Global Studies will include politics it  willing to include global or
69dLyztc-As,121680,127950,international law it will include  culture cultural anthropology Global
69dLyztc-As,127950,135300,Studies is very big I'm focusing first  only on  business basic business is business is
69dLyztc-As,135300,145769,taught in business schools around the  world okay okay so we're business begin
69dLyztc-As,145769,152510,what is the foundation of business in  other words what do you need in terms of
69dLyztc-As,152510,160200,background in order to begin  understanding business and the two areas
69dLyztc-As,160200,166560,that you need to understand is  quantitative methods quantitative
69dLyztc-As,166560,176120,methods basically means math and  economics you need to understand basic
69dLyztc-As,176120,185390,economics before you can do any business  studies so let's a little bit about each
69dLyztc-As,185450,191750,if you're a business student you want to  take basic quantitative methods and
69dLyztc-As,191750,198389,usually we separate these quantitative  methods in two subjects or in two areas
69dLyztc-As,198389,206690,the first air is just business math this  is standard math which is used mostly in
69dLyztc-As,206690,213510,business there is nothing very special  mathematics is a broad field and you're
69dLyztc-As,213510,219019,going to study only those specific  things that are commonly used in
69dLyztc-As,219019,224400,business and of course accounting  finance in general so that's business
69dLyztc-As,224400,231209,math I think you are already or have  already taken business math course the
69dLyztc-As,231209,237319,second one that you do is business  statistics and business statistics is
69dLyztc-As,237319,242630,about analyzing and interpreting data
69dLyztc-As,242630,249359,usually in the real world you will see a  lot of data  maybe interest rates over many many
69dLyztc-As,249359,258959,years  maybe exchange rates over many years  maybe economic growth or if you want to
69dLyztc-As,258959,265320,look at economic growth you may try to  relate the economic growth to investment
69dLyztc-As,265320,271950,or economic growth to consumption or  economic growth in the case of Korea
69dLyztc-As,271950,277500,with exports so statistics will try to
69dLyztc-As,277500,285360,tell your basic relationship which is  let's say in the case of Korea most
69dLyztc-As,285360,293460,important for economic growth of Korea  is it consumption or is it investment or
69dLyztc-As,293460,300840,is it exports you may have many  different theories and you may guess
69dLyztc-As,300840,308100,many different things but with  statistics you can get the data you can
69dLyztc-As,308100,314850,analyze and you can try to discover  relationships and based on the data you
69dLyztc-As,314850,320370,can conclude which is more important or
69dLyztc-As,320370,325650,which is the most important factor in  other words in business statistics have
69dLyztc-As,325650,333870,you already studied basic statistics or  you will have you studied already so
69dLyztc-As,333870,341520,basic statistics will tell you these  relationships okay the second foundation
69dLyztc-As,341520,349470,before you begin real Business Studies  is economics you see if I have the next
69dLyztc-As,349470,358650,slide and economics is divided into of  course over 15 different fields you have
69dLyztc-As,358650,365100,let me just read to microeconomics and  labor economics you have International
69dLyztc-As,365100,372290,Economics yet international trade  international finance you have labor
69dLyztc-As,372290,380880,economics okay you have many different  fields in economics in general basic
69dLyztc-As,380880,386790,economics which we sometimes call  principles of economics or introduction
69dLyztc-As,386790,394860,to economics includes these two fields  microeconomics and macroeconomics you
69dLyztc-As,394860,400470,need these to understand  general business micro economics
69dLyztc-As,400470,405789,concerns the behavior of individuals the
69dLyztc-As,405789,414039,behavior of consumers and the behaviors  of families how families get job their
69dLyztc-As,414039,420430,income how families spend their income  how much they spend on food
69dLyztc-As,420430,428410,how much on cars how much on housing in  other words how families make economic
69dLyztc-As,428410,435910,decisions the economic decisions are  about making money and spending money
69dLyztc-As,435910,441280,respectively investing money in other  words what you do with your money
69dLyztc-As,441280,446590,so that's microeconomics the second part  of microeconomics is about the
69dLyztc-As,446590,453389,businesses you look about one business  how the business is managed
69dLyztc-As,453389,460830,microeconomics tells you how much labour  how much workers to employ how much
69dLyztc-As,460830,468280,capital to employ possibly possibly a  little bit of how much to borrow then it
69dLyztc-As,468280,476169,tells you how much to produce how to  price your product and in general the
69dLyztc-As,476169,485009,main concern for firms is how to  maximize profits about business is about
69dLyztc-As,485009,492940,making money is about making profits in  microeconomics focus is on how to make
69dLyztc-As,492940,500919,maximum profits which usually boils down  to how much to produce and sell and at
69dLyztc-As,500919,506280,what price macro economics is about the
69dLyztc-As,506280,514649,general economy the general economy is  about production and output we call this
69dLyztc-As,514649,520169,GDP gross domestic production is about
69dLyztc-As,520169,528010,labor is an employment we call these  jobs it's about are there a lot of jobs
69dLyztc-As,528010,534600,or a future  next one is about wages are the jobs
69dLyztc-As,534600,540340,well paid or poorly paid okay the next
69dLyztc-As,540340,548070,thing is about interest rate interest  rate is the cost of capital so
69dLyztc-As,548070,554680,macroeconomics concerns about labour in  the cost of labour and capital in the
69dLyztc-As,554680,560530,cost of capital cost of capital is  interest rates and macroeconomics is
69dLyztc-As,560530,565810,concerned about exports and imports and
69dLyztc-As,565810,571750,is concerned about the most important  price in the economy the most important
69dLyztc-As,571750,578490,price of the economy is the price of  money we call the price of money
69dLyztc-As,578490,586120,exchange rate how much the Korean  currency exchanges for Chinese currency
69dLyztc-As,586120,594550,for US dollars for Japanese yen or for  European euro so macroeconomics again is
69dLyztc-As,594550,600120,concerned about employment and wages
69dLyztc-As,600120,606730,about business output in business prices
69dLyztc-As,606730,615100,in other words business profitability  about MP exports imports and exchange
69dLyztc-As,615100,621520,rates this is what macroeconomics is all  about so these are the foundations
69dLyztc-As,621520,628590,before you need to specialize further  into business this is the background
69dLyztc-As,628590,631590,next
69dLyztc-As,633600,644350,next if you study or when you study  business you study four main areas we
69dLyztc-As,644350,652149,can also call them four main fields the  or four main subjects okay the four
69dLyztc-As,652149,657430,fields are accounting finance marketing
69dLyztc-As,657430,665250,and management and I'll discuss each one  of these now accounting is the language
69dLyztc-As,665250,671100,of business is translating business
69dLyztc-As,671100,678970,activity into numbers so that numbers  can everyone understand the trick in
69dLyztc-As,678970,685510,accounting is that you as Koreans can  read a European business accounts and
69dLyztc-As,685510,692589,you can interpret and understand them or  me having studied in the US and come
69dLyztc-As,692589,699399,from Bulgaria can read Korean accounting  statements and understand what they mean
69dLyztc-As,699399,704709,and how we interpret them so let's talk
69dLyztc-As,704709,711000,about each of these accounting is
69dLyztc-As,711000,718450,separated sometimes they call it  principles of accounting sometimes they  call it introduction to accounting the
69dLyztc-As,718450,726940,accounting field is generally separated  in two major sub areas first one is
69dLyztc-As,726940,733420,called financial accounting the second  one is called managerial accounting you
69dLyztc-As,733420,741870,need to learn and understand both this  is the foundation for every business
69dLyztc-As,741870,749470,financial accounting is how you make the  accounts and how you report them how you
69dLyztc-As,749470,754810,report the accounts we call these  financial statements to the owners of
69dLyztc-As,754810,764470,the business to the government to  investors to bankers to creditors in
69dLyztc-As,764470,770260,other words this is account  which is designed for people outside the
69dLyztc-As,770260,775300,firm and it is highly standardized we
69dLyztc-As,775300,781450,have and now almost the whole world uses  what's called international accounting
69dLyztc-As,781450,786700,standards we use them in Bulgaria they  are all used of course in Thailand
69dLyztc-As,786700,791740,they're used in America everywhere in  Europe I'm pretty sure you in Korea and
69dLyztc-As,791740,797410,I I know for sure Japan's using them  China is now introducing them so that
69dLyztc-As,797410,804220,the statements are done here as well as  there and everywhere in the world in the
69dLyztc-As,804220,809950,same way you read them the same way you  make them the same way you interpret
69dLyztc-As,809950,816750,them the same the same way so that's  financial accounting it gives you a
69dLyztc-As,816750,823510,balance sheet with assets and  liabilities it gives you an income
69dLyztc-As,823510,831730,statement with revenues expenses in  profits and it gives you cash flows how
69dLyztc-As,831730,838770,money is coming in and how money is  going out so that's financial accounting
69dLyztc-As,838770,847980,managerial accounting is accounting  designed to serve the needs of
69dLyztc-As,847980,855700,management so that management can make  decisions these are going to be internal
69dLyztc-As,855700,862540,reports they're going to be used by the  CEO and CFO the marketing manager the
69dLyztc-As,862540,869830,production manager they're going to be  used to see what the costs are what is
69dLyztc-As,869830,877260,the cost of a product how to price a  product how much to produce how much
69dLyztc-As,877260,884650,supplies to order it will include  budgets budgets for inventory budgets
69dLyztc-As,884650,891460,for ordering okay it will include all of  those things managerial accounting is
69dLyztc-As,891460,898990,accounting for managerial purposes and  managerial purposes how management makes
69dLyztc-As,898990,906510,the  decisions inside the firm so this is  standard accounting for outsiders and
69dLyztc-As,906510,913560,this is whatever management needs for  decision-making you need to study
69dLyztc-As,913560,921269,accounting first before you study  finance before you study management
69dLyztc-As,921269,929040,before you study marketing and before  you study any other things except of
69dLyztc-As,929040,934980,course math in economics okay so you do  math and economics first then the third
69dLyztc-As,934980,941399,subject is accounting you can do  financial accounting and possibly maybe
69dLyztc-As,941399,948500,you could study marketing or management  in parallel
69dLyztc-As,952110,960200,next is finance in finance focus focus  is on money finance is the subject of
69dLyztc-As,960200,966600,managing money the subject which is  commonly taught and it's usually in all
69dLyztc-As,966600,972240,business school is called financial  management in financial management is
69dLyztc-As,972240,979290,exactly that how you manage money how  you manage business money sometimes this
69dLyztc-As,979290,985680,course is called in many business  schools corporate finance in corporate
69dLyztc-As,985680,993450,finance is how you manage money for big  corporations in other words if you let's
69dLyztc-As,993450,999390,say do accounting books or finance for  Samsung it's got major corporation you
69dLyztc-As,999390,1005180,need corporate finance financial  management and corporate finance is
69dLyztc-As,1005180,1013120,about 90 percent the same corporate  finance has stuff specific to big
69dLyztc-As,1013120,1018860,corporations you generally need  financial management in financial
69dLyztc-As,1018860,1024319,management is how you manage the assets  of the company
69dLyztc-As,1024319,1031069,how you manage liabilities of the  company and the most important part is
69dLyztc-As,1031069,1037459,how you manage investments how you make  investments when you make an investment
69dLyztc-As,1037459,1044780,you want to make proper calculation to  find out is the investment profitable or
69dLyztc-As,1044780,1054280,not profitable what's the return on  investment so finance is focus is on
69dLyztc-As,1054280,1062480,investment but not only okay financial  management is about financing financing
69dLyztc-As,1062480,1069860,means how you get money do you get it by  a bank loan do you borrow money from the
69dLyztc-As,1069860,1077620,bank or do yourself bonds in other words  you borrow money from the bond market or
69dLyztc-As,1077620,1084590,you sell stock which is you raise money  from investors
69dLyztc-As,1084590,1092420,there's certain optimal ratios it's not  good to take too much debt in a very
69dLyztc-As,1092420,1097730,little capital but it's not a good idea  to have too much capital in very little
69dLyztc-As,1097730,1105170,debt there is some optimum some balance  so financial management will do this for
69dLyztc-As,1105170,1110900,you some business schools will usually  have only one financial management
69dLyztc-As,1110900,1118030,course but most business schools will  have two financial management courses
69dLyztc-As,1118030,1124220,sometimes there are smaller call them  fundamentals of financial management
69dLyztc-As,1124220,1131000,which cover maybe 15 or 16 chapters if  the school is very good in very hard
69dLyztc-As,1131000,1136550,they'll cover all fifteen chapters in  one semester in 15 weeks and it's hard
69dLyztc-As,1136550,1141680,but they keep doing it most business  schools around the world in what may
69dLyztc-As,1141680,1148100,mean most students cannot handle 15  chapters in 15 weeks
69dLyztc-As,1148100,1155660,so usually financial management they  cover in the first semester eight  chapters the first eight and in the
69dLyztc-As,1155660,1161540,second semester they cover the other  eight chapters it's a little bit easier
69dLyztc-As,1161540,1168260,so the big subject is separated in part  one in part two and Finance is about
69dLyztc-As,1168260,1175180,again investments next one is marketing
69dLyztc-As,1175180,1181820,marketing again is about the customer  what the customer wants what the
69dLyztc-As,1181820,1188540,customer is willing to pay okay  marketing is about the product what the
69dLyztc-As,1188540,1193580,customer wants again what product they  want do they want a big screen or they
69dLyztc-As,1193580,1201080,want a small screen do they want a heavy  mobile with a large battery or they want
69dLyztc-As,1201080,1206660,it very slim very light but battery life  is no good what the customer wants
69dLyztc-As,1206660,1214670,that's the product the next thing is  price how do we price it okay if it's
69dLyztc-As,1214670,1220460,similar let's say to  Apple iPhone do we price it above do we
69dLyztc-As,1220460,1227810,price it below do we price it at Apple  iPhone in other words you need to think
69dLyztc-As,1227810,1235040,about the competition so you need to  think about your customer the product
69dLyztc-As,1235040,1241370,the features of the product the price  you need to think about the competitors
69dLyztc-As,1241370,1246700,what the competitors are offering unis  also need to think about service
69dLyztc-As,1246700,1253820,customer service that's very important  especially for some customers especially
69dLyztc-As,1253820,1259400,for customers of products that you need  a lot of service like cars cars need a
69dLyztc-As,1259400,1265000,lot of service maybe phones don't need  so much service anymore so this is all
69dLyztc-As,1265000,1270320,marketing sometimes marketing is one
69dLyztc-As,1270320,1278350,huge textbook and it just go half and  half sometimes marketing two is usually
69dLyztc-As,1278350,1284030,separated out as advertising now from
69dLyztc-As,1284030,1290710,the previous screen I think I forgot  sometimes financial management to is
69dLyztc-As,1290710,1296750,separated out as a separate course  called investments so instead of two you
69dLyztc-As,1296750,1303440,get investments for marketing  instead of marketing to they just call
69dLyztc-As,1303440,1310250,it advertising and you learn all the  tricks about advertising advertising is
69dLyztc-As,1310250,1318410,about making the customer to like to  want and to eventually buy your product
69dLyztc-As,1318410,1324410,okay against about advertising campaigns  and promotions in all the other things
69dLyztc-As,1324410,1329630,that will make the customer buy your  product so that's what marketing is
69dLyztc-As,1329630,1336740,about and next one is management not  necessarily the last one management
69dLyztc-As,1336740,1345710,again is about how businesses make  decisions decisions are about planning
69dLyztc-As,1345710,1352760,how do we plan how much we're going to  produce how  much we're going to order how many
69dLyztc-As,1352760,1358820,people we will need the management of  people's got a special name it's called
69dLyztc-As,1358820,1365480,a Personnel Management it's considered  very important and usually instead of
69dLyztc-As,1365480,1371260,having management - they'll separate and  have a whole subject called Personnel
69dLyztc-As,1371260,1378100,Management Management is let me repeat  about planning it's also about
69dLyztc-As,1378100,1385700,organizing how we're going to organize  what departments we're going to have  when a marketing department in finance
69dLyztc-As,1385700,1391670,department and accounting department in  a production department and a personnel
69dLyztc-As,1391670,1399590,department in a legal department and IT  or computer technology department so
69dLyztc-As,1399590,1406730,what kind of departments we're going to  have management is about leadership how
69dLyztc-As,1406730,1411770,to lead people how to manage people how
69dLyztc-As,1411770,1418480,to organize people one of the most  important part in businesses is how to
69dLyztc-As,1418480,1425960,motivate people and of course how to  reward people what kind of salaries what
69dLyztc-As,1425960,1431570,kind of vacations you're going to give  them and all the other thing whatever is  necessary
69dLyztc-As,1431570,1437960,and finally management is about control  are going to put a camera and watch the
69dLyztc-As,1437960,1444200,people are they going to have a card  every time they walk in they slide their  card in other words you keep track of
69dLyztc-As,1444200,1450920,their time are they going to give you  weekly reports monthly reports annual
69dLyztc-As,1450920,1456980,reports in other words how you control  how you make sure that you achieve your
69dLyztc-As,1456980,1463340,goals how you make sure that employees  do their job appropriately
69dLyztc-As,1463340,1469790,that's what management is about in these  four fields accounting finance marketing
69dLyztc-As,1469790,1479080,and management consists the core once  you got the core the main education
69dLyztc-As,1480100,1487240,oh there's one more once you get the  core the big wants to get the core the
69dLyztc-As,1487240,1492370,capstone the most important the most  difficult course the course that
69dLyztc-As,1492370,1499030,requires understanding all the other for  understanding accounting and finance and
69dLyztc-As,1499030,1505420,marketing and management is called  strategic management strategic
69dLyztc-As,1505420,1510520,management is how you competes are going
69dLyztc-As,1510520,1517000,to compete on efficiency are going to  compete on price are going to compete on
69dLyztc-As,1517000,1522760,a better product are going to compete on  a variety of products you know the basic
69dLyztc-As,1522760,1530520,thing that you can think the simplest  and easiest that you can understand is  how Samsung Galaxy will compete against
69dLyztc-As,1530520,1536470,iPhone is going to be bigger screen  better Valarie battery whatever the
69dLyztc-As,1536470,1544480,fioors is going to be a different  operating system more free software in  other words how you compete it's also
69dLyztc-As,1544480,1552010,how you innovate how you innovate your  products okay so all of this is called a
69dLyztc-As,1552010,1558910,capstone capstone means the top means  the most important the one which builds
69dLyztc-As,1558910,1567330,on all the others  that's the capstone course and let's see
69dLyztc-As,1567840,1575730,specializations once you have your core  you can specialize in there are four
69dLyztc-As,1575730,1581710,primary specializations you can  specialize in accounting and those that
69dLyztc-As,1581710,1586960,specialize in accounting are simply  going to take four or five or six more
69dLyztc-As,1586960,1592060,accounting courses in other words you  take the basics of accounting finance
69dLyztc-As,1592060,1597930,marketing management and then you focus  on accounting you're going to do after
69dLyztc-As,1597930,1605710,introductory accounting to do  intermediate accounting intermediate  accounting is hard the textbook is that
69dLyztc-As,1605710,1611740,"like 1,500 pages it's a killer Oh"
69dLyztc-As,1611740,1619540,that's why accounting people get or make  a lot of money it's very hard a lot of
69dLyztc-As,1619540,1624760,accounting majors just fail on  intermediate accounting so they take it
69dLyztc-As,1624760,1631330,year-long two semesters after they do  accounting sorry intermediate financial
69dLyztc-As,1631330,1639400,accounting they'll do cost accounting  and cost accounting will go in a lot  more detail of managerial accounting how
69dLyztc-As,1639400,1646500,we determine costs and all the other  tricks related to the cost inside the  business not with businesses about
69dLyztc-As,1646500,1655290,revenues and expenses cost accounting  focuses on the expenses only that's it
69dLyztc-As,1655290,1661750,you'll do some auditing all the thing is  trying to check and verify if your
69dLyztc-As,1661750,1668470,accounting is good is proper it's  correct if there is cheating if there is
69dLyztc-As,1668470,1675010,fraud if someone's stealing money okay  or if someone is called cooking the
69dLyztc-As,1675010,1683350,books in other words they're lying and  cheating trying to mislead you methods  the management or external people so
69dLyztc-As,1683350,1689860,that's what auditing is and of course  you have nonprofit institutions you have
69dLyztc-As,1689860,1695280,also government institutions Government  Accounting is a little difference
69dLyztc-As,1695280,1701200,nonprofit institutions are also a little  bit different they not run for-profit so
69dLyztc-As,1701200,1707980,there have a separate accounting of  their own and just not to mislead you
69dLyztc-As,1707980,1713440,there may be more one two three four  more courses but if you take business
69dLyztc-As,1713440,1719680,and you have a field usually four or  five extra courses are enough to have
69dLyztc-As,1719680,1726040,the field similar with finance you can  take financial management too or you can
69dLyztc-As,1726040,1732760,do investments or you can do Financial  Economics and other learn worth learn
69dLyztc-As,1732760,1739270,about financial markets financial  institutions financial instruments you
69dLyztc-As,1739270,1746810,have separate ones called financial  derivatives this is very advanced  very difficult very sophisticated and
69dLyztc-As,1746810,1751820,you may have a separate course about  that if you specialize in finance and of
69dLyztc-As,1751820,1759440,course risk management how you manage  your financial risks or operations and
69dLyztc-As,1759440,1766250,production risk risk management includes  a subfield of insurance if you're a big
