vid,start,end,text
69dLyztc-As,3318130,3324950,"2,000 years ago we did it for many  hundreds of years and we know that it"
69dLyztc-As,3324950,3331849,doesn't work as well okay and again if  you don't know what's important that's
69dLyztc-As,3331849,3338209,got two things first you think to find  out what's important but you can't you
69dLyztc-As,3338209,3343339,ask the professor that's what the  professor's job is to tell you what is
69dLyztc-As,3343339,3348619,more important and to tell you what is  less important that's what you asked the
69dLyztc-As,3348619,3356599,teacher hey which are the most important  things that I need to learn in the rainy  just memorizing is very common but
69dLyztc-As,3356599,3362119,doesn't help you much you just pass the  exam but next time doesn't help so much
69dLyztc-As,3362119,3370069,that's a very common distinction between  Western students and Eastern students
69dLyztc-As,3370069,3376940,"again we've had universities 2,000 years  ago 1,000 years ago for thousands of"
69dLyztc-As,3376940,3383599,years we have this experience and we  know what works and what doesn't work  back in the old days where the
69dLyztc-As,3383599,3391849,discussion with the Dean universities in  the West were established at the library
69dLyztc-As,3391849,3397459,whenever you have a library you make a  university because university is based
69dLyztc-As,3397459,3405380,on books and is based on reading books  that's how you get education more
69dLyztc-As,3405380,3412869,questions you have a third chance all  right another one
69dLyztc-As,3417440,3424430,because because  last questions no okay well thank you
69dLyztc-As,3424430,3426880,very much
