vid,start,end,text
Ay4qA5emBFw,981440,982720,okay
Ay4qA5emBFw,982720,984079,can you imagine if you worked for the
Ay4qA5emBFw,984079,986639,power company licking closed few
Ay4qA5emBFw,986639,989279,thousand power bills a day you were home
Ay4qA5emBFw,989279,991519,by
Ay4qA5emBFw,994399,997360,i acquired it at an estate sale
Ay4qA5emBFw,997360,999680,i'd like to sell it because it's taking
Ay4qA5emBFw,999680,1002240,up space in my house i'd like to get
Ay4qA5emBFw,1002240,1004639,about 400
Ay4qA5emBFw,1004639,1008160,i would probably spend the money on a
Ay4qA5emBFw,1008160,1009920,birthday present for my husband his
Ay4qA5emBFw,1009920,1012399,birthday's next week
Ay4qA5emBFw,1012399,1014800,this is really neat this is something
Ay4qA5emBFw,1014800,1016720,that definitely made a company's
Ay4qA5emBFw,1016720,1018720,business easier
Ay4qA5emBFw,1018720,1020079,when this thing was in proper working
Ay4qA5emBFw,1020079,1022399,order and you had a great operator who
Ay4qA5emBFw,1022399,1025360,was doing 50 to 100 envelopes a minute
Ay4qA5emBFw,1025360,1027038,i love it i mean there's things that
Ay4qA5emBFw,1027038,1028640,they did back then they don't do today i
Ay4qA5emBFw,1028640,1031280,mean you don't see gold leafing on
Ay4qA5emBFw,1031280,1033199,office equipment anymore and this right
Ay4qA5emBFw,1033199,1034240,here they could have made this for a
Ay4qA5emBFw,1034240,1035760,little less money but it wouldn't have
Ay4qA5emBFw,1035760,1036798,looked good
Ay4qA5emBFw,1036798,1038720,in this time period aesthetics were very
Ay4qA5emBFw,1038720,1040880,very important
Ay4qA5emBFw,1040880,1044240,in the early 1900s this envelope sealer
Ay4qA5emBFw,1044240,1046400,was actually pretty high tech it
Ay4qA5emBFw,1046400,1048640,eventually evolved into an automatic
Ay4qA5emBFw,1048640,1049679,version
Ay4qA5emBFw,1049679,1052400,and today those machines can do 15 000
Ay4qA5emBFw,1052400,1054559,envelopes an hour
Ay4qA5emBFw,1054559,1057039,so how did this thing exactly work
Ay4qA5emBFw,1057039,1058880,the sticky part of the envelope would be
Ay4qA5emBFw,1058880,1061520,here fed through this way through there
Ay4qA5emBFw,1061520,1063760,yeah
Ay4qA5emBFw,1063840,1066400,come out and then from what i figured
Ay4qA5emBFw,1066400,1069200,out was that you had to close it push it
Ay4qA5emBFw,1069200,1071600,through these other series of rollers
Ay4qA5emBFw,1071600,1074880,okay there we go
Ay4qA5emBFw,1075200,1075800,cool
Ay4qA5emBFw,1075800,1076670,[Music]
Ay4qA5emBFw,1076670,1078640,[Applause]
Ay4qA5emBFw,1078640,1080480,so you want to sell it
Ay4qA5emBFw,1080480,1082320,i'd like to yes
Ay4qA5emBFw,1082320,1083760,how much you want for it
Ay4qA5emBFw,1083760,1085919,i was thinking about 400.
Ay4qA5emBFw,1085919,1087679,it's more of a decorator thing than it
Ay4qA5emBFw,1087679,1088799,is a collector thing you know what i
Ay4qA5emBFw,1088799,1090640,mean weird little things like this go
Ay4qA5emBFw,1090640,1094559,for a couple hundred bucks in this size
Ay4qA5emBFw,1094559,1097520,i'll give you 100 for it
Ay4qA5emBFw,1097919,1101039,can you do 100 and a half
Ay4qA5emBFw,1101039,1103279,um
Ay4qA5emBFw,1103440,1104880,i'll tell you what i'll give you 125 for
Ay4qA5emBFw,1104880,1106840,it
Ay4qA5emBFw,1106840,1112640,135. 125 for it 135 one two one
Ay4qA5emBFw,1113570,1116160,[Music]
Ay4qA5emBFw,1116160,1118320,just because i'm a wonderful human being
Ay4qA5emBFw,1118320,1120960,i will go 130.
Ay4qA5emBFw,1120960,1123760,all right 1 30. thanks all right follow
Ay4qA5emBFw,1123760,1124960,me and we'll do some paperwork on it
Ay4qA5emBFw,1124960,1126640,okay
Ay4qA5emBFw,1126640,1128559,i took 130
Ay4qA5emBFw,1128559,1131440,for it because i really just didn't want
Ay4qA5emBFw,1131440,1135320,to have to take it home again
Ay4qA5emBFw,1145520,1147600,you
