vid,start,end,text
dXgNiQsML6w,1397696,1403668,THOSE NUMBERS ARE UNFORTUNATELY   EXPECTED TO INCREASE BECAUSE  SEARCH AND RESCUE EFFORTS ARE   STILL ONGOING.  THIS CITY IS A COMMUNITY THAT   HAS NOT SEEN A LOT OF MISSILE 
dXgNiQsML6w,1403668,1426992,STRIKES OF LATE IN MAY AND 
dXgNiQsML6w,1426992,1432197,"JUNE.   THERE WAS AN OIL REFINERY, ONE  OF THE LARGEST, THIS LARGEST  OIL PRODUCER IN UKRAINE, THAT   WAS STRUCK BY A NUMBER OF   RUSSIAN MISSILES. "
dXgNiQsML6w,1432197,1437903,"IT IS STILL INOPERABLE TODAY  BUT THIS, FOR A LOT OF PEOPLE,  SEEMED TO COME OUT OF THE BLUE.   PRESIDENT ZELENSKYY IS SAYING   WHAT HAPPENED HERE IS A "
dXgNiQsML6w,1437903,1443375,TERRORIST ATTACK.   HE SAYS THERE WAS NO MILITARY   OR STRATEGIC REASON FOR THIS  MALL TO BE TARGETED.
dXgNiQsML6w,1443375,1448513,"HE SAYS THERE WERE ONLY PEOPLE  INSIDE, TRYING TO LIVE A NORMAL   LIFE.   >> THAT RAISES THE QUESTION   WHETHER THIS IS AN INTIMIDATION   STRIKE. "
dXgNiQsML6w,1448513,1474072,YOU HAVE THE G-7 MEETING AT THE   SAME MOMENT AND WHETHER PUTIN   IS TRYING TO SEND A MESSAGE.  THERE IS NO STRATEGIC VALUE   WHEN ATTACKING A SHOPPING MALL.
dXgNiQsML6w,1474072,1479910,">> UKRAINIAN OFFICIALS, WHEN IT   CAME TO THE AIRSTRIKES WE SAW   IN KYIV, THEY WERE SAYING THEY  THOUGHT THIS WAS SOME SORT OF   SHOW OF FORCE, WHERE RUSSIA WAS "
dXgNiQsML6w,1479910,1484983,TRYING TO INTIMIDATE UKRAINIAN  CITIZENS AND PUT PRESSURE ON  LEADERS AT THE G-7 SUMMIT AS  THEY WERE CONSIDERING   ADDITIONAL SANCTIONS AGAINST  THE RUSSIAN FEDERATION. 
dXgNiQsML6w,1484983,1490388,ALL OF THIS IS HAPPENING AS THE   FIGHTING IN THE EAST JUST   CONTINUES TO RAGE ON AND RUSSIA   HAS MADE A LOT OF GROUND ON THE 
dXgNiQsML6w,1490388,1495727,"EASTERN FRONT LINES OF LATE.  THE KEY CITY FELL, THAT BEING   SEVERODONETSK.  ACCORDING TO THE MEDIA OUTLET   THAT IS CONTROLLED BY THE SO  CALLED PEOPLE'S REPUBLIC OF "
dXgNiQsML6w,1495727,1516181,"LUHANSK , THEY ARE SAYING SOME  PEOPLE HAVE BEEN EVACUATED TO "
dXgNiQsML6w,1516181,1521720,"OTHER PLACES.   THERE WERE TALKS ABOUT TRYING   TO GET PEOPLE TO LEAVE BUT THEY   WERE ONLY WILLING TO EVACUATE   THEM INTO RUSSIAN TERRITORY,  WHICH UKRAINIAN CITIZENS DID"
dXgNiQsML6w,1521720,1526791,"NOT WANT TO DO.   ON THE EASTERN FRONT, THERE IS  ONLY ONE CITY THAT STANDS   BETWEEN RUSSIAN FORCES AND THEN   TAKING THE ENTIRE LUHANSK   REGION. "
dXgNiQsML6w,1526791,1545710,"THAT IS THE SISTER CITY OF  SEVERODONETSK.    IN ADDITION TO POURING ALL OF   THEIR RESOURCES, ALL OF THEIR   GROUND PERSONNEL INTO THIS FIGHT"
dXgNiQsML6w,1545710,1551516,"IN THE EAST, THEY HAVE  MOBILIZED THE MAJORITY OF THIS  UNIT.   YOU HAVE THEM JUST HAMMERING  THESE COMMUNITIES ALL ALONG THE   EASTERN SIDE OF UKRAINE AND NOW "
dXgNiQsML6w,1551516,1556755,"THEY ARE ALSO LAUNCHING, IT   APPEARS, A SIGNIFICANT AMOUNT   OF MISSILES INTO THE CIVILIAN   AREAS, LIKE WE SAW IN KYIV, AND   NOW WITH A SHOPPING MALL. "
dXgNiQsML6w,1556755,1565063,">> ELLISON BARBER, WHO WAS IN   KYIV, THANK YOU VERY MUCH.  >>> GHISLAINE MAXWELL IS PUT ON "
dXgNiQsML6w,1565063,1570568,SUICIDE.  WE HAVE CONFLICTING ACCOUNTS OF   WHAT IS GOING ON.   >>> HUNDREDS OF FLIGHTS ARE   CANCELED TODAY AS WE HEAD   TO
dXgNiQsML6w,1570868,1577542,>>> NBC NEWS  STREAMING FREE  NOW.  >>> BACK NOW AND WE ARE 
dXgNiQsML6w,1577542,1582947,LEARNING THAT JEFFREY EPSTEIN'S   FORMER CONFIDANT AND CONVICTED  SEX TRAFFICKER GHISLAINE
dXgNiQsML6w,1582947,1588620,MAXWELL  IS ON SUICIDE WATCH  AHEAD OF HER SENTENCING   TOMORROW IN NEW YORK BUT THERE
dXgNiQsML6w,1588620,1596361,ARE TWO DIFFERENT ACCOUNTS OF   WHAT'S GOING ON.  ONE OF MAXWELL'S LAWYERS THAT   SHE IS NOT SUICIDAL. SHE WROTE
dXgNiQsML6w,1596361,1602467,TO THE COURT SAYING MAXWELL HAD   BEEN REMOVED FROM THE GENERAL   POPULATION AT THE DETENTION   CENTER IN BROOKLYN AND SHE WAS
dXgNiQsML6w,1602467,1607572,GIVEN A SUICIDE SMOCK.  PROSECUTORS SAY MAXWELL HERSELF 
dXgNiQsML6w,1607572,1614479,EMAILED THE BUREAU TO TELL THEM   SHE FEELS AFRAID FOR HER
dXgNiQsML6w,1614479,1620318,SAFETY.   HER INCONSISTENT ACCOUNTS TO  THE PSYCHOLOGY STAFF RAISED   CONCERNS THAT SHE IS AT RISK
dXgNiQsML6w,1620318,1625857,FOR SELF-HARM.  TOM WINTER HAS BEEN FOLLOWING   THIS DEVELOPMENT. 
dXgNiQsML6w,1625857,1631996,"TOM, A LITTLE CONFUSING HERE  AND HARD TO UNPACK.   WHAT HAVE WE LEARNED?   >> Reporter: TOM, THIS HAS BEEN "
dXgNiQsML6w,1631996,1638636,GOING BACK AND FORTH THE PAST   SEVERAL DAYS.   WE HAVE AT DIFFERENT TIMES OVER   THE COURSE OF THE ENTIRETY OF   CUSTODY GHISLAINE MAXWELL 
dXgNiQsML6w,1638636,1644075,"RAISING QUESTIONS ABOUT HER   TREATMENT, THAT SHE HAS BEEN  SINGLED OUT. OF COURSE HER  FORMER CONFIDANT WAS CHARGED"
dXgNiQsML6w,1644075,1650448,WITH JEFFREY EPSTEIN AND HE 
dXgNiQsML6w,1650448,1658923,DIED BY SUICIDE JUST A MONTH  AND A HALF AFTER TAKEN INTO   CUSTODY.  HER SCRUTINY AT THE DIFFERENT 
dXgNiQsML6w,1658923,1663994,JAIL FACILITY LOCATED ACROSS  THE RIVER FROM MANHATTAN IN   BROOKLYN HAS BEEN UNDER   SCRUTINY SINCE DAY ONE. SHE HAS 
dXgNiQsML6w,1663994,1672570,"BEEN SUBJECTED EVERY 15   MINUTES, BEING CHECKED ON BY A  PRISON STAFF AS WELL AS BEING "
dXgNiQsML6w,1672570,1680478,"LIMITED IN HER INTERACTION WITH   OTHER INMATES.  THAT HAS SINCE CHANGED  FOLLOWING HER CONVICTION, "
dXgNiQsML6w,1680478,1689821,EXCUSE ME.  SHE HAS BEEN OUT IN GENERAL   POPULATION AND SAYS SHE HAS   CONCERNS ABOUT HER SAFETY AND   THROUGHOUT THE DAY TODAY AND
dXgNiQsML6w,1689821,1697629,"TOMORROW, TOM, AND PERHAPS  BEYOND THAT, SHE WILL BE ON   MORE OF A MODIFIED SUICIDE  WATCH WITHOUT THAT SMOCK, AS"
dXgNiQsML6w,1697629,1703034,YOU SUGGESTED.  >> REMIND US HOW MUCH TIME SHE  IS FACING.
dXgNiQsML6w,1703034,1710642,"ONE OF HER LAWYERS SAID THEY  WERE CONSIDERING ASKING FOR A   DELAY IN SENTENCING BECAUSE   MAXWELL COULD NOT REVIEW IT   NECESSARY LEGAL DOCUMENTS,  RIGHT?  WALK US THROUGH THOSE TWO "
dXgNiQsML6w,1710642,1717882,"THINGS, IF YOU WOULD.   >> Reporter: APPARENTLY THAT  HAS BEEN REMEDIED. SHE HAS  ACCESS TO HER NOTES AND A "
dXgNiQsML6w,1717882,1723955,"WRITING INSTRUMENT ACCORDING TO   COURT FILINGS. SHE IS OKAY ON   THAT FRONT, TOM."
dXgNiQsML6w,1723955,1730595,"AS FAR AS TOMORROW'S  PROCEEDINGS GO, THE SCHEDULE  STARTS AT 11:00 A.M.  AND WE WILL HEAR FROM SIX OF"
dXgNiQsML6w,1730595,1739971,"MAXWELL'S VICTIMS. THAT IS ON   SCHEDULE AND ON TIME, SO THERE  IS NO INDICATION THERE WILL BE"
dXgNiQsML6w,1739971,1746678,ANY DELAY.  SHE FACES 30 TO 60 YEARS  APPROXIMATELY IN PRISON WHICH   EFFECTIVELY AMOUNTS TO A LIFE   SENTENCE FOR THE 60-YEAR-OLD. 
dXgNiQsML6w,1746678,1752450,SIGNIFICANT PENALTIES ARE WHAT  THE PROSECUTORS ARE ASKING FOR.   WE WILL SEE WHAT THE JUDGE
dXgNiQsML6w,1752450,1758923,"DECIDES TO DO HERE, TOM. IT'S   NOT LOOKING GOOD FOR MAXWELL  FUTURE.   >> TOM, THANK YOU SO MUCH."
dXgNiQsML6w,1758923,1764696,TOM WINTER IN NEW YORK.   >>> LET'S GET YOU OVER TO THE   FIVE THINGS WE THINK YOU NEED 
dXgNiQsML6w,1764696,1770434,TO KNOW TONIGHT.  22 YOUNG PEOPLE HAVE DIED.  FOUR REMAIN IN CRITICAL 
dXgNiQsML6w,1770434,1779110,CONDITION AFTER A MYSTERIOUS  TRAGEDY STRUCK A SOUTH AFRICAN  NIGHTCLUB.  THE VICTIMS WERE CELEBRATING  THE END OF THEIR EXAMS AT A 
dXgNiQsML6w,1779110,1784282,TAVERN BEFORE THEY SUDDENLY   DIED.   AUTHORITIES ARE INVESTIGATING 
dXgNiQsML6w,1784282,1790989,"WHAT CAUSED THE DEATHS, BUT   THEY A TOXICOLOGY REPORT WILL   NEED TO BE DONE.  THE YOUNGEST, JUST 13 YEARS   OLD.  >>> EIGHT U.S. NAVY DESTROYER   THAT SANK IN WORLD WAR II HAS "
dXgNiQsML6w,1790989,1796461,BECOME THE DEEPEST SHIPWRECK  EVER DISCOVERED.  THE WRECK WAS FOUND IN TWO
dXgNiQsML6w,1796461,1801599,PIECES OFF THE COAST OF THE   PHILIPPINES AT A DEPTH OF MORE  THAN 4 MILES. 
dXgNiQsML6w,1801599,1806604,THE NAVY DESTROYER WAS ENGAGED  IN THE LARGEST SEA BATTLE OF  WORLD WAR II WITH JAPAN.
dXgNiQsML6w,1806604,1814779,">>> 400,000 SOLAR POWERED   UMBRELLAS SOLD AT COSCO HAVE"
dXgNiQsML6w,1814779,1820451,BEEN RECALLED FOR RISK OF FIRE  AND BURN INJURIES.  THERE HAVE BEEN SIX REPORTS OF
dXgNiQsML6w,1820451,1826157,"THE LITHIUM BATTERIES   OVERHEATING, THREE OF WHICH   CAUGHT FIRES ENDORSE.   COSCO IS ASKING ANYONE THAT HAS   PURCHASED THE UMBRELLAS TO"
dXgNiQsML6w,1826157,1832630,"RETURN IT FOR A FULL REFUND.  >>> THE REMAINS OF A 30,000-  YEAR-OLD WOOLLY MAMMOTH "
dXgNiQsML6w,1832630,1837936,DISCOVERED IN NORTHWESTERN  CANADA.   LOOK AT THAT.   UNCOVERED BY MINERS DIGGING 
dXgNiQsML6w,1837936,1844542,THROUGH THE PERMAFROST ON THE   EUREKA CREEK IN THE YUKON. IT   IS THE MOST COMPLETE AND BEST 
dXgNiQsML6w,1844542,1850848,"PRESERVED WOOLLY MAMMOTH EVER   FOUND IN NORTH AMERICA.   >>> AND NUMBER FIVE, TOP GUN: "
dXgNiQsML6w,1850848,1856821,"MAVERICK HAS SURPASSED $1   BILLION WORLDWIDE, BECOMING THE "
dXgNiQsML6w,1856821,1863494,SECOND MOVIE OF THE PANDEMIC  ERA TO DO SO.   IT IS TOM CRUISE'S FIRST TIME TO  REACH THAT MILESTONE. 
dXgNiQsML6w,1863494,1870134,THE MOVIE EARNED ANOTHER $30  MILLION IN ITS FIFTH WEEKEND  SINCE ITS DOMESTIC RELEASE.   >>> A BAD SIGN IF YOU HAVE
dXgNiQsML6w,1870134,1875806,FOURTH OF JULY TRAVEL PLANS.
dXgNiQsML6w,1875806,1881179,WITH MORE MASS FLIGHT   CANCELLATIONS OVER THE WEEKEND  AND INTO TODAY AND INTO THE WEEK  . 800 FLIGHTS ACROSS THE  COUNTRY CANCELED TODAY AFTER
dXgNiQsML6w,1881179,1887485,MORE THAN 2000 WERE CANCELED  FRIDAY THROUGH SUNDAY.  WITH 3.5 MILLION PEOPLE 
dXgNiQsML6w,1887485,1893557,EXPECTED TO TRAVEL BY AIR THIS  HOLIDAY WEEKEND COMING UP TO A
dXgNiQsML6w,1893557,1899263,"RECORD, REALLY.   ACCORDING TO AAA, HOW OUR   AIRLINES AND OFFICIALS ARE  GETTING A HOLD OF ALL OF THIS?"
dXgNiQsML6w,1899263,1904469,"RIGHT NOW THEY ARE POINTING   FINGERS KIND OF AT EACH OTHER   BACK AND FORTH, BLAMING EACH  OTHER."
dXgNiQsML6w,1904469,1912443,WE KNOW THE AIRLINES HAVE BEEN  DEALING WITH STAFFING SHORTAGES   FROM PILOTS TO FLIGHT ATTENDANTS  TO AIR TRAFFIC CONTROLLERS  AFTER A TRAVEL DEMAND BOUNCED 
dXgNiQsML6w,1912443,1918716,BACK MUCH FASTER THAN THEY WERE   READY FOR.  LESLIE JOSEPH JOINED US NOT TO  TALK ABOUT WHAT COMES NEXT. 
dXgNiQsML6w,1918716,1924789,"LESLIE, THE AIRLINES AND FAA  EXPECTED THIS FOURTH OF JULY  WEEKEND TO BE THE BUSIEST IN"
dXgNiQsML6w,1924789,1931963,THREE YEARS AND IT'S REALLY A   TEST FOR THE AIRLINES.  I'VE BEEN TALKING WITH THE FAA  AND D.O.T.
dXgNiQsML6w,1931963,1939470,"I KNOW YOU HAVE BEEN TALKING  WITH THE AIRLINES.  WHAT ARE YOU HEARING?   >> HI, TOM.   NICE TO TALK TO YOU."
dXgNiQsML6w,1939470,1946811,WE HAVE A LOT OF PEOPLE   TRAVELING. IT IS A VERY POPULAR 
dXgNiQsML6w,1946811,1951983,HOLIDAY.  THE AIRLINES ARE NORMALLY MORE  STAFFED.  THAT LOW STAFFING COMING BACK   FROM THE PANDEMIC IS NOT
dXgNiQsML6w,1951983,1958823,"EQUIPPED TO HANDLE THE SHEER  NUMBER OF PASSENGERS THAT ARE   FLYING.   ANOTHER THING TO REMEMBER,  PASSENGERS OR TRAVELERS ARE "
dXgNiQsML6w,1958823,1964829,"GOING THROUGH A SMALLER FIELD,  MOSTLY UNITED STATES AND"
dXgNiQsML6w,1964829,1970401,"DOMESTIC TRAVEL.  SINCE 2019, PEOPLE WERE MORE  SPREAD OUT AND WE HAD A LOT "
dXgNiQsML6w,1970401,1979911,MORE INTERNATIONAL TRAVEL.  WE ARE SEEING A LOT OF DEMAND   TO FLORIDA.   THAT IS A VERY POPULAR AREA.
dXgNiQsML6w,1979911,1986684,"AND IS PUTTING A STRAIN ON THE  AIRLINES OVERALL.   >> IN 2019, FEWER THAN 2% OF"
dXgNiQsML6w,1986684,1992423,"FLIGHTS WERE CANCELED.  WE ARE NOW RUNNING AT 3.5%,   WHICH IS REALLY STUNNING WE   HAVE HAD THAT BIG OF AN "
dXgNiQsML6w,1992423,1997695,"INCREASE.   BIG AIRLINES LIKE UNITED,   DELTA, JETBLUE CUTTING FLIGHTS"
dXgNiQsML6w,1997695,2002900,FROM SOME AIRPORTS TO HELP WITH   CONGESTION AND DELAYS.  HOW LONG DO YOU THINK THIS IS 
dXgNiQsML6w,2002900,2011642,GOING TO WORK?  WHAT ARE YOU HEARING FROM YOUR  SOURCES?  >> WE ARE HEARING MAYBE BY THE  FALL.   THIS DOESN'T HELP ANYONE FOR  THE FOURTH OF JULY OR ANYONE
dXgNiQsML6w,2011642,2018549,"PLANNING A SUMMER VACATION WITH   THE KIDS OFF OF SCHOOL, BUT   REALLY IN THE FALL, IN NORMAL   TIMES KIDS GO BACK TO SCHOOL"
dXgNiQsML6w,2018549,2024188,AND IT SLOWS DOWN.  IT DOESN'T HELP ANYONE WHO IS   TRAVELING NOW.
dXgNiQsML6w,2024188,2029794,IT IS NOT JUST THESE  CANCELLATIONS AND DELAYS.   THERE ARE VERY LONG WAIT TIMES
dXgNiQsML6w,2029794,2035466,TO SPEAK TO CUSTOMER SERVICE TO   HELP YOU WITH YOUR FLIGHT.
dXgNiQsML6w,2035466,2044075,THE OPTIONS ARE NOT THERE.
dXgNiQsML6w,2044075,2049212,YOU ARE PLAYING MUSICAL CHAIRS  ON THE SIDE.  THERE ARE A LOT OF TRIPS THAT   REALLY CAN'T BE MOVED.  PEOPLE ARE TRAVELING FOR  GRADUATION CEREMONIES AND 
dXgNiQsML6w,2049212,2054819,"WEDDINGS AND THINGS THAT HAVE A   VERY FIRM DATE.   WHAT AIRLINES ARE URGING NOW,   THEY'RE TRYING TO STAFF UP AS   QUICKLY AS THEY CAN BUT "
dXgNiQsML6w,2054819,2061125,UNFORTUNATELY THEY DID ENCOURAGE
dXgNiQsML6w,2061125,2070668,"-- AND MANY WORKERS TOOK THEM   UP ON THIS, BUT BUYOUTS.  THEY ARE TRYING, BUT IT WILL"
dXgNiQsML6w,2070668,2076040,TAKE MONTHS.  WHEN THERE ARE ISSUES LIKE
dXgNiQsML6w,2076040,2083047,"THUNDERSTORMS, THEY HAVE A HARD   TIME RECOVERING.  >> YEAH, THEY SURE DO.  ALL RIGHT, IF YOU ARE FLYING  THIS SUMMER, BE PREPARED TO BE"
dXgNiQsML6w,2083047,2088486,"RESCHEDULED, SO BOOK TIME ON  EITHER SIDE OF YOUR FLIGHT.   LESLIE, THANK YOU."
dXgNiQsML6w,2088486,2093624,">>> COMING UP, THERE COULD BE   BIG ECONOMIC CONSEQUENCES TO"
dXgNiQsML6w,2093624,2105169,DENYING WOMEN ABORTION ACCESS.  A LOOK AT WEALTH DISPARITIES  MORE WOMEN TO FACE NOW THAT ROE 
dXgNiQsML6w,2105169,2111075,"V. WADE HAS BEEN STRUCK NOT ONL   IT  IS AN HONOR.  >> SOMETIMES THE NEWS CAN BE  DIFFICULT AND OVERWHELMING, SO  WE HAVE CREATED A NEWSCAST JUST "
dXgNiQsML6w,2111075,2117215,"FOR THEM.   WE HOPE YOUR FAMILY WILL WATCH  ""NIGHTLY NEWS: KIDS EDITION."" "
dXgNiQsML6w,2117215,2128893,">>> OKAY, ALL EYES ON WIMBLEDON   OF THE TENNIS WORLD.  THIS COULD BE NOVAK DJOKOVIC'S"
dXgNiQsML6w,2128893,2138970,"LAST TOURNAMENT OF THE YEAR DUE   TO HIS VACCINATION STATUS.  PLUS, CAN SERENA WILLIAMS WIN   AGAIN?  WE ARE TALKING ABOUT ALL OF   THAT AND MORE."
dXgNiQsML6w,2138970,2152383,"FIRST,  AS STATES BEGIN DENYING "
dXgNiQsML6w,2152383,2157387,"ACCESS TO ABORTION, WOMEN COULD   BE FACING THE HARSH FINANCIAL   REALITY.  SOME ARE FORCED TO BECOME   PARENTS SOONER THAN PLANNED,  AFFECTING THEIR ABILITY TO GET"
dXgNiQsML6w,2157387,2162793,"AN EDUCATION, TO KEEP A JOB,  AND COVER THE COST OF   CHILDCARE.  THOSE THAT MISS ON A COLLEGE  DEGREE BECAUSE OF UNPLANNED   PREGNANCIES LOSE $1.3 MILLION "
dXgNiQsML6w,2162793,2173037,IN EARNINGS OVER THEIR LIFETIME   ACCORDING TO RESEARCH FROM  UNIVERSITY OF MICHIGAN.   A TEN-YEAR STUDY CONDUCTED AT   THE UNIVERSITY OF CALIFORNIA  FOUND WOMEN WHO WERE DENIED AN
dXgNiQsML6w,2173037,2178542,ABORTION WERE 3 TO 4 TIMES MORE 
dXgNiQsML6w,2178542,2184281,LIKELY TO BE UNEMPLOYED AND   HAVE A HOUSEHOLD INCOME BELOW   THE POVERTY LINE.   SOME EMPLOYERS HAVE SAID THEY   ARE STEPPING IN TO HELP.  COMPANIES ON YOUR SCREEN SAY
dXgNiQsML6w,2184281,2193324,"THEY WILL HELP COVER ABORTION   COSTS GOING FORWARD FOR PEOPLE,   EMPLOYEES, IN STATES WHERE  ABORTION IS NO LONGER LEGAL.  ONE CORRESPONDENT -- THEY ARE "
dXgNiQsML6w,2193324,2199196,"ACKNOWLEDGING THAT THEY ARE   PLENTY OF PEOPLE WHO ARE  APPLAUDING THE SUPREME COURT  DECISION TO STRIKE DOWN ROE V.  WADE, ACKNOWLEDGING THAT WE   SHOULD ALSO MAKE THE POINT THAT "
dXgNiQsML6w,2199196,2211042,DENYING ABORTION ACCESS CAN   BOIL DOWN TO FINANCIAL HARDSHIP   ON THE MOTHER.  THAT IS IF THEY ARE ON THE  YOUNGER SIDE.   YOU CAN REDUCE GRADUATION RATES 
dXgNiQsML6w,2211042,2219250,"AND IF SHE CAN GET A JOB, PAID  LEAVE IS LIKELY NOT GOING TO BE   AVAILABLE AND CHILDCARE HAS "
dXgNiQsML6w,2219250,2227825,BECOME PRETTY EXPENSIVE.  HOW DOES ONE COME TO TERMS WITH   THE DISPARITY HERE AND THE  IMPACT ON YOUNG WOMEN   ESPECIALLY?   >> LOOK AT THE DATA AND THE 
dXgNiQsML6w,2227825,2237201,RESEARCH.   ECONOMISTS SAY THE ECONOMIC   IMPACT OF ABORTION BANS ARE SET   TO GO INTO EFFECT IN 26 STATES
dXgNiQsML6w,2237201,2250914,"AND ARE EXPECTED TO BE BOTH   SIGNIFICANT AND IMMEDIATE.  THE AVERAGE COST OF RAISING A   CHILD IS $230 -- $230,000 AND "
dXgNiQsML6w,2250914,2256653,THE FINANCIAL IMPACT FOR THE  ECONOMIC POLICY INSTITUTE MEANS   THE LOSS OF SECURITY AND  DEPENDENCE AND MOBILITY FOR   PEOPLE WHO ARE SEEKING AN   ABORTION IN A RESTRICTED STATE. 
dXgNiQsML6w,2256653,2267131,"THIS WILL IMPACT LOW AND MIDDLE   INCOME BIRTHING PEOPLE THE  MOST, ESPECIALLY BLACK AND  BROWN PEOPLE.   >> LET'S TALK ABOUT WHAT THIS "
dXgNiQsML6w,2267131,2277174,MEANS FOR STATES' ECONOMIES.  A RECENT STUDY BY THE INSTITUTE   FOR WOMEN'S POLICY RESEARCH   ESTIMATED THAT STATE-LEVEL
dXgNiQsML6w,2277174,2283214,ABORTION RESTRICTIONS COST  ECONOMIES ABOUT ONE $5 BILLION  PER YEAR BECAUSE THE LABOR  FORCE AND EARNING LEVEL SHRANK  AND WOMEN ARE TAKING TIME OFF 
dXgNiQsML6w,2283214,2290220,OF WORK.  WHAT AFFECTS ARE THESE DAYS   LOOKING AT IN THE LONGER RUN? 
dXgNiQsML6w,2290220,2298929,>> IT DISPROPORTIONATELY  AFFECTS BIRTHING PEOPLE BETWEEN   15 AND 44 YEARS OLD AND IN THAT 
dXgNiQsML6w,2298929,2308505,"BRIEF WE READ FROM LAST YEAR,   MORE THAN 150 ECONOMISTS ARGUE  THAT ROE IS CAUSALLY CONNECTED  TO WOMEN'S ADVANCEMENT IN   SOCIAL AND ECONOMIC LIFE. "
dXgNiQsML6w,2308505,2315479,"THEY ALSO FOUND IN 2020,  GETTING RID OF ALL STATE-LEVEL"
dXgNiQsML6w,2315479,2321018,RESTRICTIONS WOULD INCREASE THE 
dXgNiQsML6w,2321018,2327691,NATIONAL GDP BY NEARLY HALF A   PERCENTAGE POINT.   THAT CAME BEFORE SECRETARY  JANET YELLEN RECENTLY SAID  ACCESS TO ABORTION RIGHT  DIRECTLY IMPACT EDUCATIONAL 
dXgNiQsML6w,2327691,2342673,LEVELS FOR BIRTHING PEOPLE COME   ALONG WITH FUTURE EARNINGS WE   HAVE TALKED ABOUT.  THERE IS A SIGNIFICANT IMPACT   ON BOTH THE STATE AND THE 
dXgNiQsML6w,2342673,2348479,"NATIONAL ECONOMY, IF YOU TALK   TO EXPERTS.   THAT IS WHAT THEY ARE SEEING IN   THE DATA.   >> LET'S SAY WOMEN ARE ABLE TO  ASK IS AN ABORTION BUT THEY "
dXgNiQsML6w,2348479,2359290,HAVE TO DRIVE TO ANOTHER STATE  TO GET THAT AND GAS PRICES ARE  AT A RECORD HIGH. 
dXgNiQsML6w,2359290,2365029,"DISTANCES ARE LONG, SO THE COST   OF TRANSPORTATION HAS TO BE   OVERWHELMING, RIGHT?  >> IT IS SO DAUNTING.   SO YOU LIVE IN COLUMBIA.  YOU WOULD HAVE TO DRIVE 128 "
dXgNiQsML6w,2365029,2370768,"MILES TO GRANITE CITY,  ILLINOIS, TWO HOURS BY CAR OR 4   1/2 HOURS BY THREE BUSES IF YOU   ARE NOT DRIVING.  IN SALT LAKE CITY, FOR EXAMPLE, "
dXgNiQsML6w,2370768,2383948,"ANOTHER TRIGGER STATE, YOU  WOULD NEED TO DRIVE 335 MILES "
dXgNiQsML6w,2383948,2389620,"AND IS SIX HOURS BY CAR TO  STEAMBOAT SPRINGS, COLORADO.  IF YOU ARE TAKING A BUS OR  PUBLIC TRANSPORTATION, THAT IS  19 HOURS BY ONE TRAIN AND THREE "
dXgNiQsML6w,2389620,2395226,BUSES.  THE HURDLE FOR TRANSPORTATION   IS ENORMOUS IN MANY OF THESE  STATES.   >> AND THEN YOU COME BACK AFTER   YOU HAVE HAD THE PROCEDURE. 
dXgNiQsML6w,2395226,2405569,"THANK YOU.  >>> COMING UP, EMERGENCY ROOM   DOCTORS SUING OVER UNSAFE   WORKING CONDITIONS.   THEY SAY PROFIT DRIVEN COMPANY"
dXgNiQsML6w,2405569,2412142,OFFICIALS PRESENT THEM TO WORK  EVEN THOUGH THEY HAD COVID  SYMPTOMS.   RUDY GIULIANI SAYS HE -- MARK  ?
dXgNiQsML6w,2412142,2418048,THAT IS WHAT WE HAVE BEEN TOLD.   >> NO.  >>> THE FIRE HAS GROWN LEAPS  AND BOUNDS.   >> IT IS PRETTY BAD.  >>> THIS IS THE BEST TIME OF
dXgNiQsML6w,2418048,2423254,THE MORNING.
dXgNiQsML6w,2423254,2428759,">>> NBC NEWS COVERS HUNDREDS OF   STORIES EACH DAY AND BECAUSE  YOU COULD NOT POSSIBLY READ,"
dXgNiQsML6w,2428759,2434098,"WATCH, LISTEN TO THEM ALL, OUR  TEAMS HAVE DONE IT FOR YOU. "
dXgNiQsML6w,2434098,2440137,THIS IS WHAT THEY TELL US IS  GOING DOWN IN THEIR REGIONS IN  THIS SEGMENT WE LIKE TO CALL -- 
dXgNiQsML6w,2440137,2456153,THE NEW YORK STATE SUPREME  COURT IS BLOCKING A LAW THAT  ALLOWS NONCITIZENS TO VOTE IN 
dXgNiQsML6w,2456153,2461892,"NEW YORK CITY.  REPUBLICAN LAWMAKERS CHALLENGE  THE MEASURE, SAYING IT WAS  UNCONSTITUTIONAL.   MORE THAN 800,000 NONCITIZENS   AND DREAMERS IN NEW YORK CITY   WOULD HAVE BEEN ALLOWED TO VOTE "
dXgNiQsML6w,2461892,2467565,"IN THE MISCIBLE ELECTIONS AS  EARLY AS NEXT YEAR.   >>> ALSO, A FORMER IN YOUR CITY   MAYOR, RUDY GIULIANI, SAYS HE   STILL FEELS PAIN AFTER HE WAS "
dXgNiQsML6w,2467565,2477474,ALLEGEDLY SLAPPED ON THE BACK 
dXgNiQsML6w,2477474,2482946,"BY A SUPERMARKET EMPLOYEE ON  SUNDAY IN STATEN ISLAND.  HE WAS CAMPAIGNING FOR HIS SON,   ANDREW, WHO IS RUNNING FOR  GOVERNOR THE SUSPECT WAS  CHARGED WITH SECOND-DEGREE"
dXgNiQsML6w,2482946,2490955,ASSAULT ACCORDING TO THE NYPD.  THE ATTORNEY SAYS THAT HE   PATTED HIM AND WENT ON WITHOUT
dXgNiQsML6w,2490955,2500097,MALICE. 
dXgNiQsML6w,2500097,2505603,">>> FROM ANOTHER BUREAU, SEVEN  WERE RESCUED THIS WEEKEND AFTER   LIGHTNING STRUCK THEIR BOAT 100   MILES OFF THE COAST OF FLORIDA.   THE GROUP WAS HEADED BACK TO"
dXgNiQsML6w,2505603,2513944,"SHORE WHEN AN UNEXPECTED STORM  SWEPT IN.   THE COAST GUARD CAME IN TO  AIRLIFT ALL OF THE PASSENGERS   OFF THE BOAT AND, THANKFULLY, "
dXgNiQsML6w,2513944,2519149,NO ONE WAS INJURED.   >>> NOW WE WANT TO BRING YOU  TODAY'S ORIGINAL WITH IN-DEPTH  REPORTING ON A TOPIC WE HAVE  BEEN KEEPING AN EYE ON. 
dXgNiQsML6w,2519149,2526357,"WHEN YOU GO TO A DOCTOR LIKE AN   EMERGENCY CARE FACILITY, YOU"
dXgNiQsML6w,2526357,2539203,EXPECT ALL AVAILABLE
dXgNiQsML6w,2539203,2544775,"PRECAUTIONS ARE MEDICALLY TAKEN   FOR YOUR SAFETY, RIGHT?   WHAT IF THE DOCTOR WHO IS   EXAMINING YOU HAS COVID   SYMPTOMS AND COMES TO WORK  ANYWAY WITHOUT GETTING TESTED?"
dXgNiQsML6w,2544775,2550680,"ACCORDING TO A LAWSUIT FILED  AGAINST AMERICAN PHYSICIAN  PARTNERS, A PRIVATE EQUITY  BACKING EMERGENCY MEDICINE  STAFFING AND SERVICES PROVIDER,   THAT IS EXACTLY WHAT HAPPENED.  A LAWSUIT ALLEGES DOCTORS WERE"
dXgNiQsML6w,2550680,2557054,ENCOURAGED TO NOT TEST FOR  COVID-19 AND TO COME TO WORK  WHEN THEY WERE SICK OR HAD  SYMPTOMS UNDER AMERICAN   PHYSICIAN PARTNERS MANAGEMENT.  WE HAVE MORE ON THE STORY.
dXgNiQsML6w,2557054,2579810,">> Reporter: THIS JANUARY, THIS   DOCTOR SAYS SHE TOLD HER BOSS"
dXgNiQsML6w,2579810,2585616,"AT THE STAFFING COMPANY THAT  YOU TESTED POSITIVE FOR COVID-  19.   IN A RECENT LAWSUIT, THEY SAID  THEY TOLD HER TO COME TO WORK.  >> I WAS ASKED SEVERAL TIMES"
dXgNiQsML6w,2585616,2590754,AND PRESSURED.  >> Reporter: SHE IS AN  EMERGENCY DEPARTMENT PHYSICIAN  AT HOUSTON METHODIST HOSPITAL.  >> I DECIDED TO TAKE --   PRESIDENT XI JINPING SHE SAYS 
dXgNiQsML6w,2590754,2599663,SHE WENT AGAINST THE UNOFFICIAL   COVID POLICY OF THE FOR-PROFIT  HOSPITAL.   IT PROVIDE MEDICAL STAFF TO   THOSE.  SHE AND SEVEN OF HER PHYSICIANS 
dXgNiQsML6w,2599663,2612543,"ARE ALLEGING OFFICIALS PRESENT  THEM TO WORK WHILE SICK, EVEN   IF THEY CONTRACTED COVID.   THEY HAVE NOT INDEPENDENTLY   VERIFIED THE ALLEGATION."
dXgNiQsML6w,2612543,2618081,">> I WAS RIDICULED BY THE   MEDICAL DIRECTOR IN FRONT OF MY   OTHER COLLEAGUES, SAYING, YOU   KNOW, THEY'RE HAVING TO COVER   FOR ME BECAUSE I WAS STAYING"
dXgNiQsML6w,2618081,2628558,"HOME WITH A SORE THROAT.  >> Reporter: IT IS OF THROAT  THAT ONE OFFICIAL DESCRIBED AS  --  >> MUST NOT TEST, AND MORE. "
dXgNiQsML6w,2628558,2645375,>> A SPOKESPERSON FOR AMERICAN  PHYSICIAN PARTNERS TOLD NBC   NEWS THIS COMPANY POLICY IS NOT   TO DISCUSS PENDING LITIGATION   AND DECLINED TO ANSWER  QUESTIONS ABOUT WHETHER THE 
dXgNiQsML6w,2645375,2650747,"WORK POLICIES AIMS TO BOOST   PROFITS AND APPEAL TO   INVESTORS.  ACCORDING TO ITS WEBSITE, THEY  PROVIDE EMERGENCY DEPARTMENT  STAFFING AT OVER 150 FACILITIES   IN 18 STATES. "
dXgNiQsML6w,2650747,2664728,THE COMPANY WAS FOUNDED IN 2015   AND IS BACKED BY CAPITAL  PARTNERS.   IT IS THE UNIT OF NEW YORK  INVESTMENT FIRMS HERE.
dXgNiQsML6w,2664728,2669733,"OFFICIALS DECLINED TO COMMENT,  CITING THE LITIGATION.  >> THEY HAVE A LOT OF POWER AND   THEY WILL USE THAT BECAUSE THE  PRESSURES FOR-PROFIT ARE SO "
dXgNiQsML6w,2669733,2674838,EXTREME.  >> MORE AND MORE EQUITY FIRMS   ARE GETTING INTO HEALTHCARE.  THEY OVERSEE AN ESTIMATED 40%   OF U.S. HOSPITAL EMERGENCY
dXgNiQsML6w,2674838,2687884,DEPARTMENTS.  ACCORDING TO FINANCIAL RECORDS  --  >> THEY BUY OUT A COMPANY WITH  A LOT OF DEBT AND ALL OF THAT 
dXgNiQsML6w,2687884,2713944,"DEBT THEN GETS PLACED ONTO THE  COMPANY INTO AN ALMOST  IMPOSSIBLE SITUATION, WHERE   THEY HAVE TO EXPAND AND   GENERATE SUCH HIGH-MARGIN   PROFITS.  >> Reporter: IN ONE STATEMENT, "
dXgNiQsML6w,2713944,2719716,"THE HOSPITAL SYSTEM, WHICH IS   NOT PART OF THE LAWSUIT, SAID   THE LITIGATION WAS AN INTERNAL  DISPUTE THAT HAD NOTHING TO DO  WITH THE CARE PROVIDED BY THE "
dXgNiQsML6w,2719716,2725054,HOSPITAL AND THEY WERE UNAWARE  OF ANY DOCTOR COMING TO WORK  AFTER TESTING POSITIVE FOR  COVID.  THE LAWSUIT AGAINST APP IS A  SIGN OF GROWING DISCONTENT
dXgNiQsML6w,2725054,2730894,"AMONG FRONTLINE HEALTHCARE  WORKERS WITH FOR-PROFIT   STAFFING.   >> YOU FEEL LIKE YOU ARE JUST   ANOTHER PHYSICIAN --  >> I THINK SITUATIONS LIKE THIS   OVER CUTTING PAY, NOT BEING "
dXgNiQsML6w,2730894,2736366,"VALUED, NOT BEING APPRECIATED,"
dXgNiQsML6w,2736366,2751715,JUST THESE PEOPLE GETTING 
dXgNiQsML6w,2751715,2757187,"CLOSER TO BURNOUT.  >> SO, SOME STATE LEGISLATORS   AND SOME STATES ARE ACTUALLY  PROPOSING BILLS THAT WOULD REIN   IN HEALTHCARE ACQUISITIONS BY   FOR-PROFIT AND PRIVATE EQUITY "
dXgNiQsML6w,2757187,2767564,"ENTITIES.   WHAT DOES THAT LEGISLATION LOOK   LIKE AND WHAT COULD IT MEAN FOR   STAFFING COMPANIES LIKE   AMERICAN PHYSICIAN PARTNERS?  >> A COUPLE WEEKS AGO, STATE  LEGISLATURES IN PENNSYLVANIA"
dXgNiQsML6w,2767564,2772969,"PROPOSED A PACKAGE OF NEW BILLS   TWO, QUOTE, SAFEGUARD THE   INTEGRITY OF LOCAL HEALTHCARE   SYSTEMS AND PROTECT PATIENTS"
dXgNiQsML6w,2772969,2782713,FROM SUFFERING THE  REPERCUSSIONS OF GREEDY AND   IRRESPONSIBLE HOSPITAL TEAMS  CARRIED OUT BY PRIVATE EQUITY 
dXgNiQsML6w,2782713,2792389,FIRMS.  THEY WOULD ESTABLISH A TWO YEAR   MORATORIUM ON THE TRANSFER OF   OWNERSHIP OF ANY HEALTH SYSTEM  OR HOSPITAL IN THE STATE OF   PENNSYLVANIA WHEN IT INVOLVES A 
