vid,start,end,text
dXgNiQsML6w,2792389,2802232,FOR-PROFIT ENTITY.  ANOTHER ONE OF THE BILLS THAT   IS PART OF THAT PACKAGE IS ONE  THAT WOULD ALTOGETHER PROHIBIT  THE OWNERSHIP OF ANY HOSPITAL 
dXgNiQsML6w,2802232,2809006,IN PENNSYLVANIA BY FOR-PROFIT 
dXgNiQsML6w,2809006,2814711,"ENTITIES.   ONLY TIME WILL TELL WHETHER   THEY WILL GET ENOUGH SUPPORT TO   BECOME LAW, BUT THE POINT HERE  IS THAT STATES ARE PAYING   ATTENTION AND THEY ARE TRYING "
dXgNiQsML6w,2814711,2819917,"TO DO SOMETHING ABOUT THIS,   TOM.  >> GOOD REPORTING.  >>> WIMBLEDON IS BACK AND GUESS   WHAT?   NOVAK DJOKOVIC PROBABLY IS  PLAYING IN HIS LAST MAJOR "
dXgNiQsML6w,2819917,2827591,TOURNAMENT OF THE YEAR.  AM KEI 
dXgNiQsML6w,2827591,2837167,WILL TAKE ON THIS MORE  ON BORN   TO RULE.  >>> THE FIRE HAS GROWN BY LEAPS   AND BOUNDS.   >> IT IS PRETTY BAD.
dXgNiQsML6w,2837167,2843206,>>> WIMBLEDON IS BACK.  MATCHES KICKED OFF IN LONDON
dXgNiQsML6w,2843206,2855786,"AND STAKES ARE HIGH, ESPECIALLY   FOR SUPERSTARS NOVAK DJOKOVIC   AND SERENA WILLIAMS."
dXgNiQsML6w,2855786,2861325,"FOR NOVAK DJOKOVIC, THIS WILL   BE HIS LAST SLAM.   HE WON HIS FIRST MATCH IN FOUR  SETS.   HAS NOT GOTTEN VACCINATED   AGAINST COVID, SO HE WILL NOT "
dXgNiQsML6w,2861325,2866797,BE ABLE TO PLAY IN THE U.S.   OPEN LATER THIS SUMMER IN NEW   YORK.   WILLIAMS IS ALSO MAKING HER OWN   COME BACK TO GRAND SLAM TENNIS
dXgNiQsML6w,2866797,2878508,AFTER A YEAR AWAY. SHE GOT HER
dXgNiQsML6w,2878508,2883814,"FIRST MATCH OF LAST YEAR'S  TOURNAMENT.   SHE WILL PLAY HER FIRST MATCH   TOMORROW.   THE TOURNAMENT WILL ALSO HAVE   SOME NOTABLE ABSENCES, ALL  RUSSIAN AND BELARUSIAN PLAYERS"
dXgNiQsML6w,2883814,2893423,"ARE BANNED BECAUSE OF RUSSIA'S  INVASION OF UKRAINE.  THAT INCLUDES THE MEN'S NUMBER  ONE PLAYER, DANIEL.   LET'S TALK THROUGH THE START  WITH DJOKOVIC.  WE FOLLOWED HIS JOURNEY WITH"
dXgNiQsML6w,2893423,2901898,THE UPS AND THE DOWNS AND ALL   THE BACKS AND FORTH.  HE WAS NOT VACCINATED.  HOW IMPORTANT IS THIS FOR HIM?  IT IS HIS LAST OPPORTUNITY FOR
dXgNiQsML6w,2901898,2917447,"A GRAND SLAM TITLE, RIGHT?  >> THAT IS RIGHT.   THIS IS MONUMENTALLY IMPORTANT"
dXgNiQsML6w,2917447,2923219,"IN ANY YEAR, A NORMAL YEAR.   CERTAINLY NOW, HE IS NOT  WILLING TO GET VACCINATED, SO   HE UNDERSTANDS HE LIKELY WILL   NOT BE ABLE TO SHOW UP AT THE "
dXgNiQsML6w,2923219,2934031,U.S. OPEN IN NEW YORK IN THE  COMING WEEKS.   HE WAS DEPORTED FROM AUSTRALIA. 
dXgNiQsML6w,2934031,2939669,"THEY ARE NOT ABLE TO RETURN TO  THE NEXT SEVERAL YEARS.'S   DECISION TO NOT GET VACCINATED,   WHICH HE HAS DOUBLE DOWN ON   AGAIN, SAYING HE REFUSES TO DO"
dXgNiQsML6w,2939669,2949112,"SO, IS SIGNIFICANTLY IMPACTING  HIS ABILITY TO PLAY IN GRAND  SLAMS.  OF COURSE, THAT IS WHY SO MUCH  RIDES ON HIS SHOULDERS AT "
dXgNiQsML6w,2949112,2954584,WIMBLEDON. IT IS ESSENTIAL FOR
dXgNiQsML6w,2954584,2960223,"HIM TO WIN.   >> LET'S TALK ABOUT EVERYBODY'S   FAVORITE, SERENA WILLIAMS.  SHE HAS BEEN OUT FOR A YEAR AND   SHE IS 40.  OUR PEOPLE READING HER SUDDEN "
dXgNiQsML6w,2960223,2970734,"RETURN TO WIMBLEDON AND HER   GOAL FOR A 24th GRAND SLAM  TITLE?  >> YEAH, PEOPLE ARE SO EXCITED  THAT SERENA WILLIAMS IS HERE. "
dXgNiQsML6w,2970734,2976339,SERENA WILLIAMS -- SHE IS   SERENA WILLIAMS.  A LOT OF PEOPLE DO NOT THINK  SHE WAS GOING TO BE ABLE TO   MAKE IT BUT IT IS LIKE TIGER
dXgNiQsML6w,2976339,2983246,WAS PLAYING AT THE MASTERS. 
dXgNiQsML6w,2983246,2988718,"IS SHE GOING TO RANK?   IS SHE GOING TO WIN?  LIKELY NOT BUT SHE IS SERENA  WILLIAMS.   ANYTHING IS POSSIBLE.   IF SHE DOES, IF SHE DOES HAPPEN "
dXgNiQsML6w,2988718,3001698,"TO COME BACK BECAUSE SHE HAS  NOT PLAYED A COMPETITIVE  SINGLES MATCH IN OVER A YEAR,   IF SHE WINS, SHE WOULD TIE WITH "
dXgNiQsML6w,3001698,3007204,"MARGARET COURT FOR THE 24th   GRAND SLAM TITLE, WHICH IS A  RECORD IN WOMEN'S TENNIS.   WE WILL SEE AND WE WILL BE  WATCHING HER CLOSELY AS SHE "
dXgNiQsML6w,3007204,3012241,"TAKES THE COURT FOR THE FIRST   TIME.   >> I WOULD NEVER BET AGAINST  HER.  WHEN IT COMES TO THE BAN ON   RUSSIAN AND BELARUSIAN PLAYERS, "
dXgNiQsML6w,3012241,3018014,THAT LEAVES 16 OF THE TOP 100   PLAYERS ELIGIBLE TO COMPETE   INELIGIBLE.   HOW SIGNIFICANT IS IT THAT SO 
dXgNiQsML6w,3018014,3033897,MANY OF THEM WILL NOT BE THERE? 
dXgNiQsML6w,3033897,3039135,>> Reporter: IT IS PRETTY   SIGNIFICANT.  THE ALL ENGLAND CLUB MAKING   THIS TOUGH DECISION.  THERE ARE DIFFERING OPINIONS ON   WHETHER OR NOT IT WAS THE RIGHT 
dXgNiQsML6w,3039135,3046376,"ONE.  DJOKOVIC WAS VERY OUTSPOKEN,  SAYING IT WAS A CRAZY DECISION.   WE'RE TALKING ABOUT TWO TOP "
dXgNiQsML6w,3046376,3052415,SEED RUSSIANS.  HE IS THE HIGHEST RANKED PLAYER   AT THE WORLD.   THERE ARE ANOTHER SIX   BELARUSIANS THAT WERE ALSO  SEATED AT THIS TOURNAMENT.  WILL ANY OF THEM -- THE IMPACT
dXgNiQsML6w,3052415,3065195,HERE IS THE FACT THAT IT  IMPACTED THE DRAW.
dXgNiQsML6w,3072903,3078175,">> WHEN I WAS A TEENAGER, I "
dXgNiQsML6w,3078175,3084214,"SNUCK IN BUT THAT IS FOR  ANOTHER DAY AND ANOTHER STORY.  THANK YOU SO MUCH.  ALL RIGHT, WE'VE GOT BREAKING   NEWS OUT OF UTAH. "
dXgNiQsML6w,3084214,3090987,A JUDGE GRANTING A TEMPORARY  RESTRAINING ORDER THAT WILL   BLOCK THE STATE FROM ENFORCING
dXgNiQsML6w,3090987,3097293,THE ABORTION BAN.   THIS IS ANOTHER TRIGGER LAW   THAT WENT INTO EFFECT AFTER ROE   V. WADE GOT OVERTURNED.   THE ORDER WILL LAST 14 DAYS.
dXgNiQsML6w,3097293,3105202,THE JUDGE SAYS EFFECTIVE WOMEN  ARE DEPRIVED OF STATE AND LOCAL   MEDICAL TREATMENT TO TERMINATE
dXgNiQsML6w,3105202,3110340,NANCY.  UTAH IS THE SECOND STATE TO SEE   ITS TRIGGER LAW LOCKED TODAY  AFTER LOUISIANA OFFERED A 
dXgNiQsML6w,3110340,3115545,SIMILAR OUTCOME EARLIER TODAY.
dXgNiQsML6w,3115545,3119749,"THAT IS A WRAP FOR THIS HOUR.   WE WILL HAVE MORE TOMORROW SAME   TIME, SAME PLACE.   COVERAGE PICKS UP RIGHT NOW."
