vid,start,end,text
EP4Hf63zR6w,1508640,1514720,annular space between the duct wall and  the cylinder  and some of the exhaust gases that come
EP4Hf63zR6w,1514720,1521600,from the turbojet  actually travel around in between that  gap and bleed in through those holes
EP4Hf63zR6w,1521600,1526880,providing a little inner buffer layer  between the hot flame and the steel
EP4Hf63zR6w,1526880,1531919,it works if you take a look at a typical  example of an afterburner firing up on a
EP4Hf63zR6w,1531919,1537279,fighter jet you'll see that the gases  inside are incandescently hot but the
EP4Hf63zR6w,1537279,1544640,walls if they're glowing at all are  usually glowing a relatively dull color  or they're not even glowing it does work
EP4Hf63zR6w,1544640,1551679,so that's what we did in version 2.0  fabricated a container tube or an outer
EP4Hf63zR6w,1551679,1558320,tube out of thin wall stainless steel  tubing  welded a flange on the back so that we  could mount this on the output from the
EP4Hf63zR6w,1558320,1564559,jet engine  and then placed a feed through for the  spark plug and for the fuel
EP4Hf63zR6w,1564559,1570000,this tube here is about three and a half  inches od or about eight and a half  centimeters and it's about a half a
EP4Hf63zR6w,1570000,1577360,meter long  at the far end we put a small reduction  in diameter a little nozzle but you'll
EP4Hf63zR6w,1577360,1583520,notice that this nozzle is substantially  smaller than the one that was used on  the same engine because we need to get
EP4Hf63zR6w,1583520,1589120,out a much larger volume of gas that's  been created by the additional heat
EP4Hf63zR6w,1589120,1596400,inside of this tube  is the inner liner tube  what i did with this is took a shorter
EP4Hf63zR6w,1596400,1601600,piece of stainless steel tubing this is  about 40 centimeters or 16 inches long
EP4Hf63zR6w,1601600,1607679,placed it on a lathe and just use the  lathe to scribe lines about one  centimeter apart
EP4Hf63zR6w,1607679,1615200,and then drew lines with the tool 16  lines like this to produce a grid to  locate the position of the holes
EP4Hf63zR6w,1615200,1621120,then  welded a cone on this end  and threaded the end of the cone to
EP4Hf63zR6w,1621120,1627279,accept a quarter npt fitting  sort of a plumbing type fitting
EP4Hf63zR6w,1627279,1632320,and i have a right angle your lock  fitting right in here that screws in and
EP4Hf63zR6w,1632320,1639120,in the end of this fitting i placed  a misting fuel nozzle like this
EP4Hf63zR6w,1639120,1645440,now because i didn't want to reach in in  order to be able to get this inside  i simply took the inside of the tubing
EP4Hf63zR6w,1645440,1651120,of the right angle fitting and threaded  it for 1 8 npt a much finer thread like
EP4Hf63zR6w,1651120,1657600,this  put this thing in the lathe and turn  down the outer mushroom shape of the end
EP4Hf63zR6w,1657600,1663440,of the nozzle this is the exact same  nozzle turned down and before  fabricating so that this entire
EP4Hf63zR6w,1663440,1671200,apparatus can slip in from the end and i  can change different nozzle sizes this  produces about an 80 degree spread of
EP4Hf63zR6w,1671200,1676399,fuel into the cone and into the  beginning part of the  tube here
EP4Hf63zR6w,1676399,1682640,then welded four studs on each end 90  degrees apart that keep this centered  inside of here
EP4Hf63zR6w,1682640,1688399,and then began drilling holes  the design of the holes is similar and  based on the same philosophy of the
EP4Hf63zR6w,1688399,1693520,flame holder inside of a turbojet engine  we start out with a large number of very
EP4Hf63zR6w,1693520,1700080,tiny holes that provide mixing of the  fuel and the air and a relatively  low air velocity
EP4Hf63zR6w,1700080,1705760,then we complement that by threading  some of those holes and placing some  fine thread
EP4Hf63zR6w,1705760,1712480,button  cap head screws  this provides the flame holders and then  right behind that mixture of fuel and
EP4Hf63zR6w,1712480,1718640,air we locate the port for the spark  plug  that fuel that begins burning here is
EP4Hf63zR6w,1718640,1723679,still burning pretty rich and as this  moves down it begins to gain more and
EP4Hf63zR6w,1723679,1728960,more air to assure that we get a full  burn of the fuel air mixture
EP4Hf63zR6w,1728960,1734559,finally near the end i increased the  number of holes to make sure that we  didn't get any flow resistance from the
EP4Hf63zR6w,1734559,1740320,large quantity of air that's coming into  our gas exhaust coming into the  afterburner engine
EP4Hf63zR6w,1740320,1746320,an interesting thing you can see  something that i didn't optimize  is the color differential here
EP4Hf63zR6w,1746320,1752480,i probably should have started these  holes a little bit lower maybe a little  smaller maybe
EP4Hf63zR6w,1752480,1758880,not so many of them because as the gas  was flowing into the tube and the  pressure was dropping on the outer
EP4Hf63zR6w,1758880,1764960,annular space between these two tubes we  were getting less and less protective  cooling at this end and this end got a
EP4Hf63zR6w,1764960,1770320,little bit hotter it didn't melt it it  certainly didn't make it not function  but you can see it's somewhat of an
EP4Hf63zR6w,1770320,1778000,iterative  trial and error type of process  240 holes here 120 holes here 60 holes
EP4Hf63zR6w,1778000,1784000,here three millimeters five millimeters  that's it
EP4Hf63zR6w,1784000,1791840,now the way this assembles  is  let's see if i can get this lined up
EP4Hf63zR6w,1792000,1797760,the inner tube  feeds into this outer tube with minimal  clearances so i have to sometimes wiggle
EP4Hf63zR6w,1797760,1802919,this around a little bit to get it to  fit
EP4Hf63zR6w,1811120,1818159,[Music]  there we go piece of cake
EP4Hf63zR6w,1818159,1823840,then as i slide this in  when this hole lines up with the spark  plug
EP4Hf63zR6w,1823840,1829520,this input for the your lock fitting  lines up with the input of the fuel
EP4Hf63zR6w,1829520,1836640,we get this in here like this  get the pipe to seat in here tighten
EP4Hf63zR6w,1836640,1841679,these nuts like this  install the spark plug like this
EP4Hf63zR6w,1841679,1848240,and we're ready to go  so let's go outside hook this guy up and  i'll show you how it works
EP4Hf63zR6w,1848880,1854960,all right so we've installed this on the  end of the turbojet we're using a little  flare coupling to allow us to use a v
EP4Hf63zR6w,1854960,1861039,band clamp that takes the two flanges  and holds them together and by tightly  screwing this together it squeezes this
EP4Hf63zR6w,1861039,1868640,and puts a lot of pressure on the two  approximate faces  this is the fuel supply for the kerosene
EP4Hf63zR6w,1868640,1874640,or the jet fuel that goes into the  afterburner this is a check valve that  prevents retrograde flow if we had any
EP4Hf63zR6w,1874640,1880559,kind of a problem we're not going to  feed hot gases into the fuel system this  is the spark plug and this is a
EP4Hf63zR6w,1880559,1886080,secondary support system that just  provides additional support so that  we're not just levering everything off
EP4Hf63zR6w,1886080,1893440,of the end of the  turbojet so now we're ready to go let's  get this thing fired up
EP4Hf63zR6w,1893440,1898960,all right so now what we're going to do  is run it up the same as we did the last  time except now i have the separate fuel
EP4Hf63zR6w,1898960,1904640,pump  and the ignition system for the  afterburner  so here we go
EP4Hf63zR6w,1904640,1911279,turn on the oil pump  and adjust it to about 40 psi
EP4Hf63zR6w,1912720,1918278,the fuel pump  adjusted to about 50 psi
EP4Hf63zR6w,1923200,1928880,all right  then we hit the ignition
EP4Hf63zR6w,1930720,1935480,and turn on the fan it's going to get  pretty loud
EP4Hf63zR6w,1953600,1956600,so
EP4Hf63zR6w,1966240,1969240,so
EP4Hf63zR6w,1979519,1982519,so
EP4Hf63zR6w,2018990,2022528,[Applause]
EP4Hf63zR6w,2025810,2029060,[Applause]
EP4Hf63zR6w,2034180,2041200,[Applause]  it works
EP4Hf63zR6w,2041200,2048079,now the interesting thing  about an afterburner is that  you can put almost anything you want
EP4Hf63zR6w,2048079,2053440,through there to burn  you can use jet fuel or kerosene you can
EP4Hf63zR6w,2053440,2060398,use diesel fuel  you can use alcohol isopropyl alcohol  and even rum
EP4Hf63zR6w,2060398,2067520,disappointing thing is it's so hot uh  once you fire it up you can't smell the  rum so but it does work
EP4Hf63zR6w,2067520,2075280,in addition you can use the same design  to put other things through the  afterburner that you don't burn
EP4Hf63zR6w,2075280,2080480,so what we're going to do is we're going  to refit this with model 1.0 and we're
EP4Hf63zR6w,2080480,2085679,going to put some fog juice through it  we'll see what happens
EP4Hf63zR6w,2086480,2091919,okay so we took out the mark ii  afterburner and put in mark one
EP4Hf63zR6w,2091919,2097760,this one does not have any ignition  system hooked up to it and we took off  the accelerating cone on the end but
EP4Hf63zR6w,2097760,2104720,left the flame holders and this is what  we're going to be pumping the fog juice  into i think you'll like it
EP4Hf63zR6w,2106480,2112000,all right so we're going to run it up  one more time we're going to use the  afterburner fuel system not the ignition
EP4Hf63zR6w,2112000,2116760,system to pump in the fog juice
EP4Hf63zR6w,2120410,2123569,[Applause]
EP4Hf63zR6w,2127839,2133640,all right  here we go gonna be loud
EP4Hf63zR6w,2134120,2190409,[Music]
EP4Hf63zR6w,2192079,2238320,do  [Music]
EP4Hf63zR6w,2238320,2245200,man i love my job  this is a heck of a lot of fun  so in any case you can use these
EP4Hf63zR6w,2245200,2251839,afterburners for a variety of different  purposes and if you want to produce fog  and you don't want to just do say a high
EP4Hf63zR6w,2251839,2258800,school performance of river dance or a  little disco performance but you want to  say cover the intersection of a road or
EP4Hf63zR6w,2258800,2264560,maybe a small town  this is your baby  we're also going to be following this up
EP4Hf63zR6w,2264560,2271440,as i said with several very short videos  that break down the subsystems of this  unit so that you can reproduce this and
EP4Hf63zR6w,2271440,2277119,we'll give you all the parts and pieces  and  plans and ideas about what you need to  know in order to be able to make this
EP4Hf63zR6w,2277119,2283760,work  and i want to thank you very much for  watching  stay safe  you have a lot of fun
EP4Hf63zR6w,2283760,2287320,and we'll see you soon
EP4Hf63zR6w,2289420,2304160,[Music]
EP4Hf63zR6w,2304160,2306240,you
