vid,start,end,text
GAZpNGwjcwM,1494330,1499610,dice compartimos los mismos gustos  bonitas y no podría más y chicas
GAZpNGwjcwM,1499610,1504710,confesión está bien bonita y bueno  llorar me gusta mucho esa canción por
GAZpNGwjcwM,1504710,1511250,ejemplo te me gustó mucho la de la ms  que se llama  se me olvidó
GAZpNGwjcwM,1511250,1517640,me cansé  ayesa de ladakh y de la ms no está si lo
GAZpNGwjcwM,1517640,1524230,pongo la camioneta y entre sí si casa  aquí no a poner es porque está por ese  mono reportar no puedo pagar a pagar  pestaña
GAZpNGwjcwM,1524230,1530390,y dicen una semana confesiones no os  demás mi confesión una estética bien
GAZpNGwjcwM,1530390,1537170,feas ya se nos está yendo pero le veo  muy  bueno ya existe que les digo que siempre
GAZpNGwjcwM,1537170,1542720,una relación es chicas siempre pasa que  a alguien le gusta más que a la otra  persona una persona es más seca una
GAZpNGwjcwM,1542720,1549650,persona es más activa una persona le  gusta más a otra no y ya que  lamentablemente quiero decirlo así pero  que usted digan cómo que geron andando
GAZpNGwjcwM,1549650,1555149,más pensando en eso no yo sí soy más así  chicas  este distrito
GAZpNGwjcwM,1555149,1561029,tristemente así dijeron me lo ha dicho  no sabes que tú piensas como que yo  estoy bien si piensa en eso no es
GAZpNGwjcwM,1561029,1566720,gracias como que nada no quiero no me  dan ganas siempre es 9
GAZpNGwjcwM,1567590,1574279,19 qué bueno pero ya visteis el vídeo no  noche acaso se sabe te gusta la canción
GAZpNGwjcwM,1574279,1581760,pero ni siquiera he visto pero si se  genera peor así ya bien  es que el chile atacado bienvenida a la
GAZpNGwjcwM,1581760,1589970,competencia  los varamientos pegar para ver parece  déjenme paro con cuidado
GAZpNGwjcwM,1594440,1603559,ayuda siempre  [Música]  las pestañas y ahora mismo
GAZpNGwjcwM,1608440,1613750,aguanten avance  ya
GAZpNGwjcwM,1614890,1620330,a reportarnos ponerte las pestañas no  hay vuelta que dicen de repente creen
GAZpNGwjcwM,1620330,1625760,que pasó hoy llegamos con las aguas de  la gente y por tanto vaya haciéndose sus
GAZpNGwjcwM,1625760,1632090,comentarios payasos pues venía uno de  los vecinos hay paseándose con sus  perritos traía creo tres perritos creo
GAZpNGwjcwM,1632090,1639320,al alcance a ver pues llegan dos chicas  con las aguas entonces quiero le dice a  su hermano y abuelo a su familiar y a su
GAZpNGwjcwM,1639320,1646580,otro trabajador oigan haga hagan de paro  de descargar la camioneta y meter las  botellas si entonces chicas yo me bajo
GAZpNGwjcwM,1646580,1652640,hoy cabrón y estaba bajando mi bolsa y  mis cositas de electrónica avioneta mi
GAZpNGwjcwM,1652640,1657890,teléfono y así cuando balde este  señor este señor es el señor perdón
GAZpNGwjcwM,1657890,1666030,combinando  y se le ocurre decir  porque tanta agua pues que se van a ir a
GAZpNGwjcwM,1666030,1672660,vivir al desierto  y entonces lo voltea a ver el señor si
GAZpNGwjcwM,1672660,1678990,ese inmenso así como con los perritos al  perrito te dije a ti  entonces como que se voltea y otra vez
GAZpNGwjcwM,1678990,1685920,vuelve a decir vuelve a decir con toda  esa agua luego porque no se queda sin  agua y deja a chingar que habrá querido
GAZpNGwjcwM,1685920,1692190,decir quién es el  que por todo esa agua que yo compré la  gente se va a quedar sin agua ahora
GAZpNGwjcwM,1692190,1697710,resulta que  pido de una chica yo no sé ni qué así lo
GAZpNGwjcwM,1697710,1704010,dijo y luego le dije lo siente un  comentario que dijo él no que con todo  esa bueno pues que me voy a vivir al
GAZpNGwjcwM,1704010,1709320,desierto aunque porque por eso la gente  se queda sin agua que porque la que yo
GAZpNGwjcwM,1709320,1714730,comprendí ya no me enseñó  no sea payaso
GAZpNGwjcwM,1714730,1720340,yo ay diosito santo como no me compra  una botellita una mejor dedicada y se la
GAZpNGwjcwM,1720340,1726980,va a dar a otro  una vez yo vi un tick tock donde uno  muchos dólares a la canta se las voy a
GAZpNGwjcwM,1726980,1732000,dar a otro y el bato le contesta  con otra canción hay una chica yo le doy
GAZpNGwjcwM,1732000,1738809,un caso de los ajeros  pero miren sirvió que transmitirá con  esta distancia no me siento sola porque
GAZpNGwjcwM,1738809,1744360,sí acertó dijo hoy que hago pues escrita  me puedo bajar todavía chicas y además  porque todo no sé qué ropa ponerme hoy
GAZpNGwjcwM,1744360,1750510,todo va a poner que será money se dice  me quiera nos va a poner chicas hay acá
GAZpNGwjcwM,1750510,1757320,si inauguramos el atienda otra cosa  mañana espero en transmisión porque que  creen ya no me entregaron hoy el juguete
GAZpNGwjcwM,1757320,1762659,se acuerdan que la empresa está como le  sube una historia este si recuerdan una
GAZpNGwjcwM,1762659,1768630,empresa chicas que se dedica a hacer  juguetes juguetes reconocidos hacia una  marca que perro na
GAZpNGwjcwM,1768630,1774899,no sé si sea cara o no sea cara esta  marca pero el chiste que si es  reconocida y yo siento que todas mañana  la van a reconocer vamos a ver qué tipo
GAZpNGwjcwM,1774899,1781799,de marca de juguetes les digo este me  sorprendió tanto chicas les voy a contar  que nos hayan contactado
GAZpNGwjcwM,1781799,1787110,probé nuestros vídeos algo así no sé y  nos comenta oye pues este yo lo que
GAZpNGwjcwM,1787110,1794549,quiero hacer es que así como mis  juguetes a lo mejor nos para la venta ya  dependiendo o sea si ustedes quisieran
GAZpNGwjcwM,1794549,1800549,también tenerlo a lo mejor de sacar a la  venta chicas pero por lo mientras esta  juguetería quiso sacar me lo solamente
GAZpNGwjcwM,1800549,1806170,exclusividad mientras a mí  y si quisieran que siguiera salir esos
GAZpNGwjcwM,1806170,1811900,juguetes luego echaron entonces me  habían dicho con el trébol entre hoy o  mañana pero yo creo que nos llegan
GAZpNGwjcwM,1811900,1818380,chicas ha de venir está en camino sí yo  creo que mañana en el tren pero si bien  gustosa bien gustos de chica mañana lo
GAZpNGwjcwM,1818380,1823540,va a transmitir porque da un poco de  emoción es demostrarles eso que perrone
GAZpNGwjcwM,1823540,1829890,la verdad qué chingón saben que es mejor  una uña de mi pie
GAZpNGwjcwM,1831870,1837830,dice una tu eres celosa  [Música]  sincera
GAZpNGwjcwM,1837830,1843769,conversión empecé con hero siempre fui  muy valemadrista porque les voy a contar
GAZpNGwjcwM,1843769,1849289,yo les he dicho chicas que si yo me  dejaba de un novio y miles no lesionaba
GAZpNGwjcwM,1849289,1856519,sea como a los 34 días ya andaban con  otro y ya lo estoy alex ya lo luego como  a los dos días que lo amaba porque esta
GAZpNGwjcwM,1856519,1863059,pendeja entonces como que nunca me  clamaban las relaciones igual ya hubo  pocas y en las pocas que me clavaba se
GAZpNGwjcwM,1863059,1870440,pasaban la lanza conmigo hijos de la  chingada pues bueno entonces nunca me  gustaba aclararlo entonces cuando llega
GAZpNGwjcwM,1870440,1876710,a cero chicas es muy normal lo quería  mucho y todo pero no era muy celosa  cuando estuve cuando me empieza a ser
GAZpNGwjcwM,1876710,1883190,celosa cuando la hermana de géneros  cadáver para lo que ya temas no sólo  darle tal novia y que esto y que lo otro
GAZpNGwjcwM,1883190,1888889,un día vamos al centro chicas dijeron y  pasa una exnovia y lo avienta si bache
GAZpNGwjcwM,1888889,1894770,lo aventó en ese día yo no sabía que era  el ex novia hasta que él me dijo ayer a  ésta
GAZpNGwjcwM,1894770,1900770,pero cuando ellos me dice a mí ya me  caía mal por tanta mala que me dice a la  hermana
GAZpNGwjcwM,1900770,1905960,dice hola mona  un año si tu vecina me da pena hablar de
GAZpNGwjcwM,1905960,1911060,a cabrón vecina pero de enfrente de la  otra calle porque todas las de alquila
GAZpNGwjcwM,1911060,1918430,la calle a nadie le habló e  vestido negro monada  y que pone música
GAZpNGwjcwM,1921100,1928510,una que pestañas usas pues uso de varias  varillas uso desde las de diez pesitos  de 15 unas nuevas en colaboración esta
GAZpNGwjcwM,1928510,1934230,se la mandaron hace mucho una seguidora  de eeuu  no sé si se acuerdan que todas éstas
GAZpNGwjcwM,1934230,1940680,tienen brillitos claros todas y me la  has ido acabando y si no las pongo uso  de varias unas chiquitas no más grandes
GAZpNGwjcwM,1940680,1946140,depende de la ocasión depende a donde me  vaya además como muy grande espero que  creen las grandes como yo tengo chiquito
GAZpNGwjcwM,1946140,1951210,me ha servido la de hacer esta vista  perdón y saben que odio eso porque me
GAZpNGwjcwM,1951210,1957700,las pues también me gustan chiquitas  siempre me ha gustado las cosas grandes  entonces éste
GAZpNGwjcwM,1957700,1963279,me cae gordo eso porque no voy a poner  pestañas a mi gusto y cuando pongo
GAZpNGwjcwM,1963279,1971100,pestañas grandes me dice catherine  mensaje bueno perdón así estoy de mensah
GAZpNGwjcwM,1971430,1980670,una  fórmula  dice valzacchi tome cada pestaña de
GAZpNGwjcwM,1980670,1989580,chicago bien para ramiro la idiota  que pido con las vistas añadas
GAZpNGwjcwM,1989660,1996050,bueno ya  bueno te ves de argentina jales
GAZpNGwjcwM,1997180,2003280,[Música]  desde pegar las pestañas odio las
GAZpNGwjcwM,2003280,2010450,pestañas  a visitarlo porque este aprieta  significa que no me haya bañados y estoy
GAZpNGwjcwM,2010450,2017760,mañana diciendo ahora que tengo me bañé  y que hasta me dio hasta el tiempo de  sacarme el pelo y de planchar melo
GAZpNGwjcwM,2017760,2023070,chicas entonces hasta que acaba de  llegar a la transmisión hijas de la  verdad bueno porque no tengas las dos
GAZpNGwjcwM,2023070,2030210,cosas porque les va a repetir canal  comunicando mucho como de mi negocio  esté dando muy la verdad muy ocupada y
GAZpNGwjcwM,2030210,2036180,sil apurada ocupado en esas cosas que  voy y vengo que voy a ir recibo paquetes  y ya se me acaban los ganchos tengo que
GAZpNGwjcwM,2036180,2043680,volver a pedir al mercado libre que ya  se me acabó esto tengo que encargar y  así quienes sostienen que alguien  carguen entonces voy diario ahorita voy
GAZpNGwjcwM,2043680,2049620,a volver a ir otra vez porque no acabó  chicas y yo ya voy a inaugurar los  últimos porque el mostrador me lo
GAZpNGwjcwM,2049620,2055888,entregan creo el miércoles o el jueves  entonces ya cuando me entreguen el cómo  se llama el mostrador pues ya tiene que
GAZpNGwjcwM,2055888,2061980,estar listo las cosas entonces también  falta que lleguen los de megacable  porque lo voy a contratar internet para
GAZpNGwjcwM,2061980,2067590,que reciban las cámaras si sirven  ahorita chicas pero necesito que tener
GAZpNGwjcwM,2067590,2072658,buena resolución en las cámaras en lo  malo y no tengo todavía no sé si graban
GAZpNGwjcwM,2072658,2078280,pero graban como que no tan bien o sea  como que vela casi toda la magia de lo
GAZpNGwjcwM,2078280,2083398,que la tiene la gente ahora quién es  pero
GAZpNGwjcwM,2083398,2090878,soy yo no aprendí entonces este anda muy  ocupado en eso pero ya cuando ya
GAZpNGwjcwM,2090878,2097329,inaugurar y playa ya me va a quitar ese  peso de encima es un poquito estresante  porque estoy yendo diario chicas diario
GAZpNGwjcwM,2097329,2103660,voy para allá diario  qué
GAZpNGwjcwM,2103660,2108819,una ya viste el vídeo que subieron que  te están echando a andar ahora tu
GAZpNGwjcwM,2108819,2114930,hermana  como  estándar lo entiendo
GAZpNGwjcwM,2114930,2120720,andar  una sistemas fiscales estoy diciendo
GAZpNGwjcwM,2120720,2129700,las pestañas por esa chica las odio  la nativa tiene pero si estás en peligro
GAZpNGwjcwM,2130250,2136910,porque es una pestaña diferente  normalmente es el paquete lo abrió hoy  está nuevo no está vieron que cuando
GAZpNGwjcwM,2136910,2144450,vieron que con las tijeritas les corta  la esquinita se los juro  saleh
GAZpNGwjcwM,2148570,2155070,dice bueno acaba de subir ahorita un  vídeo de hormonas que según te tiene  envidia  míreles que si está loco con otra gente
GAZpNGwjcwM,2155070,2160540,ya la hagan caso hacia la gente chicas  buscan así como que meter controversias
GAZpNGwjcwM,2160540,2167899,ahí meter la pata  cuando te ves muy linda  y pensar que antes era muy peleón era
GAZpNGwjcwM,2167899,2173069,así chica las personas cambian no uno  siempre tiene que estar allí en 22 mismo
GAZpNGwjcwM,2173069,2178409,es simple un hoyo o la mona ya llegué  una cuarte la del lado derecho donde
GAZpNGwjcwM,2178409,2184020,empieza pues ya me la como de wii  no sé por qué no te pones extensiones de
GAZpNGwjcwM,2184020,2191800,pestañas porque yo soy alérgica a este  producto chicas me hace reacción a mi  ojo me hace alergia y si me hacen granos
GAZpNGwjcwM,2191800,2196960,cuando yo chicas me he puesto pestañas  es un tipo de líquido diferente y me
GAZpNGwjcwM,2196960,2204220,hace reacción chicas empiezan a ayudar  de granitos y me da alergia no puedo  ponerme pestañas ya estás realmente  solamente estos pegamentos que en un
GAZpNGwjcwM,2204220,2209980,ratito ya te aburrió ya te la quitas  pero eso es que te duran hasta 30 días  de nuevo a mí no me gustan ese tipo de
GAZpNGwjcwM,2209980,2216130,cosas porque porque si me hacen la  alergia entonces lo mejor negro es que  les digo contando la historia hoy te les
GAZpNGwjcwM,2216130,2221320,dije que se me quebró mi hijo ya no sé  qué traerá chicas pero desde chica  fíjense que nunca pueden crecer bien mis
GAZpNGwjcwM,2221320,2228340,uñas me crecen y se me quiebran no se  ven porque pueden durar y he visto  personas que la agarran la uña y sumió
GAZpNGwjcwM,2228340,2233680,bien grandes chicas a mí no a mí me  quiere crecer logró se me quiebra y no  se no se diga más de mis pies bueno que
GAZpNGwjcwM,2233680,2239050,mis pies los dejo bien firme  a mi chico me salen pero eso está aquí
GAZpNGwjcwM,2239050,2244130,esos son mis dedos  vídeos también raros y
GAZpNGwjcwM,2244130,2250360,y en mi dedo gordo parece la salchicha  mordida  de gente eso me voy a
GAZpNGwjcwM,2250360,2258490,coruña  muy mal me parece como los callejeros
GAZpNGwjcwM,2258880,2265970,y de la forma de uña o sea picudo  aparece el triángulo acá tengo esta agua
GAZpNGwjcwM,2265970,2272930,fría que se me quebró  tengo este piden de vídeos cómo están mi  dedo está está más grande que el gordo
GAZpNGwjcwM,2272930,2280580,si ven y cuando tiene que ser el wache  mis dedos este es el meñique el índice y
GAZpNGwjcwM,2280580,2286790,el anular  anularse el anular es el más grande que
GAZpNGwjcwM,2286790,2292030,es el tercero porque este el abuelo es  ese papá la mamá del hijo y el bisnieto
GAZpNGwjcwM,2292030,2297060,entonces de ser abuelo y este es el más  grande
GAZpNGwjcwM,2297060,2303930,miren el en acá acá le vale el  quiso ser más grande / chicas como
GAZpNGwjcwM,2303930,2310980,sobresale o se está más grande que me  dio google  vídeos también nuevas chicas de verdad
GAZpNGwjcwM,2310980,2316920,que si me dijeran dame una foto de tus  pies no yo creo que eso es para asustar
GAZpNGwjcwM,2316920,2322380,a más en vez de espantapájaros lo pone  en mi pata toma mi chica tengo mismo en
GAZpNGwjcwM,2322380,2329710,mis pies y encima lo alcanzó sígueme  quieran ver si me alcanzó te detengo
GAZpNGwjcwM,2329710,2335730,otra historia del caso chicas yo tengo  mucha más flexibilidad
GAZpNGwjcwM,2335730,2340200,un poco
GAZpNGwjcwM,2341200,2349499,no chicas y simón a poco si tienes y  chicas  yo sí tengo mucha facilidad
GAZpNGwjcwM,2349570,2358590,yo sí yo sí puedo fíjense que desde muy  chica a mí me gustaba mucho irme de pies  todavía pero ya de diferente
GAZpNGwjcwM,2359230,2366070,ahora eres de una raza bien berger aa  cabrón o si te pasa hay no dice el vídeo
GAZpNGwjcwM,2366070,2372070,de que no sabe todo  no aparece dejen les digo yo siempre
GAZpNGwjcwM,2372070,2379000,este cuando estaba más chica siempre se  puede abrir de pie chicas ya ven que  existe como se llama la rueda la que te
GAZpNGwjcwM,2379000,2386110,das así y que tener es difícil después  de la vuelta no la rueda de la fortuna  la ruleta o la rueda de visión la vuelta
GAZpNGwjcwM,2386110,2392860,del carro no cosas así que las de cites  y abre esto de sus pies de eso yo podía  o que te dejamos abrir de pie yo también
GAZpNGwjcwM,2392860,2398560,lo podía hacer el chicas ahora llegando  ahora me dijeron me dice a ver a ver a  plantearme también quiero en un calambre
GAZpNGwjcwM,2398560,2404560,no a chicas y yo no pagué mi juicio o  sea si los puedo menos de pendeja pero  lo que usted si ganamos una la elástica
GAZpNGwjcwM,2404560,2412089,no puedo  no puedo quitar me duelen no puedo  abrirle más mis pies no se los juro que
GAZpNGwjcwM,2412089,2418030,no puedo pero se tienen empate es que  quieras a veces quiera mis demás chicas  yo creo que para que toda su panza
GAZpNGwjcwM,2418030,2424630,que para aquí la mano y no puedo yo creo  que necesito más pierna para alcanzar  abrazarlo todo no puedo chicas así es
GAZpNGwjcwM,2424630,2430990,que no quiere entrar aquí y yo nunca  brindis que este debate hay no chicas a  veces a veces se me ha pasado eso y por
GAZpNGwjcwM,2430990,2437740,eso ahorita ahorita odio estas  posiciones porque no puedo no lo me dan  calambres empecé acción y ahora cuéntame
GAZpNGwjcwM,2437740,2443680,empiezo mi político  y empiezas a sentir que mi pie se me va
GAZpNGwjcwM,2443680,2450240,por otro lado dice mona nuevo las fotos  pero ya tomaron dos capturas a tus pies  y no ganaste dinero al nodo entonces el
GAZpNGwjcwM,2450240,2456270,cliente no sabía si pagar una mamá me  estrellas
GAZpNGwjcwM,2456930,2460400,entonces vamos de gratis
GAZpNGwjcwM,2463800,2471539,una vez más ha leído  allí  bueno mi saludo me llamo jade qué bonito
GAZpNGwjcwM,2471539,2480240,nombre y jade  mona el dedo gordo no se llama así
GAZpNGwjcwM,2480240,2487730,qué  no los días se dio aquí no volví a la
GAZpNGwjcwM,2487730,2493490,aplicación de pagan por mostrar tus  patas  ay no
GAZpNGwjcwM,2493490,2499210,y en dónde era eso  hay noches pensé
GAZpNGwjcwM,2499210,2506560,imagínense que después  esa aplicación y que después un día  me encuentran también un vídeo con un
GAZpNGwjcwM,2506560,2512349,dedo jajaja  calles de imaginen se va poco a poco y
GAZpNGwjcwM,2512349,2517760,vídeos de esos donde gente se habrá  hecho para la acción de la gente sexy  tipo que por eso
GAZpNGwjcwM,2517760,2523559,y se me quedan un calambre si así se  llama me quedaron un calambre
GAZpNGwjcwM,2523559,2530670,una atención y él nunca se lastimó está  para ver si acá se les dice así me
GAZpNGwjcwM,2530670,2537539,quedan un calambre un calambre chicas es  cuando te  sientes así como que el pie se te pone
GAZpNGwjcwM,2537539,2542549,tieso y que al momento de ponerse de pie  eso ya no lo puedes mover y empiezas a
GAZpNGwjcwM,2542549,2547619,sentirse como cosquillitas y eso es lo  peor chicas mía a mí me ha dado
GAZpNGwjcwM,2547619,2553319,calambres cuando me estoy bañando no es  lo peor chicas lo peor tienes que tener  unos huevos para agarrar te porque si no
GAZpNGwjcwM,2553319,2559229,te caído puras nalgas en el baño y más  en resumen no ve lo peor me halagó  cuando lo estoy haciendo y lo peor chica
GAZpNGwjcwM,2559229,2564719,es lo peor pero ay me da bien a tu  congelas cuando giró se ponía aquí por  eso no me gusta a mí no me gusta esa
GAZpNGwjcwM,2564719,2569939,posición es ahorita que haberá que está  tirada extranjeros mientras verdad y  luego una vez chicas me duele bien feo
GAZpNGwjcwM,2569939,2575400,me quedé gordo porque me acostó bien me  quise agarrar bien y aquí y aquí y
GAZpNGwjcwM,2575400,2581069,habría si agarrándolos los dos así y  cuando me quieran ser así chicas más  dije no yo creo que pensó que yo
GAZpNGwjcwM,2581069,2586430,era el titanic pero con las patas  normalmente bien feo pero
GAZpNGwjcwM,2587310,2591740,chicas no me tronó el cuerito
GAZpNGwjcwM,2594150,2601160,hay momentos después cuando ya  casi
GAZpNGwjcwM,2602359,2607099,no se  presentó
GAZpNGwjcwM,2610940,2618170,sentiste bonito te gustó no me quedé  bien gordo aquí no quiero volver a  repetir nuevamente la vega ya ya no
GAZpNGwjcwM,2618170,2623520,dejaba tela solo en el baño mochila  silencios que metro no algo al como que
GAZpNGwjcwM,2623520,2629579,sentir metro en el court sis no sé que  metro no  bueno porque tienes esas uñas ya se me
GAZpNGwjcwM,2629579,2636410,quebraron miren yo solamente me caben  estas largas ya como forma las voy a  cortar éstas
GAZpNGwjcwM,2636900,2643059,decimos una cosa es una aplicación que  te paga  por mostrar tu verdad no sé cómo se
GAZpNGwjcwM,2643059,2648070,llama  y simona cuando tu verificación
GAZpNGwjcwM,2648070,2654650,con mickey a verificar page como quita  está enojado conmigo  una como plátano para que no te den
GAZpNGwjcwM,2654650,2660290,calambres por sí sí como es cuando más  me da cuando quiero comer plátano pero
GAZpNGwjcwM,2660290,2666430,no me como lo como a gusto luego me da  me dan calambres wey
GAZpNGwjcwM,2666430,2671190,a lanús juan a la noche
GAZpNGwjcwM,2671700,2677339,mona quien se despierta a como que hago  despierta no manchen
GAZpNGwjcwM,2677339,2682720,opositora no es noche wey son las que es  temprano son las 22 horas es que a mí me
GAZpNGwjcwM,2682720,2689349,que bien gordo los iphones que no lo soy  contienen los los teléfonos así en los  horarios así las 22 horas ya saben cómo
GAZpNGwjcwM,2689349,2696730,cuenta de 22 horas las 12 13 14 15 17 18  921 22 las 10 yos iniciando un acuerdo
GAZpNGwjcwM,2696730,2704020,son a 22 horas rápido tengo que empezar  a través del 26 novelas y hoy tan porque  sé que son las 10 34 una pieza que es un
GAZpNGwjcwM,2704020,2709650,rollo post izado un rollo hai xing  una que puedo ser un desgarre dos chicas
GAZpNGwjcwM,2709650,2716100,imagínense imagínense que me dieran que  me desmembrar a manchin chicas imaginen
GAZpNGwjcwM,2716100,2722420,menezes que salidas impacta moda yo  trato que tu pata o hacerla la plata   por
GAZpNGwjcwM,2722420,2728480,una vez que te conozco de chicas que  bueno ya tiene mucho que nos decían que
GAZpNGwjcwM,2728480,2735690,era mi primera vez que pare  por qué
GAZpNGwjcwM,2735690,2740910,pero entonces por qué no tienes sony no  chicas por qué
GAZpNGwjcwM,2740910,2747150,porque no tengo porque no me gusta no me  gusta chicas a verla no tengo cuerpo ya
GAZpNGwjcwM,2747150,2753270,les he dicho una vez imágenes de que yo  diga voy a grabar un vídeo y no voy a  hacer rica ahí en un link y no va a
GAZpNGwjcwM,2753270,2761160,grabar ahí bailando y mirando las nalgas  imagínense que olvida el vídeo se haga  viral o así de bien feo y que
GAZpNGwjcwM,2761160,2767070,especialmente levi's ahí salen todos y  salgan la rosa guadalupe hay menos de la  misma tengo que ver menos chicas y lo
GAZpNGwjcwM,2767070,2772140,perdí ya sabes bailar una pero hay no  quisiera mis ridículos chicas nuevo
GAZpNGwjcwM,2772140,2777710,gracias yo no sé y además las mujeres y  chicas están bonitas es tan bueno algo  que puede enseñar
GAZpNGwjcwM,2777710,2781790,lo que para dar lástima
GAZpNGwjcwM,2785030,2791940,y como estoy contando las horas  si yo es que nunca lo contaré piense que
GAZpNGwjcwM,2791940,2797940,yo esté ya bien grande también me  enseñaron a saber el horario en el reloj
GAZpNGwjcwM,2797940,2807290,de aquí el yo casi no sé los relojes  chicas donde está el 1 del 2 estrés así  y es un palito que va dando vueltas así
GAZpNGwjcwM,2807330,2814170,así va dando vueltas yo nunca casi lo  sabía no sabe cuándo es que ahora es  normalmente siempre me equivocaba pero y
GAZpNGwjcwM,2814170,2820080,ahorita ya más o menos meses ya me  agarró la onda pero me para quebrarme la
GAZpNGwjcwM,2820080,2825880,si quiero verla ahora la vez del  teléfono pero en el de acá porque da que  en el de la muñeca engordo
GAZpNGwjcwM,2825880,2834370,dice uno siempre estoy triste pero  minutos vídeos y nos pasa la tristeza la  ve y si no me gusta mosto cambio de lado
GAZpNGwjcwM,2834370,2842080,mejor complejo para tus calambres y dos  chicas de que engordó fíjense que me dan  cada mes hasta cuando hago del 21 me
GAZpNGwjcwM,2842080,2850330,odio yo creo que saben que como que la  tasa del mayor está muy chiquita no está  muy abajo más bien porque me siento y
GAZpNGwjcwM,2850330,2856750,estoy así chicas normal o volteando por  otro lado porque no me gustaba que mi  cara porque ya saben que todo los años
GAZpNGwjcwM,2856750,2863590,teniendo estas cosas me gustan a mi cara  porque lo que tal y quiera sino que  como cada puro pues no me da vergüenza
GAZpNGwjcwM,2863590,2871270,chicas me da mucha vergüenza  entonces de este mejor así no solamente  otros lados así entonces cuando me toque
GAZpNGwjcwM,2871270,2876280,que me acabe que diga allá ya terminé  bueno y que yo limpiar a una chica lo
GAZpNGwjcwM,2876280,2883090,trasmitió un calambre también seguido me  a mis vídeos también cuando hago del  baño la otra estaba haciendo chicas hice
GAZpNGwjcwM,2883090,2890200,del baño de eso y había limpiar y que  empiecen el pie derecho no mamen chicas  no me podía parar de latas atrás
GAZpNGwjcwM,2890200,2897520,no dije poquito más y como está dando  bien no sabe ni cómo quitármelos me  pegaban así bien me pegan en el
GAZpNGwjcwM,2897520,2902859,calambre me estaba moviendo chicas y me  resbalaba y me resbalaba y dije ahorita  que me resbalé llena de cacao
GAZpNGwjcwM,2902859,2908710,está sano vaart guay ahora entonces me  aguante casi quiera llorar casi quiere  habilitar funcionó que hacer del baño
GAZpNGwjcwM,2908710,2916270,nunca me da miedo los calambres y lo  dice más que cuando no sale embarazada  teherán te dan pinches calambres cuando
GAZpNGwjcwM,2916270,2923260,vas a tener un bebé yo ni tengo y ya  tengo calambres porque a mí me dio todo  al revés no era todo menos el hijo o la
GAZpNGwjcwM,2923260,2929130,mona hola señor candelario a cabrón  yo estoy viendo el sabor de mi esposo
