vid,start,end,text
GAZpNGwjcwM,2929130,2936440,porque mío se me descargo bien achicó ya  casi vamos a tener que terminar la  transmisión
GAZpNGwjcwM,2936910,2945800,también se puede cambiar a 12 horas y  bebe como como porque mi teléfono  siempre lo tengo con las horas así por
GAZpNGwjcwM,2945800,2952250,ejemplo ahorita arriba aquí en el  samsung si dice las 7 28 así y en el  iphone o el teléfono siempre está las 21
GAZpNGwjcwM,2952250,2957349,horas con tantos minutos las 22 a 23 las  24 horas y no me gusta porque no lo
GAZpNGwjcwM,2957349,2962430,entiendo chicas  una ola entre la configuración general
GAZpNGwjcwM,2962430,2970530,luego fecha ahora sea pongas el formato  de 24 horas y listo  a ver si está mal y lo hago saludable
GAZpNGwjcwM,2970530,2977339,saludos pues que cree dice una demanda  nosotras cinco mil estrellas  hay muchas gracias de verdad que dios
GAZpNGwjcwM,2977339,2983160,las bendiga siempre muchas muchas  gracias a todos ya todas este siempre
GAZpNGwjcwM,2983160,2990510,por apoyado por compartir por vendrá  aquí a la transmisión de aquí a platicar  conmigo estaré aquí desmadre acompaña de
GAZpNGwjcwM,2990510,2998380,un rato bueno con éste pero que para  esta carta a catalina  catalina no se quiere es algo que no
GAZpNGwjcwM,2998380,3006080,conocemos  o la mona que falta mucho potasio  rotación
GAZpNGwjcwM,3007360,3012670,qué es potasio poco  potasio en configuración puedes
GAZpNGwjcwM,3012670,3018040,cambiarla haber hablante tomó cuenta que  termina transmisión este me voy a meter
GAZpNGwjcwM,3018040,3024070,a eso y pues ya dice mona tres guapas y  arregladas bueno mire no te es posible
GAZpNGwjcwM,3024070,3030250,pero aquí nos va a enseñar cómo lo con  el pelo verdadero cuanto a mi pequeño  así está ahorita que me dará no me pongo
GAZpNGwjcwM,3030250,3038260,a mi peine digo me pongo mi vestido o me  pongo mi ropa miren haciendo un peinado  o hay ese mes plancho mi pelo pero así
GAZpNGwjcwM,3038260,3046760,era mi peinado el día de hoy mire  aparezco como kalimba  [Risas]
GAZpNGwjcwM,3046760,3053290,a lo mejor que puedo con mi pelo hippie  o seguidos bien poca
GAZpNGwjcwM,3053290,3067660,gente  como mancini  [Risas]
GAZpNGwjcwM,3068250,3071850,y no
GAZpNGwjcwM,3073440,3081720,saben dónde ni un punto en el perro cómo  comportarme riendo
GAZpNGwjcwM,3082560,3089869,ya bélgica el karma  pero pero no me asusto porque me pegue
GAZpNGwjcwM,3089869,3097190,en el mero codo y dicen que cuando te  pegas accidentalmente en el codo vas a  recibir una noticia buena o mala no sé
GAZpNGwjcwM,3097190,3103630,que voy a recibir ahorita chicas yo creo  que me van a crecer las nalgas a la  mañana no sé qué noticia voy a recibir
GAZpNGwjcwM,3103630,3110950,se aventó por andar mi riendo  saludos pero
GAZpNGwjcwM,3110950,3117200,dices bueno hace muchos meses no importo  chicas no importa también termine de  analizar los nenes y si no los hacen
GAZpNGwjcwM,3117200,3123260,bien en buen plan actúa mario también me  río no piensa de que haya más no le  gustan que región que estará seguida o
GAZpNGwjcwM,3123260,3129770,algo no chicas últimas no lo digo o qué  ámbito se ve birol y está con las  pestañas no no me enojo no pasa nada
GAZpNGwjcwM,3129770,3135930,chicas a veces suele pasar no soy  perfecta  y según
GAZpNGwjcwM,3135930,3144730,nos llegan bueno ya voy cuídense mucho  ya esté las mejoras y en paz a descansar
GAZpNGwjcwM,3144730,3151330,a que se vayan a echarse un baile o que  se vayan a hacerlo o se vayan a bañar a
GAZpNGwjcwM,3151330,3156880,cenar hacerse unos tacos de ahí se llama  ver con baile a éste con una silla con
GAZpNGwjcwM,3156880,3162820,sus nuevos hoy sí un perreo porque vive  hoy en hoy es de los perros monos no te
GAZpNGwjcwM,3162820,3170770,burles de mi novio calima  dice mona yo te llevo tu jugar ahí
GAZpNGwjcwM,3170770,3177520, a pelo una buena rosa está  quedando sin platino lo pela no voy a  logística a su canal desde el principio
GAZpNGwjcwM,3177520,3183910,le voy a agradecer me da mucho gusto que  él llegue aquí a las transmisiones  muchas gracias por llegar aquí con
GAZpNGwjcwM,3183910,3189700,nosotras a pasar un rato  estudio les agradezco hay también muchos
GAZpNGwjcwM,3189700,3196250,tintos la verdad me sorprende  dicen así terminan las extensiones
GAZpNGwjcwM,3196250,3202190,por su claro que habrá una definición  partido esté confiada le agradezco mucho
GAZpNGwjcwM,3202190,3209270,al señor rod que me las ha mandado no sé  cuánto demandó hoy cabronas
GAZpNGwjcwM,3209270,3214460,pero muchos incluso necesito lo bendiga  y será multiplique ya va a haber tienda
GAZpNGwjcwM,3214460,3221230,que vaya caminando se va encontrar mucho  dinero y si me hay que encontrar tesoro  escondido
GAZpNGwjcwM,3222190,3227319,porque hoy no lo haces caso rod no o sí
GAZpNGwjcwM,3228580,3234060,dice rodrigo que sacará las caguamas que
GAZpNGwjcwM,3234390,3241480,no vi  pero tengo que sacarme con él
GAZpNGwjcwM,3241480,3249490,dice una pinta terol o con papel de  china de hecho por mercadolibre encargo  un tinte me llega mañana me llegó un
GAZpNGwjcwM,3249490,3255190,tinte rosa no va a pintar para cuidarlos  a porque el día de la inauguración  quiero traer mi pelo más rosa todavía no
GAZpNGwjcwM,3255190,3260650,sale m no no te vayas  maricarmen heavy hola ana vélez romero
GAZpNGwjcwM,3260650,3266220,laura y amigas min villamar juan carlos  al cabrón
GAZpNGwjcwM,3266420,3273609,bueno puedes hacer un corazón para una  edición por fas un corazón donde con la  maná sí
GAZpNGwjcwM,3278799,3284119,en dónde  saludos desde puebla
GAZpNGwjcwM,3284329,3291809,estiman 55 minutos cama más cosas me  tengo que ir cuídense mucho  este monto mi bebé este hasta con tus
GAZpNGwjcwM,3291809,3297150,risas  ojo bueno me voy este espacio nos
GAZpNGwjcwM,3297150,3303589,felicitábamos almuerzo no perdón cn  los chicos muy triste donde enferma ya
GAZpNGwjcwM,3303589,3308690,dice el roble donde estudias paraje los  también ya bien cabronas
GAZpNGwjcwM,3308690,3315750,saludos a johan severa a cabrón kinesis  me mandó un mensaje mi mamá sufrió
GAZpNGwjcwM,3315750,3320910,a ver mi mamá me mandó un whatsapp que  johan se espera no si quieren mi mamá me  mandó un whatsapp por este teléfono se
GAZpNGwjcwM,3320910,3326930,apareció saludos a johan se espera pues  no se quiere ser pero saludos a johan
GAZpNGwjcwM,3326930,3332710,no sé quién es johan  sabes puede durar tres horas físicas  pero recuerden que viven todas las
GAZpNGwjcwM,3332710,3339190,transmisiones en facebook duró una hora  así que hay problemas  mejor me voy a yoshito cynthia metsu a
GAZpNGwjcwM,3339190,3345810,paz vas a ver y jala racionada hizo el  corazón como peña nieto no
GAZpNGwjcwM,3346210,3352820,una chica  guapa tengo que andar guapa no digo que
GAZpNGwjcwM,3352820,3359260,invites a los tacos con cerveza  si quiere caer mona te recomiendo el
GAZpNGwjcwM,3359260,3364780,tinte de la fox chicas se va a tener la  atención por favor unas nuevas superan
GAZpNGwjcwM,3364780,3367560,la risa de jockey
GAZpNGwjcwM,3375400,3383619,háblame  te hablo  hola ale herrera hola chicas verbier hoy
GAZpNGwjcwM,3383619,3388960,también si puedo volver les ha  transmitido que no se desanimen otra  terminó esta y hoy tengo otra casita le
GAZpNGwjcwM,3388960,3394540,transmito un minuto no es cierto no les  transmite otros otros minutitos este lo
GAZpNGwjcwM,3394540,3401980,que me agregó tiene que ponerme de ropa  dejen ya me voy a terminar televisión  amigo que se me termine está pm
GAZpNGwjcwM,3401980,3407830,bonito saluditos me saluda al mono dijo  que para aquellas las caguamas pues les  digo que si me las quiero echar cabronas
GAZpNGwjcwM,3407830,3413470,y malas si me las quiero la verdad es  que tengo muchas ganas de ser de como
GAZpNGwjcwM,3413470,3418650,que de tomar alguna pero sí tengo miedo  a que me vaya a mirar hay unas personas
GAZpNGwjcwM,3422330,3429950,desde argentina  si se los juro que si ven a miedo sólo  una mitad que empiece otra bueno que
GAZpNGwjcwM,3429950,3435380,empezará otras más de mestanza a que  será sigue en youtube por escribir sea
GAZpNGwjcwM,3435380,3443630,similar tu tiempo en términos y entonces  de gm empezamos otra emoción no existes  vamos a ver con unos chips si vamos a
GAZpNGwjcwM,3443630,3451240,buscar una vestimenta digna para hoy  sábado de que te quieres ir a pasear  pero no puedes
GAZpNGwjcwM,3451869,3458140,por aquí en este rapero favorito mi  rapero favorito hoy esos contesten face  yo pienso que en quien qué tal el acabo
GAZpNGwjcwM,3458140,3463890,y digo lady gaga hoy también sobre mí  otra vez aguante
