vid,start,end,text
kZu_ojDI-Vk,2490053,2499095,">> WELL DONE, SUMMER McINSTOSH  IN A WORLD JUNIOR CHAMPIONSHIP."
kZu_ojDI-Vk,2499095,2504368,>> Andrew: GOLD FOR SUMMER  McINTOSH IN THE WOMEN'S  200-METRE BUTTERFLY AND KYLIE  MASSE IN THE 50-METRE BACKSTROKE  AND BRONZE FOR THE WOMEN'S
kZu_ojDI-Vk,2504368,2514812,"200-METRE FREESTYLE TEAM.  WHILE JOSH LIENDO TOOK BRONZE IN  THE MEN'S 100-METRE FREESTYLE,"
kZu_ojDI-Vk,2514812,2520950,THE FIRST  BLACK CANADIAN WON AN INDIVIDUAL  MEDAL AT AN INDIVIDUAL MEDAL  SWIMMING EVENT.
kZu_ojDI-Vk,2520950,2528625,">>> FROM THE POOL TO THE RING, A  YOUNG FAN BEFRIENDS A WRESTLING  LEGEND.  >> HE WAS LIKE SO EXCITED TO  KNOW THAT, LIKE, A REAL WRESTLER  LIVED HERE AND HE BUILT THIS  HOME."
kZu_ojDI-Vk,2528625,2540970,>> Andr
kZu_ojDI-Vk,2540970,2547644,">> Andrew: DAYNE FLEISCHER IS 6  BUT HE'S ALREADY A WRESTLING  SUPERFAN, THEN HE LEARNED THAT A  LEGEND IN THE SPORT LIVED JUST  AROUND THE CORNER."
kZu_ojDI-Vk,2547644,2553250,OUR COLLEAGUES AT CBC INDIGENOUS  SHOWED THE BOND THEY FORMED WHEN  THEY MET AND LITTLE A FRIENDSHIP
kZu_ojDI-Vk,2553250,2558888,"THAT IS OUR  ""MOMENT.""  >> GO FOR IT.  WHAT IS THAT CALLED?  >> IT'S CALLED THE PUNCH IN THE"
kZu_ojDI-Vk,2558888,2564561,FACE.  >> HE HAS JUST BEEN OBSESSED
kZu_ojDI-Vk,2564561,2569867,WITH IT.  HE CAN TELL YOU EVERY  WRESTLER FROM EVERY DECADE.  THEIR MOVES AND THEIR SAYINGS  AND THEIR SONGS.
kZu_ojDI-Vk,2569867,2576239,"HE WAS LIKE SO EXCITED TO KNOW  THAT, LIKE, A REAL WRESTLER, YOU  KNOW, LIVED HERE AND THAT HE'S,  LIKE, SO CLOSE TO HOME."
kZu_ojDI-Vk,2576239,2585015,THAT REALLY HIT A HIGH NOTE.  >> BILLY TWO RIVER!
kZu_ojDI-Vk,2585015,2590020,[Cheers and Applause]
kZu_ojDI-Vk,2590020,2598128,>> IT WAS MY FIRST  [indiscernible] AND I ENDED UP  IN A RING.  >> JUST ON A FLUKE HE SEEN HIM  BY THE RIVER AND HIS DAD STOPPE
kZu_ojDI-Vk,2598128,2603266,"AND THEY WENT TO SEE HIM.  THEY TOOK PICTURES.  AND HE  EVEN GOT A LITTLE BIT EMOTIONAL,"
kZu_ojDI-Vk,2603266,2608872,SO EXCITED TO MEET HIM FINALLY.
kZu_ojDI-Vk,2608872,2614011,BILLY HAD MADE A VIDEO.  >> I WANT TO THANK YOU VERY MUCH
kZu_ojDI-Vk,2614011,2619449,FOR REMEMBERING ME FOR MY  BIRTHDAY.  >> THEY HAVE LIKE A CUTE LITTLE  FRIENDSHIP NOW.
kZu_ojDI-Vk,2619449,2627791,"IT IS REALLY NICE.  >> Andrew: WELL THAT'S SUCH A  GREAT STORY AND, YOU KNOW, BILLY  TWO RIVERS HAS HAD SUCH AN"
kZu_ojDI-Vk,2627791,2634364,"ILLUSTRIOUS CAREER.  IF I'M DOING THE MATH WRITE,  HE'S BEEN IN THE WRESTLING GAME"
kZu_ojDI-Vk,2634364,2639369,FOR MORE THAN A QUARTER CENTURY.  HE'S EVEN GOT A CHAMPIONSHIP  BELT TO HIS NAME AND I THINK  THAT IT GOES TO SHOW YOU THAT  YOU NEVER KNOW WHO IS DRAWING  THEIR INSPIRATION FROM YOU.  OR WHAT KIND OF AN IMPACT YOU
kZu_ojDI-Vk,2639369,2677374,"MIGHT BE HAVING ON OTHER PEOPLE  UNBEKNOWNST TO YOU.  THAT'S ""THE NATIONAL"" FOR JUNE  23RD.  HAVE A GREAT NIGHT.  (♪♪)"
