vid,start,end,text
kZu_ojDI-Vk,1278843,1284649,>> Andrew: FOOD AND OTHER  SUPPLIES BEING AIR DROPPED TODAY  BY THE INDIAN MILITARY TO AREAS  DEVASTATED BY FLOODS IN THE  NORTHEAST OF THE COUNTRY.
kZu_ojDI-Vk,1284649,1291156,MILLIONS HAVE BEEN DISPLACED IN  THE REGION AFTER HEAVY MONSOON  RAINS BROUGHT ON THE WORST  FLOODING IN DECADES.
kZu_ojDI-Vk,1291156,1298563,NOW THAT FLOODING IS ALSO  CAUSING DEVASTATION ACROSS THE  BORDER IN BANGLADESH.  OFFICIALS SAY THAT THE  FLOODWATERS ARE SLOWLY STARTING
kZu_ojDI-Vk,1298563,1306237,"TO RECEDE, BUT THAT FOR MILLIONS  THE SITUATION IS STILL DIRE.  GEORGIE SMYTH SHOWS US THE  HUMANITARIAN CRISIS."
kZu_ojDI-Vk,1306237,1315413,>> Reporter: AN ENTIRE CITY  UNDER WATER.  FROM THE AIR THE BANGLADESH
kZu_ojDI-Vk,1315413,1320618,PARACHUTES SEND IN CRITICALLY  NEEDED SUPPLIES.  PEOPLE BELOW ARE DISPLACED AND
kZu_ojDI-Vk,1320618,1326591,"DESPERATE.  THIS WOMAN WAS WITHOUT FOOD FOR  THREE DAYS.  >>(SPEAKING ALTERNATE LANGUAGE).  >> Reporter: SHE WAS STRANDED  FOR A WEEK BEFORE BEING RESCUED  FROM HER HOME, SHE SAYS."
kZu_ojDI-Vk,1326591,1334533,"EVEN THE REFUGE CENTRES ARE ON  THE EDGE OF GOING UNDER, A FEW  MORE INCHES OF WATER COULD  INUNDATE OTHER BUILDINGS."
kZu_ojDI-Vk,1334533,1340939,"DOZENS ARE DEAD AND MILLIONS  STRANDED AND DESPITE A FLY-OVER  OF THE AREA BY BANGLADESH'S  PRIME MINISTER, ANGER IS"
kZu_ojDI-Vk,1340939,1346311,"SWELLING AT THE ADMINISTRATION.  ""OUR HOME IS FLOODED AND WE CAME"
kZu_ojDI-Vk,1346311,1354519,"HERE FOR SHELTER BUT HAVEN'T  BEEN GIVEN RELIEF SUPPLIES,""  THIS WOMAN SAYS.  THE FLOODING IS THE WORST IN"
kZu_ojDI-Vk,1354519,1360926,"THIS PART OF NORTHEASTERN INDIA  AND IN BANGLADESH, AND THE AREAS"
kZu_ojDI-Vk,1360926,1369133,NEAR THE  INDIAN BORDER ARE HIT THE  HARDEST.  SCENES LIKE THIS WERE CAPTURED  BY AIDE WORKER RUSSELL MARBUN.
kZu_ojDI-Vk,1369133,1374472,>> THIS TIME IT'S WORSE -- WORST  THAN EVER.
kZu_ojDI-Vk,1374472,1380612,AND WITHIN A FEW HOURS BEFORE  HOUSES ARE GOING UNDER WATER.  >> Reporter: A NIGHTMARE  SITUATION FOR THOSE TRYING TO
kZu_ojDI-Vk,1380612,1385717,MITIGATE THE DELUGE.  >> ALL OF THIS WATER IS IN  THE AREA.
kZu_ojDI-Vk,1385717,1392824,SO ALL OF THE STANDING WATER WE  PUMP FROM BANGLADESH TO INDIA.
kZu_ojDI-Vk,1392824,1398730,SO THAT CHANNEL CANNOT BE ABLE  TO CARRY SUCH A
kZu_ojDI-Vk,1398730,1408940,HUGE AMOUNT OF WATER WITHIN THIS  SHORT TIME.  >> Reporter: SCIENTISTS STUDYING  THESE EVENTS FROM AFAR SAY THAT  CLIMATE CHANGE HAS INCREASED THE  PROBABILITY AND THE INTENSITY OF
kZu_ojDI-Vk,1408940,1414779,AN EVENT LIKE THIS.  >> IT'S A PERFECT STORM SORT OF  SITUATION.  SO THERE WAS ACTIVITY WHICH  BROUGHT THE MONSOON EARLIER AND  IT'S A LUNAR NEW YEAR WHICH
kZu_ojDI-Vk,1414779,1420552,MEANS THAT WE MAY GET MORE
kZu_ojDI-Vk,1420552,1426191,RAINFALL OVER THE SEASON.  AND THESE AREAS ARE PRONE TO  FLOODING.  >> Reporter: RAINY MONSOON  SEASON IN BANGLADESH RUNNING TO
kZu_ojDI-Vk,1426191,1431896,"OCTOBER.  GEORGIE SMYTH, CBC NEWS,  VANCOUVER.  >> Andrew: WELL, THE WORLD  HEALTH ORGANIZATION HELD AN  EMERGENCY MEETING ON THE GROWING"
kZu_ojDI-Vk,1431896,1437435,MONKEYPOX OUTBREAK TODAY.  IT IS CONSIDERING WHETHER TO  DECLARE A PUBLIC HEALTH  EMERGENCY OF INTERNATIONAL
kZu_ojDI-Vk,1437435,1443842,CONCERN.  THAT IS THE W.H.O.'S HIGHEST  ALERT LEVEL AND CURRENTLY ONLY
kZu_ojDI-Vk,1443842,1449547,"APPLIES TO COVID-19 AND POLIO.  MORE THAN 3,000 CASES HAVE BEEN  CONFIRMED WORLDWIDE."
kZu_ojDI-Vk,1449547,1455620,"THERE ARE MORE THAN 200 IN THIS  COUNTRY.  >>> NEXT ON ""THE NATIONAL,"""
kZu_ojDI-Vk,1455620,1461393,"ROSIE IS HERE WITH THE FINAL ""AT  ISSUE"" OF THE SEASON.  >> Rosemary: THAT'S RIGHT,  ANDREW, AND WE WILL START WITH  THE PRIME MINISTER DEFENDING THE"
kZu_ojDI-Vk,1461393,1467165,"RCMP COMMISSIONER TODAY WHILE  FACING ALLEGATIONS THAT THE  GOVERNMENT APPLIED POLITICAL  PRESSURE ON THE FORCE, JUST ONE"
kZu_ojDI-Vk,1467165,1481846,OF MANY CHALLENGES FACING THE  GOVERNMENT AS THE PARLIAMENTARY  SITTING WRAPS UP FOR THE SUMMER.
kZu_ojDI-Vk,1482447,1487585,(♪♪)  >> Justin Trudeau: WE DID NOT
kZu_ojDI-Vk,1487585,1492990,PUT ANY UNDUE INFLUENCE OR  PRESSURE AND IT'S EXTREMELY  IMPORTANT TO HIGHLIGHT THAT IT  IS ONLY -- IT IS ONLY THE RCMP
kZu_ojDI-Vk,1492990,1499431,AND POLICE THAT DETERMINE WHAT  AND WHEN TO RELEASE INFORMATION.
kZu_ojDI-Vk,1499431,1504469,"THE COMMISSIONER'S STATEMENT,  THE MINISTER'S STATEMENT, WE'RE  VERY CLEAR ON THAT AND, YES, I  AM STILL VERY MUCH HAVE  CONFIDENCE IN COMMISSIONER"
kZu_ojDI-Vk,1504469,1511376,LUCKI.  >> Rosemary: THE HOUSE HAS
kZu_ojDI-Vk,1511376,1516381,"WRAPPED NOW FOR ITS SUMMER  BREAK, AND AS YOU HEARD THERE,"
kZu_ojDI-Vk,1516381,1522019,THE PRIME  MINISTER BEING FORCED TO DEFEND  BOTH THE RCMP COMMISSIONER AND  HIS OWN GOVERNMENT AGAINST  ALLEGATIONS OF POLITICAL  INTERFERENCE.  JUST ONE OF MANY CHALLENGES THE  LIBERALS ARE DEALING WITH AS
kZu_ojDI-Vk,1522019,1527325,"THEY HEAD OFF FOR THE SUMMER.  SO HOW ARE THEY HANDLING ALL OF  IT?  AND IT'S THURSDAY AND ""AT ISSUE""  IS HERE."
kZu_ojDI-Vk,1527325,1532330,"CHANTEL HÉBERT, ALTHIA RAJ,  ELAMIN ABDELMAHMOUD AND ANDREW  COYNE, GOOD TO SEE EVERYBODY."
kZu_ojDI-Vk,1532330,1541306,"I APPRECIATE YOU BEING HERE.  LET'S SORT OF GO -- AND WE'LL  START WITH CHANTAL ON THIS.  I MEAN, WE COULD START WITH THIS"
kZu_ojDI-Vk,1541306,1546310,"LATEST CONTROVERSY THIS WEEK,  BUT THERE IS ALL SORTS OF"
kZu_ojDI-Vk,1546310,1551349,CHALLENGES  FACING THE GOVERNMENT RIGHT NOW  THAT IT'S HAVING TO MANAGE.  CHANTAL?  >> THE PASSPORT LINEUPS THAT
kZu_ojDI-Vk,1551349,1557122,"LOOKS LIKE A HOMELESS CAMP,  WHERE THEY ISSUE PASSPORTS IN"
kZu_ojDI-Vk,1557122,1563728,MONTRÉAL.  I HAVE NEVER SEEN THE LIKES OF  IT.
kZu_ojDI-Vk,1563728,1575974,"AND TRANS MOUNTAIN PIPELINE, NOT  ACCORDING TO THE PARLIAMENTARY"
kZu_ojDI-Vk,1575974,1581212,"BUDGET OFFICER, THE  PARLIAMENTARY BUDGET OFFICER,  NOT GOING TO BE PAYING BACK THE  MONEY THAT HAS BEEN INVESTED  INTO IT.  GO DOWN THE LIST, AND WHAT YOU  HAVE IS CERTAINLY A SIGH OF"
kZu_ojDI-Vk,1581212,1589687,"RELIEF FOR PARLIAMENT TO WIND  DOWN.  BUT CERTAINLY NOT WHERE THE  LIBERALS WOULD HAVE WANTED TO BE  AT THIS POINT, WHICH I BELIEVE  THAT IS IN SERIOUS TROUBLE,"
kZu_ojDI-Vk,1589687,1594793,"COMPLACENCY, AND WORSE THAN  THAT -- COMPETENCE ISSUES NOW  BEING RAISED, WHICH IS PROBABLY"
kZu_ojDI-Vk,1594793,1601032,"THE MOST DEADLY THING TO BE  RAISED ABOUT A GOVERNMENT.  >> Rosemary: ANDREW, CHANTAL  DIDN'T EVEN MENTION INFLATION  WHICH IS, OF COURSE, THE OTHER"
kZu_ojDI-Vk,1601032,1607504,BIG THING THAT WILL CONTINUE IN  WEEKS AHEAD.  BUT YOU GO AHEAD WITH WHAT YOU  THINK ARE THE CHALLENGES.
kZu_ojDI-Vk,1607504,1614979,">> WELL, THAT'S A VERY GOOD  POINT.  NOTHING THAT WE HAVE SEEN IN  PREVIOUS DECADES COULD BE MORE  LETHAL FOR A"
kZu_ojDI-Vk,1614979,1620584,GOVERNMENT'S CHANCES THAN TO BE  GOVERNING IN TIMES OF INFLATION.  BUT IT'S ALSO BEEN A VERY BAD  FEW WEEKS FOR THEM GENERALLY.  PEOPLE WILL PUT UP WITH AND HAVE  PUT UP WITH A LOT FROM THIS
kZu_ojDI-Vk,1620584,1625857,"GOVERNMENT, IN TERMS OF CYNICISM  OR DOCTRINE IDEOLOGY OR THE"
kZu_ojDI-Vk,1625857,1631429,"MORAL VANITY, OR EVEN SOME OF  THE ETHICAL FAILINGS.  BUT WHEN YOU START TALKING ABOUT"
kZu_ojDI-Vk,1631429,1637669,"BASIC QUESTIONS OF  COMPETENCE, LIKE THE AIRPORT  MESS OR THE PASSES PORT MESS AND"
kZu_ojDI-Vk,1637669,1644509,"-- THE PASSPORT MESS, AND  NOW COMPOUND THAT WITH SERIOUS  ALLEGATIONS OF ABUSE OF POWER,  WHETHER WE'RE TALKING ABOUT"
kZu_ojDI-Vk,1644509,1649948,"LYING TO PARLIAMENT ABOUT THE  EMERGENCIES ACT.  OR IN THIS LATEST INCIDENT,  INTERFERING IN A POLITICAL"
kZu_ojDI-Vk,1649948,1656955,"-- CRIMINAL INVESTIGATION FOR  POLITICAL ENDS, WHICH, LET'S  JUST SAY THAT FITS A PATTERN."
kZu_ojDI-Vk,1656955,1662393,"THIS IS -- THIS ALL PUT TOGETHER  IS EXTREMELY SERIOUS BUSINESS.  >> Rosemary: ALTHIA, DO YOU  THINK THAT IT'S THAT BAD FOR  THEM RIGHT NOW OR THERE'S A LOT  OF BUMPS IN THE ROAD?"
kZu_ojDI-Vk,1662393,1669901,>> THERE'S A LOT OF BUMPS BUT  THERE ARE THINGS LIKE MARCO
kZu_ojDI-Vk,1669901,1675373,"MENDICINO, MISLEADING CANADIANS  ABOUT WHETHER OR NOT LAW  ENFORCEMENT HAD SPECIFICALLY"
kZu_ojDI-Vk,1675373,1681346,"RECOMMENDED THE EMERGENCIES ACT.  IN THIS CASE, BRENDA LUCKI, THE"
kZu_ojDI-Vk,1681346,1686951,RCMP COMMISSIONER.  OR WHETHER  OR NOT THERE WAS SOME DIRECTION
kZu_ojDI-Vk,1686951,1693992,"OR DISCUSSION WITH THE PRIME  MINISTER'S OFFICE, BILL BLAIR  WHO WAS THEN THE PUBLIC SAFETY  MINISTER.  THESE SEEM TO BE THINGS THAT THE  GOVERNMENT SHOULD BE  PURPOSEFULLY AVOIDING TO DO."
kZu_ojDI-Vk,1693992,1699964,"INTEREST RATES, INFLATION, WE  COULD EVEN ADD TO THAT THE  CLIMATE TARGETS -- LIKE, THEY"
kZu_ojDI-Vk,1699964,1707371,HAVEN'T ANNOUNCED THE STEPS IN  ORDER TO REACH THEIR 2030  TARGETS AND THEY DO NOT SEEM
kZu_ojDI-Vk,1707371,1712944,"LIKE THEY'RE GOING TO BE VIABLE  AT ALL.  THE GOVERNMENT NEEDS TO REFOCUS,  PARE DOWN AND IMPLEMENT THE"
kZu_ojDI-Vk,1712944,1721518,THINGS THEY WANTED TO DO AND  THEN KIND OF TELL US WHY WE HAD  AN ELECTION IN THE FIRST PLACE  LAST FALL.  BECAUSE IT'S NOT REALLY CLEAR.
kZu_ojDI-Vk,1721518,1727224,">> Rosemary:WELL, I DON'T KNOW  THAT WE KNEW THAT DURING THE  ELECTION EITHER.  BUT, ELAMIN, WHAT DO YOU THINK"
kZu_ojDI-Vk,1727224,1735066,ARE SOME OF THE CHALLENGES TO  THE GOVERNMENT RIGHT NOW?  >> I THINK THAT ONE INTERESTING  THINGS ABOUT EACH OF THESE THAT  WE NAMED -- AND WE NAMED ABOUT
kZu_ojDI-Vk,1735066,1740071,HALF A DOZEN SO FAR -- IS THAT  EACH ONE OF THEM CONFIRMS THE  WORST THING THAT THE PEOPLE  THINK ABOUT THIS GOVERNMENT.  IT'S NOT ONLY THE FACT THAT
kZu_ojDI-Vk,1740071,1745142,"THESE ARE CRISES, THESE ARE THE  CRISES THAT SORT OF MIRROR HOW  THE GOVERNMENT THINK ABOUT THE  GOVERNMENT IN THEIR WORST DAYS."
kZu_ojDI-Vk,1745142,1750949,"WE THINK OF THE COMPETENCY  ISSUES AT THE AIRPORT, AND  PEOPLE EXPECT GOVERNMENTS TO"
kZu_ojDI-Vk,1750949,1756387,"KIND OF MESS UP AIRPORTS AND  THEY'RE, IN FACT, DOING EXACTLY  THAT, OR AT LEAST THEY'RE NOT"
kZu_ojDI-Vk,1756387,1761592,"HANDLING THAT APPROPRIATELY.  AND WHEN WE LOOK AT THE  SITUATION WITH THE RCMP  COMMISSIONER, THAT IS THE KIND"
kZu_ojDI-Vk,1761592,1767765,OF STORY THAT KIND OF CONFIRMS  WHAT THE WORST THINGS THAT  PEOPLE THINK ABOUT THE LIBERALS  ON THEIR WORST DAYS ARE.  SO THOSE CRISES KIND OF
kZu_ojDI-Vk,1767765,1773338,"COMPOUND, AND TO KIND OF LEAD US  TO THIS MOMENT WHERE YOU MIGHT  SAY THAT THIS GOVERNMENT HAS  BEEN NARRATIVELESS FOR SOME TIME"
kZu_ojDI-Vk,1773338,1779310,"AND THEY HAVE NOT REALLY PUT  FORTH A STORY, PROBABLY SINCE  THAT AGREEMENT THAT ALTHIA JUST"
kZu_ojDI-Vk,1779310,1784882,MENTIONED.  I THINK THAT IS THE  LAST SORT OF MEANINGFUL STORY  THAT THE GOVERNMENT HAS KIND OF  PUT FORWARD IN TERMS OF WHAT
kZu_ojDI-Vk,1784882,1790788,THEIR PLANS ARE GOING TO BE  LOOKING FORWARD.  BUT SINCE THEN THEY HAVE BEEN  JUST ADDRESSING THAT.
kZu_ojDI-Vk,1790788,1796260,>> Rosemary: BUT THEY DO HAVE  THINGS TO TALK ABOUT.  THERE WAS A BUDGET
kZu_ojDI-Vk,1796260,1801833,WITH A LOT OF THINGS IN IT THAT  WE HAVEN'T HEARD A LOT ABOUT  SINCE THEN.  SO WHAT IS LEADS TO THE LACK OF  FOCUS AND THE OTHER ISSUES THAT  WE HAVE BEEN TALKING ABOUT HERE?  >> THE SENSE THAT THIS IS A
kZu_ojDI-Vk,1801833,1806837,PRIME MINISTER AND THE  GOVERNMENT THAT SPENT TWO YEARS  SAYING WE HAVE YOUR BACKS ON THE
kZu_ojDI-Vk,1806837,1812110,PANDEMIC.  AND IT'S NOW TRYING TO SAY THAT
kZu_ojDI-Vk,1812110,1817148,ON THE BUDGET AND FISCAL POLICY
kZu_ojDI-Vk,1817148,1822720,AND IT SERIOUSLY DOESN'T FEEL  THAT WAY.  THERE'S A SENSE OUT THERE THAT  THE GOVERNMENT IS MISSING IN  ACTION.
kZu_ojDI-Vk,1822720,1829761,"SO I SPENT THE WEEK TALKING TO  PEOPLE WHO LIKE THE LIBERALS,"
kZu_ojDI-Vk,1829761,1838169,"AND THERE ARE TWO THINGS -- TWO  SCHOOLS OF THOUGHT -- TO SHAPE  UP SCHOOLS, YOU DO SOMETHING  OVER THE SUMMER, AND SHAPE UP."
kZu_ojDI-Vk,1838169,1843174,"BUT THE SHIP OUT SCHOOL, ABOUT  THE PRIME MINISTER, WAS LARGER.  AND THAT CAN'T BE GOOD."
kZu_ojDI-Vk,1843174,1848246,">> Rosemary: NO.  ANDREW, WHAT DOES THAT MEAN THEN  FOR THE MONTHS AHEAD FOR HIM?"
kZu_ojDI-Vk,1848246,1853584,"I MEAN, HE'S ON A LONG OVERSEAS  TRIP RIGHT NOW AT A NUMBER OF  SUMMITS WHICH USUALLY HELPS THE  PRIME MINISTER TO JUST GET OUT"
kZu_ojDI-Vk,1853584,1858822,OF THE COUNTRY.
kZu_ojDI-Vk,1858822,1866464,">> WELL, THE RETHINK WILL HAVE  TO BE PRETTY FUNDAMENTAL.  BECAUSE FOR THE X NUMBER OF"
kZu_ojDI-Vk,1866464,1873738,"YEARS OF IN GOVERNMENT HAS BEEN  TO SPEND -- SPEND,"
kZu_ojDI-Vk,1873738,1879577,"SPEND AND SPEND SOME MORE.  YOU'RE GETTING TO THE POINT  WHERE EVEN PEOPLE SYMPATHETIC  ARE SAYING THAT YOU HAVE TO REIN  IT IN.  AND I WILL SAY, HOWEVER, THAT  THE BLESSING THEY HAVE AND THE  OPPOSITION, THE QUOTE/UNQUOTE,"
kZu_ojDI-Vk,1879577,1885049,"GOVERNMENT IN WAITING SHOULD BE  SHOWING ITSELF OFF TO MAXIMUM  ADVANTAGE, WHERE IT SHOULD BE"
kZu_ojDI-Vk,1885049,1890054,SHOWING ITSELF AS BEING  THE REASONABLE ALTERNATIVE TO  THE GOVERNMENT IS RUNNING A  CLOWN SHOW OF A LEADERSHIP RACE
kZu_ojDI-Vk,1890054,1895460,"WHERE INSTEAD OF TALKING ABOUT  SERIOUS AND SUBSTANTIVE  POLICIES, THEY ARE TALKING ABOUT  CONSPIRACY THEORIES AND IS THE"
kZu_ojDI-Vk,1895460,1903167,WORLD ECONOMIC FORUM RUNNING THE  COUNTRY AND THESE KIND OF  NONSENSE.  SO THEY'RE GETTING THE USUAL
kZu_ojDI-Vk,1903167,1908706,LIBERALS IN THE FORM OF THEIR  OPPOSITION.  >> Rosemary: ALTHIA?  >> I WOULD THINK FOR NOW THOUGH
kZu_ojDI-Vk,1908706,1913845,"BECAUSE IN THE FALL THERE WILL  BE A BRAND-NEW LEADER ON  SEPTEMBER 10th, THAT IS GOING"
kZu_ojDI-Vk,1913845,1921118,TO CHANGE  THE DYNAMIC IN THE HOUSE OF  COMMONS AND THEY'LL COME OUT  SWINGING.  YOU'LL HAVE A QUÉBEC ELECTION  WITH AN INCUMBENT PREMIER WHO
kZu_ojDI-Vk,1921118,1926891,"SEEMS TO WANT TO FIGHT  JUSTIN TRUDEAU, AND SO IT'S  GOING TO BE MUCH MORE DIFFICULT."
kZu_ojDI-Vk,1926891,1932196,I THINK THAT THE PROBLEM ON THE  INFLATION FRONT IS THAT THE  LIBERALS WANT TO HAVE IT BOTH
kZu_ojDI-Vk,1932196,1940738,"WAYS.  YOU KNOW, THEY RAN ON HELPING  THE MIDDLE CLASS AND THOSE  WANTING TO JOIN IT.  AND THEY RAN ON THE PANDEMIC AS  CHANTEL MENTIONED AND NOW THEY"
kZu_ojDI-Vk,1940738,1946677,"DO SEEM TO HAVE THE INSTINCT TO  WANT TO HELP PEOPLE, AND AT THE  SAME TIME, MINISTER FREELAND"
kZu_ojDI-Vk,1946677,1952116,WANTS TO SHOW THAT  SHE CAN SHOW FISCAL RESTRAINT  AND SHE CAN BE RESPONSIBLE.  AND THOSE TWO THINGS ARE
kZu_ojDI-Vk,1952116,1958022,"CONTRADICTORY.  BUT, FRANKLY, THEY ARE ALSO  CONTRADICTORY IN THE  CONSERVATIVE BENCH.  I MEAN, JUST THIS QUESTION  PERIOD TODAY ON THURSDAY, YOU  HAD ONE QUESTION DEMANDING MORE"
kZu_ojDI-Vk,1958022,1963561,SUPPORT AND ANOTHER QUESTION  SAYING THAT YOU WERE SPENDING  TOO MUCH.  SO NONE OF THE PARTIES REALLY  HAVE A GOOD ANSWER TO THAT.
kZu_ojDI-Vk,1963561,1969500,">> Rosemary: ELAMIN?  >> THAT MAY BE TRUE, BUT I THINK  THAT PIERRE POILIEVRE HAS BEEN"
kZu_ojDI-Vk,1969500,1975973,VERY GOOD AT SORT OF  ARTICULATING THE STREET LEVEL  FRUSTRATION WITH THIS  GOVERNMENT.  AT LEAST WHEN IT COMES TO
kZu_ojDI-Vk,1975973,1981311,"INFLATION.  AND HE WAS, IN FACT, WAY AHEAD  ON THIS,  WHETHER HE WAS CORRECT ABOUT THE  REASONS OR NOT."
kZu_ojDI-Vk,1981311,1987251,"HE DOES GET TO LOOK BACK AT THAT  RECORD AND SAY IF HE BECOMES THE  LEADER, HE GETS TO LOOK BACK AT  THAT RECORD AND SAY, YOU KNOW"
kZu_ojDI-Vk,1987251,1992756,"WHAT, I HAVE BEEN  ADVANCING THIS MESSAGE SINCE DAY  ONE.  I THINK THAT IS A WORRY FOR THIS  GOVERNMENT BECAUSE IF HE HAS  BEEN THE PERSON SAYING IT"
kZu_ojDI-Vk,1992756,1999129,"LONGEST, AND THIS GOVERNMENT IS  SORT OF GIVING SPEECHES THAT  FEEL VERY OUT OF TOUCH WITH HOW  PEOPLE ARE FEELING ABOUT  INFLATION, THAT ALREADY PUTS HIM"
kZu_ojDI-Vk,1999129,2004635,"ON THE BACK PLATE.  >> Rosemary:OKAY, WE'RE GOING  TO TAKE A BREAK.  I'M SURE THAT THE GOVERNMENT"
kZu_ojDI-Vk,2004635,2009774,WILL BE VERY HAPPY.  AND WE'LL  TALK ABOUT ANOTHER SERIOUS ISSUE  THAT M.P.s ARE FACING AND WHAT
kZu_ojDI-Vk,2009774,2014845,"IT MEANS FOR POLITICAL  DISCOURSE, FACING PHYSICAL AND  ONLINE THREATS, FORCING SOME TO  CARRY PANIC BUTTONS.  WHAT DOES THAT TELL US ABOUT THE  STATE OF POLITICAL DISCOURSE IN"
kZu_ojDI-Vk,2014845,2025390,THE COUNTRY?
kZu_ojDI-Vk,2026023,2031562,"(♪♪)  >> FOR ME, I PROBABLY  ENCOUNTERED ABOUT 20 DEATH  THREATS WHICH WERE PUT FORWARD"
kZu_ojDI-Vk,2031562,2038102,TO THE POLICE.  THERE HAVE BEEN SOME -- A FEW  WHO HAVE BEEN CONVICTED.  >> I CARRY ONE ALL THE TIME.
kZu_ojDI-Vk,2038102,2045909,"YEAH, AND I WORRY ABOUT MY  CHILDREN AND I WORRY ABOUT MY  FAMILY AND I WORRY ABOUT MY  CONSTITUENCY STAFF, MY STAFF ON  THE HILL."
kZu_ojDI-Vk,2045909,2051616,">> IF SOMEONE DOESN'T FEEL SAFE  IN THE EXECUTION OF THEIR  DUTIES, WE SHOULD HAVE A  CONVERSATION ABOUT IT.  >> Rosemary: M.P.s ARE TALKING"
kZu_ojDI-Vk,2051616,2057021,ABOUT VARIOUS THREATS AND  CHALLENGES THEY FACE TODAY AND  SOME OF THEM THAT YOU HEARD  THERE ARE BEGINNING TO CARRY  PANIC BUTTONS.
kZu_ojDI-Vk,2057021,2064762,"WHAT DOES THAT TELL US ABOUT THE  STATE OF POLITICAL DISCOURSE IN  THIS COUNTRY?  ""AT ISSUE"" IS BACK, AND ELAMIN,"
kZu_ojDI-Vk,2064762,2076741,"CHANTAL, ANDREW ARE BACK."
kZu_ojDI-Vk,2076741,2081746,"I MEAN, I THINK THAT WE KNOW  THAT POLITICIANS HAVE LONG BEEN  TARGETS OF THREATS AS PUBLIC  FIGURES, BUT IT DOES FEEL LIKE  SOMETHING IS A LITTLE DIFFERENT.  AND I WONDER HOW TROUBLING IT IS  AND HOW WORRIED WE SHOULD BE"
kZu_ojDI-Vk,2081746,2087318,ABOUT THAT LEVEL OF DISCOURSE  AND RHETORIC?  >> WE HAVE SEEN SOME RESEARCH  THAT SUGGESTS THAT A LOT OF THE  POLARIZATION IN THIS COUNTRY IS
kZu_ojDI-Vk,2087318,2095825,AMONG GENERATIONAL LINES.  SO THE IDEA THAT THERE ARE
kZu_ojDI-Vk,2095825,2101031,YOUNGER GENERATIONS WHO NO  LONGER FEEL THAT THE GOVERNMENT  IS WORKING FOR THEM.  I DON'T KNOW WHAT THAT SAYS  ABOUT OUR CURRENT DEMOCRACY.  I DON'T KNOW WHAT THAT SAYS  ABOUT PEOPLE'S TRUST IN  GOVERNMENT.
kZu_ojDI-Vk,2101031,2106603,"WE'RE LIVING THROUGH THIS MOMENT  WHERE PEOPLE ARE, YOU KNOW,  SUFFERING FROM INFLATION.  AND THE RELATIONSHIP TO  GOVERNMENT HAS BEEN"
kZu_ojDI-Vk,2106603,2111976,"FUNDAMENTALLY ALTERED AND I'M  NOT SURE THAT I'M SEEING ANY --  ANYONE, WHETHER IT'S THE  OPPOSITION OR THE GOVERNMENT,"
kZu_ojDI-Vk,2111976,2116981,SPEAKING TO THAT AND SPEAKING TO  PASS THE POLICY AND THE EMOTION  OF HOW PEOPLE ARE RELATING TO
kZu_ojDI-Vk,2116981,2124822,"GOVERNMENT AT THE MOMENT.  AND I HAVE TO SAY THAT THAT  CAN'T BE MAKING THE PROBLEM ANY  BETTER.  >> Rosemary: IT'S INTERESTING,"
kZu_ojDI-Vk,2124822,2130961,"CHANTAL, BECAUSE I DON'T THINK  THAT THERE'S BEEN A TIME,  CERTAINLY IN MY LIFETIME, THAT"
kZu_ojDI-Vk,2130961,2138735,THE GOVERNMENT  HAS FELT SO PRESENT BECAUSE OF  THE THINGS THAT IT WAS DOING TO  KEEP US ALL SORT OF ALIVE.  BUT IT DOES SEEM THAT HAS  SHIFTED IN SOME PEOPLE'S MINDS  TOO.
kZu_ojDI-Vk,2138735,2144908,">> I THINK THAT WE ARE AT A  POINT, AT LEAST IN THE NATIONAL  CYCLE, WHERE PEOPLE ARE LOOKING  FOR LEADERSHIP AT A TIME WHEN"
kZu_ojDI-Vk,2144908,2151649,THE EXPIRY DATE ON THE  GOVERNMENT IS IN A WAY COMING TO  A CLOSE.
kZu_ojDI-Vk,2151649,2157188,BUT I ALSO THINK THAT  POLITICIANS ON BOTH SIDES OF THE  HOUSE -- I AM NOT NAMING A
kZu_ojDI-Vk,2157188,2163194,"PARTY, HAVE SPENT SO MUCH TIME  OVER THE PAST TWO DECADES  TALKING ABOUT EACH OTHER ACROSS"
kZu_ojDI-Vk,2163194,2169300,"THE AISLE AS IF THEY WERE ALL  CROOKS, PEOPLE WHO ARE ONLY IN  THIS BUSINESS FOR THEIR OWN"
kZu_ojDI-Vk,2169300,2175973,"INTEREST, THAT AT SOME POINT  THEY HAVE MANAGED TO CONVINCE A  LOT OF PEOPLE THAT WHOEVER IS ON"
kZu_ojDI-Vk,2175973,2181645,"THE OTHER SIDE OF THE AISLE IS  NOT THERE FOR PUBLIC SERVICE.  AND THEY -- IN SO DOING, THEY  ARE SHOOTING THEMSELVES IN THE"
kZu_ojDI-Vk,2181645,2187985,"FOOT.  BUT FOR SHORT-TERM GAIN, ALL  PARTIES HAVE BEEN PLAYING THAT"
kZu_ojDI-Vk,2187985,2193023,GAME AND NOW IT'S GOING TO COME  BACK TO HOUND THEM FOR A LONG  TIME.  >> Rosemary: ANDREW?  >> WHAT WE'RE DEALING WITH RIGHT
kZu_ojDI-Vk,2193023,2198862,NOW WHEN WE ARE TALKING ABOUT  THREATS TO THE LIVES AND SAFETY  OF M.P.s IS SOMETHING I THINK
kZu_ojDI-Vk,2198862,2204268,"NEW, I THINK THAT IT IS IN PART  DUE TO THE ADVENT OF SOCIAL  MEDIA WHICH IS QUITE"
kZu_ojDI-Vk,2204268,2209640,UNPRECEDENTED IN THE WAY THAT IT  ENABLES PEOPLE TO FIND EACH
kZu_ojDI-Vk,2209640,2216380,"OTHER ONLINE, TO RADICALIZE EACH  OTHER, TO BUTTRESS EACH OTHER'S  BELIEFS AND TO WHIP PEOPLE INTO"
kZu_ojDI-Vk,2216380,2222019,A FRENZY.  AND THE  TYPE OF LANGUAGE THAT YOU HEAR  THERE THAT SO EXAGGERATES THE  QUOTE/UNQUOTE THREAT REPRESENTED
kZu_ojDI-Vk,2222019,2229226,"BY THE GOVERNMENT.  I HAVE DONE A LOT OF BUSINESS  WITH THE GOVERNMENT, I MEAN, I  DON'T THINK THAT IT'S A"
kZu_ojDI-Vk,2229226,2237468,DICTATORSHIP OR TRYING  TO THROW US INTO A DARK NIGHT OF
kZu_ojDI-Vk,2237468,2242706,TYRANNY.
kZu_ojDI-Vk,2242706,2248278,BUT THAT LANGUAGE IS USED TO  JUSTIFY TO ONE'S SELF THAT  EXTREME ANSWERS ARE JUSTIFIED IN  RESPONSE TO THIS.  THEN WHEN YOU HAVE POLITICAL  LEADERS WHO OUGHT TO BE TAMPING  THAT DOWN AND OUGHT TO BE  FINDING WAYS TO CHANNEL THAT
kZu_ojDI-Vk,2248278,2254251,"INTO MORE USEFUL THINGS,  WHIPPING UP THE RHETORIC  THEMSELVES, WHEN HAVE MAXIME  BERNIER CALLING THE PRIME  MINISTER A PSYCHOPATH ONLINE AND  SOME OF THE OTHER EXAGGERATED  RHETORIC OUT THERE --"
kZu_ojDI-Vk,2254251,2259623,"I WOULD BE WORRIED.  >> Rosemary: 30 SECONDS TO YOU,  ALTHIA."
kZu_ojDI-Vk,2259623,2264761,">> IT IS INCUMBENT ON LEADERS TO  LEAD, UNFORTUNATELY.  FOR EXAMPLE, THIS WEEK WE HAD 20  CONSERVATIVE M.P.s WHO MET  WITH SOME OF THE FREEDOM CONVOY%"
kZu_ojDI-Vk,2264761,2269800,"LEAD, UNFORTUNATELY.  FOR EXAMPLE, THIS WEEK WE HAD 20  CONSERVATIVE M.P.s WHO MET  WITH SOME OF THE FREEDOM CONVOY  MEMBERS.  ONE OF THEM INVOLVED IN THE  FEBRUARY EVENT TALKED ABOUT  CANADA BEING CLOSE TO A CIVIL"
kZu_ojDI-Vk,2269800,2274805,WAR.  AND THE TWITTER THREAD TALKS
kZu_ojDI-Vk,2274805,2280044,"ABOUT THE ILLEGITIMATE ELECTION  OF JUSTIN TRUDEAU, THAT JUSTIN  TRUDEAU HAD CHEATED."
kZu_ojDI-Vk,2280044,2285983,"YOU KNOW, IT IS INCUMBENT ON  THOSE M.P.s TO CLAMP DOWN ON  THAT AND TO SAY THAT IS NOT  TRUE.  YOU KNOW, WE HAVE FAIR ELECTIONS"
kZu_ojDI-Vk,2285983,2292356,-- ELECTIONS CANADA IS KNOWN  AROUND THE WORLD FOR CONDUCTING  FAIR ELECTIONS.
kZu_ojDI-Vk,2292356,2297561,SO IT IS ALSO INCUMBENT ON THE  GOVERNMENT FRANKLY THOUGH TO  ALSO SPEAK TRUTHFULLY WHEN THEY
kZu_ojDI-Vk,2297561,2302833,"DO NOT SPEAK TRUTHFULLY, PEOPLE  LOSE TRUST.  AND TRUST IS AT THE CENTRE OF  ALL OF THIS."
kZu_ojDI-Vk,2302833,2309306,">> Rosemary: OKAY, ON THAT NOTE,  HEAVY TOPIC AND IMPORTANT"
kZu_ojDI-Vk,2309306,2315679,"CONVERSATION.  I'M GOING TO SAY  GOODBYE TO YOU FOR THE SUMMER,  HOPEFULLY.  NOT BECAUSE I DON'T LOVE YOU AND  WON'T MISS YOU, BECAUSE I WILL.  BUT WE'LL TAKE A BREAK."
kZu_ojDI-Vk,2315679,2323020,"AND THANK YOU VERY MUCH.  AND, OF COURSE, WE WILL BE BACK  IF AND WHEN NEWS WARRANTS, AND"
kZu_ojDI-Vk,2323020,2328658,"WITH THAT  I'LL SEND THINGS BACK TO ANDREW  IN TORONTO.  >> Andrew: OKAY, THANK YOU VERY  MUCH, ROSIE.  >>> AFTER THE BREAK AN  EXTRAORDINARY RESCUE."
kZu_ojDI-Vk,2328658,2336666,>> MY ONLY THOUGHTS WERE LIKE  SHE HAS TO BREATHE.  >> Andrew:WE'LL HEAR A  FIRSTHAND ACCOUNT OF THE  EXTRAORDINARY RESCUE.
kZu_ojDI-Vk,2336666,2343240,>> WHAT IS THAT MOVE CALLED?  >> CALLED THE PUNCH IN THE FACE.  >> Andrew: AND THE FATEFUL  MEETING OF A YOUNG BOY AND HIS  HERO.
kZu_ojDI-Vk,2343240,2351214,PODCASTS.  (♪(♪♪)
kZu_ojDI-Vk,2351214,2357521,>> Andrew: WELCOME BACK.  A SUDDEN SHOCK TURNED HEROIC  RESCUE AT THE WORLD AQUATICS
kZu_ojDI-Vk,2357521,2362660,CHAMPIONSHIP IN BUDAPEST THIS  WEEK AFTER AN AMERICAN SWIMMER
kZu_ojDI-Vk,2362660,2369666,BLACKED OUT AND SANK LIKE A  STONE TO THE BOTTOM OF THE POOL.  HERE'S BELLE PURI ON THE QUICK  ACTION THAT SAVED HER LIFE.
kZu_ojDI-Vk,2369666,2376773,>> Reporter: TWO-TIME OLYMPIAN  ANITA ALVAREZ IS NO STRANGER TO  PERFORMING ON THE WORLD STAGE  BUT HER LATEST COMPETITION
kZu_ojDI-Vk,2376773,2383413,LITERALLY TOOK THE U.S. ARTISTIC  SWIMMER'S BREATH AWAY.
kZu_ojDI-Vk,2383413,2389820,">> THAT AND I REMEMBER GOING  DOWN AND JUST BEING LIKE, LIKE  UH-OH, I DON'T FEEL TOO GREAT  AND THAT'S THE LAST THING THAT I  REMEMBER.  >> Reporter: THE 25-YEAR-OLD"
kZu_ojDI-Vk,2389820,2395225,"LOST CONSCIOUSNESS AND SANK,  LIFELESS TO THE BOTTOM OF THE"
kZu_ojDI-Vk,2395225,2402733,POOL.  ALVAREZ HAD JUST COMPLETED HER  PERFORMANCE IN THE WOMEN'S SOLO  FREE ROUTINE.
kZu_ojDI-Vk,2402733,2412809,">> AND I SAW HER MORE PALE THAN  NORMAL AND I SAID OH, AND I SAW  HER GOING DOWN.  >> Reporter: ALVAREZ'S COACH  IMMEDIATELY JUMPED INTO THE  WATER TO SAVE HER."
kZu_ojDI-Vk,2412809,2420183,>> IT'S A LITTLE DISTURBING TO  SAY THE LEAST.
kZu_ojDI-Vk,2420183,2425589,>>> IT WAS WORRYING.  MY ONLY THOUGHTS WERE THAT
kZu_ojDI-Vk,2425589,2434030,SHE HAS TO BREATHE.  I WAS LIKE OPEN HER MOUTH AND  MAKE HER COUGH.  >> Reporter: THE SAME THING  HAPPENED TO ALVAREZ LAST YEAR AT  AN OLYMPIC QUALIFYING EVENT AND  IT'S NOT JUST HER.
kZu_ojDI-Vk,2434030,2439970,">> IT HAPPENS.  THERE HAVE BEEN INCIDENTS OF IT  HAPPENING AT CLUB LEVELS, AT ALL  LEVELS OF OUR SPORT, BUT IN"
kZu_ojDI-Vk,2439970,2448178,TERMS OF COMMON -- I WOULDN'T  SAY THAT IT HAPPENS ON A REGULAR  BASIS.
kZu_ojDI-Vk,2448178,2453416,">> Reporter:SUSAN KEMPER IS A  FORMER ARTISTIC SWIMMING COACH.  >> UNFORTUNATELY, THIS IS JUST A"
kZu_ojDI-Vk,2453416,2459089,NEGATIVE WAY OF DEMONSTRATING  THAT ARTISTIC SWIMMING IS A  SPORT.
kZu_ojDI-Vk,2459089,2464895,"THIS ATHLETE WAS IN THE WATER  FOR LESS THAN THREE MINUTES, AND"
kZu_ojDI-Vk,2464895,2471902,DROVE HERSELF TO THE POINT WHERE  SHE WAS UNCONSCIOUS.  >> Reporter:ALVAREZ SCORED 86.6
kZu_ojDI-Vk,2471902,2477240,"POINTS FOR HER ROUTINE AND  FINISHED SEVENTH IN THE  COMPETITION.  READY TO SWIM AGAIN, SHE SAYS"
kZu_ojDI-Vk,2477240,2483547,"THAT IT WAS THE BEST PERFORMANCE  OF HER CAREER.  BELLE PURI, CBC NEWS, VANCOUVER.  >> Andrew: WOW.  SO TEAM CANADA, IT DID NOT HIT  THE PODIUM IN BUDAPEST TODAY,  BUT IT SURE DID YESTERDAY WITH"
kZu_ojDI-Vk,2483547,2490053,"FOUR MEDALS, INCLUDING TWO GOLD."
