vid,start,end,text
NTLifuwI7Dg,2481280,2487839,sand won't be able to transition it this  is one of the most simple looking but  most ancient cooking structures used to
NTLifuwI7Dg,2487839,2494240,trap heat and bake smoke or steam food  when no other equipment is available is  this a jamaican style of cooking it's
NTLifuwI7Dg,2494240,2500160,really getting back to the roots of what  jerk is jerk is coming from the days  when the tainos and the maroons got
NTLifuwI7Dg,2500160,2507040,together they hunted the wild hogs  burying the hug that's how the jerk  process came about so whatever we have  passed those days and just our last
NTLifuwI7Dg,2507040,2513119,culture but when you get the meat it  just has a different flavor a different  texture even sometimes a different color
NTLifuwI7Dg,2513119,2520079,you'll see it and it looks pink or  reddish but then it's already cooked  it's a smoked flavor that goes through
NTLifuwI7Dg,2520079,2528000,it so they saw the fire don't cook it  with a smoke so that is why the process  takes six and a half hours
NTLifuwI7Dg,2529200,2536160,chef yes sir the moment is upon us yes  it is underneath this piece of  corrugated steel is a mystery all right
NTLifuwI7Dg,2536160,2541680,there's a wild hog  it's either done  or dead or or decorated
NTLifuwI7Dg,2541680,2547280,well either way it's most certainly dead  absolutely so step one remove this
NTLifuwI7Dg,2547280,2551319,all right try to be super careful
NTLifuwI7Dg,2554640,2561280,wow that's crazy the pig rolled over  while it was in there i wasn't expecting  that  this is black is that how it's supposed
NTLifuwI7Dg,2561280,2569040,to be yeah so are you gonna eat this  skin you can  straight up straight up oh yes
NTLifuwI7Dg,2569040,2573200,all right just up up  yeah man
NTLifuwI7Dg,2574319,2581599,as the chef as a guy pulling out of the  ground you have your back to the crowd  to the people who are going to be eating  it soon what's that one piece that you
NTLifuwI7Dg,2581599,2587520,can't resist to try immediately it's  either the butt  that part or either the rib i love the
NTLifuwI7Dg,2587520,2593760,rib you got that texture that everything  that you're looking for well i'm looking  for some rib then all right
NTLifuwI7Dg,2593760,2600800,oh this is nice super juicy i've never  seen pig skin like this where it's just  covered in jerk seasoning it's become
NTLifuwI7Dg,2600800,2607329,like a hardened paste yeah cheers  [Music]
NTLifuwI7Dg,2608720,2615280,oh yeah  that pop  you're so juicy it's hard to describe  that pimento it gives a certain kind of
NTLifuwI7Dg,2615280,2620400,freshness to it there's a spice i feel  the warmth like all the way from my  mouth to my belly oh it's so delicious
NTLifuwI7Dg,2620400,2626240,are you are you on your second rib now  he's like yup keep talking
NTLifuwI7Dg,2627200,2633200,oh he's just ripping the ankle off oh  you can try that thank you sir oh look  at this there's skin there's fat there's
NTLifuwI7Dg,2633200,2639680,protein there's a mix of textures and  tissues you want some i want all of it  oh okay
NTLifuwI7Dg,2640079,2645119,oh yeah completely different experience  than the ribs there's crunchy [ __ ] it's  moist and it's more interspersed with
NTLifuwI7Dg,2645119,2651599,fat all of this on the outside is what  kept everything moist on the inside  absolutely yeah i mean the pig is like  the perfect animal for cooking because
NTLifuwI7Dg,2651599,2658640,it's almost hard to mess it up and i  don't mean to take any credit away from  you but it's like nature's little  cooking vessel it has a thick skin it
NTLifuwI7Dg,2658640,2666078,keeps everything protected inside  this is fantastic chef you've outdone  yourself thank you very much lenny
NTLifuwI7Dg,2670160,2675440,chef andrew cuts up the roasted pig and  portions it out ribs tenderloin sirloin
NTLifuwI7Dg,2675440,2682000,belly bacon ham shoulder it's all  stacked up together except for the head  the head remains whole and we'll be
NTLifuwI7Dg,2682000,2687839,trying that soon  chairs cheers we're cheering these red
NTLifuwI7Dg,2687839,2693680,stripes so much i should be getting a  little sponsorship i think sponsored by  red stripe
NTLifuwI7Dg,2693680,2700000,right here this is the kidney i love it  all right cheers  little gaming a little different i like
NTLifuwI7Dg,2700000,2706720,it though  nice and soft like a little livery in  the texture but it's really just taking  on all those seasonings beautifully i
NTLifuwI7Dg,2706720,2712319,want to talk about this pimento this is  a spice that's used all over jamaica  everywhere in everything now when i find
NTLifuwI7Dg,2712319,2718000,new ingredients i like to try them just  raw so when i'm tasting it i can  identify it in a dish from then on yeah
NTLifuwI7Dg,2718000,2723760,right we're trying out  it's super fragrant
NTLifuwI7Dg,2723760,2729280,to me it's a mix of cloves a little mint  and pepper it has a little bit of a  numbing effect a little sting what the
NTLifuwI7Dg,2729280,2736319,szechuan peppercorn is to food in  chengdu china  this is to food in jamaica absolutely
NTLifuwI7Dg,2736319,2742960,this part right here the ears  do you hear that  it broke off so easily oh my god
NTLifuwI7Dg,2742960,2750800,oh wow  it's almost like a jerk jerk definitely  a dark jerk  crunchy tough although fatty interior
NTLifuwI7Dg,2750800,2756560,oh my god  dude it's so warm chef are you horrified  at home no no no no no
NTLifuwI7Dg,2756560,2762319,right there that is the money  oh that's my favorite bite yet that is
NTLifuwI7Dg,2762319,2768640,game ender right there  what's interesting to me is we've had  three different types of jerk and they  all use different cooking styles i mean
NTLifuwI7Dg,2768640,2773839,we had it on the pan we had it over the  pimento wood and then here underground  all the results are a little bit
NTLifuwI7Dg,2773839,2781119,different but there's still a thread  that connects them all too definitely  there's a seasoning thread that connects  it the pimento especially yeah now i
NTLifuwI7Dg,2781119,2786240,feel like i really get it what makes it  jerk and there's nothing else like it in  the world no incredible so
NTLifuwI7Dg,2786240,2791680,thank both of you cheers to that i  appreciate it man blessings
NTLifuwI7Dg,2796880,2802560,our caribbean culinary adventure  continues here on the island of jamaica  what are you going to make from this i'm
NTLifuwI7Dg,2802560,2808800,going to make a dish  yeah all right well  sounds good let's get going  [Music]
NTLifuwI7Dg,2808800,2815200,today we're telling three different  stories of seafood in jamaica you're  going to attempt to fry this whole tuna
NTLifuwI7Dg,2815200,2820800,that's right from the rare creatures  caught and cooked in local villages i  saw one fisherman come in he had a
NTLifuwI7Dg,2820800,2825920,puffer fish those are poisonous no no no  to preparing and eating the caribbean's
NTLifuwI7Dg,2825920,2833440,most venomous fish beautiful fish but if  you get stuck by one of those  sharp barbs you're in for a bad day
NTLifuwI7Dg,2833440,2837280,it all starts  here
NTLifuwI7Dg,2842079,2848240,matt and i are starting the day in a  small village tucked away on the edge of  montego bay greeting us here jackie put
NTLifuwI7Dg,2848240,2853520,it there yeah where are we right now we  are in the greenspan fisherman beach  grange pen is one among hundreds of
NTLifuwI7Dg,2853520,2859119,fishing villages dotting jamaica's  coastline villages like this are made up  of modest houses built with wood and
NTLifuwI7Dg,2859119,2865860,sheet metal and they kind of have to  live here because they're right next to  the water they can jump in their boat  they go out they fish
NTLifuwI7Dg,2865860,2871359,[Music]  with their self-constructed boats and  locally made gear fishermen here leave
NTLifuwI7Dg,2871359,2876880,for the ocean at the crack of dawn and  they return when the sun is up and the  tide is low is there any type of fish
NTLifuwI7Dg,2876880,2882640,that if you catch it you throw it out  stingray is dangerous to the partner so  we will left him inside but i see people
NTLifuwI7Dg,2882640,2888720,they say it's viagra so why don't you  want to catch it more a successful catch  looks like a boat full of snappers
NTLifuwI7Dg,2888720,2896319,groupers jackfish doctor fish and  barracudas solo fishing like this makes  up 95 of the jamaican fishing industry i
NTLifuwI7Dg,2896319,2902000,saw one fisherman come in he had a  puffer fish those are poisonous no no no
NTLifuwI7Dg,2902000,2907839,according to national geographic  wikipedia and the japanese chef who once  prepared fugu for me the puffer fish
NTLifuwI7Dg,2907839,2914559,contains tetrodotoxin which is 1200  times more poisonous than cyanide
NTLifuwI7Dg,2914559,2921359,you've eaten that fish like sometimes  not out of that but you never felt  anything make your face numb like you  had a stroke no if someone knows certain
NTLifuwI7Dg,2921359,2928480,type of fish that you have a big head  and a small body you don't touch it i'm  like that on tinder big head small body
NTLifuwI7Dg,2928480,2934319,encouraged by jackie's confidence matt  and i decided to take a bite of puffer  fish freshly caught and grilled on the
NTLifuwI7Dg,2934319,2942439,spot that was until i saw how they  prepared it  [Music]
NTLifuwI7Dg,2944000,2950400,i gotta say i've lost my nerve can't do  it  come to think about it the gentleman in  japan did have a certificate on his
NTLifuwI7Dg,2950400,2956559,restaurant wall and i mean does anyone  in this village have a special  certificate to prepare fugu in a way  that's not going to kill anybody they've
NTLifuwI7Dg,2956559,2964160,been cooking it for longer than sushi  chefs but they don't have a certain  thing so you feel comfortable i  feel like yeah exactly
NTLifuwI7Dg,2964160,2970319,here these were looking a lot more  tropical a little bit ago these are dr  fish why are they called them we got  them say that they're good for you
NTLifuwI7Dg,2970319,2976480,that's all i can give you it's all right  in the belief that seafood tastes best  in its natural form with its natural
NTLifuwI7Dg,2976480,2983359,flavors the preferred preparation here  is straightforward gut  roast done let me get to what we call a
NTLifuwI7Dg,2983359,2989520,plate oh thanks i'll take a plate  i go from right here right down to the  belly there and i just tear across so
NTLifuwI7Dg,2989520,2995440,once you tear across all of that white  meat comes off so i'm just gonna toss it  in my mouth right away
NTLifuwI7Dg,2995440,3001920,yeah no seasoning at all it's just warm  soft fishy natural flavors of the ocean  stretchy chewy skin and a liquid crunch
NTLifuwI7Dg,3001920,3007680,as well that's nice perfectly seasoned  by the caribbean this is like survival  cooking cooking at its most basic form
NTLifuwI7Dg,3007680,3016960,just grab the fish scale it gut it throw  it on a fire it's not pretty good that  was just an appetizer leading up to this
NTLifuwI7Dg,3018960,3025359,this is a caribbean king crab  these crabs are efficient cleaners of  coral reefs thanks to their diet based
NTLifuwI7Dg,3025359,3031440,on algae with that in mind fishermen  plant these crabs around their fishing  spots to create a better environment for
NTLifuwI7Dg,3031440,3038120,other species to spawn once these  cleaners grow fat it's their turn to  become part of the life cycle
NTLifuwI7Dg,3038120,3041159,[Music]
NTLifuwI7Dg,3044640,3050240,usually you're going to see a big crab  like this steamed up or put in a pot of  boiling water but here it's going to be
NTLifuwI7Dg,3050240,3056640,grilled we're cooking it on a tire rim  i've never seen it done this way  it's midway through cooking right now
NTLifuwI7Dg,3056640,3061920,all right give it a little bit of a flip  all right  good flip it's kind of just bubbling and
NTLifuwI7Dg,3061920,3067680,boiling in its own shell at this point  and they wait for it to stop boiling as  soon as that's done we know the meat is
NTLifuwI7Dg,3067680,3073920,done it's time to crack it open and see  what's inside  [Applause]
NTLifuwI7Dg,3073920,3079839,i'm not sure where to start legs like  oh dude it's steaming look at this we  don't have anything to crush it with we
NTLifuwI7Dg,3079839,3085840,do this in jamaica we always have our  red stripe handy if we're not drinking  it we're using it
NTLifuwI7Dg,3085840,3091200,[Music]  you have a good meat going on
NTLifuwI7Dg,3091570,3097280,[Laughter]  no there's tons of shattered shell in  there i really [ __ ] this up
NTLifuwI7Dg,3097280,3103760,what it's like when you're trying to  open a hard-boiled egg and it just keeps  shattering into pieces and not actually  opening there's gonna be no crab left
NTLifuwI7Dg,3103760,3110160,get it  there you go  so much meat all that works it's so  voluminous i can hardly handle this
NTLifuwI7Dg,3110160,3116240,whole bite  i think i tasted something it was very  small
NTLifuwI7Dg,3116240,3121280,now the claws have to have something  inside  i'm looking for just the bite of all
NTLifuwI7Dg,3121280,3129119,bites we have to just tick time ah there  we go there we go there we go there we  go oh it's so solid you got a huge piece
NTLifuwI7Dg,3129119,3134960,oh this is perfect my hands got  chocolate and i'm just gonna put it on  my clean hand the meat it's like a dry
NTLifuwI7Dg,3134960,3140480,desert like all these separate little  muscle fibers and in between there's  delicious crabby juice what have you
NTLifuwI7Dg,3140480,3146079,done  well done is there still a tendon in the  middle no i took the tendon out oh dude  this could be the best bite in the world
NTLifuwI7Dg,3146079,3153359,should we beat each other i don't think  we can do that  [Music]
NTLifuwI7Dg,3153359,3159760,yo best  bite ever it tastes buttery its own  juices just make it sweet and brings
NTLifuwI7Dg,3159760,3165359,together that meat perfectly if this  crab was alive right now it would be  blushing guys oh my god
NTLifuwI7Dg,3165359,3172079,yeah but i've had so many different  species i gotta say it's probably the  top a lot of crab is good it's good in  general it's got a bit of sweetness or a
NTLifuwI7Dg,3172079,3178720,bit of like briny seafoodiness to it  this is completely different an  incredible texture with every bite you  take you can feel the juices rushing out
NTLifuwI7Dg,3178720,3184160,of the meat and then it's just naturally  sweet but also just buttery almost like  an oil natural oil that's coming from
NTLifuwI7Dg,3184160,3189200,the crab meat maybe cooking it the way  he's cooked it keeps the oils in the  meat because when you boil it you always
NTLifuwI7Dg,3189200,3194640,see this like white pasty stuff around  the meat well that's all the fat that's  boiled out of the produce exactly and to
NTLifuwI7Dg,3194640,3199680,me when you boil it you bring the flavor  out when you steam it or you cook it  like this the flavor stays in yeah
NTLifuwI7Dg,3199680,3206000,absolutely  seafood story one complete  in our next chapter we'll see a chef
NTLifuwI7Dg,3206000,3211810,take on a seafood challenge of epic  proportions a record-breaking attempt  like you've never seen before
NTLifuwI7Dg,3211810,3215070,[Applause]
NTLifuwI7Dg,3217040,3222559,chef jeff  put her there pleasure to be here great  respect every time life is beautiful
NTLifuwI7Dg,3222559,3228960,chef jeff is the founder and head of  spirits his venue is packed with  palette-pleasing local seafood but today
NTLifuwI7Dg,3228960,3236400,we're going off menu i want to talk  about what we're eating today right here  that bad boy
NTLifuwI7Dg,3236400,3241440,this is a 30 pound yellow fin tuna a  whole yellow fin tuna i don't even
NTLifuwI7Dg,3241440,3246800,should i do an interview from here can  you see me getting your hands on a tuna  like this in jamaica is a real treat for
NTLifuwI7Dg,3246800,3253920,local chefs so jeff's plan for today  he's gonna fry it whole  [Music]
NTLifuwI7Dg,3253920,3259119,have you ever fried a fish this big  before no it's the first time i'm going  to attend  a day
NTLifuwI7Dg,3259119,3265680,what's your strategy your square and  once you do that it's open up each layer  to the oil so you get that hot that's
NTLifuwI7Dg,3265680,3271359,penetrate to the fish the bone the meat  so that's going to be a lot of cuts is  it going to even be recognizable if the
NTLifuwI7Dg,3271359,3278000,family came here before it went into an  autopsy could they pull back the sheep  and identify this as a family member
NTLifuwI7Dg,3278000,3283520,no  no  [Music]  for a fish this huge they must construct
NTLifuwI7Dg,3283520,3288880,a pan big enough to suit its mighty  girth this sounds like an incredible  journey something that's never been done
NTLifuwI7Dg,3288880,3295520,before in this kitchen never with big  risk comes big reward and great  responsibility i kind of i think i don't
NTLifuwI7Dg,3295520,3301359,know while the oil tub slowly reaches  the required temperature the chef rubs  the fish with a blend of seasonings
NTLifuwI7Dg,3301359,3307160,making sure they reach every deep  crevice  then like ted bundy it's ready to fry
NTLifuwI7Dg,3307160,3312720,[Music]  you ready that's right they've got two
NTLifuwI7Dg,3312720,3317920,of these fryer tools they're gonna bring  it over to the oil and lower it in
NTLifuwI7Dg,3317920,3323920,descending  slowly  [Music]  and we just have to hope
NTLifuwI7Dg,3323920,3330079,oh my god it's crackling so far so good  it's not like those videos like when  they cook a turkey for thanksgiving and
NTLifuwI7Dg,3330079,3335920,it starts on fire  i'm bravely watching what's happening  from a safe distance he's slowly easing
NTLifuwI7Dg,3335920,3342559,the fish down into the oil he doesn't  want to do it too much yes it's in it's  fully in it's submerged oh this looks
NTLifuwI7Dg,3342559,3348079,awesome is it working yes  [Music]  how do you feel is this what you
NTLifuwI7Dg,3348079,3354400,expected yes so now i'm gonna get my  spoon what happened i just want this  side to start cooking so once we turn it
NTLifuwI7Dg,3354400,3361599,the cooking process already started so  it would be much easier wow this is a  huge tuna the cuts look perfect they
NTLifuwI7Dg,3361599,3367920,look clean it's like every little cut on  there is its own tuna fillet or tuna  steak you feel happy i'm happy i'm happy
NTLifuwI7Dg,3367920,3373119,i'm happy we're on the right track  add black pepper scotch bonded pepper
NTLifuwI7Dg,3373119,3381200,and garlic to the oil to enhance the  flavor of the oil itself  [Music]
NTLifuwI7Dg,3381200,3387359,then the moment finally comes one of the  most epic flips in seafood history  [Music]
NTLifuwI7Dg,3387359,3393760,it's super hard to flip because it's so  big and right now some of the skin is  peeling off a little bit but i think  they're managing pretty good it's just
NTLifuwI7Dg,3393760,3398880,going to get one flip that's it this is  the final flip
NTLifuwI7Dg,3398960,3405119,chef are you happy with the flip i'm so  happy perfect flip time perfect  [Music]
NTLifuwI7Dg,3405119,3410400,and i'm just looking at a nice texture  oh my gosh the whole thing is in here  the eyes the face we can eat all of it
NTLifuwI7Dg,3410400,3416640,right that's right i enjoy the head yeah  yeah  leave the fish to fry for another five
NTLifuwI7Dg,3416640,3422640,to six minutes and keep adding hot oil  to the top like you're basting a turkey
NTLifuwI7Dg,3422799,3428000,when the fish is visually crisp it's  ready to leave all right this is the  most delicate part of the process now it
NTLifuwI7Dg,3428000,3435520,is frying it's so easy for the fish to  fall apart grabbing the whole thing it's  gonna go on a platter right next to it
NTLifuwI7Dg,3437280,3443440,boom right down on the checkered platter  and that is in one solid piece
NTLifuwI7Dg,3443440,3448880,oh chef wow  look at this fantastic job it looks  properly roasted all the way through
NTLifuwI7Dg,3448880,3455040,there's enough tuna steaks on here to  feed a whole village and soon i'm gonna  be trying this out myself i'm so excited
NTLifuwI7Dg,3455040,3460720,chef you've outdone yourself well done  and well done to you too what did i do  look at you all in the fish hey
NTLifuwI7Dg,3460720,3467280,yeah look at me dress it up with spicy  pickled veggies and bammy whammy all  that's left to do is to dig in oh it's
NTLifuwI7Dg,3467280,3472880,still plenty hot yeah i'm one yes  look at that it's a whole tuna steak  there's a little different textures all
NTLifuwI7Dg,3472880,3478640,over this thing some parts are really  crisped up and some are a little bit  more steamy
NTLifuwI7Dg,3479520,3486319,it's all crunchy medium the skin and all  the outside here has just been  completely coated and lined with  seasoning so it's warm it's savory it's
NTLifuwI7Dg,3486319,3492000,salty oh my lord all right i'm ripping  off this tail piece obviously it's a lot  more narrow so probably cooked a lot
NTLifuwI7Dg,3492000,3497599,faster and you can see a beautiful crisp  right here  [Music]  super crispy the teal usually have a
NTLifuwI7Dg,3497599,3503680,little darker note to it than the white  meat of the belly especially with the  tuna here's what i'm really curious  about did the body cook all the way
NTLifuwI7Dg,3503680,3510319,through  i'm pulling out of this whole big slice  yeah  so that is almost all the way cooked
NTLifuwI7Dg,3510319,3517040,through some sashimi in the middle here  and then just right nearby some nice  fried tuna
NTLifuwI7Dg,3517040,3523760,very tender there's so many experiences  in one fish the head there's a lot of  treasured parts in here first is the  cheek i've been told by many fish head
NTLifuwI7Dg,3523760,3530559,lovers that this is the best bite  the whole tuna right here it is super  fatty mixed with protein and then a nice
NTLifuwI7Dg,3530559,3536880,crunchy exterior here  oh yeah a lot more fatty i feel it in  your fingers right
NTLifuwI7Dg,3536880,3542880,but the whole head there was so much  meat and so many different holes and  crevices and places where you could  reach in and grab meat and pull it out
NTLifuwI7Dg,3542880,3549040,tuna tongue is that a delicacy not that  popular i'm gonna put that  there  so this is the top of the head yeah i'm
NTLifuwI7Dg,3549040,3555440,on an insane amount of meat on here you  can see even the grain the way the meat  is growing here gorgeous oh look at just
NTLifuwI7Dg,3555440,3562798,like the tenderloin this is the backup  with some crunch on it try some of that  i would love that thank you my friend
NTLifuwI7Dg,3564799,3569839,this is one of the most unique seafood  experiences i've ever had i mean anybody  can fry a fish or fry a tuna but when
NTLifuwI7Dg,3569839,3575520,it's at this scale you can see the  difference from the head for the tail  from a little bit of sashimi inside that  may not have been intentional
NTLifuwI7Dg,3575520,3580720,compliments to the chef he ordered  himself creating this masterpiece and  the size alone sonic you know when you
NTLifuwI7Dg,3580720,3587040,come to jamaica size matters  our final chapter brings back an element
NTLifuwI7Dg,3587040,3593920,of danger no not the puffer fish this  would be even worse it's peeing it goes  right to your neural tub it's a bad deer
NTLifuwI7Dg,3593920,3599250,that was really bad this danger of the  deep is waiting for me here
NTLifuwI7Dg,3599250,3605680,[Music]  safiron is a family-owned business we've  been here 35 years you come here you
NTLifuwI7Dg,3605680,3611200,feel like you're on a boat and you're  getting fresh seafood straight from the  caribbean sea locals come tourists come
NTLifuwI7Dg,3611200,3617440,every animal in the jungle kind of comes  homestead one reading us today jason  owner of pier one what are some of the
NTLifuwI7Dg,3617440,3623520,more popular seafood in jamaica well  lobsters are always number one and the  red snapper is a close second of course
NTLifuwI7Dg,3623520,3628640,now we're gonna try something today  that's a little bit different so we're  trying something that's not really
NTLifuwI7Dg,3628640,3634319,native to this area no no this is the  lionfish yes  [Music]
NTLifuwI7Dg,3634319,3640559,coming from the tropical waters of the  south pacific and indian oceans this  beauty is the star of many aquariums but
NTLifuwI7Dg,3640559,3645759,around florida and the caribbean it's an  absolute terror
NTLifuwI7Dg,3646000,3651839,the lionfish is believed to have escaped  or even more likely to have been  released into florida waters from an
NTLifuwI7Dg,3651839,3658079,aquarium over two decades ago they're  very aggressive and they feed on young  fish on the reef and once they come up
NTLifuwI7Dg,3658079,3663680,the reef is basically dead in an effort  to reduce the number of lionfish the  jamaican government encourages its
NTLifuwI7Dg,3663680,3669440,consumption well it's very difficult to  catch you have to handle them with a lot  of caution because even dead even in
NTLifuwI7Dg,3669440,3675119,this state if one of those barbs were to  stick you you would be in for a bad  night 20 minutes for the puffer fish
NTLifuwI7Dg,3675119,3681119,yeah this would be even worse it's pain  it goes right to your neurotox it's a  body all right i'm going to gently put
NTLifuwI7Dg,3681119,3687680,the plate down behind you and just don't  back up too much  despite its bad reputation when it comes
NTLifuwI7Dg,3687680,3694480,to flavor this bad boy is highly rated  among seafood lovers  but before you dig in you must carefully
NTLifuwI7Dg,3694480,3702480,remove the fish's venomous spikes it  cooks anyway it's a nice fish it can be  escovich fried steamed roasted what
NTLifuwI7Dg,3702480,3707599,should we do today let's do a nice  steamed fish next score the fish and  season it with salt and pepper then
NTLifuwI7Dg,3707599,3713440,stuff some thyme onion garlic and scotch  bonnet into its nooks and crannies  [Music]
NTLifuwI7Dg,3713440,3719520,heat it in a pan with olive oil sprinkle  some bell pepper and scallions on top
