vid,start,end,text
NTLifuwI7Dg,1193120,1198320,definitely a regular dancer it's at the  core of what i do  when donkey said they wanna let me
NTLifuwI7Dg,1198320,1203520,believe it i'm what you call one of  those crossover fusion kind of guys is  it something that you make a living from
NTLifuwI7Dg,1203520,1209279,it  definitely that's full-time full-time  full-time
NTLifuwI7Dg,1209919,1216480,were you always rastafarian no i grew up  in a christian house my father was a  minister so when did you convert so to
NTLifuwI7Dg,1216480,1222640,speak it wasn't really a conversion it  was like a journey the journey really  began from church then you're just  trying to find more purpose more meaning
NTLifuwI7Dg,1222640,1227679,to this life we live in and rastafari  was the only thing within jamaica that  showed me there's things that i can
NTLifuwI7Dg,1227679,1234159,relate to that i couldn't have related  to before in the christian church for  many rastafarianism may conjure images
NTLifuwI7Dg,1234159,1239520,of dreadlocks reggae music and marijuana  in reality it's much more than that it
NTLifuwI7Dg,1239520,1246240,began as a black empowerment religious  and social movement in the 1930s  eventually it became one of jamaica's
NTLifuwI7Dg,1246240,1252400,major religions and cultural forces so  it's a way of life it's a way of life  really these days more than one million
NTLifuwI7Dg,1252400,1257840,people worldwide identify as rastafari  all right this is a great breakfast and  i think we have a lot more to see all
NTLifuwI7Dg,1257840,1261080,right let's go
NTLifuwI7Dg,1268000,1274080,to learn more about the rastafari  lifestyle and diet we're heading to a  place known as bobo hills it's a place
NTLifuwI7Dg,1274080,1279120,that does hoses the original traditions  of rastafari
NTLifuwI7Dg,1279120,1285760,tucked away in these mountains lies a  commune where a small devoted population  learns and worships are there people who
NTLifuwI7Dg,1285760,1291679,live there full-time yeah full-time  fully for them but to get there you not  only need to climb this mountainside you
NTLifuwI7Dg,1291679,1297360,also must be invited in as tourists are  not welcome
NTLifuwI7Dg,1297679,1305320,oh this is crazy now what  why don't we just go  let's go yeah
NTLifuwI7Dg,1306240,1312960,this is priest prince he's a member of  bobo ashanti one of the major branches  of rastafarianism that was born in this
NTLifuwI7Dg,1312960,1319360,village before we enter we must say a  prayer  after give thanks for this day and for
NTLifuwI7Dg,1319360,1324639,this visitation if thankfully skill for  guidance going out and coming in
NTLifuwI7Dg,1326720,1329720,rastafari
NTLifuwI7Dg,1333440,1339600,many rosters limit their diet to what  they consider pure and natural that  means no processed food no artificial
NTLifuwI7Dg,1339600,1345760,seasoning coloring or preservatives  there's not a lot of powders or  processed seasonings the food eaten here
NTLifuwI7Dg,1345760,1350480,is grown locally or harvested straight  from the source
NTLifuwI7Dg,1351730,1358720,[Music]  [Applause]  their diet is also free of alcohol
NTLifuwI7Dg,1358720,1366399,cigarettes and drugs  except for one  and that one is used a lot
NTLifuwI7Dg,1372640,1377919,sir bless blessed love my lord meet the  village chef john wordy an expert in
NTLifuwI7Dg,1377919,1383440,rustic cooking today you're the chef are  you always the chef oh my fama was a  toddler so when you were younger did you
NTLifuwI7Dg,1383440,1389520,eat meat no and so what we have here is  basically vegetarian right not child  coming from the earth do you do any
NTLifuwI7Dg,1389520,1396080,gardening here yeah man when we're ready  man we have a callaloo coming from here  we have a lettuce green banana oh wow
NTLifuwI7Dg,1396080,1402720,all that's here yeah man you are in  jerusalem school room  the raw rastafarian diet is extremely
NTLifuwI7Dg,1402720,1408960,healthy as they mostly grow their own  organic food this tradition has roots in  the distrust of our current modern food
NTLifuwI7Dg,1408960,1417640,system and supply chain a system that  often relies on chemicals pesticides  preservatives and gmos
NTLifuwI7Dg,1425040,1431200,[Music]  whether these fears are justified or  debatable one thing is certain the
NTLifuwI7Dg,1431200,1437440,rastafari diet is evidence that eating  organic food doesn't have to be boring  or expensive
NTLifuwI7Dg,1437440,1443679,can you show me this one yeah this is  the congo peas tango like in africa yes  oh these are great we're going to make
NTLifuwI7Dg,1443679,1448799,some strew witnesses so today you're  going to make three different dishes  nacho we're going to give you some strew
NTLifuwI7Dg,1448799,1455600,we're going to give you some ground  providence food and we're going to put  the aki with the vegetable
NTLifuwI7Dg,1456840,1461919,perfect standards for cooking and eating  here are just one facet of the rastafari
NTLifuwI7Dg,1461919,1467920,lifestyle  the faith itself is the bedrock upon  which all else is
NTLifuwI7Dg,1467920,1473279,[Music]  unsanta for your built and cast and all
NTLifuwI7Dg,1473279,1478960,the faces shine upon us that children  that we shall be safe and redeem the  rastafari lifestyle has deep roots in
NTLifuwI7Dg,1478960,1484480,christianity  their holy book the bible their paradise
NTLifuwI7Dg,1484480,1491200,africa and their divine guiding spirit  god also goes by a different name john
NTLifuwI7Dg,1491200,1497760,their wise prophet hail selassie king of  ethiopia in the 1930s
NTLifuwI7Dg,1499200,1504559,the word rastafarianism comes from ross  tafari mokhane the pre-regnal title of
NTLifuwI7Dg,1504559,1512590,his majesty the faith teaches redemption  for african descendants and their  repatriation to zion or africa
NTLifuwI7Dg,1512590,1515659,[Music]
NTLifuwI7Dg,1518640,1525120,back in the kitchen john wordy is  cooking up a feast  first boiled dumplings different from
NTLifuwI7Dg,1525120,1531440,what we've tried this morning as they're  made with whole wheat flour and cornmeal  the dough is manipulated into the shape
NTLifuwI7Dg,1531440,1537600,of a banana then plopped into a pot and  left to boil  in the meantime the chef prepares ground
NTLifuwI7Dg,1537600,1542880,provisions or root vegetables dashin or  taro there's also cocoa another kind of
NTLifuwI7Dg,1542880,1549919,sweet potato and green bananas  all these will join the dumplings
NTLifuwI7Dg,1549919,1556320,i'm in dinner time here we go this looks  excellent oh my gosh so this is a banana  we had this morning no that's a spinners
NTLifuwI7Dg,1556320,1561919,a dumpling but in a different form oh  you're right as i bit into it i was like  wait that's just dough
NTLifuwI7Dg,1561919,1568400,yeah it tastes like whole wheat because  people just use cornmeal and flour only  but they add the wheat flour there's not  that much process it's healthier it's
NTLifuwI7Dg,1568400,1574000,gonna pass through a bit easier to your  system we're going to be pooping good  tonight if you're feeling down and for
NTLifuwI7Dg,1574000,1579760,you how hard is it to stick to the diet  of a rastafarian there's levels to it  the real diet of our crease like
NTLifuwI7Dg,1579760,1585279,rastafaris is fasting where they really  don't eat that much they just live off  the air and water and there's fruits how
NTLifuwI7Dg,1585279,1592080,many calories are in air i have no idea  i'm pretty sure it's like probably right  all right but for people who can't live  off air then what the next level is then
NTLifuwI7Dg,1592080,1597360,vegan the next step would be vegetarian  food what are we eating right now and  then there's the next level where  there's some of us eat fish along with
NTLifuwI7Dg,1597360,1605278,this so we don't eat any other meat but  i eat fish i find it hard giving up the  fish but no goat no chicken no beef
NTLifuwI7Dg,1606960,1612400,although some rastafarians still eat  fish for most meat is something taboo as  it's considered
NTLifuwI7Dg,1612400,1618320,dead food that will not provide your  body with energy but on the contrary  strip it away there's a rooster down
NTLifuwI7Dg,1618320,1624799,here i love the idea of a rooster going  into a food hall takes a lot of balls  right no he knows he's safe here nobody  eats it oh yeah that's right exactly
NTLifuwI7Dg,1624799,1630339,what's the point of having a rooster  here it's a part of the family  [Music]
NTLifuwI7Dg,1630480,1636320,next up congo bean stew remember those  congo beans soaked in coconut juice  they're simply boiled with chopped
NTLifuwI7Dg,1636320,1640840,carrots okra and irish potatoes
NTLifuwI7Dg,1641760,1647360,let's try it out  definitely taste the coconut yeah the  coconut gives it some natural sweetness
NTLifuwI7Dg,1647360,1654720,oh yeah that's that's like the secret  ingredient like coconut milk mixed with  beans beans are nice and starchy there's  okra in there carrots that's nice
NTLifuwI7Dg,1654720,1661520,now the star of today's table steamed  vegetables with aki aki is a type of  fruit a distant cousin of lychee and
NTLifuwI7Dg,1661520,1666880,longitude  start by boiling the freshly picked aki
NTLifuwI7Dg,1666880,1673679,then prepare the vegetables so delicious  vegetable calaloo  cabbage
NTLifuwI7Dg,1673679,1679519,onion  tomato  pepper
NTLifuwI7Dg,1679760,1685200,put the veggies in a separate pot and  let them cook  when it's nice and soft season with sea
NTLifuwI7Dg,1685200,1691760,salt and add the boiled aki mix well and  serve  so i had aki on my first day in jamaica
NTLifuwI7Dg,1691760,1697240,and so is this like similar thing but  without the salt fish yeah
NTLifuwI7Dg,1697520,1702640,oh yeah very different from the aki i  had yesterday much more like gentle  flavors like i actually tasted cabbage
NTLifuwI7Dg,1702640,1708240,not super seasoned gentle light and you  can really just taste the vegetables  themselves typical jamaicans we just add
NTLifuwI7Dg,1708240,1713440,a little black pepper all these other  things to spice it up but really this is  how it should be eaten this is fantastic
NTLifuwI7Dg,1713440,1719919,it was a pleasure hanging out with you  today enjoying a meal with you and to  learning more about the rastafari people  what's behind this place this way of
NTLifuwI7Dg,1719919,1724440,life and especially the food delicious
NTLifuwI7Dg,1726880,1733200,our caribbean culinary adventure  continues here on the island of jamaica
NTLifuwI7Dg,1734640,1740640,today we're going on a cross-country  jerk tour  starting with the classics the oil drum
NTLifuwI7Dg,1740640,1746320,is unique how long do you think you have  to cook inside of it to get rid of the  uh oil flavor
NTLifuwI7Dg,1746320,1752159,ending with an entire freaking pig have  you done this before yes i've done it a  few times have you ever been surprised
NTLifuwI7Dg,1752159,1759039,in a bad way  so what's so special about jamaican jerk  and how did it become world renowned
NTLifuwI7Dg,1759039,1765279,well it all starts  here  heading 70 miles from kingston to the
NTLifuwI7Dg,1765279,1771760,northeast tip of the island we'll bring  you here portland this is the home of  jerk
NTLifuwI7Dg,1771760,1777760,the standard next to which every  jamaican jerk could be compared here  right on the side of the street you'll
NTLifuwI7Dg,1777760,1783760,find jerk come the traditional way  open it up big reveal
NTLifuwI7Dg,1783760,1790240,[Music]  i'm told this is called pan chicken one  chicken locally i call it pan fold it's
NTLifuwI7Dg,1790240,1796480,made in an old oil drum  so what that does it recreates the  original style of jerk where it was
NTLifuwI7Dg,1796480,1802240,underground where the smoke was up into  it because you have to have smoke and  jerk this jerk chicken is grilled over
NTLifuwI7Dg,1802240,1809039,charcoal but first it's doused in a  spicy pungent marination of spices only  available here in jamaica here's how
NTLifuwI7Dg,1809039,1816000,it's done by the bow this is the  original jerk season that i use this is  blended scotch bonnet pepper that i
NTLifuwI7Dg,1816000,1821200,already pre-blended here the seasoning  is called seasoning to the bone
NTLifuwI7Dg,1821200,1828960,this is a jerk seasoning it's made of  natural jamaican herbs like pimento  berries blended dried crushed pepper
NTLifuwI7Dg,1828960,1836720,this is the all-purpose seasoning the  same thing like the drink seasoning but  it's more refined  one tablespoon of garlic powder mix all
NTLifuwI7Dg,1836720,1843200,together until it has this nice light  brown color  [Music]
NTLifuwI7Dg,1843200,1850880,rub that on the chicken along with thyme  onion and scallions and let it soak up  those flavors for 25 minutes
NTLifuwI7Dg,1850880,1856990,toss it on a custom grill made from an  old oil drum and keep it hot avoiding  direct contact with the flames
NTLifuwI7Dg,1856990,1863200,[Music]  your chicken's probably the most popular
NTLifuwI7Dg,1863200,1869760,but what is it that makes something  jerky it is the marinade process it  looks delicious we should try it out
NTLifuwI7Dg,1875039,1880799,salty spicy the scotch bonnet is very  unique it's like a heating pad in the  winter it's a nice lingering heat it's
NTLifuwI7Dg,1880799,1886559,not intense so it just stays there and  it just hums yeah you see the thing is  with jerk we have two important
NTLifuwI7Dg,1886559,1891840,ingredients which are grown in jamaica  better than anywhere in the world  pimento the scotch bunny all of that
NTLifuwI7Dg,1891840,1897360,combined up with other seasonings is  what creates this magnificent drugstore  i could just eat and listen to you talk
NTLifuwI7Dg,1897360,1903360,all day  oh even the white meat is soft and  tender and juicy everything is juicy
NTLifuwI7Dg,1903360,1908640,that's his festival  is a type of fried bread that's usually  paired with jerk chicken it's made from
NTLifuwI7Dg,1908640,1914399,flour cornmeal salt baking powder water  and sugar it's also addictive when you
NTLifuwI7Dg,1914399,1920960,finish eating you'll blow it up like a  puffer fish  no sweet heavy crunchy outside doughy
NTLifuwI7Dg,1920960,1927200,inside it helps to stuff up some of the  heat of the scotch bonnet pepper that we  just spoke about i've learned one of the  best compliments you can give to food in
NTLifuwI7Dg,1927200,1933840,jamaica is  nice nice yum  our first and most affordable location
NTLifuwI7Dg,1933840,1939360,is a great entry point into the world of  jerk but here in jamaica you can jerk  anything
NTLifuwI7Dg,1939360,1945039,well i mean  any food i think you get my point  [Music]
NTLifuwI7Dg,1945039,1950640,our next stop right here gold teeth jerk  center located on fairy hill just a few
NTLifuwI7Dg,1950640,1956799,minutes from boston beach here they  offer a range of protein options folks  come here for their traditional jerk
NTLifuwI7Dg,1956799,1962720,technique we can do the turkey gourd  rabbit reindeer whatever you want  there'll be cookies
NTLifuwI7Dg,1962720,1968000,yeah  meet the chef jay james how you doing  bro good
NTLifuwI7Dg,1968000,1974080,me too i feel like i just smoked two  packs of cigarettes i don't know why you  and jamaica get used to the smoke i'm  used to a different kind of smoke and
NTLifuwI7Dg,1974080,1980960,that's what i'm saying when you're in  jamaica  unlike the typical grilling over steel  grates everything here is notably
NTLifuwI7Dg,1980960,1986480,grilled on top of wood  is the wood actually giving flavor to
NTLifuwI7Dg,1986480,1992559,the meat yes man the wood give flavor as  well this is pimento wood with even  thicker boards on top to help hold in
NTLifuwI7Dg,1992559,1998399,some heat what's so special about the  pimento wood oh my god you can see this  one sweating
NTLifuwI7Dg,1998399,2005360,give it the flavor this one's sweating  too yeah how are you doing i want some  underneath it all charcoal emitting heat
NTLifuwI7Dg,2005360,2011760,and flavorful smoke also from pimento  wood it goes from raw to cooked lots of  cocoa right here it must take a while
NTLifuwI7Dg,2011760,2017360,because the wood isn't burning how long  does it take six hours oh that's a long  time low and slow the other reason we
NTLifuwI7Dg,2017360,2023440,came here not just for the way you're  grilling it the way you're preparing the  meat but also the different types of  meat you have available here it's
NTLifuwI7Dg,2023440,2029120,different than other places here  you're serving rabbit yes
NTLifuwI7Dg,2029120,2034240,why rabbit  it's famous meat no on the black you  know yeah
NTLifuwI7Dg,2034240,2040640,the rabbit is cleaned and all its organs  are put aside time for the marination  we've got the pimento right over here
NTLifuwI7Dg,2040640,2045840,give it a flavor we're gonna go over the  jerk sauce  the rabbit is rubbed down with a secret
NTLifuwI7Dg,2045840,2052720,jerk sauce but even the most secret jerk  sauce must contain a couple of key  ingredients pimento berries spices and
NTLifuwI7Dg,2052720,2059839,scotch bonnet peppers this is the liver  this is the kidney stuff it after  marinating it's brought to grill for six
NTLifuwI7Dg,2059839,2066720,hours  [Music]  so with rabbit sometimes it can be a bit  dry and doesn't have a lot of fan how do
NTLifuwI7Dg,2066720,2072000,you keep it moist slow fire if you're  gonna blaze a fire it's gonna dry down  you have to know the country wallet this
NTLifuwI7Dg,2072000,2077118,is the rabbit right here oh it's  interesting the way you prepared it here  the rabbit it almost looks like chicken
NTLifuwI7Dg,2077118,2084320,it tastes like chicken tastes like  chicken  i'm in waguan
NTLifuwI7Dg,2084320,2090480,that's it right  i'm very curious about this is it rabbit  very common meat here not very common
NTLifuwI7Dg,2090480,2095679,but what it is it's grown a lot  throughout jamaica because they breed a  lot what do you think is the best part
NTLifuwI7Dg,2095679,2101960,of a freaking rabbit the legend thai  right they're looking [ __ ] i'm gonna try  it out cheers
NTLifuwI7Dg,2104480,2111520,getting a little pepper yeah low heat  but a lot of juice which is impressive i  mean this animal has almost no fat it's  almost like a nice juicy moist chicken
NTLifuwI7Dg,2111520,2118000,breast and it's smoky i'm gonna get a  little bit of sauce you don't need too  much because trust me the heat is on it
NTLifuwI7Dg,2118000,2124240,and the heat is in it all so hot but  it's all nice it's not the intense heat  no it's a manageable heat you see when
NTLifuwI7Dg,2124240,2131359,you start acting or sowing like you're  pregnant then you know the pepper nice i  think the reason some people faint when  they eat hot food is because they go
NTLifuwI7Dg,2131359,2137920,on oxygen yeah they hyperventilate  this is a rabbit it's an appetizer we
NTLifuwI7Dg,2137920,2144480,still have a whole goat like we have  you ready one what leg please sir
NTLifuwI7Dg,2144480,2152400,put it like that try to use the meat off  the leg  no  we're going to drink sauce
NTLifuwI7Dg,2152400,2158720,stuff the sauce inside  that's a permanent  flavor let it soak for two hours then we
NTLifuwI7Dg,2158720,2163760,put it on wood  uh right here a whole leg of a goat let
NTLifuwI7Dg,2163760,2169200,me pick it up i think we could just give  it a little bit of a split still smell  that is a ram goat can you smell that a
NTLifuwI7Dg,2169200,2175680,ram goat yeah one a woman a man i can't  you can smell the different kind of  mango and lemon goat
NTLifuwI7Dg,2175680,2182400,take a look at this man he really works  at coating all the meat massage that  seasoning right down into it cheers
NTLifuwI7Dg,2182400,2189520,cheers  super juicy wow it's very goaty oh i'm  bad to have spicy milk
NTLifuwI7Dg,2189520,2195599,this is the same spice same drop  seasoning on it you can taste a little  bit of the heat as well it's interesting  seeing the jerk seasoning placed with
NTLifuwI7Dg,2195599,2201119,different proteins because it brings out  different flavors i still taste the goat  itself but there's still the powerful
NTLifuwI7Dg,2201119,2207200,jerk flavor the scotch bonnet it's hot  it's spicy and there's the smokiness  from the wood from the fire you come to
NTLifuwI7Dg,2207200,2214359,jamaica you need the smoke whether it's  from the jerk or something else the  smoke has to be
NTLifuwI7Dg,2214560,2220640,today was just a warm up yeah i'm on  tomorrow  something i didn't even know was  possible we're jerking a whole pig it
NTLifuwI7Dg,2220640,2226800,doesn't sound right but it's gonna look  right i can guarantee you that and taste  even better
NTLifuwI7Dg,2226800,2232720,these  for our final jerk experience we're  heading 130 miles to the northwestern
NTLifuwI7Dg,2232720,2237839,coast of jamaica this is montego bay the  second largest city in jamaica after
NTLifuwI7Dg,2237839,2243119,kingston  [Music]  i've come here to see an entire pig get
NTLifuwI7Dg,2243119,2249359,jerked and this is the jerk master  himself chef what's going on it's a very  impractical location for an interview
NTLifuwI7Dg,2249359,2256079,and that's how the creative minds work  you know yeah it's gonna look beautiful  i hope so  andrew a jamaican jerk competition
NTLifuwI7Dg,2256079,2262000,champion in 2019 he's not even a  full-time chef but with love and a  passion for cooking he's mastered the
NTLifuwI7Dg,2262000,2267040,art of jerk you can jerk anything that  you want yeah you know what i'm saying
NTLifuwI7Dg,2267040,2274079,really i tried everything i've done bird  i've done rabbit i've done fish i've  done big of course i've done chicken
NTLifuwI7Dg,2274079,2279519,it's a love for me so i have the show  for the show
NTLifuwI7Dg,2279680,2286160,today his approach is a long lost one  cooking underground today you're doing a  whole pig have you done this before yes
NTLifuwI7Dg,2286160,2292720,i have how many times maybe about six  seven times before how do you make sure  no sand gets in the meat we line it with
NTLifuwI7Dg,2292720,2298560,the banana leaves so the banana leaves  basically protects the pig from the sun  how do you know for sure when it's done
NTLifuwI7Dg,2298560,2305760,have you ever been surprised in a bad  way  no never  first up andrew prepares the pit digging
NTLifuwI7Dg,2305760,2311680,sand to a depth of about two feet  layer in sheet metal and secure it with
NTLifuwI7Dg,2311680,2318480,rocks  add a layer of pimento wood to give off  a distinct aroma
NTLifuwI7Dg,2318480,2324160,add heat and let the fire do the work  this is the base  all right so we're going to get the jerk
NTLifuwI7Dg,2324160,2330079,seasoning ready if put on the pig  automatically have a start to the spice  of life i will get the fermented all
NTLifuwI7Dg,2330079,2336720,powder just as chengdu china celebrates  their szechuan peppercorns jamaica  celebrates their pimento both these
NTLifuwI7Dg,2336720,2343119,peppercorns have a distinct potent  flavor that you could not compare to  ordinary black pepper get it all dusty
NTLifuwI7Dg,2343119,2348240,then we're going to do the scotch bunny  add some vinegar and some water
NTLifuwI7Dg,2348240,2354720,add some garlic some fresh thyme  scallion now i can add my pimento to it
NTLifuwI7Dg,2354720,2360480,with the seasoning what does the  seasoning absolutely have to have in  order to be called jerk absolutely
NTLifuwI7Dg,2360480,2366800,important in any jerk you have to have  pimento and you have to have scotch  bonnet when it's mixed into the all the
NTLifuwI7Dg,2366800,2373599,other ingredients and stuff it just  brings out an amazing flavor and once  you get that incorporated with any meat
NTLifuwI7Dg,2373599,2378800,at all it's like heaven wow i got really  lost in your beautiful words
NTLifuwI7Dg,2378800,2383920,now we need the pig let's get this pig  ready trying to get little grooves so
NTLifuwI7Dg,2383920,2389680,the seasoning can soak right down into  under the skin  he applies a dry rub jerk seasoning that
NTLifuwI7Dg,2389680,2395440,includes a blend of herbs and spices  flip them over  usually cinnamon thyme cayenne pepper
NTLifuwI7Dg,2395440,2401520,garlic onion and allspice  then he adds his own wet rub give it a
NTLifuwI7Dg,2401520,2407119,good massage and let it marinate no this  is what you call it cocoa butter good  for the skin
NTLifuwI7Dg,2407119,2413280,do you think the jerk is it all about  the seasoning or about the cooking  technique too it's a mixture of  everything because everybody tried their
NTLifuwI7Dg,2413280,2418880,own spices and herbs and different  mixtures and stuff like that but even if  you put it and you don't have the
NTLifuwI7Dg,2418880,2425440,technique and the passion because it  takes time jerk is not something that  you don't show showing the grill i want  to turn color it good you're looking for
NTLifuwI7Dg,2425440,2432640,a texture you're looking for flavor  you're looking for a smell you're  looking for if it got crispy everything  is a process
NTLifuwI7Dg,2432720,2438880,the pig is ready the pit is set time to  make the bed  andrew layers the cooking grape with
NTLifuwI7Dg,2438880,2444480,even more pimento leaves to give it more  flavor although they come with flavors  as a pimento the spice of jamaica you
NTLifuwI7Dg,2444480,2449839,use it in anything it's in the blend  it's in the leaves it's in the berries  now the most important step of this
NTLifuwI7Dg,2449839,2454960,process getting the pig tucked in for  bed you want the head of the butt the  head all right
NTLifuwI7Dg,2454960,2461280,i got the butt right here yes  all right let's go  if we fail we might end up having a raw
NTLifuwI7Dg,2461280,2467559,pig covered in salt be careful of your  step though should i step here yeah
NTLifuwI7Dg,2468079,2474720,all right lay it down here that's right  so it's on the grill it's on the pimento  leaves yes it's over the coal what's the
NTLifuwI7Dg,2474720,2481280,next step  line the sides also with leaves then i'm  gonna get another sheet cover it so the
