vid,start,end,text
oOcZRxBwZ1k,7874,12345,>>> WELCOME TO THE BEAT. 
oOcZRxBwZ1k,12345,13813,THE TOP STORY IN THE U.S. IS 
oOcZRxBwZ1k,13813,16482,THE DEVASTATING EVIDENCE THAT 
oOcZRxBwZ1k,16482,17317,DONALD TRUMP SUPPORTED THE 
oOcZRxBwZ1k,17317,18851,ARMED OVERTHROW OF THE U.S. 
oOcZRxBwZ1k,18851,22488,GOVERNMENT. INCRIMINATING 
oOcZRxBwZ1k,22488,23155,EYEWITNESS TESTIMONY WHICH 
oOcZRxBwZ1k,23155,24190,RIVETED CONGRESS AND THE NATION 
oOcZRxBwZ1k,24190,26693,IS OPEN MAN UP NEW LANES. 
oOcZRxBwZ1k,26693,28228,IT BUILDS A CRIMINAL EVIDENCE 
oOcZRxBwZ1k,28228,29696,AGAINST TRUMP AND THE FORMER 
oOcZRxBwZ1k,29696,30897,PRESIDENT AFTER YEARS OF 
oOcZRxBwZ1k,30897,33632,"SHOCKWAVES, MELTDOWNS AND ALL "
oOcZRxBwZ1k,33632,37537,"KINDS OF PUBLIC DISCUSSION, THE "
oOcZRxBwZ1k,37537,38705,NEW EVIDENCE IS STILL DRYING 
oOcZRxBwZ1k,38705,44410,"REACTIONS LIKE THIS, STUNNING "
oOcZRxBwZ1k,44410,45311,AND SHOCKING DETAILS WITH MANY 
oOcZRxBwZ1k,45311,46613,SPEECHLESS AT THE PORTRAIT OF A 
oOcZRxBwZ1k,46613,50817,TRULY UNHINGED PRESIDENT. 
oOcZRxBwZ1k,50817,51618,THE WASHINGTON POST REPORTING 
oOcZRxBwZ1k,51618,53453,TRUMP HAS HAD BAD MOMENTS BUT 
oOcZRxBwZ1k,53453,59225,FEW WORSE THAN HUTCHINSON'S 
oOcZRxBwZ1k,59225,59625,TESTIMONY. 
oOcZRxBwZ1k,59625,60760,WE START WITH THE WORDS FROM 
oOcZRxBwZ1k,60760,63963,"ONE OF TRUMP TOP AIDES, FORMER "
oOcZRxBwZ1k,63963,66866,CHIEF OF STAFF WHO DID NOT 
oOcZRxBwZ1k,66866,68334,REQUEST A PART IN. 
oOcZRxBwZ1k,68334,70536,TALKING ABOUT MICK MULVANEY ONE 
oOcZRxBwZ1k,70536,73206,OF THE VETERANS WITH THE NEW 
oOcZRxBwZ1k,73206,75275,EVIDENCE DOES CHANGE THINGS 
oOcZRxBwZ1k,75275,76809,BECAUSE IT LINKS TRUMP TO THE 
oOcZRxBwZ1k,76809,80747,ARMED VIOLENCE IN ADVANCE. 
oOcZRxBwZ1k,80747,84417,HE VERY SIMPLY AND PLAINLY LAYS 
oOcZRxBwZ1k,84417,89589,OUT HOW AND FIRST I WANT TO 
oOcZRxBwZ1k,89589,91024,SHOW IT IN TWO PARTS HOW IN 
oOcZRxBwZ1k,91024,92158,MANY OTHER DEBATES OVER DONALD 
oOcZRxBwZ1k,92158,93159,"TRUMP, HIS OLD BOSS INCLUDING "
oOcZRxBwZ1k,93159,98164,DEBATES OVER TRUMP'S AT TIMES 
oOcZRxBwZ1k,98164,100233,VIOLENT SPEECHES HAS PREVIOUSLY 
oOcZRxBwZ1k,100233,103670,DEFENDED HIS FORMER BOSS. 
oOcZRxBwZ1k,103670,107774,>> I HAVE SEEN HIM ACCUSED OF 
oOcZRxBwZ1k,107774,108675,VIOLENCE WITH NO VIOLENCE AT 
oOcZRxBwZ1k,108675,110043,ALL SO I HAVE BEEN DEFENDING 
oOcZRxBwZ1k,110043,110343,HIM. 
oOcZRxBwZ1k,110343,114547,I HAVE BEEN DEFENDING HIM. 
oOcZRxBwZ1k,114547,115781,>> HIS MIND HAS CHANGED AND NOW 
oOcZRxBwZ1k,115781,117216,HE SAYS IN PUBLIC BECAUSE OF 
oOcZRxBwZ1k,117216,121688,THE NEW EVIDENCE THAT TRUMP NEW 
oOcZRxBwZ1k,121688,122588,THEY WERE ARMED AND TRUMPED 
oOcZRxBwZ1k,122588,127260,PUSH THEM ON ANYWAY. 
oOcZRxBwZ1k,127260,128127,>> AFTER YESTERDAY WHEN SHE 
oOcZRxBwZ1k,128127,129862,TESTIFIED THAT HE KNEW THERE 
oOcZRxBwZ1k,129862,131630,WERE GUNS ON PROPERTY AND HE 
oOcZRxBwZ1k,131630,132699,STILL ENCOURAGED PEOPLE TO GO 
oOcZRxBwZ1k,132699,134400,"TO THE CAPITAL, THAT CHANGES MY "
oOcZRxBwZ1k,134400,136269,MIND. 
oOcZRxBwZ1k,136269,138938,>> THAT CHANGES HIS MIND. 
oOcZRxBwZ1k,138938,142775,HE IS NOT THE ULTIMATE ARBITER 
oOcZRxBwZ1k,142775,143643,THAT IT STRIKING BECAUSE HE 
oOcZRxBwZ1k,143643,150750,HELD THE SAME POST AS MARK 
oOcZRxBwZ1k,150750,151684,MEADOWS WHO IS NOW UNDER 
oOcZRxBwZ1k,151684,152418,INVESTIGATION AND CONDEMNATION 
oOcZRxBwZ1k,152418,153286,IS STRIKING THEM FOR MANY 
oOcZRxBwZ1k,153286,154553,REASONS IN HIS MIND WAS CHANGED 
oOcZRxBwZ1k,154553,155855,SPECIFICALLY BY TESTIMONY WHICH 
oOcZRxBwZ1k,155855,159325,IS A TYPE OF EVIDENCE IN A 
oOcZRxBwZ1k,159325,161794,WORLD OF FACTS. MANY PEOPLE 
oOcZRxBwZ1k,161794,164197,AROUND TRUMP DON'T CARE ABOUT 
oOcZRxBwZ1k,164197,169469,THE FACTS AND WANT YOU TO THINK 
oOcZRxBwZ1k,169469,170703,THE FACTS DON'T MATTER AND SOME 
oOcZRxBwZ1k,170703,171738,WILL OPERATE LIKE THAT THE 
oOcZRxBwZ1k,171738,172772,WHOLE PUBLIC LIVES AND SOME 
oOcZRxBwZ1k,172772,174006,WILL RISK GOING TO JAIL FOR 
oOcZRxBwZ1k,174006,176142,THAT AND SOME HAVE GONE TO JAIL 
oOcZRxBwZ1k,176142,180947,FOR THAT BUT I WANT YOU TO 
oOcZRxBwZ1k,180947,181814,UNDERSTAND THAT MR. MULVANEY 
oOcZRxBwZ1k,181814,183015,LIKE A LOT OF PEOPLE TODAY 
oOcZRxBwZ1k,183015,184416,AFTER ALL OF THIS IS CITING THE 
oOcZRxBwZ1k,184416,185317,"FACTS, THE EVIDENTIARY WEIGHT "
oOcZRxBwZ1k,185317,186619,OF IT AND TESTIMONY OF SOMEONE 
oOcZRxBwZ1k,186619,189222,WHO SERVED HIS SAME POST. 
oOcZRxBwZ1k,189222,197096,>> THANKS MIKE GET REAL BAD IF 
oOcZRxBwZ1k,197096,198898,"I SAY KEEP IN TOUCH WITH ME, WE "
oOcZRxBwZ1k,198898,200032,ARE GOING TO GET CHARGED WITH 
oOcZRxBwZ1k,200032,201334,EVERY CRIME IN A IMAGINABLE IF 
oOcZRxBwZ1k,201334,202402,WE MAKE THAT HAPPEN. 
oOcZRxBwZ1k,202402,205972,">> THEY ARE NOT HERE TO HURT ME,"
oOcZRxBwZ1k,205972,207273,TAKE THAT AWAY. 
oOcZRxBwZ1k,207273,209942,>> HE USED HIS FREE HAND TILL 
oOcZRxBwZ1k,209942,215381,LUNCH AT MR. ANGLE AND HE 
oOcZRxBwZ1k,215381,216883,MOTIONED TOWARDS HIS CLAVICLE. 
oOcZRxBwZ1k,216883,220886,>> TODAY AS IT ROILS THE 
oOcZRxBwZ1k,220886,222422,"NATION, OTHER CONSERVATIVES ARE "
oOcZRxBwZ1k,222422,225091,ALSO JOINING THE SAME BREAKING 
oOcZRxBwZ1k,225091,225758,POINT. 
oOcZRxBwZ1k,225758,227226,CRACKS IN THE NORMAL UNITED 
oOcZRxBwZ1k,227226,230229,DEFENSE OF TRUMP. 
oOcZRxBwZ1k,230229,235902,TOP HOSTS OF FOX NEWS AND SOME 
oOcZRxBwZ1k,235902,237837,ARE STILL TRYING TO DISMISS ALL 
oOcZRxBwZ1k,237837,240106,THE TESTIMONY BUT THERE ARE 
oOcZRxBwZ1k,240106,240973,ALSO PRETTY CLEAR AND UNUSUAL 
oOcZRxBwZ1k,240973,242375,SIGNS OF A PARTIAL SPLIT WITHIN 
oOcZRxBwZ1k,242375,243642,THE MURDOCH MEDIA EMPIRE. 
oOcZRxBwZ1k,243642,244744,WHEN EXPERT TELLING THE 
oOcZRxBwZ1k,244744,248748,AUDIENCE THE NEW TESTIMONY WAS 
oOcZRxBwZ1k,248748,249548,WORSE THAN AMERICA THOUGHT AND 
oOcZRxBwZ1k,249648,255388,A TOP NEWSPAPER IN THE WALL 
oOcZRxBwZ1k,255388,256555,STREET JOURNAL HAS A NEW 
oOcZRxBwZ1k,256555,257924,EDITORIAL WHICH DOES CRITICIZE 
oOcZRxBwZ1k,257924,260693,THE COMMITTEE AND THEY DO TAKE 
oOcZRxBwZ1k,260693,262127,SHOTS AT WHAT THEY SEE AS A 
oOcZRxBwZ1k,262127,266599,PARTISAN COMMITTEE BUT THEY NOTE
oOcZRxBwZ1k,266599,267299,", ACCUMULATING EVIDENCE OF "
oOcZRxBwZ1k,267299,268201,TRUMP'S CONDUCT BASED ON FIRST-
oOcZRxBwZ1k,268201,268968,"HAND ACCOUNT AND REPUBLICANS, "
oOcZRxBwZ1k,268968,271070,MUST FACE THE EVIDENCE OF 
oOcZRxBwZ1k,271070,273005,TRUMP'S BEHAVIOR WHICH WILL BE 
oOcZRxBwZ1k,273005,278411,RELEVANT TO VOTERS AND THE 
oOcZRxBwZ1k,278411,279545,SPLIT HAS CONTINUED ON FOX'S 
oOcZRxBwZ1k,279545,280245,THERE WERE POLITICAL ANCHORS 
oOcZRxBwZ1k,280245,281247,ARE STILL DEFENDING TRUMP BUT 
oOcZRxBwZ1k,281247,282782,OTHER LEGAL THREATS OF BROKEN 
oOcZRxBwZ1k,282782,283849,RANKS. 
oOcZRxBwZ1k,283849,288054,>> THEY SAID IT WAS A GAME 
oOcZRxBwZ1k,288054,292225,"CHANGER, WRONG AGAIN. "
oOcZRxBwZ1k,292225,293392,WHAT YOU HEARD IS AN INCREDIBLY 
oOcZRxBwZ1k,293392,294260,BIZARRE HEARSAY ALLEGATION AND 
oOcZRxBwZ1k,294260,295094,IF YOU HAD A DIFFERENT 
oOcZRxBwZ1k,295094,296128,PERSPECTIVE PRESENTED I DON'T 
oOcZRxBwZ1k,296128,297129,THINK IT WOULD BE VERY HELPFUL 
oOcZRxBwZ1k,297230,299031,TO PRESIDENT TRUMP BECAUSE THE 
oOcZRxBwZ1k,299031,302201,EVIDENCE PRETTY CLEARLY SHOWS 
oOcZRxBwZ1k,302201,303069,HIS UNFITNESS AND SUGGEST HE 
oOcZRxBwZ1k,303069,304637,MAY BE GUILTY OF CRIME. 
oOcZRxBwZ1k,304637,309775,>> UNFITNESS AND MAY BE GUILTY 
oOcZRxBwZ1k,309775,310976,"OF A CRIME, ANOTHER WORD IS "
oOcZRxBwZ1k,310976,312745,DEVASTATING AND THE LAST VOICE 
oOcZRxBwZ1k,312745,314413,WAS THE PROSECUTOR ANDREW 
oOcZRxBwZ1k,314413,317016,McCARTHY AND HE WROTE A WHOLE 
oOcZRxBwZ1k,317016,317950,BOOK DEFENDING TRUMP AND 
oOcZRxBwZ1k,317950,323489,ATTACKING THE MOLAR PROBE IS 
oOcZRxBwZ1k,323489,324657,THE REAL BALL OF COLLUSION 
oOcZRxBwZ1k,324657,326392,DURING THE TRUMP ERA AND THAT'S 
oOcZRxBwZ1k,326392,327893,HIS BOOK AND I WANT YOU TO SEE 
oOcZRxBwZ1k,327893,329996,WHERE HE'S COMING FROM AND THE 
oOcZRxBwZ1k,329996,331731,POSITIONS HE'S TAKING ON OTHER 
oOcZRxBwZ1k,331731,334800,LEGAL ISSUES AND PEOPLE DEBATE 
oOcZRxBwZ1k,334800,335935,WHAT THEY FOUND WAS A FACTUAL 
oOcZRxBwZ1k,335935,337203,MATTER BUT McCARTHY IS HARD-
oOcZRxBwZ1k,337203,338471,CORE CONSERVATIVE LAWYERS YOU 
oOcZRxBwZ1k,338471,340339,CAN GET MAYBE THAT'S WHY HE'S 
oOcZRxBwZ1k,340339,342842,ON FOX. HE IS OUT HERE NOW 
oOcZRxBwZ1k,342842,349181,"SAYING, IN A LEGAL MATTER AND A "
oOcZRxBwZ1k,349181,350115,MATTER OF CRIMINAL EXPOSURE FOR 
oOcZRxBwZ1k,350115,351884,"DONALD TRUMP, THE NEW TESTIMONY "
oOcZRxBwZ1k,351884,353553,IS DEVASTATING BECAUSE IT 
oOcZRxBwZ1k,353553,358124,IMPLICATES TRUNK TRUMP DIRECTLY 
oOcZRxBwZ1k,358124,362628,IN THE LEGAL MATTER TO 
oOcZRxBwZ1k,362628,365464,KNOWINGLY WELCOME AND ENCOURAGE 
oOcZRxBwZ1k,365464,366666,ARMED SUPPORTERS. 
oOcZRxBwZ1k,366666,372438,>> HE WANTED IT FULL AND WAS 
oOcZRxBwZ1k,372438,375207,ANGRY THAT THEY WERE NOT 
oOcZRxBwZ1k,375207,378678,LETTING PEOPLE THROUGH. 
oOcZRxBwZ1k,378678,385718,I WAS PART OF THE CONVERSATION 
oOcZRxBwZ1k,385718,387152,AND WAS IN THE VICINITY OF THE 
oOcZRxBwZ1k,387152,387819,CONVERSATION WHERE I WERE 
oOcZRxBwZ1k,387819,388821,HOPING HEARD THE PRESIDENT SAY 
oOcZRxBwZ1k,388821,390022,"SOMETHING TO THE EFFECT OF, I "
oOcZRxBwZ1k,390022,391123,DON'T CARE THAT THEY HAVE 
oOcZRxBwZ1k,391123,391523,WEAPONS. 
oOcZRxBwZ1k,391523,392825,THEY ARE NOT HERE TO HURT ME. 
oOcZRxBwZ1k,392825,394560,TAKE THAT THING AWAY AND LET MY 
oOcZRxBwZ1k,394560,394993,PEOPLE IN. 
oOcZRxBwZ1k,394993,396729,THEY CAN MARCH TO THE CAPITAL 
oOcZRxBwZ1k,396729,400766,FROM HERE. 
oOcZRxBwZ1k,400766,402101,>> TAKE THE METAL DETECTORS 
oOcZRxBwZ1k,402101,407340,AWAY. 
oOcZRxBwZ1k,407340,408007,LEGAL EXPERTS WEIGHING IN 
oOcZRxBwZ1k,408007,409108,DESCRIBING IT AS AN ILLEGAL 
oOcZRxBwZ1k,409108,410309,ORDER BY THE COMMANDER IN CHIEF 
oOcZRxBwZ1k,410309,412211,ON A DAY OF A NATIONAL SECURITY 
oOcZRxBwZ1k,412211,413512,MELTDOWN WHERE HE ALSO WAS 
oOcZRxBwZ1k,413512,419051,DERELICT IN DUTY. 
oOcZRxBwZ1k,419051,419886,NO EVIDENCE THE SECRET SERVICE 
oOcZRxBwZ1k,419886,421020,FOLLOWED THAT ILLEGAL ORDER OR 
oOcZRxBwZ1k,421020,422221,THEY BEGAN TO LET IN ARMED 
oOcZRxBwZ1k,422221,423556,PEOPLE EVEN IF TRUMP SAID HE 
oOcZRxBwZ1k,423556,425157,DID NOT CARE THAT THEY HAD 
oOcZRxBwZ1k,425157,427693,WEAPONS. 
oOcZRxBwZ1k,427693,428894,LET ME TELL YOU TONIGHT AS 
oOcZRxBwZ1k,428894,430529,"ASYNC SAN, DO YOU KNOW WHO "
oOcZRxBwZ1k,430529,434500,CARED? 
oOcZRxBwZ1k,434500,435368,THE SECRET SERVICE AGENTS WHO 
oOcZRxBwZ1k,435368,436068,RISK THEIR LIVES. 
oOcZRxBwZ1k,436068,437136,THEY DID CARE. 
oOcZRxBwZ1k,437136,438537,THE POLICE WHO WERE SAVAGELY 
oOcZRxBwZ1k,438537,443376,ATTACKED. THEY DID CARE. AND 
oOcZRxBwZ1k,443376,444510,YOU KNOW WHAT ELSE CARES? 
oOcZRxBwZ1k,444510,448114,"IN AMERICA, STILL, THE LAW CARES"
oOcZRxBwZ1k,448114,449815,AND THE LAW IS DETERMINED 
oOcZRxBwZ1k,449815,451450,INDEPENDENTLY. THE LAW ON THE 
oOcZRxBwZ1k,451550,455688,MATTER OF JOURNALISM IN THE 
oOcZRxBwZ1k,455688,456822,STORY THAT TOUCHES ON POLITICS 
oOcZRxBwZ1k,456822,458224,AND WE REPORTED ON A STORY OF 
oOcZRxBwZ1k,458224,461427,WHAT SOME TRUMP AIDS AND TRUMP 
oOcZRxBwZ1k,461427,463829,"LAWYERS SAID, SAW AND THOUGHT "
oOcZRxBwZ1k,463829,465431,AFTER THEY EACH REACHED THEIR 
oOcZRxBwZ1k,465431,472405,BREAKING POINT AND SOME PEOPLE 
oOcZRxBwZ1k,472405,473305,"REACHED IT BEFORE NOVEMBER, IN "
oOcZRxBwZ1k,473305,474073,"JANUARY, AFTER JANUARY BUT "
oOcZRxBwZ1k,474073,475541,REMEMBER ALL OF THAT IS SKEWED 
oOcZRxBwZ1k,475541,476375,POLITICALLY BECAUSE IT WILL NOT 
oOcZRxBwZ1k,476375,479845,BE THEM THOUGH IT INTERESTING 
oOcZRxBwZ1k,479845,481247,"THAT SOME ARE DONE WITH TRUMP, "
oOcZRxBwZ1k,481247,482047,IT WILL BE INDEPENDENT 
oOcZRxBwZ1k,482047,482848,PROSECUTORS WHO DECIDE ANY 
oOcZRxBwZ1k,482848,484483,FURTHER CHARGES RELATED TO THIS 
oOcZRxBwZ1k,484483,486485,ARMED INSURRECTION AND THE 
oOcZRxBwZ1k,486485,488187,VIOLENCE AND THE ATTEMPT TO 
oOcZRxBwZ1k,488187,492458,OVERTHROW DEMOCRACY THE SECRET 
oOcZRxBwZ1k,492458,493559,SERVICE AGENTS AND THE POLICE 
oOcZRxBwZ1k,493559,494460,AND EVER WHEN IT IMPACTS. 
oOcZRxBwZ1k,494460,494594,AND IT 
