vid,start,end,text
s8hWQwFwayo,80,6399,most human beings are only living at  about 40  of their capability
s8hWQwFwayo,6399,12880,you take that challenge  when you answer the call  and you see the other side of pain
s8hWQwFwayo,12880,18320,it's cold glory  this is called glory
s8hWQwFwayo,18320,26880,i have never seen anybody who did  extraordinary feats  that didn't have extraordinary issues
s8hWQwFwayo,26880,34000,it is the passion  that gives you the power you need  but it is the pain
s8hWQwFwayo,34000,39280,from which you have the conviction about  it  if you had not been through some pains
s8hWQwFwayo,39280,46399,you would not have the burning to do  what you do everybody can serve anyone  can be a leader
s8hWQwFwayo,46399,52640,listen our gravestone our gravestone has  a day a day when you were born in a day  when you die
s8hWQwFwayo,52640,57920,and they got a dance in between  and that dash defines what your legacy
s8hWQwFwayo,57920,62960,is  work hard you get what you gotta get  you don't work hard
s8hWQwFwayo,62960,68000,you get naughty  you get nothing  you gotta work hard
s8hWQwFwayo,68000,73760,work hard  you work hard you get what you gotta do  you don't work hard you don't get
s8hWQwFwayo,73760,79920,nothing  you don't get nothing  nothing  zero
s8hWQwFwayo,79920,85520,nothing  zero  nothing  keep working
s8hWQwFwayo,85520,91119,i was not the biggest  the strongest or fastest but my goals  were clear
s8hWQwFwayo,91119,97360,my actions were and still are in service  of those goals what wakes you up what  drives you why are you playing this game
s8hWQwFwayo,97360,102640,dr miles monroe compares leaders  to the king of the jungle he says he
s8hWQwFwayo,102640,108640,says the lion is not the tallest animal  in the jungle the land is not the  largest animal in the jungle the lion is
s8hWQwFwayo,108640,115280,not the smartest nor the most  intelligent animal in the jungle and yet  when the lion shows up he is king
s8hWQwFwayo,115280,121439,he is king you don't need to be  intelligent you don't need to be smart  you don't need to have a certain height  you don't need to have a certain way you
s8hWQwFwayo,121439,126960,don't need to have any kind of advantage  and yet you can be a leader  four o'clock in the morning i wake up 4
s8hWQwFwayo,126960,132800,30 4 45 i'm doing some sort of cardio  open these garage doors it's still dark
s8hWQwFwayo,132800,140560,outside i do this and then i'll have  breakfast and then i will go do all my  strength and conditioning training at a  gym for about an hour
s8hWQwFwayo,140560,146239,and then i'll go to set  we on average probably about five hours
s8hWQwFwayo,146239,152640,of sleep  it's 4 45 a.m it's still dark outside  look at that the lights just went out  and i'm getting ready to kill this am
s8hWQwFwayo,152640,157840,cardio you can't even see me but it's  gonna be so good it's bad
s8hWQwFwayo,159120,164560,focus  you do anything you never want to do  anything half-assed especially when it
s8hWQwFwayo,164560,170760,comes to your training get in be intense  execute on it and get out
s8hWQwFwayo,172959,178159,for a lot of guys out there and i was  certainly one of those guys in my 20s i  thought i had all the answers didn't
s8hWQwFwayo,178159,183519,know [ __ ] by the way in my 30s i'm still  trying to find myself as a lot of guys  are out there hopefully when you hit
s8hWQwFwayo,183519,189280,your 40s you're hitting a nice stride if  i'm gonna do it i need to do this job  right i need to stay focused on it i
s8hWQwFwayo,189280,193120,need to get the best effort i possibly  can
s8hWQwFwayo,195280,201200,we live down here in south florida it's  hurricane season  focus but when it's time to go to the
s8hWQwFwayo,201200,207280,gym  we got to get to the gym  and there ain't no stopping us  it's like i'm going to be the baddest
s8hWQwFwayo,207280,213200,[ __ ] walking  all right empty gym the way we like it  it's sunday
s8hWQwFwayo,213200,220879,just finished my warm-up  this pain ought to be fun  i work out twice before everyone wakes
s8hWQwFwayo,220879,226000,up  all right workout number two i'm out  working all my competition all right
s8hWQwFwayo,226000,231360,saturday afternoon empty gym the way we  like it it's leg day which means it's
s8hWQwFwayo,231360,237120,gonna be sweaty painful and fun  [Music]
s8hWQwFwayo,237120,243819,so how do you make it  how do you overcome the odds  [Music]
s8hWQwFwayo,245760,253040,i don't know what to say really  three minutes
s8hWQwFwayo,253040,260479,to the biggest battle of our  professional lives  all comes down to today
s8hWQwFwayo,262800,269520,we're in hell right now gentlemen  believe  me and
s8hWQwFwayo,269520,274880,we can stay here get the [ __ ] kicked out  of us  or
s8hWQwFwayo,274880,282560,we can fight our way back  into the light  we can climb out of hell or you could be
s8hWQwFwayo,282560,287600,like me dream of pro football get hurt  dream over
s8hWQwFwayo,287600,294400,find yourself with just seven bucks in  your pocket  so how did i get here  by being the hardest worker in the room
s8hWQwFwayo,294400,302000,now it's time to see who has a heart  now is the time to prove to yourselves
s8hWQwFwayo,302000,309280,and prove to everyone out there or  somebody  you're worthy of something
s8hWQwFwayo,309280,314639,and you're able to do something special  that no one else in the world can do
s8hWQwFwayo,314639,322520,are you ready to go out there and take  what's yours  what you worked hard for
s8hWQwFwayo,325440,332080,all of us in life have things we want  we don't get what we want we get what we
s8hWQwFwayo,332080,334960,have to have
s8hWQwFwayo,337280,343120,we all get what we tolerate  in ourselves and other people
s8hWQwFwayo,343120,349030,but when you're no longer willing to  tolerate something that's when your life  changes
s8hWQwFwayo,349030,355919,[Music]  everyone in the world  has a list of things they think they
s8hWQwFwayo,355919,363360,should do  i should lose weight  i should work out  i should spend more time with my kids
s8hWQwFwayo,363360,369120,i should work harder i should make more  calls i should i should i should i
s8hWQwFwayo,369120,375199,should  and then you know what people don't do  their shoulds and they get mad at  themselves they beat themselves up about
s8hWQwFwayo,375199,380960,it  what changes people is when your should
s8hWQwFwayo,380960,388080,becomes a must  when suddenly the thing you said should  happen has to happen
s8hWQwFwayo,388080,393199,that's when human beings change  it's like if you want to take the island
s8hWQwFwayo,393199,398720,and you're the head of the army you want  to take the island the most powerful way  to take the island is burn the boats
s8hWQwFwayo,398720,405360,because if there's no way to go back  it's amazing what happens when it's a  must to do something versus a should
s8hWQwFwayo,405360,413540,that's what makes human beings succeed  [Music]
s8hWQwFwayo,413759,419840,ego is the success inhibitor you have to  do your best not to make decisions based
s8hWQwFwayo,419840,426880,off of ego for sure  success and failure are generally slow
s8hWQwFwayo,426880,433759,processes  either slowly building things up
s8hWQwFwayo,433759,438720,or  gradually tearing them down
s8hWQwFwayo,440800,447599,and  that's why i say you've got to pay  attention  [Music]
s8hWQwFwayo,447599,452880,you have to  watch you have to watch every single
s8hWQwFwayo,452880,460960,second  because those seconds
s8hWQwFwayo,461039,468960,they turn into minutes  [Music]  and minutes  turn into hours and hours turn into days
s8hWQwFwayo,468960,476160,and days turn in to years  [Music]
s8hWQwFwayo,476879,483919,and so  that second  that second that just went by
s8hWQwFwayo,483919,489280,that counted  and so did that second
s8hWQwFwayo,489280,495840,and so did that one and in those  precious seconds you are either
s8hWQwFwayo,495840,502400,building  or you are decaying you are either
s8hWQwFwayo,502400,508879,gaining ground  [Applause]  or you were losing ground
s8hWQwFwayo,508879,515680,in that second  and in every second
s8hWQwFwayo,518240,524640,every second counts  [Music]
s8hWQwFwayo,524640,531920,so  make  every  second
s8hWQwFwayo,532320,538800,the dream shattered sent home with seven  bucks in my pocket i was like wait no i  gotta play in the nfl eventually those
s8hWQwFwayo,538800,543839,are my big goals that's my dream you  realize that that playing in the nfl was
s8hWQwFwayo,543839,549279,the best thing that never happened  because it got me here so my point is  look you're going to get your ass kicked
s8hWQwFwayo,549279,554480,we're going to get the [ __ ] kicked out  of us you got to get up you got to have  faith that the one thing you wanted to
s8hWQwFwayo,554480,560080,happen  oftentimes is the best thing that never  happened so have faith and just keep
s8hWQwFwayo,560080,565220,that in mind and keep plugging away  [Music]
s8hWQwFwayo,567360,573760,when you crawl out from underneath the  covers every morning and you sit on the  edge of the bed
s8hWQwFwayo,573760,580800,you have a choice before you we're wired  differently we have to set a goal that  if we hit that goal we're guaranteed to
s8hWQwFwayo,580800,588000,make sure all that other stuff in the  middle is going to happen  why three o'clock in the morning why  don't you sleep my appetite my appetite
s8hWQwFwayo,588000,594480,i say e.t i want more i can do more if i  accomplish this without a father what if  i accomplish this with my mind being a
s8hWQwFwayo,594480,599360,teenage mom if i accomplish this as a  high school dropout
s8hWQwFwayo,600880,606959,if i can accomplish these things from  this start now that i'm at this place  knowing what i know now what can i come
s8hWQwFwayo,606959,612079,and i want you to think about that i  want you to think about more than just  what you're going to do financially more
s8hWQwFwayo,612079,618399,than what you're going to do in this  industry in the next three years  right more than that  what's your appetite what are you going
s8hWQwFwayo,618399,624320,to do that will ensure that when the  alarm clock goes off that you're already
s8hWQwFwayo,624320,630399,up 10 20 minutes before your alarm clock  blows up why  do the work
s8hWQwFwayo,631040,638720,do the [ __ ] work  you've heard me say it before no alarm  clock need it my passion wakes me up
s8hWQwFwayo,638720,645160,listen to me no alarm clock need him i  am
s8hWQwFwayo,649600,655600,sometimes the only way to go about doing  the work  is get [ __ ] raw
s8hWQwFwayo,655600,660959,and get [ __ ] intense  get angry and aggressive and make it
s8hWQwFwayo,660959,667680,[ __ ] happen  for yourself  you start today
s8hWQwFwayo,667760,674959,i don't care when your life clock  started ticking you can start [ __ ]  right now today
s8hWQwFwayo,674959,681760,if it's 4 15 a.m in my world  [Music]  you're on the east coast and it's 6 15
s8hWQwFwayo,681760,686959,a.m and you're already up and you're  already dragging ass  by 6 16.
s8hWQwFwayo,686959,693200,you can change your [ __ ] perspective  of the world and of your life
s8hWQwFwayo,693519,701440,my advice  [ __ ] do it  do it  [ __ ] do it dig [ __ ] it deep and get
s8hWQwFwayo,701440,708160,it done  do  the work  of your life  no alarm i haven't used an alarm clock
s8hWQwFwayo,708160,713760,in over 20 years what is it internally  aired i want to be successful i want to
s8hWQwFwayo,713760,720880,execute i want to make all my dreams  become a reality i want to do everything  i said i'm going to do so my appetite
s8hWQwFwayo,720880,726639,increases it gets stronger every year i  want more every i want to do more every
s8hWQwFwayo,726639,734160,i want to help more every year i want to  be bolder i want to be better i want to  be stronger every single year every
s8hWQwFwayo,734160,741360,single year your appetite should go up  you should never get settled you should  never get settled you should never get
s8hWQwFwayo,741360,748800,content every single year  when you get content when you settle
s8hWQwFwayo,748800,755440,somebody's chasing you somebody's coming  from behind and somebody's trying to  take your spot and so every single day
s8hWQwFwayo,755440,762800,when you wake up you gotta set new goals  new benchmarks you got to raise it  higher and higher and higher so you can
s8hWQwFwayo,762800,769120,make your dreams become a reality hunter  watching watson a true hunter is wired  differently
s8hWQwFwayo,769120,776639,he's wired differently  had the same makeup listen to me what  makes a gazelle a gazelle is how he's
s8hWQwFwayo,776639,782560,wired  what makes a lioness okay let me explain  to you when a lion sees a gazelle and
s8hWQwFwayo,782560,789120,the gazelle sees the lion both bees see  each other at the exact same time when  the gazelle sees the lion because of how
s8hWQwFwayo,789120,794000,he's wired he automatically fear takes  over
s8hWQwFwayo,794399,801440,when the lion sees a gazelle  [Music]  he lights up it's showtime
s8hWQwFwayo,801440,809440,the hunt is on this is what i was made  for do the work  [Music]  do the [ __ ] work
s8hWQwFwayo,809440,815320,why do you want to work out  what is your goal
s8hWQwFwayo,816800,821839,the most important thing is that you  have a vision  that you have a goal
s8hWQwFwayo,821839,829839,because without that vision without that  goal again you're drifting around and  you're never going to end up anywhere
s8hWQwFwayo,831279,836480,people don't become successful  just by accident you know i mean maybe
s8hWQwFwayo,836480,841760,the guy  that found gold in california and  started the gold rush but don't count on
s8hWQwFwayo,841760,847279,that that's a one in a lifetime kind of  a situation so you got to really have a
s8hWQwFwayo,847279,853279,specific order to me to have that vision  that i want to be mr universe
s8hWQwFwayo,853279,859600,they don't want to be the greatest  bodybuilder of all time  that was a great vision and that
s8hWQwFwayo,859600,865760,specifically to look like reg park and  to be up there on that stage and to lift  the trophy overhead and to win the
s8hWQwFwayo,865760,871519,championship over and over and over  again so that was a great goal you have  to have a goal now it doesn't have to be
s8hWQwFwayo,871519,878639,that specific goal but it has to have  some goal this is why i always recommend  it to people sit down take your time and
s8hWQwFwayo,878639,884880,start thinking about  why do you want to work out what is your  goal and that can be as crazy as it is
s8hWQwFwayo,884880,890560,it could be you know i want to impress  girls if that's your goal so be it but
s8hWQwFwayo,890560,897279,it motivates you it could be that you're  emulating a certain you know bodybuilder  or a certain football player a certain
s8hWQwFwayo,897279,904560,boxer whatever it is have those pictures  put all over the wall like i did when i  was a kid i put pictures of rich pocket
s8hWQwFwayo,904560,911279,of sunny listen of boxers and of ali and  the power lifters and weightlifters all  over my bedroom
s8hWQwFwayo,911279,917360,you know a wall  so that every day when i go to sleep  every day when i wake up i look at those
s8hWQwFwayo,917360,922959,pictures and they motivate me you need  that motivation and then therefore you  have this kind of
s8hWQwFwayo,922959,928800,imprint in front of you all the time and  you know exactly what you're chasing
s8hWQwFwayo,931040,937839,people always come up to me says why are  you smiling you're working out five  hours a day you're doing the same as the  other guys but the other guys have a
s8hWQwFwayo,937839,943440,sour face they're pissed off that they  have to do another rep or another set or  something i looked forward to i looked
s8hWQwFwayo,943440,950800,forward to another thousand  reps of sit-ups i looked forward to  another 500 pounds of of a leg press or
s8hWQwFwayo,950800,957759,squat i looked forward doing more and  more curls until my arms fall off why  because i knew that every rep that i did
s8hWQwFwayo,957759,965519,in every set that i did and more weights  did i lift it i get one step closer to  turning that vision into reality so i
s8hWQwFwayo,965519,971360,was turned on by that i was excited i  couldn't wait to get to the gym
s8hWQwFwayo,979040,985519,i remembered that when i weighed 245  pounds  and bob raferson the director of stay
s8hWQwFwayo,985519,991839,hungry said to me that i'm interested in  having you come in for reading and work  on your acting and all this because i'm
s8hWQwFwayo,991839,997600,interested in having you in the movie to  start with the jeff bridges and with  sally fields i was delighted about that
s8hWQwFwayo,997600,1004240,i was excited and i started pumping up  more and more and then he said but  i don't want you to weigh more than 210
s8hWQwFwayo,1004240,1009360,pounds  you want me to be in the movie but i'm
s8hWQwFwayo,1009360,1016480,weighing 245 to 46. i see i just won the  olympia i say in 19 which was 1974
s8hWQwFwayo,1016480,1021519,and i was really at my biggest  and but he demanded that and he says
s8hWQwFwayo,1021519,1027120,look it's very  simple on the day  we start shooting
s8hWQwFwayo,1027120,1032798,he says i'm gonna put you on the scale  and if you don't make the 210 you're out
s8hWQwFwayo,1032798,1040000,because i have someone else in mind  and  i worked on it i started visualizing
s8hWQwFwayo,1040000,1045360,myself very clearly as a lean athlete  because that's the only way i could lose
s8hWQwFwayo,1045360,1050640,that weight in the office and get  interested in running more because up  until that point i ran like three miles
s8hWQwFwayo,1050640,1058000,after training or before training or  whatever but now all of a sudden it was  five miles six miles seven miles eight  miles and they even ran mini marathons
s8hWQwFwayo,1058000,1065679,in order to lose the weight and they did  everything with high reps and i was  watching my diet what they eat and all  those kind of things and by the day
s8hWQwFwayo,1065679,1072160,the day before  i remember we went birmingham alabama  the day before i was at the ymca with
s8hWQwFwayo,1072160,1079039,bob rafeson he was swimming and i was  working out and i was running there was  a tractor that was running he says
s8hWQwFwayo,1079039,1084240,let's step on the scale and i stepped on  the scale and they were 209
s8hWQwFwayo,1084240,1091260,so it just shows you what is possible if  you visualize exactly what you want to  look like
s8hWQwFwayo,1091260,1103930,[Music]
s8hWQwFwayo,1108799,1114240,and there was no room for any kind of  like well i can get my act together or  anything like this because there's only
s8hWQwFwayo,1114240,1120480,a certain amount of time but the key  thing again is have the clear vision
s8hWQwFwayo,1120480,1127440,have the specific goal of what you want  to accomplish because then you never go  to the gym and you say the day
s8hWQwFwayo,1127440,1135039,i feel down a little bit  i don't know what it is all about i  don't know my life i'm confused no
s8hWQwFwayo,1135039,1142399,i tell you that i was a perfect example  of someone that was not confident at all
s8hWQwFwayo,1145919,1152000,i mean when i was a kid that was just  like any other kid that had hang-ups and  problems and all this
s8hWQwFwayo,1152000,1157039,but when i joined the weightlifting club  and i won my first
s8hWQwFwayo,1157039,1162320,little trophy  because they did the best clean jerk
s8hWQwFwayo,1162320,1169919,and then we went to another meet and  they won another little trophy  i started feeling like somebody
s8hWQwFwayo,1171360,1177520,but the bottom line is  everyone can use the same method because  i used it in politics i used it in
s8hWQwFwayo,1177520,1183280,making money i used it and everything  that i've done in the movie business  when you have one little victory little
s8hWQwFwayo,1183280,1189280,victories add up and that is what gives  you then ultimately confidence
s8hWQwFwayo,1189280,1197760,well for me the most important thing  always to have a deadline  so when i for instance had a competition
s8hWQwFwayo,1197760,1203520,and let's say the competition was in the  middle of september  and it was now beginning of summer
s8hWQwFwayo,1203520,1209200,so there was no more time to screw  around so there was the time now to get  going on a diet to get going with the
s8hWQwFwayo,1209200,1216320,training to not slack off at all because  there was a deadline there the day of  the competition i had to be in the best
s8hWQwFwayo,1216320,1222480,shape possible and i knew that if i come  to the competition and then lose because
s8hWQwFwayo,1222480,1228720,i did not schedule my training the  proper way or i didn't have the right  frame of mind or i didn't give
s8hWQwFwayo,1228720,1234880,everything  literally worked my butt off i would be  just so angry so i never wanted to be in
s8hWQwFwayo,1234880,1240159,that situation so this is why it was  very important to pick that time and to  say this is when i have to be in top
s8hWQwFwayo,1240159,1245280,shape and then i work towards that but  it's not just with the competition i  mean they're always the same in the
s8hWQwFwayo,1245280,1252559,movie business i mean to me it was  always a big advantage when i said okay  my movie starts on april 1 and i have
s8hWQwFwayo,1252559,1258000,now three months so i have to get really  in great shape  so you pick those times it could also be
s8hWQwFwayo,1258000,1263520,that they have no movie and you have no  mr olympia or no mr america no mr  universe coming up or any of those
s8hWQwFwayo,1263520,1269760,things but you say to yourself  the summer starts in june  i'm gonna go to the beach in june and at
s8hWQwFwayo,1269760,1275760,that time i want to be in great shape so  that creates an urgency that makes you  really start training out and taking it
s8hWQwFwayo,1275760,1281440,seriously because if you don't have a  specific plan then you wander around i  mean you can have as i have told you
s8hWQwFwayo,1281440,1287280,many times the best ship or the best  plane in the world but if you don't have  a specific goal where you want to go and
s8hWQwFwayo,1287280,1293039,when you want to get there you just  drift around and you never get anywhere  so this is why it is important to create
s8hWQwFwayo,1293039,1301280,that urgency and have a specific time  when you want to be in shape well i mean  look everyone has a problem with time
s8hWQwFwayo,1301280,1307039,but  the day is 24 hours  and we sleep six
s8hWQwFwayo,1307039,1313919,now i know there are some out there that  say well whoa whoa i need eight  well i say just sleep a little faster
s8hWQwFwayo,1313919,1319120,because the bottom line is we have six  hours of sleep 24 hours are available so
s8hWQwFwayo,1319120,1324640,if 18 hours now available to your work  your family
s8hWQwFwayo,1324640,1331039,your hobbies  and also to learn something new or to do  something new which could easily be that
s8hWQwFwayo,1331039,1336960,you want to learn a new language  or that you want to read and as a  new year's resolution you have to read a
s8hWQwFwayo,1336960,1343120,book every week or you say i'm going to  go and reshape my body  so you're going to go and take this hour
s8hWQwFwayo,1343120,1349840,out of your schedule and say i'm going  to train an hour every day so this is  for most people a huge challenge but it
s8hWQwFwayo,1349840,1355520,is totally doable i can tell them  because the kind of things that i did  when i came to this country i mean i
s8hWQwFwayo,1355520,1361360,went to school i was working in  construction  i was working out my five hours a day i
s8hWQwFwayo,1361360,1367840,was taking acting classes from eight  o'clock at night to 12 midnight i was  doing all of those things
s8hWQwFwayo,1367840,1375280,i wanted to make sure  that out of the 24 hours of the day that  i don't waste one single hour those
s8hWQwFwayo,1375280,1380880,hours were too precious and so then i  just want to tell people don't give me  this thing i have a difficult time with
s8hWQwFwayo,1380880,1387730,the time and i don't have time for this  and i don't have that you have time you  make the time
s8hWQwFwayo,1387730,1394260,[Music]
s8hWQwFwayo,1394320,1400320,it's another early morning  every morning every day of our lives we
s8hWQwFwayo,1400320,1405600,have choices to make you have a choice  to stay in bed  to say
s8hWQwFwayo,1405600,1412720,forget it i'm not gonna work out today  or  forget it i'm not gonna  work hard today you always have a choice
s8hWQwFwayo,1412720,1417919,every single day of your life  done today
s8hWQwFwayo,1417919,1423520,no one cares what you did  yesterday  you gotta change your dialogue
s8hWQwFwayo,1423520,1430480,there used to be a mentality  doesn't work  what have you done today to better
s8hWQwFwayo,1430480,1437200,yourself  today is another day today is another
s8hWQwFwayo,1437200,1445039,day that i'm faced  with another choice to make  so i'm making the choice again to put my
s8hWQwFwayo,1445039,1453039,shoes on early in the morning  and get acting again  make the right decision
s8hWQwFwayo,1454400,1460159,well some of you read  that i think about when it's hot outside  that it's
s8hWQwFwayo,1460159,1465919,sunny in 70.  well it's [ __ ] not today  it's the reality it's about 90 degrees
s8hWQwFwayo,1465919,1472559,100 humidity but who gives a [ __ ]  that being said  september 3rd
s8hWQwFwayo,1472559,1479600,i had to have my book turned in  and when i realized i'm reading this  book a lot  but i realized
s8hWQwFwayo,1479600,1486240,i wasn't born this [ __ ]  i made them  at the bottom of insecurities fear
s8hWQwFwayo,1486240,1491919,self-doubt lies  was me buried in the [ __ ] fetal  position
s8hWQwFwayo,1491919,1499120,how i got out of that  was recognizing being honest with it  being truthful with it and then fixing
s8hWQwFwayo,1499120,1505440,it we like to live on social media with  lies about ourselves how great we are
