vid,start,end,text
s8hWQwFwayo,3014720,3021359,the struggle is in your mind  this is why we have people who go to bed  tired and wake up tired
s8hWQwFwayo,3021359,3026520,slept eight hours and you wake up steal  time
s8hWQwFwayo,3026640,3032079,the reason you wake up tired is that you  got sleep but you didn't get rest
s8hWQwFwayo,3033040,3039760,your mind has been in turmoil all night  long  you've been wrestling in your sleep have
s8hWQwFwayo,3039760,3046559,you ever woke up and your bed was wet  the bed is all talk just like you've  been in a fight because your mind has
s8hWQwFwayo,3046559,3055040,not rested your body went to sleep but  your mind is still caught up in a  warfare your mind is the battleground
s8hWQwFwayo,3055040,3061119,enemies after your mind  out to where you to death out to stress
s8hWQwFwayo,3061119,3066160,you to death how to break you down how  to make you quit how to make you think
s8hWQwFwayo,3066160,3073520,that you can't get up out to make you  give up on your dream the warfare is in  your mind it's not in your checkbook
s8hWQwFwayo,3073520,3082280,it's not in your savings account it's  not on your job the fight that you got  to fight is in your mind
s8hWQwFwayo,3085359,3091359,and if you whip it in your head you can  whip it in your checkbook you can whip  it on your jaw you can whip it out of
s8hWQwFwayo,3091359,3097640,your children but you got to cry  it out of your head
s8hWQwFwayo,3103280,3110319,you'll see a fight sometimes you see a  fighter  and i mean that fighter is getting his
s8hWQwFwayo,3110319,3116079,ass  whooped  from pillar to post
s8hWQwFwayo,3116079,3123200,he's getting knocked down beat up  eyes black and bloody face beaten
s8hWQwFwayo,3123200,3129838,and everybody  is wondering
s8hWQwFwayo,3136960,3142880,why  don't he just quit
s8hWQwFwayo,3142880,3150160,why don't they just stop  if you really want your life to work
s8hWQwFwayo,3150160,3155680,then you're going to have to give  and get on the goddamn road and stick
s8hWQwFwayo,3155680,3161040,your thumb out and hitchhike start  walking now
s8hWQwFwayo,3162319,3167680,nobody is going to hit  you the fulfillment of the dream you
s8hWQwFwayo,3167680,3172880,have in your mind about a great life you  want to live  don't write me and tell me that in five
s8hWQwFwayo,3172880,3179520,years you picture yourself as a pro  wrestler but when you answer other  portions of the questionnaire you're not
s8hWQwFwayo,3179520,3185280,even in a film yet  this is what's wrong with people today
s8hWQwFwayo,3185280,3195040,this is what's wrong with people today  they think that great lives just fall  out of god if they dream hard enough
s8hWQwFwayo,3195040,3202240,fantasies hard enough and long enough  they keep stroking that that their life  will turn out just the way they dream
s8hWQwFwayo,3202240,3208640,it's a fly you're feeding yourself every  day  alive
s8hWQwFwayo,3208640,3215200,why  would they continue  to fight
s8hWQwFwayo,3215200,3221040,why would they continue to go on  even though
s8hWQwFwayo,3221040,3228640,they are being  beaten  all across the ring the octagon
s8hWQwFwayo,3228640,3233920,or the wrestling map  why would they do that what would make  them
s8hWQwFwayo,3233920,3239760,do that  your life
s8hWQwFwayo,3239760,3245760,will not wait  for you to quit telling yourself lies
s8hWQwFwayo,3245760,3251160,it will go by and your whole life will  be a lie
s8hWQwFwayo,3252240,3257440,and the answer  is simple
s8hWQwFwayo,3258800,3265280,they cannot  help themselves
s8hWQwFwayo,3265280,3273000,because they are  a fighter  and being a fighter it is
s8hWQwFwayo,3273000,3279240,inbred in them  to fight
s8hWQwFwayo,3279520,3288319,no matter  how  difficult or lost the situation may seem
s8hWQwFwayo,3288319,3294480,they cannot  help themselves  it's impossible
s8hWQwFwayo,3294480,3304319,for them to stop fighting  [Music]
s8hWQwFwayo,3304319,3312559,so don't write me and tell me that kind  of [ __ ]  i just don't care  i don't care i want
s8hWQwFwayo,3312559,3318480,with every part of my being  [Music]
s8hWQwFwayo,3318480,3324240,for every human being to succeed  in life
s8hWQwFwayo,3324240,3330000,the dreams that they have  but i don't give a [ __ ] if you fail
s8hWQwFwayo,3330000,3335040,i've never met any human being who  didn't dab it within themselves to
s8hWQwFwayo,3335040,3341040,succeed at life  but i've met plenty who choose to
s8hWQwFwayo,3341040,3346319,and if that's your attitude  that you're too that you choose to
s8hWQwFwayo,3346319,3352079,and you're waiting for somebody to  rescue you  don't waste my time
s8hWQwFwayo,3352079,3360960,all i want to do is give you  some tools  with an intense emphasis
s8hWQwFwayo,3361760,3366880,in  the way that only i can  and try to bury them knock them in your
s8hWQwFwayo,3366880,3371359,head so you get out there and you kill  it at life
s8hWQwFwayo,3374720,3380559,when i'm doing nose dives in the parking  lot
s8hWQwFwayo,3382079,3388880,will i continue to fight  yes  the answer is yes
s8hWQwFwayo,3388880,3396319,when i'm laying in a hospital bed with  tubes and needles sticking out my ass
s8hWQwFwayo,3396319,3402319,where i continue to fight  yes  [Music]  when i'm laying
s8hWQwFwayo,3402319,3411040,down  on this book  will i continue to fight
s8hWQwFwayo,3411040,3418400,but  yes  i can't help myself
s8hWQwFwayo,3418400,3424400,why do you do it i can't help myself i'm  a fighter  [Music]
s8hWQwFwayo,3424400,3429520,and that's what fighters do  until the good lord
s8hWQwFwayo,3429520,3437440,throw the town in on sea peak butcher  i am going to continue to fight until my
s8hWQwFwayo,3437440,3444240,corner man throw the towel in  until my referees stop the fight
s8hWQwFwayo,3444240,3448640,i'm going to continue to fight
s8hWQwFwayo,3455170,3461200,[Music]  a lot of people say i just want to sort  of they kind of they're kind of dabbling
s8hWQwFwayo,3461200,3467920,in the idea of improving themselves and  the real way to do it is you got to  write down what the [ __ ] you want and  then go after it if you decide i'm going
s8hWQwFwayo,3467920,3474000,to get down to bang i'm going to do this  i'm going to run a marathon in less than  five hours i'm gonna you know whatever
s8hWQwFwayo,3474000,3479200,the [ __ ] it is you gotta write that [ __ ]  down and go for it
s8hWQwFwayo,3479920,3486799,well my workout i schedule every sunday  i schedule everything that i'm gonna do  during the week i say i have to do yoga
s8hWQwFwayo,3486799,3493200,two times this week i have to lift  weights three times this week i have to  run twice this week and however i fit
s8hWQwFwayo,3493200,3497440,that in i fed that in but i owe those  things
s8hWQwFwayo,3499359,3505680,and you don't need two and a half hours  you can get a great workout in 40  minutes and that's all you need for the  whole day 100
s8hWQwFwayo,3505680,3512000,you know this idea of time like how much  time did you put in today like you could  work out in a [ __ ] manner for two
s8hWQwFwayo,3512000,3517040,hours and not get nearly as much done as  you can for a half hour hard just
s8hWQwFwayo,3517040,3523119,running so i have to get those things in  the only exceptions are injuries and  sickness
s8hWQwFwayo,3526000,3531440,i do everything that i can to put my  body and my brain in a good place so
s8hWQwFwayo,3531440,3538240,that i'm i'm keeping my engine smooth  i'm changing my oil i'm changing my  spark plugs i'm making sure that it's
s8hWQwFwayo,3538240,3544400,operating i mean it's not going to be  perfect but yeah i know that i've done  my best to keep it working the best that
s8hWQwFwayo,3544400,3551040,it can there's consequences that you pay  to constantly seeking comfort and and  avoiding discomfort and avoiding hard
s8hWQwFwayo,3551040,3556559,work and those consequences are you're  never going to feel self-realized you're  never going to feel like you  accomplished anything you're never going
s8hWQwFwayo,3556559,3562480,to have this feeling of understanding  that  difficulty and struggle and and the
s8hWQwFwayo,3562480,3568160,ability to push through that is a muscle  and you develop that muscle by doing it  and once you do you develop a lot of
s8hWQwFwayo,3568160,3574160,self-satisfaction and you develop peace  of mind and you you understand that you  can overcome obstacles if you don't have
s8hWQwFwayo,3574160,3579280,to overcome obstacles you never know  whether or not you can unless you're  faced with actual adversity you don't
s8hWQwFwayo,3579280,3586160,understand how you're gonna feel and how  you're gonna react when you overcome  that adversity  things that are difficult when you do
s8hWQwFwayo,3586160,3592240,these difficult things you're stressing  your mind or i should start stressing  your mind
s8hWQwFwayo,3592240,3597680,exercising your mind and exercising your  body's ability to manage intense
s8hWQwFwayo,3597680,3603520,situations it's hard it's very difficult  it's very testing and in doing so  you
s8hWQwFwayo,3603520,3610480,you lessen the stress of regular life  the more  stressful situations that i experience
s8hWQwFwayo,3610480,3615839,the more i understand what they are and  the more i can relax
s8hWQwFwayo,3618559,3625200,but it's also like  the a matter of constantly being  exposed to these stressful situations
s8hWQwFwayo,3625200,3631920,where there's not a long break in  between doing stand-up or a long break  in between martial arts training where
s8hWQwFwayo,3631920,3638640,to the point where anxiety can build up  and then once you get into it it's  almost an it's an unusual situation
s8hWQwFwayo,3638640,3644400,instead of an unusual one what i tell  people is the best advice that i i've  ever
s8hWQwFwayo,3644400,3649599,heard  the best advice i ever came up with is  that live your life like you're the hero
s8hWQwFwayo,3649599,3656079,in your movie and right now is when the  [ __ ] movie starts and your life is a  [ __ ] back disaster pretend you are of
s8hWQwFwayo,3656079,3662240,right now you are in the part of the  movie that starts and it shows you as a  [ __ ] loser and just decide not to be
s8hWQwFwayo,3662240,3668839,a loser anymore live your life like  there's a documentary crew following you  around and you are analyzing your
s8hWQwFwayo,3668839,3675440,own do what you would want to do so that  your kids one day would look back at it  and see that documentary and look on it
s8hWQwFwayo,3675440,3681839,with pride like wow my dad was a bad  [ __ ] he really did what he had  to do wow my mom really got her [ __ ]
s8hWQwFwayo,3681839,3688640,together i'd love a success story but  even more than a success story i like a  dude who [ __ ] his life up and then gets
s8hWQwFwayo,3688640,3695040,it back together against dory those are  my favorite stories and the way to do  that you gotta write [ __ ] down you gotta
s8hWQwFwayo,3695040,3701200,think that you are the hero in your own  [ __ ] movie and then you get a sit  down and you gotta write [ __ ] down write
s8hWQwFwayo,3701200,3707920,down what you need to do  truth
s8hWQwFwayo,3707920,3713599,truth is if you work hard you can  achieve your goal  truth it's not a question anymore you
s8hWQwFwayo,3713599,3719920,know what i mean a moment like this  proves it  when you had the question man i'm doing  this cardio in the morning is it worth
s8hWQwFwayo,3719920,3725200,it  man i'm doing these deadlifts today i  feel tired is it gonna be worth it man
s8hWQwFwayo,3725200,3731359,you know what i gotta go to the gym and  train today after i've had an entirely  difficult work day man i've got these  other challenges that are pulling on me
s8hWQwFwayo,3731359,3737039,pulling on my concentration you know  what is this extra effort worth it  fast forward stand here in this room
s8hWQwFwayo,3737039,3744400,forget everything else  forget everything else  forget that there was any sunlight left
s8hWQwFwayo,3744400,3749520,what would you spend today  thinking about
s8hWQwFwayo,3749520,3755520,yourself  or the man that's beside you  or the man that you know you'll get
s8hWQwFwayo,3755520,3761359,everything in your heart for  we get one opportunity in life
s8hWQwFwayo,3761359,3768079,one chance in life  to do whatever you gonna do  to lay your foundation to make whatever
s8hWQwFwayo,3768079,3774079,mom you're gonna make  whatever legacy you gonna leave  leave your legacy
s8hWQwFwayo,3774079,3779839,and it's fine through ever  wins and losses come a dime with us
s8hWQwFwayo,3779839,3787280,but effort  nobody can judge ever  because effort is between you and you
s8hWQwFwayo,3787280,3793599,everything to do with nobody else  so that team that think they ready to  see you
s8hWQwFwayo,3793599,3798799,they think what they see me they saw  with themselves
s8hWQwFwayo,3798799,3804319,because every day is a new day  every moment is a new moment
s8hWQwFwayo,3804319,3811119,so now you got to go out and show them  that i'm a different creature now  that
s8hWQwFwayo,3814230,3817320,[Music]
s8hWQwFwayo,3823920,3828160,so let's do what we do  tonight
s8hWQwFwayo,3829460,3836640,[Music]
s8hWQwFwayo,3836640,3844480,take ownership take extreme ownership  don't make excuses don't blame any other
s8hWQwFwayo,3844480,3853119,person or any other thing  [Music]  get control of your ego
s8hWQwFwayo,3853119,3859090,don't  hide your delicate pride  from the truth
s8hWQwFwayo,3859090,3868319,[Music]  take ownership of everything in your  world the good and the bad
s8hWQwFwayo,3868799,3873839,take ownership of your mistakes take  ownership of your shortfalls take
s8hWQwFwayo,3873839,3879039,ownership of your problems and then take  ownership of the solutions that will get
s8hWQwFwayo,3879039,3882559,those problems solved
s8hWQwFwayo,3885039,3891760,take ownership  of your mission  take ownership of your job
s8hWQwFwayo,3891760,3898799,of your team of your future and take  ownership of your life
s8hWQwFwayo,3899260,3904480,[Music]  and lead
s8hWQwFwayo,3905760,3912240,lead  lead yourself
s8hWQwFwayo,3912240,3917839,and your team  and the people in your life lead them
s8hWQwFwayo,3917839,3923838,all  to victory
s8hWQwFwayo,3926880,3933839,huh  you think it's a game  this is real  this is real life champ
s8hWQwFwayo,3933839,3939520,work hard you get what you gotta get  you don't work hard you get nada
s8hWQwFwayo,3939520,3944559,you get nothing  you gotta work hard  work hard
s8hWQwFwayo,3944559,3952079,you work hard you get what you gotta get  you don't work hard you don't get  nothing you don't get nothing
s8hWQwFwayo,3952079,3957760,nothing  zero  nothing  zero
s8hWQwFwayo,3957760,3965480,nothing  keep working  work hard you get what you gotta get
s8hWQwFwayo,3970559,3979200,i'm going to work i'm going to press  tour i'm going to learn i'm going to do  everything in my power every single day
s8hWQwFwayo,3979200,3985359,i'm going to do everything in my power  to become a victor and not a victim  let's go chad
s8hWQwFwayo,3985359,3993440,let's go chad pain  is temporary  it may last for a minute or an hour or a
s8hWQwFwayo,3993440,4000079,day or even a year  but eventually it will subside
s8hWQwFwayo,4000079,4006880,and something else will take its place  if i quit however it will last forever
s8hWQwFwayo,4006880,4013200,and so every time something gets hard  you quit you call mama i dare you to  take a little pain
s8hWQwFwayo,4013200,4019119,i dare you  i dare you not to go home  somebody said i don't go home i feel bad
s8hWQwFwayo,4019119,4025520,go through it  you ain't gonna die at the end of pain  and success
s8hWQwFwayo,4025520,4034640,you're not gonna die because you feeling  a little pain  be committed beyond circumstance and be
s8hWQwFwayo,4034640,4040400,committed beyond compartmentalization  meaning my greatness and my excellence  can't be compartmentalized to an
s8hWQwFwayo,4040400,4046160,individual to an environment to a  circumstance meaning it is my essence i  show up and i want to impact because
s8hWQwFwayo,4046160,4051520,this is who i am as an individual it's  my essence meaning when the adversity  and the opposition hit like the only
s8hWQwFwayo,4051520,4058000,thing i've been trained to do was to  think positive and look positive i've  reverse engineered it
s8hWQwFwayo,4059440,4067078,the only thing i need is breath in my  body and i'm a flat out going get it
s8hWQwFwayo,4080240,4086000,i know how you feel  you went to bed last night  and all these ideas about you're going
s8hWQwFwayo,4086000,4092960,to get up this morning it's going to be  different things are going to be  different  today you're going to start
s8hWQwFwayo,4092960,4100000,start taking steps towards doing some of  those projects that you know will get  you closer to living that dream life you
s8hWQwFwayo,4100000,4108238,keep playing over and over in your head  different from the practical life that  you've got to get up and meet every day
s8hWQwFwayo,4108238,4115758,to go to the  cubicle-infested world  and work a job just to pay the bills
s8hWQwFwayo,4115758,4121120,put gas in the gas tank to take you  places where you don't really want to go  to be around people you don't enjoy
s8hWQwFwayo,4121120,4126798,being around put groceries in a  refrigerator  groceries that keep you fat and lazy
s8hWQwFwayo,4126798,4132719,keep you away from being healthy and fit  in your life  pay the mortgage on a house that doesn't
s8hWQwFwayo,4132719,4139600,inspire you it's just a nuisance and you  ain't coming home dude what the [ __ ] are  you doing
s8hWQwFwayo,4139679,4145279,and you what makes it even worse  is that you cower
s8hWQwFwayo,4145679,4151758,before you got from the bedroom to the  kitchen  mr ugly was there
s8hWQwFwayo,4151758,4158080,mr resistance  right in your ass  telling you what you were going to do
s8hWQwFwayo,4158080,4165120,different than what you want to do and  what the inner voice inside of you tells  you you need to do with your life
s8hWQwFwayo,4165120,4170480,telling you that those things that you  believe matter and have a purpose in  your life
s8hWQwFwayo,4170480,4176000,really don't that the silly the  superficial the stupid does
s8hWQwFwayo,4176970,4181849,[Music]
s8hWQwFwayo,4182080,4188960,watching some mind-numbing tv  making that list you need to go to the  store next time
s8hWQwFwayo,4188960,4195440,making those phone calls to those people  and just chit chatting and gossiping  about dumbass things
s8hWQwFwayo,4195440,4202080,mr resistance will be there every  morning  morning noon and night and while you
s8hWQwFwayo,4202080,4207840,were sleeping  right in your ass kicking your ass  unless you turn around and you start
s8hWQwFwayo,4207840,4213199,throwing punches  [Music]  you know what my bottom line goal
s8hWQwFwayo,4213199,4219679,with one more your nation is  is to have everybody out there
s8hWQwFwayo,4219679,4227280,realize  that there is something better for you  to do with your time than even being
s8hWQwFwayo,4227280,4232719,here  right now i am mr resistance i'm  distracting you
s8hWQwFwayo,4232719,4240000,from doing the work you need to do  get the [ __ ] out of here and do the work
s8hWQwFwayo,4240000,4247440,of your life  how can a person start something and be
s8hWQwFwayo,4247440,4252480,on fire but the moment something doesn't  go the way that they want it to go  they're not the same in the goods
s8hWQwFwayo,4252480,4258880,i've been on this quest to figure out  how can a person be on fire and say man  this is what i've been put on this earth  to do but the moment a couple of things
s8hWQwFwayo,4258880,4265199,don't come back the way that they  thought it would come back they're not  the same individual and the words that  they once spoke it means nothing to them
s8hWQwFwayo,4265199,4270560,i've been on this quest to figure out  how can a person get on a journey to  dreams goals and aspirations and the
s8hWQwFwayo,4270560,4277280,moment they hit opposition adversity or  challenge it doesn't mean anything to  him anymore
s8hWQwFwayo,4279360,4285600,i have invested more than 20 years of my  life  in the belief in the idea
s8hWQwFwayo,4285600,4291280,of being able to come to the olympia and  to do  an absolute best
s8hWQwFwayo,4291280,4298719,despite whatever the opposition  whatever said  whatever the beliefs are
s8hWQwFwayo,4298719,4304560,on stage off stage whatever the  oppositionary forces have been
s8hWQwFwayo,4305199,4311360,my resolve has been to  respond as a champion and just aim to
s8hWQwFwayo,4311360,4316550,represent the better thought of what  that means to me
s8hWQwFwayo,4316550,4324400,[Music]  you don't get this far  [Music]  you don't get to this point
s8hWQwFwayo,4324400,4328040,and just stop
s8hWQwFwayo,4332239,4336280,doesn't happen like that
s8hWQwFwayo,4342210,4347229,[Music]
s8hWQwFwayo,4347600,4354800,it's always worth it to do your best  and to believe in something and to work  towards the attainment of the goal
s8hWQwFwayo,4354800,4361249,and if it is  [Music]
s8hWQwFwayo,4362000,4367920,that you have to expand your vision  then you climb higher and you do that
s8hWQwFwayo,4367920,4371840,and you don't be afraid to
s8hWQwFwayo,4373040,4378640,it's not possible to be training harder  or more consistently or more dedicated
s8hWQwFwayo,4378640,4384719,than me because i couldn't give a single  ounce more to any aspect of this thing
s8hWQwFwayo,4384719,4390570,that i'm doing so  that makes me feel pretty powerful  pretty confident
s8hWQwFwayo,4390570,4396560,[Music]  truth
s8hWQwFwayo,4396560,4401840,truth is if you work hard you can  achieve your goal  truth it's not a question anymore you
s8hWQwFwayo,4401840,4408159,know what i mean a moment like this  proves it  when you had the question man i'm doing  this cardio in the morning is it worth
s8hWQwFwayo,4408159,4413199,it  man i'm doing these deadlifts today and  i feel tired is it going to be worth it
s8hWQwFwayo,4413199,4419280,man you know what i got to go to the gym  and train today after i've had an  entirely difficult work day man i've got  these other challenges that are pulling
s8hWQwFwayo,4419280,4425280,on me pulling all my concentration you  know what is this extra effort worth it  fast forward stand here in this moment
s8hWQwFwayo,4425280,4431440,what does it feel like it feels like yes  yeah  my heart been popping my body been
s8hWQwFwayo,4431440,4437679,getting hot i thought i was nervous i  said damn man i fumbled twice before the  game i was nervous yeah i look around
s8hWQwFwayo,4437679,4442960,and see something people face at the  same mine that's all i mean they can't  be nervous ain't no way they're nervous  i ain't nervous my heart goes down a
s8hWQwFwayo,4442960,4449360,little bit my heart's going down a  little bit i ain't nervous no more i'm  like all right all right i'm good come  back you come back i'm like damn what is
s8hWQwFwayo,4449360,4455239,this feeling what is this feeling i'm  like am i scared i look away
s8hWQwFwayo,4462400,4465560,i'm ready
s8hWQwFwayo,4474990,4478069,[Music]
s8hWQwFwayo,4480840,4486080,somewhere around the world where's the  game  it's the game that nobody but you think
s8hWQwFwayo,4486080,4492080,you could win  it's one game around the world and  somehow it blessed us in these people
s8hWQwFwayo,4492080,4498960,it's here because on nobody but the  people in this locker room and you got a  [ __ ] chance to bust their head
s8hWQwFwayo,4503030,4506130,[Music]
s8hWQwFwayo,4538130,4551260,[Music]
s8hWQwFwayo,4556480,4558560,you
