vid,start,end,text
s8hWQwFwayo,1505440,1510200,get to the source and fix the problem
s8hWQwFwayo,1512380,1518720,[Music]  i'm a big believer in doing something  that sucks
s8hWQwFwayo,1518720,1524559,every single day of your life  i believe it's a key component
s8hWQwFwayo,1524559,1532080,into strengthening your mind  every day you're trying to find more  of what you're capable of
s8hWQwFwayo,1532080,1537200,and that's the big question  what are you capable of
s8hWQwFwayo,1537200,1542880,stop doing the things  that you do every day  you run every day
s8hWQwFwayo,1542880,1545520,go swim
s8hWQwFwayo,1548880,1555200,flip your towel one tire for a mile  you'll definitely build something so
s8hWQwFwayo,1555200,1560799,i'm all about casting the mind  do something that sucks
s8hWQwFwayo,1565600,1571360,don't get twisted  it's not about flipping tires  i'm in las vegas right now and it's hot
s8hWQwFwayo,1571360,1579039,as [ __ ] it's not about any of that  but what it is about  is a lot of us give total control
s8hWQwFwayo,1579039,1585679,to  life  we don't have any control of it we just  give all control to life
s8hWQwFwayo,1585679,1590960,i do this [ __ ] every morning  to prepare my mind for what life's gonna
s8hWQwFwayo,1590960,1599320,throw at me  a healthy body gives you a healthy mind  that's what it's about
s8hWQwFwayo,1604080,1610400,so i just got back from a long run  and  what i realized for myself and a lot of
s8hWQwFwayo,1610400,1617760,people  is that  life is one big tug of war  between mediocrity
s8hWQwFwayo,1617760,1623840,and trying to find your best self  so  there's tricks to all this crap in life
s8hWQwFwayo,1623840,1630159,life is one big head game  one trick in this situation is so i  didn't want to run so what did i do i
s8hWQwFwayo,1630159,1635600,figured out a couple of things  you have to sometimes  let mediocrity think that you're giving
s8hWQwFwayo,1635600,1642080,into it  so i said you know what instead of going  for a 20 miler so go out for an easy
s8hWQwFwayo,1642080,1647600,six or seven  what that did in my brain was it said  okay mediocrity thought it won
s8hWQwFwayo,1647600,1654799,so let loose a little bit  and let go of that oh this is gonna suck  this could be okay it's not too bad
s8hWQwFwayo,1654799,1660799,the second should get to mile two guess  what happens  greatness pulls mediocrity into [ __ ]
s8hWQwFwayo,1660799,1665120,mud  get out there and get after it
s8hWQwFwayo,1666640,1673279,you wanna go in about the right mindset  the right gear  in combat you wear body armor
s8hWQwFwayo,1673279,1678880,but what we do wrong is we want to  strengthen our minds  you got to strengthen your mind
s8hWQwFwayo,1678880,1685279,take control over that  so then when you get out in the real  world and they [ __ ] you up you got
s8hWQwFwayo,1685279,1693200,protection  so i'm about 15 miles from home  and i i often talk about taking souls
s8hWQwFwayo,1693200,1698320,this morning  this person i usually train alone
s8hWQwFwayo,1698320,1703919,this person wanted to run with me  and i said fine we'll run 15.
s8hWQwFwayo,1703919,1711520,this morning comes  there's storms coming in this way  and the person calls and said hey
s8hWQwFwayo,1711520,1717360,why don't we do it tomorrow  taking souls is when i told him  [ __ ]
s8hWQwFwayo,1717360,1722559,i'm gonna run 15 today  and i'll run with you again tomorrow
s8hWQwFwayo,1722559,1728559,that's what taking souls is about  don't worry about the elements and  what's going on
s8hWQwFwayo,1728559,1731919,you gotta get out there and get it
s8hWQwFwayo,1734320,1740640,he wasn't the only one  that felt about taking the day off  because the storm is coming in right now
s8hWQwFwayo,1740640,1748399,and there's not a soul out here but me  [Music]
s8hWQwFwayo,1748399,1754320,if you want to get better  do the [ __ ]  that no one else
s8hWQwFwayo,1754320,1760159,wants to do  do the [ __ ] that no one else is even  thinking about doing
s8hWQwFwayo,1760640,1766080,at the end of the day hard work  may not be enough you still may fail
s8hWQwFwayo,1766080,1769960,just stay at it go ahead
s8hWQwFwayo,1777950,1781729,[Music]
s8hWQwFwayo,1783760,1790320,the more things you can do  get outside that zone  that zone is that zone makes you feel
s8hWQwFwayo,1790320,1795840,good  the stronger your mind's gonna get
s8hWQwFwayo,1795919,1801039,it starts getting used to doing [ __ ]  like this  it's not fun
s8hWQwFwayo,1801039,1807679,my mind's used to it  when that alarm clock goes off there's  at least 50 of the time where you just
s8hWQwFwayo,1807679,1814559,that that soft little pillow is just  caressing your head and you want to stay  there  and it takes discipline to go nope i'm
s8hWQwFwayo,1814559,1821520,gonna get up out of this bed i'm gonna  do what i'm supposed to do we are  average probably about five hours of  sleep work hard sleep
s8hWQwFwayo,1821520,1828000,tomorrow morning when that alarm goes  off and you start feeling all the  excuses that come in and that bed is
s8hWQwFwayo,1828000,1833120,cozy i know what you're saying i love my  bed too  and you then go five four three two one
s8hWQwFwayo,1833120,1840640,and you get up that discipline that you  have at that moment you win that fight  that's a big victory and then that that
s8hWQwFwayo,1840640,1846960,that pattern will carry out throughout  the day because once you're up well now  that i'm up i might as well go work out  because i'm already up and i i feel good
s8hWQwFwayo,1846960,1853279,that i got up out of bed and i won that  battle let me go win another battle i'm  gonna go get it done and that discipline  carries on throughout the day so now you
s8hWQwFwayo,1853279,1859519,take that and you you expand that out  over a week in a month and you end up  with more discipline and it starts with
s8hWQwFwayo,1859519,1866640,that simple act of getting up and  getting out of bed in the morning i work  out twice before everyone wakes up so it
s8hWQwFwayo,1866640,1872640,started off four o'clock in the morning  where i'd start and start with my cardio  then i'd have breakfast and then i would  go to the gym and then i go to work i
s8hWQwFwayo,1872640,1879279,wake up at 4 30 in the morning because  no one else is awake yet so that gives  me the opportunity to do things that i  need to get done
s8hWQwFwayo,1879279,1885039,kind of selfishly for myself and the big  one in that category is working out and  it doesn't feel good at 4 30 when you
s8hWQwFwayo,1885039,1890640,get up but by the time seven o'clock  rolls around and you've already worked  out you've already gotten some some work
s8hWQwFwayo,1890640,1896159,done and you've got some time to say  goodbye to your kids before they go to  school it's infinitely better than
s8hWQwFwayo,1896159,1901919,sleeping in until 6 45 and you get out  of bed and now you missed your kids  going to school or or whatever you
s8hWQwFwayo,1901919,1907679,you're not prepared for the day it's  it's awful wake up at the same time  every day and if you pick that time and
s8hWQwFwayo,1907679,1914240,you start waking up at the same time  every day that's very good for you it  doesn't have to be 4 30 it could be 6  30. it could be 7 i don't know what your
s8hWQwFwayo,1914240,1919600,personal schedule is find out a time  pick it set it stick to it
s8hWQwFwayo,1919600,1926480,look everyone has a problem with time  but  the day is 24 hours
s8hWQwFwayo,1926480,1932960,and we sleep six  now i know there are some out there that  say whoa whoa whoa i need eight
s8hWQwFwayo,1932960,1938320,but i say just sleep a little faster  because the bottom line is we have six
s8hWQwFwayo,1938320,1944880,hours of sleep 24 hours are available so  if 18 hours now available do your work
s8hWQwFwayo,1944880,1952240,your family  your hobbies and also to learn something  new or to do something new which could
s8hWQwFwayo,1952240,1958399,easily be that you want to learn a new  language to read a book every week or  you say i'm going to go and reshape my
s8hWQwFwayo,1958399,1964960,body  so you're going to go and take this hour  out of your schedule and say i'm going  to train an hour every day
s8hWQwFwayo,1964960,1970880,so this is for most people a huge  challenge but it is totally doable i can  tell them because the kind of things
s8hWQwFwayo,1970880,1977200,that i did when i came to this country i  mean i went to school i was working in  construction
s8hWQwFwayo,1977200,1984159,i was working out my five hours a day i  was taking acting classes from 8 o'clock  at night to 12 midnight i was doing all
s8hWQwFwayo,1984159,1990559,of those things  i wanted to make sure  that out of the 24 hours of the day that
s8hWQwFwayo,1990559,1997360,i don't waste one single hour those  hours were too precious and so then i  just want to tell people don't give me
s8hWQwFwayo,1997360,2002960,this thing i have a difficult time with  the time and i don't have time for this  and i have that you have time you make
s8hWQwFwayo,2002960,2008720,the time sometimes even if you're the  most highly motivated person in the  world that grind starts to beat you down
s8hWQwFwayo,2008720,2014960,a little bit and that's when you have to  stop looking at the short-term thing  because that's not that's not getting  you to get it done and you got to look
s8hWQwFwayo,2014960,2021679,okay what is the long-term goal that i'm  looking at what am i really trying to  get done in the long term and you say oh  you know what i'm actually waking up
s8hWQwFwayo,2021679,2027120,today early so i can be ahead of the  curve so i can sell more of these  widgets or whatever
s8hWQwFwayo,2027120,2032799,so that i can buy a house  and you know what today matters today  matters this decision that i'm making
s8hWQwFwayo,2032799,2038960,right now is that first step it's me  taking one stroke swimming in the right  direction heading towards the shore and
s8hWQwFwayo,2038960,2044080,if i don't take this i'm not making any  progress i've been struggling struggling  struggling we still had all the same
s8hWQwFwayo,2044080,2049760,problems  i stole a lien on the house still facing  bankruptcy still fighting like crazy i
s8hWQwFwayo,2049760,2055200,was still unemployed the next morning  the alarm goes off and um
s8hWQwFwayo,2055200,2061280,i pretended nasa was there  it's the stupidest story i literally  went five four three two one i counted
s8hWQwFwayo,2061280,2068240,out loud and then i stood up  and i i'll never forget standing there  and for the first time in three months
s8hWQwFwayo,2068240,2074800,i had beaten my habit  of hitting the snooze button  i couldn't believe it and i thought wait
s8hWQwFwayo,2074800,2080079,a minute  counting backwards is the dumbest thing  i've ever heard in my entire life well
s8hWQwFwayo,2080079,2085118,the next morning i used it again and it  worked the next morning i used it again  and it worked the next morning i used it
s8hWQwFwayo,2085118,2092560,again and it worked and then i started  to notice something really interesting  there were moments all day long
s8hWQwFwayo,2092560,2098720,all day long  just like that five second moment in bed
s8hWQwFwayo,2098720,2107040,where i knew knowledge what i should do  [Music]  and if i didn't move within five seconds
s8hWQwFwayo,2107040,2113839,my brain would step in and talk me out  of it  every human being has a five second  window might even be shorter
s8hWQwFwayo,2113839,2119359,for you  you have about a five second window in  which you can move from
s8hWQwFwayo,2119359,2125680,idea to action before your brain kicks  into full gear  and sabotages
s8hWQwFwayo,2125680,2130720,any change in behavior  because remember your brain is wired to  stop you from doing things that are
s8hWQwFwayo,2130720,2136880,uncomfortable or uncertain or scary  it's your job to learn how to move from
s8hWQwFwayo,2136880,2142800,those ideas that could change everything  into acting on them in the smallest
s8hWQwFwayo,2142800,2148960,moment when i was in high school i uh  early on about 16 years old i decided to
s8hWQwFwayo,2148960,2154000,become president united states because i  thought how can i contribute the most to  society and i went to a seminar by a man
s8hWQwFwayo,2154000,2159760,named jim rohn he's still a seminar  speaker  i took a week's pay i was working 40 a  week as a janitor
s8hWQwFwayo,2159760,2166240,and um it was 35 for the evening seminar  so it was big decision i listened to him  speak and i came out so inspired because
s8hWQwFwayo,2166240,2172079,most of what he said i already believed  now as an authority figure saying you  really can be this way
s8hWQwFwayo,2172079,2179359,why pay the price  why work this hard  why go this far
s8hWQwFwayo,2179359,2185680,why try to learn this much  why try to do it all
s8hWQwFwayo,2185680,2192079,why try to see it all  why try to have it all
s8hWQwFwayo,2192079,2197520,why do it  why learn it why study why put yourself  out
s8hWQwFwayo,2197520,2201838,why try to take on this much  responsibility
s8hWQwFwayo,2202800,2208400,why develop yourself to the full  why try to become all that you can
s8hWQwFwayo,2208400,2215599,possibly become  why try to earn as much as you can earn  share as much as you can share
s8hWQwFwayo,2215599,2222320,develop every skill you possibly can see  every human you possibly can  go to every class you possibly can touch
s8hWQwFwayo,2222320,2227520,everybody you possibly can  why do that much why go that far
s8hWQwFwayo,2227520,2234640,why share that much  [Music]  why give that much away  why try to see everything why try to do
s8hWQwFwayo,2234640,2240839,everything  why try to become everything  that's a good question
s8hWQwFwayo,2240839,2247359,why and you're the only one personally  that can answer that question for  yourself you've got to have your own
s8hWQwFwayo,2247359,2257838,list of why  work on your list of whys
s8hWQwFwayo,2259760,2265310,if the why is powerful the how is easy
s8hWQwFwayo,2265310,2270720,[Music]  if you want to think that enough to go  out and fight for it to work day and
s8hWQwFwayo,2270720,2277839,night for it to give up your time your  peace and your sleep for it if all that  you dream and scheme is about it and
s8hWQwFwayo,2277839,2284560,life seems useless and worthless without  it and if you gladly sweat for it fred  fought and planned for and lose all your
s8hWQwFwayo,2284560,2290560,terror of the opposition for it and if  you simply go after that thing that you  want with all of your capacity
s8hWQwFwayo,2290560,2295680,strengthen sagacity faith hope and  confidence and stern pertinacity if
s8hWQwFwayo,2295680,2301680,neither cold poverty famisha adult  sickness or pain of body and brain can  keep you away from the thing that you
s8hWQwFwayo,2301680,2307280,want  dogged and grim you besiege and beset it  with the help of god you'll get it but
s8hWQwFwayo,2307280,2313040,if the why isn't strong  if your goals aren't powerful
s8hWQwFwayo,2313040,2319119,if the vision isn't clear the old  prophet said without a vision we die  without a vision we perish without a
s8hWQwFwayo,2319119,2325040,dream or nothing  and because  he spoke how people live their lives as
s8hWQwFwayo,2325040,2333200,a result of the story they believe about  themselves he interrupted the story that  i believed about myself
s8hWQwFwayo,2335359,2341160,work on your list of why
s8hWQwFwayo,2342079,2348160,make no small plans  for they have no magic to stir men's
s8hWQwFwayo,2348160,2355040,blood  make large plans  for they do have magic
s8hWQwFwayo,2355040,2361520,to stir man's blood  impossible is not a fact it's an opinion
s8hWQwFwayo,2361520,2367040,it's your opinion then they'll say no  science shows and i see and how many  times the science shows something's  impossible now science shows it's
s8hWQwFwayo,2367040,2373839,possible things are impossible until  somebody does it  divorce the story of your limitation and
s8hWQwFwayo,2373839,2379039,marry the truth of your unlimited  capacity then the whole game changes
s8hWQwFwayo,2379920,2385520,success  is born out of luck  it's awareness of mind that takes
s8hWQwFwayo,2385520,2389280,advantage of that opportunity
s8hWQwFwayo,2391760,2397760,you will all be confronted with  opportunity  you must take advantage of it
s8hWQwFwayo,2397760,2403599,because if you don't take advantage of  your opportunity you'll never realize  your dreams
s8hWQwFwayo,2403920,2411440,whether you want them or not is the  irrelevance you don't know that until  you achieve it
s8hWQwFwayo,2411440,2416720,but most people have strategies  available or they could get them or you  could create them but the problem is you
s8hWQwFwayo,2416720,2422720,got a story  and your story is why it isn't working  and the story is i've tried everything
s8hWQwFwayo,2422720,2428880,if you tried everything you'd be fit  you tried everything you'd be profitable
s8hWQwFwayo,2428880,2434659,if you tried everything you'd be there  but people said  [Music]
s8hWQwFwayo,2435520,2441599,i was born into accounts to stay  getting a job at the hotel st george was
s8hWQwFwayo,2441599,2448240,my passport to escape the world that i  was born into to start a new world
s8hWQwFwayo,2451119,2458560,do i have what it takes  i said to myself yes
s8hWQwFwayo,2459599,2464839,so i started pushing and pushing and  pushing and pushing  self
s8hWQwFwayo,2464839,2468720,belief at whatever cost
s8hWQwFwayo,2472480,2478640,you can do more than this if i had to  walk ahead and walk it just became just  a process of grinding and grinding and
s8hWQwFwayo,2478640,2485200,grinding a good word for it  it's not even a good word for it  and just just going further and further
s8hWQwFwayo,2485200,2491839,and then when i got through running i go  to the bike i go to the pool if i got  tired somewhere my legs are tired i go
s8hWQwFwayo,2491839,2497680,to the gym and i develop this crazy  workout where i was doing volume
s8hWQwFwayo,2497680,2502960,things don't happen overnight  you have to make the emotional personal
s8hWQwFwayo,2502960,2505960,investment
s8hWQwFwayo,2508000,2511359,to make your dreams come true
s8hWQwFwayo,2516480,2522800,never throw in the towel if i threw in  the towel  pick it up  never give in
s8hWQwFwayo,2522800,2526640,never ever ever give in
s8hWQwFwayo,2529520,2537359,[Music]  and when you're young  it's very easy to give in
s8hWQwFwayo,2537359,2543680,to walk away  it really is  so whatever you want to do in your life
s8hWQwFwayo,2543680,2549119,don't overwork it don't overthink it you  realize your dream  trust me
s8hWQwFwayo,2549119,2554400,the question isn't can you handle the  situation
s8hWQwFwayo,2554400,2558559,the question is can you handle your mind
s8hWQwFwayo,2560960,2566400,can you manage the thoughts and the  emotions that are trying to poison your
s8hWQwFwayo,2566400,2572000,progress  forget managing the situation
s8hWQwFwayo,2572319,2575960,manage your mind
s8hWQwFwayo,2583040,2592359,no matter whose fault it is that  something is broken if it's your  responsibility to fix it
s8hWQwFwayo,2592560,2597760,it's not somebody's fault if their  father was an abusive alcoholic but it's
s8hWQwFwayo,2597760,2603440,for damn sure their responsibility to  figure out how they're going to deal  with those traumas and try to make a
s8hWQwFwayo,2603440,2609839,life out of it  it's not your fault if your partner
s8hWQwFwayo,2609839,2615200,cheated and ruined your marriage but it  is for damn sure your responsibility to
s8hWQwFwayo,2615200,2620880,figure out how to take that pain and how  to overcome that and build a happy life
s8hWQwFwayo,2620880,2625530,for yourself  [Music]
s8hWQwFwayo,2627040,2632880,fault and responsibility do not go  together it sucks but they don't when
s8hWQwFwayo,2632880,2640160,something is somebody's fault we want  them to suffer we want them punished we  want them to to pay we want it to be
s8hWQwFwayo,2640160,2646400,their responsibility to fix it but  that's that's not how it works  especially when it's your heart
s8hWQwFwayo,2646400,2652400,your heart your life your happiness is  your responsibility and your
s8hWQwFwayo,2652400,2656240,responsibility alone
s8hWQwFwayo,2658079,2663838,fear  is not  real
s8hWQwFwayo,2664210,2669699,[Music]  [Applause]
s8hWQwFwayo,2671440,2678640,the only place that fear can exist is in  our thoughts of the future
s8hWQwFwayo,2680640,2686800,it is a product of our imagination  causing us to fear things that do not at
s8hWQwFwayo,2686800,2695760,present and may not ever exist  [Music]
s8hWQwFwayo,2695760,2703599,as long as we're pointing the finger  and  and stuck in whose fault something is
s8hWQwFwayo,2703599,2710960,we're jammed and trapped into victim  mode when you're in victim mode you are  stuck in suffering the road to power is
s8hWQwFwayo,2710960,2717200,in taking responsibility  your heart  your life your happiness is your
s8hWQwFwayo,2717200,2722640,responsibility  and your responsibility alone
s8hWQwFwayo,2724640,2731839,we always talk about hunger and how you  always want to outwork your competition  regardless of how successful you may be  lucky enough to be you want to be hungry
s8hWQwFwayo,2731839,2735760,if you know what it's like to be hungry  you'll never be full
s8hWQwFwayo,2740079,2746400,it's one thing to be hungry it's another  thing when you're starving for greatness  and starving for success
s8hWQwFwayo,2746400,2751839,what if  a lot of times i'll be in a 200 mile run
s8hWQwFwayo,2751839,2758240,or something like that  and i'm all jacked up  body's broken mind's broken spirit's
s8hWQwFwayo,2758240,2765200,broken  i started to say what if i can pull this  off  [Music]
s8hWQwFwayo,2765200,2770720,greatness it's in my dna i know what  it's like to operate every single day  regardless of the success that i've been
s8hWQwFwayo,2770720,2775760,a lucky son of a [ __ ] to achieve i  operate every day as if i'm starving
s8hWQwFwayo,2775760,2782720,it's the what if  i can pull off a [ __ ] miracle  what if i can become someone that no one
s8hWQwFwayo,2782720,2788400,thinks i can be and just that just me  talking about that  i have the hair growing up on my off
s8hWQwFwayo,2788400,2794560,because it makes me just like  what if  when you're trying to get better in life
s8hWQwFwayo,2794560,2800880,the grind is forever there is no end  there is no countdown  as long as you're breathing
s8hWQwFwayo,2800880,2808560,you gotta keep trying to get better  you've never arrived in life
s8hWQwFwayo,2808560,2811880,stay hard
s8hWQwFwayo,2816960,2822640,a lot of people say that nothing's  impossible  [ __ ]  i even said that nothing's impossible
s8hWQwFwayo,2822640,2828079,several times in my life  i lied there's a lot of things that are  impossible for you to do
s8hWQwFwayo,2828079,2835280,what happens is when we come across  something that's very hard  and we try it once or maybe twice
s8hWQwFwayo,2835280,2841440,we then say we're done we can't do it  anymore  before you say something's impossible
s8hWQwFwayo,2841440,2847440,do it and do it and do it to a level  that people think that you might be  [ __ ] crazy
s8hWQwFwayo,2847440,2852720,until you say it's impossible  people want to know where i find my
s8hWQwFwayo,2852720,2857760,strength at where i get my strength i  get from a lot of places but right now  this morning
s8hWQwFwayo,2857760,2863359,i'm getting it from  without a [ __ ] that's up  there's not a car there's another person
s8hWQwFwayo,2863359,2870240,everybody's in your bed sleep dreading  that it's a monday haters monday  and i'm loving it i'm loving that where
s8hWQwFwayo,2870240,2875440,everybody's getting weaker i'm getting  stronger  it's not about the running the swimming
s8hWQwFwayo,2875440,2882480,to push up to sit-ups that's about what  those things do for your mentality you  don't get better on the daggone couch
s8hWQwFwayo,2882480,2888749,you get better by coming out here and  getting the [ __ ]  [Music]
s8hWQwFwayo,2888880,2895359,it's one thing to be hungry it's another  thing when you're starving for greatness  and starving for success
s8hWQwFwayo,2895359,2900720,the people in the world become weaker  people  it's by capping your brain it's by
s8hWQwFwayo,2900720,2908000,putting this kind of garbage in it about  not attacking what you're not good at  it's about putting a cap on managing
s8hWQwFwayo,2908000,2914720,your expectations if i lived that way if  i had any kind of thought process like  managing expectations
s8hWQwFwayo,2914720,2920960,i would be a 400 pound man by now  working some job that made
s8hWQwFwayo,2920960,2926640,no money and i would not never know  my capabilities i would never have
s8hWQwFwayo,2926640,2932860,become a navy seal i needed to raise a  school all these things i did
s8hWQwFwayo,2932860,2940480,[Music]  the mine is a medieval [ __ ]
s8hWQwFwayo,2940480,2944880,it's constantly fighting against you
s8hWQwFwayo,2947359,2953440,it's the only thing  in the history of the [ __ ] world that  shows up on time
s8hWQwFwayo,2953440,2959280,every time  [Music]  it has a tactical advantage over you it
s8hWQwFwayo,2959280,2965760,knows your fears it knows your  insecurities  it knows everything about you might be  the only thing
s8hWQwFwayo,2965760,2970839,in that world that knows all about you
s8hWQwFwayo,2974000,2979520,you gotta know about it  [Music]
s8hWQwFwayo,2979520,2985760,it's gonna show up when you don't want  to show up  it's gonna show up at the worst time
s8hWQwFwayo,2985760,2992880,possible when you wanna be successful  it's gonna say take the easy road  take the easy way out
s8hWQwFwayo,2992880,2999640,you gotta learn  your brain like your brain has learned  you
s8hWQwFwayo,3001119,3006400,the mind is the battleground  it is the place where the greatest  conflict is
s8hWQwFwayo,3006400,3013838,there are more people in this room  having trouble in their mind than there  are people having trouble in their  finances
