vid,start,end,text
styN6QavqVU,957440,959680,was like eating glue this is like eating
styN6QavqVU,959680,962399,glue if it like is half dried if you let
styN6QavqVU,962399,963600,it sit in your mouth for too long your
styN6QavqVU,963600,965360,mouth is going to like stay shut you
styN6QavqVU,965360,966639,know it'll never open again you know
styN6QavqVU,966639,967759,what i will say though the taste is
styN6QavqVU,967759,970720,better this has just made me realize
styN6QavqVU,970720,973040,how i don't i guess like the flavor of
styN6QavqVU,973040,974720,pringles
styN6QavqVU,974720,976399,i don't know i i thought i liked
styN6QavqVU,976399,977519,pringles
styN6QavqVU,977519,979519,but seeing the flavor of pringles
styN6QavqVU,979519,983279,distilled into this
styN6QavqVU,983279,986160,it just has this cardboardy flavor to it
styN6QavqVU,986160,987839,it's not actually that great obviously
styN6QavqVU,987839,990000,that doesn't work outside of chip form
styN6QavqVU,990000,992160,and i don't know why it doesn't work
styN6QavqVU,992160,994160,pause right there cause i do remember
styN6QavqVU,994160,995519,what we mentioned earlier pringles
styN6QavqVU,995519,997440,having less than 50 potato in them so
styN6QavqVU,997440,999120,here i'm just getting a lot more flavor
styN6QavqVU,999120,1001279,from the additives and oils it's a fiber
styN6QavqVU,1001279,1004000,and starchy flavor not an actual potato
styN6QavqVU,1004000,1005600,flavor traditional potato flakes by
styN6QavqVU,1005600,1007199,contrast don't have this issue because
styN6QavqVU,1007199,1009040,they've already been cooked that process
styN6QavqVU,1009040,1010560,is breaking down a lot of the natural
styN6QavqVU,1010560,1012079,starches that are in the potato and
styN6QavqVU,1012079,1014000,there isn't additional cornstarch or
styN6QavqVU,1014000,1015600,wheat starch that's been mixed in
styN6QavqVU,1015600,1017600,resulting in less gluey textures and
styN6QavqVU,1017600,1019600,less nasty flavors which is something
styN6QavqVU,1019600,1021360,that we were about to learn with test
styN6QavqVU,1021360,1023519,number two the lay's potato chips let's
styN6QavqVU,1023519,1025760,eat a lay's potato chip in mushy form
styN6QavqVU,1025760,1028079,shall we what's better than a potato
styN6QavqVU,1028079,1030558,chip a mushy potato chip you know what
styN6QavqVU,1030558,1034480,this tastes like potatoes or graton
styN6QavqVU,1034480,1037480,hmm
styN6QavqVU,1038319,1039199,this is
styN6QavqVU,1039199,1041038,decent kind of good
styN6QavqVU,1041038,1042400,oh
styN6QavqVU,1042400,1044000,we did it
styN6QavqVU,1044000,1045918,it's not terrible
styN6QavqVU,1045918,1048160,i don't want to throw up
styN6QavqVU,1048160,1050320,it's actually really good this is
styN6QavqVU,1050320,1053679,rotten potatoes legitimately
styN6QavqVU,1053679,1055520,this is one of those drier moments where
styN6QavqVU,1055520,1057840,i'm shocked this looks disgusting it
styN6QavqVU,1057840,1059919,looks terrible stirring it over there
styN6QavqVU,1059919,1061760,stephanie was like this is
styN6QavqVU,1061760,1063600,not gonna work this is absolutely worse
styN6QavqVU,1063600,1064960,than the pringles
styN6QavqVU,1064960,1066480,this is my fourth bite of this
styN6QavqVU,1066480,1069120,but the fact that maybe that's a mistake
styN6QavqVU,1069120,1070559,it's salty
styN6QavqVU,1070559,1072960,it's potato more importantly it's potato
styN6QavqVU,1072960,1074720,and i think that's what the pringles are
styN6QavqVU,1074720,1076960,missing is the potato flavor they taste
styN6QavqVU,1076960,1079679,like cardboard whereas this tastes like
styN6QavqVU,1079679,1081919,a potato see what i tell you shocking
styN6QavqVU,1081919,1083520,results but going back and looking at
styN6QavqVU,1083520,1084960,the science of how these chips are made
styN6QavqVU,1084960,1087360,it absolutely makes complete sense this
styN6QavqVU,1087360,1089360,is actually a success
styN6QavqVU,1089360,1092880,it's buttery it's salty it's potatoey
styN6QavqVU,1092880,1095039,this is actually lovely if you had no
styN6QavqVU,1095039,1097360,potatoes in your house and you for some
styN6QavqVU,1097360,1099840,reason needed a like actual hot served
styN6QavqVU,1099840,1101360,potato dish
styN6QavqVU,1101360,1103039,on your table and you had no other
styN6QavqVU,1103039,1106400,options this is completely passable wow
styN6QavqVU,1106400,1109039,it works hallelujah one of them works
styN6QavqVU,1109039,1110960,and finally round number three the
styN6QavqVU,1110960,1112720,cheddar cheese pringles would a bit of
styN6QavqVU,1112720,1114320,extra flavor powder help them fare
styN6QavqVU,1114320,1116500,better than the originals
styN6QavqVU,1116500,1119710,[Music]
styN6QavqVU,1120240,1121440,the foot
styN6QavqVU,1121440,1123840,huh
styN6QavqVU,1124080,1125679,the flavor's better
styN6QavqVU,1125679,1128080,sort of
styN6QavqVU,1128720,1131120,you know what it tastes like a cheeto
styN6QavqVU,1131120,1132460,you know what
styN6QavqVU,1132460,1133840,[Music]
styN6QavqVU,1133840,1136000,i don't mind this i'm surprised that
styN6QavqVU,1136000,1137039,you're actually having as strong of a
styN6QavqVU,1137039,1139039,reaction as you do the texture is still
styN6QavqVU,1139039,1141520,terrible i i disagree the flavor here is
styN6QavqVU,1141520,1144799,garbage the flavor here because of the
styN6QavqVU,1144799,1147520,the cheddar cheese powder has actually
styN6QavqVU,1147520,1151120,made it into a palatable food item that
styN6QavqVU,1151120,1152799,i can put in my stomach here's where we
styN6QavqVU,1152799,1154880,may be divided this doesn't work for me
styN6QavqVU,1154880,1157360,as a cheese flavor and then i still get
styN6QavqVU,1157360,1159600,a lot of glop okay so we have one
styN6QavqVU,1159600,1162320,definite fail definite fail one definite
styN6QavqVU,1162320,1165679,win yep and then one house divided this
styN6QavqVU,1165679,1168480,was shockingly intense and also very
styN6QavqVU,1168480,1170080,surprising from a result standpoint i
styN6QavqVU,1170080,1171600,was hopeful that one of them would turn
styN6QavqVU,1171600,1174480,out i did not expect it to be any of
styN6QavqVU,1174480,1175520,these guys
styN6QavqVU,1175520,1177200,i thought for sure we would make a
styN6QavqVU,1177200,1179120,winner of the pringles and we certainly
styN6QavqVU,1179120,1180960,did not if you take one thing away from
styN6QavqVU,1180960,1182480,this episode
styN6QavqVU,1182480,1185280,tick tock youtube whoever do not use
styN6QavqVU,1185280,1187520,pringles to make mashed potatoes it
styN6QavqVU,1187520,1189679,optimizes nothing you will regret it
styN6QavqVU,1189679,1191280,that being said if you want to
styN6QavqVU,1191280,1193679,experiment with making lays or flavored
styN6QavqVU,1193679,1196320,pringles into mashed potatoes yeah
styN6QavqVU,1196320,1197679,there's some validity there but you know
styN6QavqVU,1197679,1199360,what at the end of the day i'm still
styN6QavqVU,1199360,1201039,going to the flake for my thanksgiving
styN6QavqVU,1201039,1203840,dinner but hey that's
styN6QavqVU,1203840,1207200,just a theory all food theory bon
styN6QavqVU,1207200,1209120,appetit
styN6QavqVU,1209120,1210880,the flake is so good
styN6QavqVU,1210880,1212400,you're so good and you know what else is
styN6QavqVU,1212400,1214000,so good this other episode of food
styN6QavqVU,1214000,1215200,theory where we tried to make the
styN6QavqVU,1215200,1217039,world's crunchiest potato chip let me
styN6QavqVU,1217039,1218640,say the potatoes in this episode wound
styN6QavqVU,1218640,1220640,up being much more delicious or if
styN6QavqVU,1220640,1221919,you're looking at ways to compliment
styN6QavqVU,1221919,1222960,your mashed potatoes with some
styN6QavqVU,1222960,1224960,thanksgiving turkey check out the secret
styN6QavqVU,1224960,1226880,hack to making the perfect thanksgiving
styN6QavqVU,1226880,1228559,dinner spoiler alert you're gonna have
styN6QavqVU,1228559,1230720,to perform cpr on a turkey both of those
styN6QavqVU,1230720,1232720,links are available on screen right now
styN6QavqVU,1232720,1234240,so give them a watch if you haven't seen
styN6QavqVU,1234240,1236000,them and as always i'll see you next
styN6QavqVU,1236000,1238320,week
