vid,start,end,text
WL54IOUrUg0,1427520,1432710,delicious and quite refreshing on such a  warm day
WL54IOUrUg0,1432710,1468010,[Music]
WL54IOUrUg0,1468799,1474960,and to cap off the night we ended up  just staying at the airbnb which we  really just wanted to soak up every
WL54IOUrUg0,1474960,1480320,moment we could at the airbnb since it  was so glorious and we had our dip pool
WL54IOUrUg0,1480320,1487520,to enjoy and the balcony  there are so many places to hang out and  just soak it all in so we watched the
WL54IOUrUg0,1487520,1493039,sunset in the pool and really enjoyed it  thoroughly it was so beautiful it was so
WL54IOUrUg0,1493039,1499679,peaceful even though there's people all  around you  it just felt so so calm it smelled like
WL54IOUrUg0,1499679,1505120,incense and salt and there were people  laughing people getting engaged and
WL54IOUrUg0,1505120,1512000,people enjoying beautiful meals you  could hear the forks clicking and live  music it was truly just one of those
WL54IOUrUg0,1512000,1517760,nights that i hope to remember for the  rest of my life because  it was absolutely a dream come true and
WL54IOUrUg0,1517760,1551339,just something so heavenly  [Music]
WL54IOUrUg0,1553620,1561480,[Music]
WL54IOUrUg0,1562980,1566130,[Applause]
WL54IOUrUg0,1568000,1571000,okay
WL54IOUrUg0,1574140,1600880,[Music]
WL54IOUrUg0,1600880,1606240,the castle of ia is an incredibly  popular sunset viewing location so if
WL54IOUrUg0,1606240,1613600,you go at sunset just expect it to be  crowded because it's definitely the  place to be but we ended up going in the
WL54IOUrUg0,1613600,1620400,morning so it was quite calm and  peaceful and the castle of ia was  actually built by the venetians and much
WL54IOUrUg0,1620400,1626640,like many of the other villages and  homes on the island the inhabitants  built their houses close to each other
WL54IOUrUg0,1626640,1633120,in hard to reach places among the cliffs  because during the middle ages there  were so many pirates that would come
WL54IOUrUg0,1633120,1638399,after these greek islands and try to  steal and they really just use this
WL54IOUrUg0,1638399,1645399,landscape as a way to protect and keep  an eye out on the water
WL54IOUrUg0,1655120,1661520,good morning from the glorious santorini  it is truly heavenly here
WL54IOUrUg0,1661520,1666880,yeah and yeah yes it's so glorious but
WL54IOUrUg0,1666880,1672000,unfortunately it's our last day in  santorini but fortunately we are heading
WL54IOUrUg0,1672000,1677120,over to milos later today  so we're going to catch a ferry in a few
WL54IOUrUg0,1677120,1682159,hours like six hours actually so we have  quite a quite a bit of time still and
WL54IOUrUg0,1682159,1688080,we're going to go to thura which is the  capital of santorini and explore  shop
WL54IOUrUg0,1688080,1694399,eat all of that good stuff and then  we'll catch our ferry but  what is your
WL54IOUrUg0,1694399,1699919,thought of santorini it's great it's  great it's great it's an understatement
WL54IOUrUg0,1699919,1706559,everywhere it's pretty  yeah seriously everywhere you from  landscapes and
WL54IOUrUg0,1706559,1712080,yeah it's like every spot of the island  is a little different which is really  neat would you say it's um worth it to
WL54IOUrUg0,1712080,1717760,rent a car  yeah yeah i think it was worth it i mean  you definitely could take buses or
WL54IOUrUg0,1717760,1723679,transportation but if you want to see  all different parts of the island having  a car is super convenient and parking is
WL54IOUrUg0,1723679,1729279,fairly easy even in popular villages  like es so yeah i was impressed like by
WL54IOUrUg0,1729279,1736480,that it's not like that back in the  states you have to pay to park  everywhere and it's hard to park yeah  it's different yeah so that was a good
WL54IOUrUg0,1736480,1743440,surprise and it's just absolutely  glorious and we're so thankful for our  time here so i'll show you what we get
WL54IOUrUg0,1743440,1752689,up to in thira  [Music]
WL54IOUrUg0,1754480,1761679,on our way to thera we stopped in the  town of immoral vaguely which isn't far  from ia at all and it is home to the
WL54IOUrUg0,1761679,1766799,skaros rock which is such an incredible  sight to see highly recommend visiting
WL54IOUrUg0,1766799,1773279,if you have the chance it is this  incredible rock formation and it was  actually considered the most important
WL54IOUrUg0,1773279,1778480,of santorini's five castle fortresses  because the rock was actually inhabited
WL54IOUrUg0,1778480,1786559,in medieval times and due to the unique  landscape of the fortress it offered a  lot more protection from the pirates so
WL54IOUrUg0,1786559,1792880,there's another fun fact but you can  actually hike along the rock and this  whole town was also very beautiful and
WL54IOUrUg0,1792880,1799120,would be a wonderful place to stay and  for our last meal in santorini we went  to lucky's slovakias in thera and this
WL54IOUrUg0,1799120,1806320,was a great place you can dine in but it  is quite small so we just grabbed and go  and walked around a bit and also got a
WL54IOUrUg0,1806320,1813679,juice we were able to enjoy some food  and take in the sights before heading to  the port our ferry was quite delayed
WL54IOUrUg0,1813679,1820559,unfortunately as you can see the water  was quite choppy this day so there was  some weather delays so we just hung out
WL54IOUrUg0,1820559,1826320,at the port for a while which  there isn't a whole lot to do at this  port i mean since we had such long
WL54IOUrUg0,1826320,1832399,delays we could have  taken a taxi back to town but we were  already here and we weren't sure what
WL54IOUrUg0,1832399,1839520,the situation would be so we kind of  just hung out at the port for quite a  bit and got some ice cream and
WL54IOUrUg0,1839520,1845600,just tried to make the most of it but it  definitely was a long travel day to get  to milos but i'm excited to show you
WL54IOUrUg0,1845600,1857050,what we got up to there  [Music]
WL54IOUrUg0,1859840,1865360,[Music]  and that's going to be it for the  santorini vlog but thank you so much for
WL54IOUrUg0,1865360,1871039,following along  the view oh yeah i'll show you one last  time i know that's right in front of us
WL54IOUrUg0,1871039,1876320,yeah it's so gorgeous catch up with you  later once we're in milos for part two
WL54IOUrUg0,1876320,1882930,of our greece trip  [Music]
