vid,start,end,text
WxyzEcfoJJ8,3490640,3495680,somebody was like always smells like the  one hotel and i'm like how because layla  beau
WxyzEcfoJJ8,3495680,3502079,sometimes 26 is they're saying  so it's giving very much a dupe for that
WxyzEcfoJJ8,3502079,3507599,like it literally smells the same it's  in the um  i forgot which one it was but they only
WxyzEcfoJJ8,3507599,3513200,have three perfumes at the store i know  it's not just bee one
WxyzEcfoJJ8,3513200,3518720,but anywho i'm trying out some perfume  oils  so i was just like let me just get the
WxyzEcfoJJ8,3518720,3526559,starter kit so it just came with all the  scents that they have  wait yeah
WxyzEcfoJJ8,3527440,3533280,uh the colors i really don't care for  this scent i don't know maybe it will  smell different
WxyzEcfoJJ8,3533280,3540960,um  as a oil but i sprayed it in a store i  didn't like it it wasn't giving but
WxyzEcfoJJ8,3540960,3545559,wait let me see which one smells like
WxyzEcfoJJ8,3546880,3552880,um  it's giving out lady  it's giving very much chantel
WxyzEcfoJJ8,3552880,3558400,chanel number five  okay this is the one this is the the one
WxyzEcfoJJ8,3558400,3565119,that smells like sounds 26  this one right here
WxyzEcfoJJ8,3565119,3570960,so i'm definitely going to be using this  when i get out the shower and stuff
WxyzEcfoJJ8,3570960,3580680,um  this one is getting all like oh my god
WxyzEcfoJJ8,3587200,3592400,this one i said i didn't care for but  um
WxyzEcfoJJ8,3595119,3601839,oh what does this one smell like  this smells like something
WxyzEcfoJJ8,3603440,3609680,something that i already have  oh this smells like
WxyzEcfoJJ8,3609680,3615280,this smells like the bias  the bias candle my smell is
WxyzEcfoJJ8,3615280,3620960,let me see how i'm doing my  my comparisons are i know myself being  spot on
WxyzEcfoJJ8,3620960,3624599,so spell this
WxyzEcfoJJ8,3632160,3635119,and then smell this
WxyzEcfoJJ8,3637200,3644160,the same no  no smell it again i think you got all  sorted already
WxyzEcfoJJ8,3644400,3649520,girl smell it again  no  i can't eat this
WxyzEcfoJJ8,3649520,3658079,turkey bacon  ma  smell this swear smell it
WxyzEcfoJJ8,3658319,3663920,oh yeah that smell like that yeah i know  i know don't play with me
WxyzEcfoJJ8,3663920,3669200,[Music]  so  i like this thing
WxyzEcfoJJ8,3669200,3675200,it's like a fresh  saying i really like i only have a house  in honestly
WxyzEcfoJJ8,3675200,3681280,um but yeah this smells just like it the  bias candle so if you like that
WxyzEcfoJJ8,3681280,3686400,it smells just like it yeah so but this  one
WxyzEcfoJJ8,3686400,3693119,is the layla  26 for sure
WxyzEcfoJJ8,3693760,3698798,smells just like it's i don't need her  to
WxyzEcfoJJ8,3704640,3709920,but yeah that's all what i got from  sephora  and then  [Music]
WxyzEcfoJJ8,3709920,3716240,i don't know if i'm going to show y'all  um  my order from essence because
WxyzEcfoJJ8,3716240,3721839,i want to do a  summer  collective haul
WxyzEcfoJJ8,3721839,3728389,we got some oddly  [Music]
WxyzEcfoJJ8,3735700,3741070,[Music]  [Applause]
WxyzEcfoJJ8,3744090,3747280,[Music]
WxyzEcfoJJ8,3751920,3758640,okay i'm just waiting to say all that  stuff but  yeah that's it for now
WxyzEcfoJJ8,3758720,3764318,but yeah i'm just about to put my  stuff up and chill
WxyzEcfoJJ8,3766839,3772640,um and this is the mayonnaise mama likes  to use if y'all are looking for  alternatives
WxyzEcfoJJ8,3772640,3778240,the mayo avocado oil tastes really good  that's what i'm getting
WxyzEcfoJJ8,3778240,3786440,lunch break  i mean dinner break  it's five o'clock
WxyzEcfoJJ8,3788140,3806890,[Music]
