vid,start,end,text
wYK_EK6zH_g,0,3620,qwerty Qolbi ya
wYK_EK6zH_g,10849,17460,Khoirul giveaway tak boleh Happy  birthday ya
wYK_EK6zH_g,17460,27460,[Musik]
wYK_EK6zH_g,29970,35360,Hi  [Musik]
wYK_EK6zH_g,35360,41120,Ho detakpos BC Decker Jun PC
wYK_EK6zH_g,42739,48289,ht125 main tenis
wYK_EK6zH_g,56030,60890,altmp3  kotor
wYK_EK6zH_g,61189,69020,karena Jono  tidak ada hashtag tim
wYK_EK6zH_g,75770,80600,juri  juri
wYK_EK6zH_g,87680,95729,American Idol dapet agama tinghui imev  shakhrukh Khan
wYK_EK6zH_g,96299,101829,itu di pada manggaleh kitab usaha Fatih  pop kamu cuma kamu by Nanti Matanya itu
wYK_EK6zH_g,101829,108939,Kiai ekor magnesium keris akan cari  magnae pada alankar 5 kunam.net ek
wYK_EK6zH_g,108939,113310,Lifebuoy goblok sebahagian besarnya
wYK_EK6zH_g,114270,121798,sama-sama agar  Prime Time
wYK_EK6zH_g,125750,134119,[Musik]
wYK_EK6zH_g,136769,142590,Because  Indonesia
wYK_EK6zH_g,142590,147640,semoga mbtg mentimun jam salesman at the
wYK_EK6zH_g,147640,155260,mouth bengkuang tipe-x Naufal gratis  babin it&t tinggal babi tak rein.net
wYK_EK6zH_g,155260,161120,kontemporer Agan alise jurnal tipe-tipe  khai ada didata hari Teuku Desti
wYK_EK6zH_g,161120,168340,tiba-tiba  meowstrem.com  film the [ __ ]
wYK_EK6zH_g,170410,173500,out the
wYK_EK6zH_g,181480,186550,ke paman kalian bye bye bye bye
wYK_EK6zH_g,186550,189629,[Musik]
wYK_EK6zH_g,209970,215100,aja ya pengen aja sih kok daun itu  equigen awetannya indah tapi rumah Sule
wYK_EK6zH_g,215100,224010,volume Sydney valaknya tidak datang di  ini Solo intense aneh ini kiri mesin ini
wYK_EK6zH_g,224010,227010,adalah
wYK_EK6zH_g,231920,237620,hai hai  hai hai
wYK_EK6zH_g,237620,245209,wujud atau naik haji traceparts semata  Ada Sule berproduksi zaman dikarenakan  Widodo sebagai metode 05 produk film
wYK_EK6zH_g,245209,252069,Korea lightening ostomi prediksi  internet polimer adisi contoh internet
wYK_EK6zH_g,263260,266260,loobeta.com
wYK_EK6zH_g,285930,288970,[Musik]
wYK_EK6zH_g,296320,302820,tipe-tipe reage lebih menkokesra  wahanabet perlu ketahui dikonfirmasi  review genimate semoga jangan khawatir
wYK_EK6zH_g,302820,307370,oleh hampir sama dengan
wYK_EK6zH_g,309590,317750,kondisi  [Tepuk tangan]
wYK_EK6zH_g,317750,324020,beautychain wortel sampai  semoga
wYK_EK6zH_g,324020,330950,cepat karena kabinet Patcher  versi
wYK_EK6zH_g,335420,338420,On
wYK_EK6zH_g,342140,349400,the country of the sultan of hope  One Day
wYK_EK6zH_g,349400,354740,[Tepuk tangan]
wYK_EK6zH_g,355490,364020,[Musik]  tidak butuh waktu  menetap walaupun
wYK_EK6zH_g,366130,374349,[Musik]  sedang juga nih Opo maneh mah ngerawat
wYK_EK6zH_g,374349,378719,sampaikan kemarin kemacetan Hanya Jadi
wYK_EK6zH_g,380009,386520,lebih lebih lebih lebih baik diketahui  om
wYK_EK6zH_g,386879,393040,om  [Musik]
wYK_EK6zH_g,398069,403509,tiket lebih  tua dengan mencoba energi Latino gila
wYK_EK6zH_g,403509,408729,mekaran hanitya sekarang lele dewani  longgar atau multi kemarin takaran Ayu
wYK_EK6zH_g,408729,415900,sama agama thp-1 Honda Wave dulu Perum  Alfian apabila tidak Sun edit-me ada  negatif menjadi rekanan megang Bella
wYK_EK6zH_g,415900,422449,demi Magana da ne ba Habib parwa kleduk  ini menyusup beathard Indonesia adalah
wYK_EK6zH_g,422449,428380,sama Gempita Geby mati model yang  itu-itu
wYK_EK6zH_g,428380,434780,dan  jangan diketik aja pak cuma setengah
wYK_EK6zH_g,434780,440000,hari itu pasti Tibet Dirga kalikesik  mrtt indah-online.com kali Perdana sama
wYK_EK6zH_g,440000,447100,gamelan wujudkan sama gado2 jangan  tiba-tiba Andre picessa kau bicara  dipercaya memang
wYK_EK6zH_g,452169,455800,kirim-kirim mikrometode
wYK_EK6zH_g,459280,465580,internet-start.net Indonesia dan  internal connect remedy sempurna
wYK_EK6zH_g,465580,469240,intense Happy birthday semoga
wYK_EK6zH_g,472690,480470,kalian bye bye  sakeco kirim hop karena review ryachudu
wYK_EK6zH_g,480470,487770,clear.co.id di balik setiap  partner Ahmad turun Outbreak antara
wYK_EK6zH_g,487770,495450,cobalah pidato amandemen bisa  mereka suka akar ini nih kirim pesan ha
wYK_EK6zH_g,495450,500000,token petak Liquid kelima ada situ ke  rumah
wYK_EK6zH_g,500610,509000,Hai ini Enggak baitunnajah nih  Hai with various file name is
wYK_EK6zH_g,509000,516250,Hai mengatur ini KWH terindah tinggalkan  temukan benar reptil enak awakne qwerty  Enggak gua kita mikirin nih polinema.com
wYK_EK6zH_g,516250,522039,a71new totalnya tuh  itu
wYK_EK6zH_g,522039,529870,dangdut edan prediksi Padepokan dikit  kenek-kenek
wYK_EK6zH_g,533920,539890,produk lebay diinjak-injak Power TV  internet coba ROM
wYK_EK6zH_g,540640,546220,philips.co.id produk-produk bodyslide  reclays.id
wYK_EK6zH_g,546280,552340,juga Badly affected by notable di  internet kering Setiadi l
wYK_EK6zH_g,552340,558950,lele  polisi-polisi by Shreya dulu richfister
wYK_EK6zH_g,558950,568160,Dragon  atau paling melek politik sederhananya  like Desire l bisa Om dibunuh bye bye
wYK_EK6zH_g,568160,577760,dimiliki oleh bikin nhac mereka label  Made by memprediksi dewasa go antibodi  seliter persiapan hapsah b i l d siapkan
wYK_EK6zH_g,580580,585930,Astagfirullahaladzim peminat bugma harga  menagerie PT Putra like dipilih itu Nike
wYK_EK6zH_g,585930,592920,dri-fit Anda betah tubuhnya turut  editing internasional Kenongo karya CCTV  camera berkemih khan multiguna Oh iya
wYK_EK6zH_g,592920,598220,memang ayam kali ini sorogenen bye-bye  Bunny
wYK_EK6zH_g,600770,608370,Sweety  kudabaru.com  polisi usai kepala karena gini mesin
wYK_EK6zH_g,608370,615470,absen Yulia gosong jadi-jadian  karena warnanya memang betul-betul
wYK_EK6zH_g,615470,620970,yiro kudabaja tiba-tiba berubah Accent  kamar comment Ema Indah dakwah
wYK_EK6zH_g,620970,627420,Khoirunnisa welcome itulah Rendy  timeless ayam kuda gini pelunggut  pendiam itu harganya Sabina tiba-tiba
wYK_EK6zH_g,627420,634090,otak seakan Labuno atau Sai Baba  bimasena kado tukarlah Benoa Jenderal  gatal Berkatilah sudah eh kau berat
wYK_EK6zH_g,634090,639640,neonatorum sedih aki NS saat ini karena  sulit gawe conarch serta benda depak Ine
wYK_EK6zH_g,639640,644820,Cornetto Unicorn mata karena Benoa bye
wYK_EK6zH_g,649050,652649,bye bye bye
wYK_EK6zH_g,659850,664990,di bye bye bye sama sekali mendelem cbt
wYK_EK6zH_g,664990,671890,gini-gini Medieval thawaf tidak inlays  Anda ayam kece saat ini ada video  lapasau kematian seperti tinta amat
wYK_EK6zH_g,671890,679030,sidwell aneh nih Bagaimana sama hadroh  al kyomi dan lagi latihan Oke awas  pasukan save binatang Peristiwa karyanya
wYK_EK6zH_g,679030,685050,mendaki awakne desain awal [ __ ] nadi  Subhana di karet Souqy Ahmad barkati
wYK_EK6zH_g,685050,690260,Aprilia k Ghar beri nama queeneta  magadar wordpress.org ke saya aruh oleh
wYK_EK6zH_g,690260,697340,Amazon hati-hati aku dawilah tiba time  when i Hai utama total pernah karywan  empire.xxi tunggu sudah 6B lainnya goyah
wYK_EK6zH_g,697340,704780,karena tak mungkin bawahannya susu  Acrylic sticker karena peluang komedi  gini ke Antimo tuekang ini Pak indah
wYK_EK6zH_g,704780,711880,hingga Ebiet G ya pasal patagonia berat  badan elektrik  B4
wYK_EK6zH_g,712120,719170,sejati.pt  lebih dari Bollywood
wYK_EK6zH_g,719560,723100,Anda vigeland
wYK_EK6zH_g,730150,734290,km Rupiah and watch
wYK_EK6zH_g,739270,743270,online HD
wYK_EK6zH_g,749010,754200,juga diesel Drake Miley demi matte ke  Yes Anda hatama yapimu lebih-lebih
wYK_EK6zH_g,754200,761960,reggae atau mati meraih cita-cita  anaknya nelpon ane bakal umroh nagaz  Tutut si rendah ymax idelino
wYK_EK6zH_g,762680,769580,begitu nego swellnet Somebody needs you  channel pilihan terbaik
wYK_EK6zH_g,770000,777230,Khair mohon  jangan Nike
wYK_EK6zH_g,778340,785750,dri-fit keloid Hei komisi MB adaband  ledakan
wYK_EK6zH_g,785750,793310,langkah  terlebih Bah gastu.net
wYK_EK6zH_g,799340,809020,dini di website Academy muka  ini bagi kita untuk
wYK_EK6zH_g,809020,817230,blackheart Magenta berpeluang kita  tyneside saat itu Nagato teteh-teteh  Taman Zainal
wYK_EK6zH_g,823770,826770,dikit-dikit
wYK_EK6zH_g,836220,843540,aduh  aduh aduh
wYK_EK6zH_g,869000,875450,nubie apaan sih durhaka pamane video  yang menepati Nambuhan Sutini Happy  adukan oleh gua pilihan hadapan Hakim
wYK_EK6zH_g,875450,883490,kamaniya nuabi mudah lama dan cd-rw  Sukamulya buah bilineata paha ke sana  ada reaksi SMA me aduh adem labi jangan
wYK_EK6zH_g,883490,889220,Cortez lebih GMA apa ingin dimakan lebih  b&t Diana rupiah asyik retina Eke
wYK_EK6zH_g,889220,896330,dikunjungi bila sdki sate nggak enak  temui Lady Bee Happy yang akan lebih ini  dipermanis rupiah dicetak spawned
wYK_EK6zH_g,896330,899770,permanently simak lebih ini
wYK_EK6zH_g,903160,907660,dan wirakusuma ane pake tu nangkapandak
wYK_EK6zH_g,909430,913540,waskita.co.id suling
wYK_EK6zH_g,916360,919360,26@gmail.com
wYK_EK6zH_g,922870,929010,Indonesia  agar bisa piye
wYK_EK6zH_g,929010,934410,tipe permainan Rp10 keledai jinak kena  Desember Bagaimanakah perilaku pasti aku
wYK_EK6zH_g,934410,939050,nenteng indah  tapi
wYK_EK6zH_g,950570,955010,Aduh jenis
wYK_EK6zH_g,958600,962399,[Musik]
wYK_EK6zH_g,965620,973830,[Musik]  mp3davichi  tank mean 2 keren nih Sisilia petinju
wYK_EK6zH_g,973830,978930,lain menilai KPU Karawang Gempita  kenderaan solicited proposal ticketing
wYK_EK6zH_g,978930,984930,eqina gente dan usah tapi Wage  diakreditasi oleh Wahana Farin cikin
wYK_EK6zH_g,984930,990880,turut consolidated proposal like kenari  menggeledah aneh wynne binal sih tadikan
wYK_EK6zH_g,990880,999330,Mama nonton Academy kabinawa mukena  choirina utama metal nowaddme.net
wYK_EK6zH_g,999330,1002450,minus WeChat
wYK_EK6zH_g,1006350,1013519,rodabet88 karena mulu rata-rata lagi ini  Fany Paulus Copy
wYK_EK6zH_g,1021320,1026670,KTP ingin dengar adicipta aneh ada tak  pabrik enak dipandang karena Gem itu
wYK_EK6zH_g,1026670,1032280,Muhammad kurogane Time by lebih-lebih  ketika richart miradi Dedi Anda b ini
wYK_EK6zH_g,1032280,1039150,sapi metal disita kwetiau pilano rumah  kalah me kasih kapal palenewen udah  saropati depannya pilih lebih tapi benar
wYK_EK6zH_g,1039150,1044400,karena melihat n-count  HP ini bidang Abah rumah nabi my channel
wYK_EK6zH_g,1044400,1049750,jadi Pak Redi atau Baki modern lebay nah  Academy ini rata country lautan milik
wYK_EK6zH_g,1049750,1054790,Nah itu ulang eh lo rata Angrybird laut  teman-teman naik ke klub Indonesia
wYK_EK6zH_g,1054790,1057720,jangan
wYK_EK6zH_g,1061560,1069270,lupa  di-like atlet dan oleh wakil banget  Emang tiru-tiru
wYK_EK6zH_g,1072180,1082140,helm-helm ondu  subsidi subsidi download kicau
wYK_EK6zH_g,1082140,1087300,burung cucak ijo sama
wYK_EK6zH_g,1094200,1097200,merah
wYK_EK6zH_g,1100290,1105540,disapa lebat Khan Deva
wYK_EK6zH_g,1107640,1114640,lagi mau Widya bonde sih diraih Tebet  Saharjo Gateway paksa kronovi guys
wYK_EK6zH_g,1114640,1123550,negara-negara nettimoto membalap  new ekekekeke
wYK_EK6zH_g,1125890,1132410,monosek Indonesia gimana sikap  Ashley dibawa game Ayla birukan net net
wYK_EK6zH_g,1132410,1138860,ono gunane dentsmile gunakan dan it  yiro ya Amira Depag Sumsel under our
wYK_EK6zH_g,1138860,1143559,patented anda kemarin matte kita masa
wYK_EK6zH_g,1144970,1150160,mi5  manusia
wYK_EK6zH_g,1158440,1166360,nah Nike ada bangku tepat karburator  Keihin itu
wYK_EK6zH_g,1166690,1176930,hitam tebal chatib haknya nahkoda dengan  ridha dan kerap richart MB fallen
wYK_EK6zH_g,1176930,1179930,angel
wYK_EK6zH_g,1185060,1192510,mama  [Musik]  janter Muller modal sama ngetik regine
wYK_EK6zH_g,1192510,1200090,benda sabet Awas Khairani  amazon.com matematika demo account
wYK_EK6zH_g,1200090,1203090,number
wYK_EK6zH_g,1216260,1221510,departemen-departemen  Om
wYK_EK6zH_g,1221900,1227400,tiba-tiba ada pelet tunai lebih jangan  lupa tinggal Jaber aja pak camat hajatan
wYK_EK6zH_g,1227400,1233319,tidak miliar medali sama geprek the  cable bracket ia pilih badai diuji  tainted membuat kalau emang udah sama
wYK_EK6zH_g,1233319,1239199,ketika genetik bersama tetapi  sewaktu-waktu faktor Saya memakai tiba  akan dengan sampai mana baik yang
wYK_EK6zH_g,1239199,1244949,menutupi saja nanti petir eh Papa saetik  bakau tiru calcimagd sedangkan
wYK_EK6zH_g,1244949,1252309,Kyuhyun lupa karena Desa Amerika lu  jangan tipe-tipe reopened Stone  banget.id setengah kuda pada mana biava
wYK_EK6zH_g,1252309,1262769,renagas itu Amerika American Idol  pilihan saya kemerdekaan dari modal  usaha manusia Dollar atau pakai high
wYK_EK6zH_g,1262769,1266459,mulu perdana situ
wYK_EK6zH_g,1269669,1274959,care@bni-life.co.id  mereka duduk karena bye klikidol insya
wYK_EK6zH_g,1274959,1281759,Robert capron karena magneson hankali  Firza dramatorrent.com asing
wYK_EK6zH_g,1281759,1289010,bebas  Raja mulailah karena itu sangat Oke  dikasih laba di Amerika webite berapa
wYK_EK6zH_g,1289010,1295490,Dino Amerika menutupi resep itu dipahami  oleh setiap meletakkan cermin seekor  Ma'had ada beberapa lama TV di home
wYK_EK6zH_g,1295490,1301720,sweet home balik setiap biogas kirim  kremes Palestine
wYK_EK6zH_g,1301720,1307660,shopee.co.th dibekali berbagai produk  rusak
wYK_EK6zH_g,1309100,1314810,Juli How many dengan merah Teteh Lanka  bime tipe-tipe Yulia Metrik ton Hotel is
wYK_EK6zH_g,1314810,1319300,The House of Credit now benedek in
wYK_EK6zH_g,1322870,1330880,the secret amat lewat gowin  pohon bakal
wYK_EK6zH_g,1334420,1339700,accumulated shakhrukh Khan  bakal
wYK_EK6zH_g,1343690,1348710,korban-korban itu Bagas itu karr the  Goblin method will comeback Epic akresi
wYK_EK6zH_g,1348710,1354870,Eko ada aduh bumi preman ya tapi ledekan  mati kena kelihatannya telah terbayar  hati ini begitu mypoker pasien bisa
wYK_EK6zH_g,1354870,1362340,hilangkan Nose terkandung iPhone juga  Powershot  sx260 Halloween theme beda-beda bumi
wYK_EK6zH_g,1362340,1367250,lebih  moga-moga
wYK_EK6zH_g,1372260,1375980,dan legenda
wYK_EK6zH_g,1383000,1389310,metode naik ke Samudra tembakau Aku  buruak regseeker anasun emang gak ada
wYK_EK6zH_g,1389310,1395960,agar dapat memprediksi editable Tonight  Hai
wYK_EK6zH_g,1396200,1402450,kesehatan polodua kau dulu gojan apa  Demi apa are going Adam Abraham  apartemen Kia Sephia Polresta
wYK_EK6zH_g,1402450,1408240,indonesia-thailand taman tidak berdebat  posted by www sekali Emang a1la itulah
wYK_EK6zH_g,1408240,1414990,marai marai satu nama ratu Nightmare pas  ada Power Factor nge-rap Anda agen ane  eh meledak Network Dila khusus Karena
wYK_EK6zH_g,1414990,1420169,Mati wrapping op het dilewati another  yang engkau ada goyah the
wYK_EK6zH_g,1420169,1426860,metre Oh tidak Julia  Julia
wYK_EK6zH_g,1428539,1434840,Julia  sama
wYK_EK6zH_g,1435470,1441559,gemes.co.id distrik salah ke Gramedia ya  detik rupiah
wYK_EK6zH_g,1441559,1450600,depan pos ubi mukena agar kg  Departemen ada waktu lebih Emang
wYK_EK6zH_g,1450600,1456640,Departemen production xml T6 lebih  perdana paint Kalau kawan sago yang saya
wYK_EK6zH_g,1456640,1461850,mendaftar sial lagi mau kalau menjadikan  dulu Skeleton
wYK_EK6zH_g,1463530,1470040,mp3audy Kamila  ini  bersamaan
wYK_EK6zH_g,1476610,1484510,atau malam hitam sangat  pertama para pengikut kelima ada kursi
wYK_EK6zH_g,1484510,1487860,Karma matang Swedish itu Kernel
wYK_EK6zH_g,1503390,1506439,[Musik]
wYK_EK6zH_g,1513920,1519770,di  mana remap ular ujannya bales aktif ya
wYK_EK6zH_g,1519770,1525500,protein inti anu ada nih sama Gem adalah  Banyumasan Banten Taman kopkami tua HW
wYK_EK6zH_g,1525500,1533320,pas ug.ac.id perkose setiap node Bubble  with hidup usaha PT MMC folden Hatta
wYK_EK6zH_g,1533320,1539750,kopkami dua hawei Jali Perkasa gelap eh  mata kami dua klub resmi Cream home
wYK_EK6zH_g,1539750,1546410,yasete Taman PAUD ketika CVT boleh diisi  tiga The Lucky paket UN attimo Monas itu
wYK_EK6zH_g,1546410,1555159,Chan lebih Edwin barat diperkosa  situkkir bye  Hai Mami rekatif karena dia tepat
wYK_EK6zH_g,1555159,1560750,c4mille umat saya gano namun tak beliau  melihat taehyun e-marketing unitnya
wYK_EK6zH_g,1560750,1566630,pasti Mama B zaman dekat telepon Kalau  keluar medium ngatino tipu hama ya
wYK_EK6zH_g,1566630,1571720,hematoma The packing Iwa melu-melu  memanggil walet Muhammad khairuna
wYK_EK6zH_g,1571720,1579549,meiyume  mama tunggu ya Pak ganti meutuwah
wYK_EK6zH_g,1579549,1585559,ekspedisi ia dan devisa proposal of  English mendadak by The government of
wYK_EK6zH_g,1585559,1592659,India on the basis of the by the  discussion by  khai
wYK_EK6zH_g,1593140,1599020,cabe di-zoom kera Mike
wYK_EK6zH_g,1599350,1605350,Raja  ketika magnesium terisak-isak
wYK_EK6zH_g,1605350,1611220,cabe mama mama Gem application in making
wYK_EK6zH_g,1611220,1619549,lebih naik wadah alankar 5 kunam.net Eka  internet dunia tema-tema Praja Nike
wYK_EK6zH_g,1625039,1628039,Nike
wYK_EK6zH_g,1635990,1639860,Nike Nike
wYK_EK6zH_g,1645350,1652309,acre  menghina eh
wYK_EK6zH_g,1656720,1662640,indomaret.co.id kamar turnamen ini
wYK_EK6zH_g,1672179,1678280,Kyle di YouTube fesyen unreasonable  regation unreasonable relations officer
wYK_EK6zH_g,1678280,1684630,at  UGM
wYK_EK6zH_g,1684630,1692220,Muksin berhijb menghina  bareng
wYK_EK6zH_g,1692820,1698160,mama rupiah sissae Dadi game widyagana  Forex Innova
wYK_EK6zH_g,1698160,1703140,anggota go home at
wYK_EK6zH_g,1704370,1707370,dingo
wYK_EK6zH_g,1711510,1717240,tiba-tiba  kirim
wYK_EK6zH_g,1717240,1722250,ke  mama Nggih
wYK_EK6zH_g,1722250,1727260,protein.com  amplop
wYK_EK6zH_g,1727440,1733669,itu dan  matic demikianlah dukemon dan nepotisme
wYK_EK6zH_g,1733669,1741760,Cannon  kemarau ini
wYK_EK6zH_g,1741760,1746860,pangkas Couture  notre
wYK_EK6zH_g,1749350,1752350,bantennews.co.id
wYK_EK6zH_g,1758350,1762309,dan tepat buat
wYK_EK6zH_g,1764170,1771500,[Musik]  kita-kita begini picek police couple
wYK_EK6zH_g,1771500,1776779,Berikut ini adalah kuno Oh usia beda  terhebat di Darmo sampai jatuh bikin ke
wYK_EK6zH_g,1776779,1783799,marker mindset atau tiba di Praha Ellie  track Oke taruh basah akmar genggaman  Karmin sitkom tabrak the intro lebat
wYK_EK6zH_g,1783799,1790460,ibadah artis contoh tonight tonight  tonight the world
wYK_EK6zH_g,1791220,1796380,ini bekerja al-qur'an atau Oh madrazo  para meledakkan benda-benda Journey by
wYK_EK6zH_g,1796380,1802230,polisi Fauzan nih  lantai gambarnya Kepada bandel uap  pelarut perdana karya lele sahabat
wYK_EK6zH_g,1802230,1807500,ladifo BC bagian Firza khawatir  Paddle Pop style
wYK_EK6zH_g,1807500,1816000,sahabat-sahabat  dibuat kereta tidak bisa nebak-nebak  dibenerin about Savita hypoxemic bandara
wYK_EK6zH_g,1816000,1821669,bala-bala kedua Polisi Air atlet dan  televisi animasi keburukan sensitif  Firza kata Dangdut Academy dejame
wYK_EK6zH_g,1821669,1829850,di-install nagih putbel ikut dia gede  kita bisa dapat duit berapa ya gossard  atau stonebridge tidak rubik
wYK_EK6zH_g,1831049,1836450,ini semakin Eternal Hai panas paha pakai
wYK_EK6zH_g,1840190,1850179,[Musik]
wYK_EK6zH_g,1851230,1858910,hai hai  [Musik]
