vid,start,end,text
XprvxmLBvuk,1216048,1224598,"If you can start every morning with a list organized by priority.  And start on your number one task and stay with it till it's done, you will supercharge your life."
XprvxmLBvuk,1224806,1233899,You will release endorphins in your brain that causes you to feel great.  You will motivate yourself and energize yourself and propel yourself into all your other tasks.
XprvxmLBvuk,1234107,1241073,"You'll get twice as much done on any day  where you start and complete your major task, first thing than on any other day."
XprvxmLBvuk,1241448,1249289,"The discipline of time management will then spread to all your other disciplines.  When you can demonstrate each morning that you have the self-control,"
XprvxmLBvuk,1249539,1256545,"self mastery, self-discipline to start and complete your most important task, you just feel fabulous about yourself."
XprvxmLBvuk,1257714,1263512,"Now, the fourth discipline is the discipline of courage. And it goes back to what we said earlier:"
XprvxmLBvuk,1263679,1268976,"Force yourself to do what you know you should do, especially in the area of courage."
XprvxmLBvuk,1269268,1275982,"The biggest obstacle to success, in my estimation, the estimation of the psychologist is the fear of failure."
XprvxmLBvuk,1276400,1281196,It's the fear that it won't work out. It's the fear of loss of time or money or emotion.
XprvxmLBvuk,1281530,1287327,It's fear that goes back to early childhood. And the only way we can succeed is by overcoming this fear.
XprvxmLBvuk,1287619,1294167,"And this fear is captured in the words: I can't, I can't. What about this? What about that? What about this?"
XprvxmLBvuk,1294668,1303218,"Fully 80% of the population is paralyzed by the fear of making a mistake.  And why? Because in growing up, you make lots of mistakes and didn't like the feel of it."
XprvxmLBvuk,1303427,1311768,So eventually you become conditioned to avoid taking any risk at all.  So you have to overcome this in order to realize your potential.
XprvxmLBvuk,1312185,1318358,"But what we know is that courage, the courage to face fears is a habit, and it's developed with practice."
XprvxmLBvuk,1318817,1328909,Just like typing with a typewriter or riding a bicycle.  You can actually develop the habit of courage by practicing courage whenever courage is required.
XprvxmLBvuk,1329453,1337127,"Aristotle wrote about this in his Nicomachean Ethics in 350 B.C.  He said, If you desire to have a quality that you don't have,"
XprvxmLBvuk,1337461,1344718,act in every instance where the quality is called for as though you already had it and you will have it.
XprvxmLBvuk,1345552,1351058,"So, as Ralph Waldo Emerson said, “Do the thing you fear and the death of fear is certain”."
XprvxmLBvuk,1351767,1359274,What he said was to confront your fears.  The natural human tendency is to avoid a fear causing or fear inducing situation.
XprvxmLBvuk,1359733,1366490,Most of our fear problems seem to be bundled up with other people by the way.  It's confronting a boss. It's confronting a bad relationship.
XprvxmLBvuk,1366615,1375499,"Sometimes it's confronting a prospect, cold calling,  going out and calling on customers and facing rejection and failure and embarrassment and so on."
XprvxmLBvuk,1376249,1385050,"But confronting that fear instead of avoiding it, just do it.  So the reason you want to confront your fears is not because of the incident."
XprvxmLBvuk,1385300,1391681,"Specifically, it's because of what it does for your character.  You wanna demonstrate to yourself that you can face down a fear"
XprvxmLBvuk,1392015,1400273,"and look at square in the eye and suddenly, surprise, surprise, it goes away.  And you realize that the fear was in your own mind."
XprvxmLBvuk,1401191,1409741,"Now, here's the most wonderful thing about overcoming fears.  If the fear of failure is summarized with the feeling, I can't I can't."
XprvxmLBvuk,1410075,1421127,"Psychologists have found you can actually short circuit or override the fear  by saying to yourself very strongly, I can do it, I can do it, I can do it, I can do it, I can do it."
XprvxmLBvuk,1421545,1430512,"So whenever you're afraid of anything, talking to somebody, confronting someone, dealing with something,  say to yourself over and over again, I can do it, I can do it, I can do it. And then just do it."
XprvxmLBvuk,1430720,1439604,"And you'll be amazed. The fear disappears. It's almost like, poof, it's gone.  So the key is you're looking at that telephone to pick up the phone, to cold call, to prospect,"
XprvxmLBvuk,1439896,1448947,"just say to yourself, I can do it, I can do it, I can do it. And pick it up and dial. And suddenly the fear disappears.  And you do this repeatedly, and eventually you develop the habit of courage."
XprvxmLBvuk,1449531,1454536,So here's an exercise for you: Identify one fear situation in your life today.
XprvxmLBvuk,1454786,1463420,"And use that as your challenge. Use that as your test case.  You say, “You know what I'm going to do? I'm going to face this fear down. I'm gonna hammer it. I'm gonna smash it."
XprvxmLBvuk,1463628,1470343,"I'm gonna look right in the eye. I'm going to deal with it, direct hit on like a car hitting a wall until the fear is gone."
XprvxmLBvuk,1470719,1478685,"And once you've done that, you'll look up and you'll be a different person.  For the rest of your life, you'll know that nothing that you're afraid of can stop you."
XprvxmLBvuk,1483607,1491281,"Now, the fifth discipline is the discipline of excellent health habits.  Your goal should be to live to be a 100 in sound physical health."
XprvxmLBvuk,1491740,1499581,"Today, the average lifespan in America is approaching 80,  which means 50% of people will die above that and 50% of people will die below."
XprvxmLBvuk,1499998,1508548,"Since you are smarter than the average, you're more knowledgeable, you're better informed,  you're probably gonna smash that average and live to be 90, 95, 100 years old."
XprvxmLBvuk,1508715,1515846,"So set a 100 as your goal and say to yourself, “Okay, I wanna live to be a 100 in great shape.  What would I have to do? What kind of shape would I have to be?"
XprvxmLBvuk,1515847,1522145,"What kind of life would I have to live physically in order to get there”?  So first of all, design your ideal body."
XprvxmLBvuk,1522395,1529736,"If your ideal body was perfect, in other words, weight, fitness, tone, stretch, flexibility and everything."
XprvxmLBvuk,1529903,1536368,"If your body was perfect, what would it look like? And make a list of all the things.  Remember when you were a child, your body was perfect."
XprvxmLBvuk,1536535,1542082,"And if your body's not perfect now, it just means that maybe you've forgotten  to do a few things or you've done a few things you shouldn't have done."
XprvxmLBvuk,1542374,1548088,So start off with a clear picture of your perfect body and recognize that that is possible for you.
XprvxmLBvuk,1548755,1555470,"Now, the key to physical health has always been contained in the five word formula.  Eat less and exercise more."
XprvxmLBvuk,1556221,1562644,"Eat less and exercise more.  Every single person who studies the subject, and now more and more people realize"
XprvxmLBvuk,1562811,1567857,that the key to success is to eat less and exercise more and exercise every day.
XprvxmLBvuk,1568108,1573029,"So discipline yourself to exercise daily. The very best time, of course, is in the morning."
XprvxmLBvuk,1573238,1580870,"If you get up in the morning and exercise immediately, even if it's just stretching or going for a walk  or riding a life cycle or walking on a treadmill, it doesn't matter what it is."
XprvxmLBvuk,1581162,1588753,"If you get up in the morning and exercise immediately,  not only will your body continue to burn calories all day, not only will you be more alert"
XprvxmLBvuk,1588920,1596011,"because you'll have highly oxygenated blood flooding your brain first thing in the morning,  but you'll develop the discipline of starting"
XprvxmLBvuk,1596011,1605353,"on something that you would normally not want to do and getting it done, getting it out of the way.  The more times I read about wealthy people, successful people, top businesspeople,"
XprvxmLBvuk,1605520,1610525,it's amazing how many of them get up at 5 o'clock and work out for an hour. It's absolutely astonishing.
XprvxmLBvuk,1610942,1619159,"Over and over again, you see their daily routine as they get up at 5:00 or 5:30  and they work out for an hour before they start planning and organizing their day."
XprvxmLBvuk,1619534,1630377,"If you can discipline yourself to do that, you have an enormous impact on your life.  Also, when you exercise, first thing in the morning for thirty to sixty minutes, your brain releases endorphins."
XprvxmLBvuk,1630670,1636009,"Which, as I said, make you happy, they make you feel exhilarated, make you feel more creative, more positive."
XprvxmLBvuk,1636176,1644809,"You feel more personable, you're more eager to get to work, and so on.  So, morning exercise just starts you off in fantastic mental and physical condition."
XprvxmLBvuk,1645602,1650523,"Now to get rid of any extra weight that you might have, just eliminate the three white poisons."
XprvxmLBvuk,1650815,1656320,"The three white poisons are anything that has flour in it, white flour, wheat flour, any kind of flour"
XprvxmLBvuk,1656738,1661534,"makes you overweight. It sticks to your gut, to your hips and to your thighs."
XprvxmLBvuk,1661910,1667582,"Eliminate sugar and any sugar products. Eliminate desserts, eliminate donuts, eliminate soft drinks."
XprvxmLBvuk,1668041,1674464,Don't eat things for sugar and eliminate salt. Don't put any salt on your food. There's plenty of salt in everything you do.
XprvxmLBvuk,1674923,1684683,"I ran into a friend of mine recently who lost twenty pounds. I looked at him, he's just swaying.  I mean, his suit jacket was swaying back and forth like a tent on a tent peg in the wind. I said,"
XprvxmLBvuk,1684933,1691272,"“Jeez”! I said, “You've lost a lot of weight”. I said, “How did you do it”?  He said, “I tried everything. I exercised”. He said, “I walked. I tried everything”."
XprvxmLBvuk,1691272,1696277,"He said, “I finally stopped eating anything white. I stopped eating flour foods,"
XprvxmLBvuk,1696778,1703450,"sugar and salt. He said, “Dropped twenty-two pounds in sixty days, never came back”.  And I've had people tell me that all over the world."
XprvxmLBvuk,1703743,1709040,"So if you can discipline yourself to only eat fruits, vegetables and proteins,"
XprvxmLBvuk,1709249,1714963,"no pasta, no bread, no rolls, no cakes, no desserts, no cokes, no colas, and no salt."
XprvxmLBvuk,1715171,1724431,"If you can just do that, you'll see yourself losing weight from the first day.  Some people will lose three or four pounds in the first week that they stop adding salt to anything."
XprvxmLBvuk,1724597,1730769,"And then, of course, drink lots of water, drink eight glasses of water a day.  And what that does is it washes all the impurities out of your system."
XprvxmLBvuk,1731146,1739862,"Very simple process. Eat more salads.  And here's a real kicker: Eat before 6 p.m. at night. Eat salad, eat light, and eat before 6 p.m."
XprvxmLBvuk,1740280,1745994,"Everything you eat after 6 p.m, you accumulate. Everything you eat before 6 p.m, burns up before you go to bed."
XprvxmLBvuk,1746327,1754877,"Don't eat within three hours of going to bed.  Just eat a light or medium light at dinner, salad with a little bit of protein before 6 p.m. or at 6 p.m."
XprvxmLBvuk,1755044,1764429,"And you'll be astonished. The next morning, you'll be thinner. It's absolutely remarkable.  Two more things, by the way, with regard to health. First of all, get regular medical and dental checkups."
XprvxmLBvuk,1764971,1775273,"People often don't go to the dentist or the doctor until they need to.  I find that it's false economy. Especially if you're over forty, you should have a complete medical every single year."
XprvxmLBvuk,1775440,1783990,"And you should have regular dental checkups at least twice a year.  If you're in business of any kind, you should have about four visits to the orthodontist"
XprvxmLBvuk,1784324,1791790,to clean your teeth every single year so that your teeth are really clean.  They found there's a direct relationship between gum health and the health of your whole body.
XprvxmLBvuk,1792081,1797170,"So with regard to self-discipline, just remember the Michael Jordan motto, ""Just do it""."
XprvxmLBvuk,1797462,1801925,"If you think it's a good idea, do it. Get on with it. Don't waste time. Don't make excuses."
XprvxmLBvuk,1802967,1810433,"Now, the sixth discipline is the discipline of regular saving and investing.  One of the greatest goals that we have in life is to be financially independent."
XprvxmLBvuk,1810809,1819275,One of the greatest worries we have in life is our bills and our debts.  The greatest fear we have in life is poverty or ending up our life with no money.
XprvxmLBvuk,1819734,1825782,"So the very act of starting to provide for yourself financially, transforms your thinking about yourself and your life."
XprvxmLBvuk,1826115,1833705,"It makes you a happy person. So set a goal of financial independence.  Decide that by gum, I'm going to become financially independent."
XprvxmLBvuk,1834123,1842966,"And resolve to get out of debt and stay out of debt.  I've worked with countless people who have become financially independent, starting from nothing."
XprvxmLBvuk,1843132,1848179,"And one of the things that they had was an aversion to debt. They hated debt, they avoided debt."
XprvxmLBvuk,1848429,1855854,The only debt they would accept would maybe be debt on a mortgage on the house that they live in.  Maybe debt on a car. But even then they don't like debt.
XprvxmLBvuk,1856145,1862402,"And other than that, they avoid debt like the plague.  So to get out of debt and stay out of debt, you have to discipline yourself."
XprvxmLBvuk,1862861,1870325,"Now, here's an interesting point, and I learned this from one of the smartest money managers I ever met.  He said: When we're young, we associate money with pleasure."
XprvxmLBvuk,1870577,1878710,"We get our first allowance and we go and we spend it on candy.  And we think that when we have money, we go and we spend it on candy or things that make us feel good."
XprvxmLBvuk,1879127,1885133,"Now, when we become adults, whenever we think of getting a lot of money,  our first thought is spending it on something that makes us happy."
XprvxmLBvuk,1885633,1893558,If you go to a tourist resort where people are on vacation and having a good time  there're just lines street after street after street of knickknacks and gadgets and junk
XprvxmLBvuk,1893766,1900857,"because people, when they're happy, associate going out and buying stuff.  However, what this does is, it keeps you broke all your life."
XprvxmLBvuk,1901024,1906570,"So what you do? And this is what he told me, is you rewire yourself.  You kind of pull out one wire and you plug it in"
XprvxmLBvuk,1906654,1913870,"and you say, instead of saying, I like spending money you say, I like saving money.  And you begin to think of how much you enjoy having money in the bank,"
XprvxmLBvuk,1914120,1922754,"how much you enjoy saving, how much you enjoy delayed gratification,  how much you enjoy the idea of moving toward financial independence."
XprvxmLBvuk,1923004,1931137,"And when you develop the habit of being happy about saving money,  you start to find yourself more and more careful with your expenditures."
XprvxmLBvuk,1931638,1937434,"Now, you know, the rule for financial independence is to save 10, 15, 20% of your income throughout your life."
XprvxmLBvuk,1937894,1942690,"And as your income grows, keep saving more and more and investing it, putting it away."
XprvxmLBvuk,1943149,1948196,"As Albert Einstein said, “Compound interest is the most powerful force in the universe”."
XprvxmLBvuk,1948613,1955411,"So putting your money away in well-chosen mutual funds  and money market funds, index funds, and just letting it grow over time."
XprvxmLBvuk,1955411,1963836,"And don't worry about the stock market going up and down.  Average increase in the US stock market for the last 100 years has been 8 to 10% each year,"
XprvxmLBvuk,1963962,1969592,"taking good years and bad years into consideration.  So your job is to save 10, 15, 20% of your income."
XprvxmLBvuk,1970426,1979811,"Now, for most people, because they're in debt, they just discard that completely. Their mind shuts down.  So, here's what I say is develop the habit of saving 1% of your income."
XprvxmLBvuk,1980269,1987068,"If you make $2,000 a month, that means you save $20.  You go down to the bank and you open up a financial freedom account"
XprvxmLBvuk,1987235,1995159,and you put in $20 from the first paycheck you get that month.  And then you discipline yourself to live on the other 99%.
XprvxmLBvuk,1995910,2001374,"Once you're comfortable living on 99%, then you increase it to 2% and 3% and 4%."
XprvxmLBvuk,2001833,2008881,"Within a year, you'll have developed a habit of living  on 85 to 90% of your income and automatically saving the balance."
XprvxmLBvuk,2009632,2014387,"You can even have the amount deducted from your paycheck, so it disappears and you never see it."
XprvxmLBvuk,2014804,2020309,Your paycheck goes into the bank  and the amount is automatically deducted into your savings account or   into an investment account.
XprvxmLBvuk,2020810,2029152,Soon you develop the habit of living on less than you earn.  And you change your thinking from 'I enjoy spending' to 'I enjoy saving'.
XprvxmLBvuk,2032447,2037076,A key way to save your money is to delay and to defer major purchase decisions.
XprvxmLBvuk,2037702,2042540,You'll find that if you think about buying a car or a washing machine or a stereo set
XprvxmLBvuk,2042874,2050589,"or a new computer, if you think about it for thirty days,  in many cases, you won't do it at all or if you do do it, you'll make a better decision."
XprvxmLBvuk,2051299,2057263,One of the smartest things of all is to buy things that are used rather than things that are new.  You know that millionaires never buy new cars.
XprvxmLBvuk,2058180,2063101,Millionaires never buy new cars. According to the studies by Stanley and Danko in “The Millionaire Next Door”:
XprvxmLBvuk,2063394,2072737,Is they wait and they buy a car that's two years old. It's coming off lease.  Or that's been driven for two years and somebody is trading it in and it's still under warranty for three years.
XprvxmLBvuk,2072945,2078784,"And you can even get extended warranties on many cars, where they'll go back and clean it all up  and give you another five years on a two year old car."
XprvxmLBvuk,2079034,2087168,"But what have you done? You save 10 or $20,000 on a car. And what do you do with that money?  You put it away and let it grow with compound interest."
XprvxmLBvuk,2087543,2094717,"If all you did was buy a used car every five to eight years, drive it until it falls apart and then buy another one,"
XprvxmLBvuk,2095051,2104477,the money you'd save from buying new cars can make you rich.  It can accumulate with compound interest into hundreds of thousands of dollars by the end of your working lifetime.
XprvxmLBvuk,2105061,2115863,"If you're going to invest, the rule is investigate before you invest.  My friend Ken Fisher of Fisher Investments says that two thirds of all investing is avoiding making mistakes."
XprvxmLBvuk,2116656,2126541,Let me repeat that: Two thirds of all success in investing or business  is avoiding making mistakes by making the wrong decisions or by making decisions too quickly.
XprvxmLBvuk,2126999,2134214,"So if you're going to invest in anything, the rule is  spend as much time investigating the investment as you spend making the money."
XprvxmLBvuk,2134715,2141639,You'll find that quick investment decisions are invariably poor investment decisions.  Only invest in things that you know and understand.
XprvxmLBvuk,2141848,2146935,Don't invest in somebody else's idea or scheme or business. Only invest in things that you know.
XprvxmLBvuk,2147353,2152150,"Number one rule is don't lose money. Whatever you do, don't lose money."
XprvxmLBvuk,2152400,2160241,"If there's a possibility of losing a little bit of money and you do it, you're probably going to lose a lot.  So be very careful. Once you earn the money, hold on to it."
XprvxmLBvuk,2160783,2166372,"There's a Japanese proverb that says, “Making money is like digging in the sand with a pin."
XprvxmLBvuk,2166998,2176424,"Losing money is like pouring water on the sand”.  It's easy to lose money, but it's hard to make it and keep it. And it's the most important discipline of all."
XprvxmLBvuk,2177216,2182013,Another discipline is to pay cash as often as possible and for as much as possible.
XprvxmLBvuk,2182346,2194358,Get rid of all your credit cards except for one. And only use that one when you have to.  The very act of paying cash really hyper sensitizes you to how much it's costing and causes you to spend less money.
XprvxmLBvuk,2195276,2200865,"W. Clement Stone once said, “If you cannot save the money, the seeds of greatness are not in you”."
XprvxmLBvuk,2201490,2206829,The primary reason why you save your money and accumulate it carefully is because it gives you two things:
XprvxmLBvuk,2206829,2215296,"First of all, it gives you freedom. You know you've got money in the bank.  If you don't like your job, you can walk away from it because you've got money in the bank."
XprvxmLBvuk,2215713,2222303,"But the second thing it gives you is opportunity.  If an opportunity comes along, you're prepared to take advantage of it."
XprvxmLBvuk,2222553,2231145,"You don't have to say, “I'm sorry, I don't have any money.  I can't afford it, I'm broke”. And people just shake their head in pity and walk away."
XprvxmLBvuk,2231562,2238485,"As an adult, you should always have opportunity money put aside.  And when you have it, you feel great about yourself."
XprvxmLBvuk,2238861,2247828,"The difference between a person with a little money and a person with no money is night and day.  A person with a little money feels great, a person with no money always feels inferior, "
XprvxmLBvuk,2247995,2253834,"anxious, worried, concerned, irritable, short tempered.  You know exactly what I'm talking about."
XprvxmLBvuk,2254835,2262760,"Now, the seventh discipline is the discipline of hard work.  There's nothing that will help you more than for you to develop a reputation as a hard worker."
XprvxmLBvuk,2263010,2269182,"In the studies of self-made millionaires, again, they said,  I didn't have better education, better talent, better knowledge,"
XprvxmLBvuk,2269183,2279819,"but I was willing to work harder than anyone else.  Most self-made millionaires work 60 and 70 hours per week for 5, 10, 15 years before they break-through."
XprvxmLBvuk,2280319,2287451,"Most other people are trying to get by on five days a week.  And then during those five days a week, they don't work very hard at all."
XprvxmLBvuk,2287827,2292665,"The interesting thing Thomas Jefferson once said,  Do you believe in luck? He was asked. He said, “Yes”."
XprvxmLBvuk,2292832,2301589,"He said, “I believe in luck”, he said, “And the harder I work, the more that I have”.  So the harder you work, the luckier you get, the harder you work, the more opportunities you have,"
XprvxmLBvuk,2301590,2308055,"the more doors open up to you, the more opportunities you see.  So in America, the average workweek is 32 hours."
XprvxmLBvuk,2308306,2313393,"As you know, in France, legally, the average workweek is 35 hours"
XprvxmLBvuk,2313519,2323237,"but then most people waste about half their time at work.  According to Robert Half International, the average person wastes 50% of their time in idle chit chat with coworkers,"
XprvxmLBvuk,2323487,2331537,"coffee breaks, lunches, reading the paper,   surfing the Internet, doing all kinds of things that don't contribute anything to the work."
XprvxmLBvuk,2332038,2338794,"So here's the rule that will make you successful, happy and rich. And it's this:  Work all the time you work."
XprvxmLBvuk,2339503,2345426,"Work all the time you work.  When you go to work, work. When you go to work, put your head down and go to work."
XprvxmLBvuk,2345551,2351015,"Don't waste a single minute. Put your head down and work all day long.  If somebody comes up to you and says, “Hi, how are you doing”?"
XprvxmLBvuk,2351098,2360399,"You say, “Fine, but right now I've got to get back to work”. Back to work, back to work.  Have you got a minute to chat? Yes, but not now, let's talk after work. Right now I've got to get my job done."
XprvxmLBvuk,2360608,2369700,"And nobody will ever stop you, when you say I've gotta get back to work, I've got a job, I've gotta get out.  I've got something I have to get done. They'll go away and they'll ruin someone else's career."
XprvxmLBvuk,2370076,2377750,"Remember, the greatest time wasters in the world of work are other people  who take up your time with idle chit chat and worthless gossip."
XprvxmLBvuk,2377958,2382880,"You got to avoid the time wasters.  In every single company, these people go around"
XprvxmLBvuk,2383089,2388469,"and they're like a virus, they go around and they infect everybody they talk to. Stay away from time wasters."
XprvxmLBvuk,2388928,2396560,"Now, here's a way to double your productivity, performance, output and income.  Here's a way to put yourself on the fast track, increase your income"
XprvxmLBvuk,2396727,2404151,"and become one of the most valuable people in your industry.  It's very simple. Start one hour earlier and when you start, get to work."
