vid,start,end,text
XprvxmLBvuk,2404527,2411659,"If the starting time in your company is 8:30, start at 7:30 or 7:00.  And you say, “Where are you going to get the time”? Get up a little earlier and get going."
XprvxmLBvuk,2412034,2417706,"Remember, all you do is beat the traffic. If you get in there early and get in there,   plan your day, get going, get organized, get started."
XprvxmLBvuk,2417915,2427298,"When other people come in, you are already running. You're already on your way.  To work through lunch. There's no law that says you have to go out and kill an hour, an hour and a half at lunch."
XprvxmLBvuk,2427508,2432972,"Eat at your desk, eat quickly, eat on the go. Use that time to work.  Don't use that time to hang around."
XprvxmLBvuk,2433514,2443149,There's a thing sweeping America today about having fun at work. No.  Work is not fun time. Work is not the playpen or the sandbox. Work is not school. Work is work.
XprvxmLBvuk,2443399,2450781,What you do is you go to work and you work all the time. You don't worry about fun.  Have your fun later knowing that you've done a fantastic job and you've gotten a lot done.
XprvxmLBvuk,2451073,2456412,"And finally, work one hour later. Be the last one to leave. Be the person who turns off the lights."
XprvxmLBvuk,2457037,2462334,"Interesting. If you look at an entrepreneurial startup,  a business that's being run by somebody who's really driving it forward,"
XprvxmLBvuk,2462626,2470718,"you'll find that the business owner's usually the first one threre, works through the whole day,  usually the last one to leave. Business owner usually works on Saturday and Sunday."
XprvxmLBvuk,2470968,2478558,"At the end of the day, the business owners got a beautiful home, house on the hill,  beautiful cars, beautiful life, vacations, a boat and the yacht basin."
XprvxmLBvuk,2478726,2483814,"And everybody says, “Boy, she is sure lucky”.  No, they're not lucky. They just worked all the time they work."
XprvxmLBvuk,2484190,2491489,"If you work three extra hours, start earlier, work harder, stay later, you'll add six hours of productive work to your day."
XprvxmLBvuk,2491780,2499579,Every hour of uninterrupted work when nobody's there  translates into three hours of productivity when there's people around interrupting you.
XprvxmLBvuk,2500080,2509507,"So keep asking at work, “What is the most valuable use of my time right now”?  What is the most valuable use of my time right now? And then do only that."
XprvxmLBvuk,2509924,2517723,"And keep saying back to work, back to work.  Whenever you get distracted or you start to follow the path of least resistance and major and minor say, “Wait a minute."
XprvxmLBvuk,2517973,2520934,"I've gotta get back to work, back to work, back to work”."
XprvxmLBvuk,2524813,2531569,"Now, the eighth discipline is the discipline of continuous learning.  The rule is: To earn more, you must learn more."
XprvxmLBvuk,2532112,2537117,"If you want to earn more than you're earning today, you've gotta learn new knowledge and skills that make it possible."
XprvxmLBvuk,2537910,2543666,"Jim Rohn once said, very famous, he said, “Work at least as hard on yourself as you do on your work”."
XprvxmLBvuk,2544208,2550713,"Work at least as hard on yourself as you do on your work.  So how do you do this? Well, you read in your field daily."
XprvxmLBvuk,2551048,2559848,"If you read sixty minutes a day in your field little in the morning, little in the evening,  it'll translate into one book a week. One book a week will translate into fifty books a year."
XprvxmLBvuk,2560224,2566647,"The average adult reads less than one book a year, and most nonfiction books are never read past the first chapter."
XprvxmLBvuk,2566939,2572026,"If you read fifty books a year, that's the equivalent of getting a Ph.D. in your field every single year."
XprvxmLBvuk,2572403,2579118,"Just reading every day will make you one of the most proficient, most skilled,  and ultimately highest paid people in your field."
XprvxmLBvuk,2579410,2586000,Listen to CDs in your car like this.  The average person drives 500 to a 1000 hours a year.
XprvxmLBvuk,2586250,2593298,That's the equivalent of three to six months of 40 hour week.  That's the equivalent of one to two full time university semesters.
XprvxmLBvuk,2593674,2599138,Just listening to educational CDs in your car will make you one of the best informed people in your field.
XprvxmLBvuk,2599763,2606895,"And finally, in continuous learning, attend seminars, take courses,  take structured courses, given by experts, given by authorities."
XprvxmLBvuk,2607104,2612234,You can learn more in a half day or a day from an expert than you might learn on your own in years.
XprvxmLBvuk,2612443,2619158,I've had many people walk out of my courses with one new idea and increase their income five times within 30 days.
XprvxmLBvuk,2619366,2625872,"One new technique for getting new clients, prospecting,  one new technique for presenting or overcoming objections, one new technique "
XprvxmLBvuk,2626081,2635466,"for closing sales or getting referrals and their income is exploded.  They have never learned it. They call me. They come to me. They say it was incredible. It changed my life, that one idea."
XprvxmLBvuk,2636050,2645266,"Now the average income in America increases about 3% a year.  With additional knowledge and skill, you increase the rate at which your income goes up."
XprvxmLBvuk,2645726,2653233,"If you get new knowledge and skill, you learn more, your income goes up 10% per annum.  You'll double your income in 7.2 years."
XprvxmLBvuk,2653609,2658363,"If your income goes up 25% per year, you'll double income in two years and eight months."
XprvxmLBvuk,2658739,2664369,"In other words, the more you learn, the more you earn.  The benefits of continuous learning are life changing."
XprvxmLBvuk,2664745,2673045,"And here's the final discipline, number nine, the discipline of persistence.  Now, the discipline of persistence says that the greatest test of self-discipline"
XprvxmLBvuk,2673295,2680719,is when you persist in the face of adversity and you drive yourself forward to complete your tasks 100%.
XprvxmLBvuk,2681762,2690312,"The test of self-discipline is when you can drive yourself to keep on keeping on,  even when everyone around you feels like quitting and you feel like quitting as well."
XprvxmLBvuk,2691313,2696402,"You know, we say that courage has two parts. The first part of courage is the courage to begin."
XprvxmLBvuk,2696568,2702783,It's the courage to start. It's the courage to launch in the face of failure with no guarantees of success.
XprvxmLBvuk,2703158,2709039,"But the second part of courage is the courage to endure, the courage to persist and to keep on going,"
XprvxmLBvuk,2709373,2717547,"when you're tired and you're disappointed and nothing's working.  And there's no guarantee of success, and maybe even a very large likelihood of failure."
XprvxmLBvuk,2718006,2725013,So it's really important.  We say that your persistence is your measure of your belief in yourself and what you are doing.
XprvxmLBvuk,2725431,2730643,"If you truly believe in the goodness and rightness and value of what you're doing, you will persist"
XprvxmLBvuk,2731270,2738401,"regardless of what's happening on the outside.  And the more you believe in the goodness and rightness of what you're doing, the more you will persist."
XprvxmLBvuk,2738819,2745409,"And wonderfully enough, the more you persist, the more you believe in yourself,  the more you believe in the value of your work."
XprvxmLBvuk,2745534,2752040,"Persistence seems to change your character. In reality, persistence is self-discipline in action."
XprvxmLBvuk,2752666,2762760,"In the final analysis, your persistence is your measure of self-discipline.  Self-discipline leads to self esteem. Every time you practice self esteem, you feel better about yourself,"
XprvxmLBvuk,2763135,2769766,"which leads to greater persistence, which leads to even greater self-discipline.  And you get on to an upward spiral in life."
XprvxmLBvuk,2770100,2776648,That's why Napoleon Hill said that persistence is to the character of a man or woman as carbon is to steel.
XprvxmLBvuk,2777107,2785157,"You actually make yourself, you shape yourself, you form yourself, you build yourself into a superior human being,"
XprvxmLBvuk,2785282,2790161,a better and stronger person by persisting when you feel like quitting.
XprvxmLBvuk,2790913,2798796,"Well, every time you have the tendency to quit, every time you feel like  giving up or cutting corners or stopping before you finish your task, say, “Wait a minute, this is a test”."
XprvxmLBvuk,2799046,2809264,This is a test of my character. This is a test to see what I made of.  And it's not what I'm working on that counts. It's the person I am becoming by either persisting or quitting.
XprvxmLBvuk,2809473,2818690,"So always persist until you have completed the task.  And as you do, you burst through and your brain floods with endorphins and you feel wonderful about yourself."
XprvxmLBvuk,2818941,2824570,Eventually you develop the habit of persistence and you become unstoppable.
XprvxmLBvuk,2825906,2833955,"Well, here are the seven benefits of practicing self-discipline in every area of your life.  Number one, the habit of self-discipline guarantees your success."
XprvxmLBvuk,2834540,2839419,"Every single successful person has that fundamental quality of persistence and tenacity,"
XprvxmLBvuk,2839711,2845592,"that fundamental quality of self-discipline to make themselves do  what they should do, whether they feel like it or not."
XprvxmLBvuk,2846051,2852099,"Number two, is when you practice self-discipline, you'll get more done faster and better than other people."
XprvxmLBvuk,2852224,2861066,You'll get more results. You'll be more productive. You have higher levels of performance.  You'll bring yourself to the attention of people who can help you and support you and move you forward.
XprvxmLBvuk,2861525,2868949,"Number three, you'll be paid more and promoted faster at any job in any situation.  The people with high levels of self-discipline who get the results"
XprvxmLBvuk,2869199,2878458,"are the ones who are immediately moved to the front of the line of life.  Number four, you'll have a greater sense of self-control, self-reliance and personal power."
XprvxmLBvuk,2878709,2886300,"You feel that you can do anything that you put your mind to  because you have the ability to make yourself, to discipline yourself to do it anyway."
XprvxmLBvuk,2887050,2893098,"Number five: Self-discipline is the key to self-esteem, self-respect and personal pride."
XprvxmLBvuk,2893640,2899396,"Every time you discipline yourself, you'll like yourself more.  Every time you discipline yourself, you see yourself as a better person."
XprvxmLBvuk,2899605,2904651,"Every time you discipline yourself, you feel great about yourself. You feel personally proud of yourself."
XprvxmLBvuk,2904860,2912159,"It affects your personality in a very positive way.  Number six: The greater your self-discipline, the greater your self-confidence"
XprvxmLBvuk,2912367,2919291,"and the lower your fears of failure and rejection.  Eventually, you develop self-confidence, so that you can walk through walls."
XprvxmLBvuk,2919625,2927215,"And number seven, with self-discipline,  you'll have the strength of character to persist over all obstacles until you succeed."
XprvxmLBvuk,2927674,2931386,"With self-discipline, you achieve personal greatness."
