vid,start,end,text
yG60YmSa_tw,0,430,Bu
yG60YmSa_tw,430,1760,[Müzik]
yG60YmSa_tw,1760,7500,duyularını açık video asker ya Gel biraz
yG60YmSa_tw,7500,11330,beri duyulami artık
yG60YmSa_tw,11330,14719,hey ho ho
yG60YmSa_tw,16760,19230,Günaydın arkadaşlar bugün mezuniyetim
yG60YmSa_tw,19230,21449,var ve mezuniyetimi sizinle birlikte
yG60YmSa_tw,21449,23369,hazırlanacağım ne giyeceğim nasıl makyaj
yG60YmSa_tw,23369,25050,yapacağım Saçımı nasıl olacak nasıl
yG60YmSa_tw,25050,27420,gidecek mezuniyet sonrasında ki parti
yG60YmSa_tw,27420,29490,nasıl olacak hepsini size göstereceğim
yG60YmSa_tw,29490,31470,Hem de benim için bir anı olarak kalmış
yG60YmSa_tw,31470,33149,olacak ileride Birkaç yıl sonra
yG60YmSa_tw,33149,35010,baktığımda Belki de diyebileceğim
yG60YmSa_tw,35010,36960,Mecnunum olacak çünkü bir kesit
yG60YmSa_tw,36960,38820,üniversiteden mezun oluyorum Ben şimdi
yG60YmSa_tw,38820,41579,Sabah kalktım Öncelikle Hemen banyoya
yG60YmSa_tw,41579,43950,girdim daha tonda Kuaför randevum var
yG60YmSa_tw,43950,45719,onu gelince kahvaltı yapacağım Öyle
yG60YmSa_tw,45719,47520,hazırlanmaya başlayacağım saat 2'de
yG60YmSa_tw,47520,49500,mezuniyet zaten yine koca bir bardak
yG60YmSa_tw,49500,51780,suyu içerek başladım bir bardaklar çizim
yG60YmSa_tw,51780,54120,Hatta yetmiyor Çünkü ve cilt güzelliği
yG60YmSa_tw,54120,56309,için suç ve çok önemli diyorsunuz nasıl
yG60YmSa_tw,56309,58379,taktım Bugün artık yani ölümü görmek
yG60YmSa_tw,58379,60579,için ablam Bugün mezunu Sen ne
yG60YmSa_tw,60579,63969,yapıyorsun Rum Bana bak bana bak
yG60YmSa_tw,63969,66790,ablacığım Mecnun oluyor bugün Mecnun
yG60YmSa_tw,66790,69580,oluyormuş ablacı bu hala uyuyor Oh
yG60YmSa_tw,69580,72810,çeviri çeviri çeviri kendi gıcıkla
yG60YmSa_tw,72810,77500,seni düğme bunu böcük böcük bakıyor
yG60YmSa_tw,77500,79620,oy oy
yG60YmSa_tw,81390,85630,veya gitme hep ibaret olan şey işiniz
yG60YmSa_tw,85630,88479,yeşil Çayların böyle çöpünü atmayın bunu
yG60YmSa_tw,88479,90640,dolaba koyuyorum soğuduktan sonra
yG60YmSa_tw,90640,92800,suratıma sürüyorum Hem cilde iyi
yG60YmSa_tw,92800,95200,geliyormuş şişliği alıyor şöyle alıyorum
yG60YmSa_tw,95200,100259,bütün cildime sürüyorum
yG60YmSa_tw,100650,103740,sopasıyla geldi gene
yG60YmSa_tw,103740,108060,sopan mı geçiyorsun orada
yG60YmSa_tw,115410,118460,göreceksiniz hazırmısınız
yG60YmSa_tw,118460,134149,[Müzik]
yG60YmSa_tw,136260,139310,12 gel bu başlar ben makyajım yapmadan
yG60YmSa_tw,139310,141470,önce çok iyi cilt bakımı yapacağım şeker
yG60YmSa_tw,141470,143299,peelingi ile başlayacağım yorgunluk
yG60YmSa_tw,143299,146510,karşıtı Bu ürün şişini falan oluyormuş
yG60YmSa_tw,146510,149269,güya bir de alırım Hayır bitsin diye
yG60YmSa_tw,149269,151849,kullanıyorum az kaldı zaten içinde gül
yG60YmSa_tw,151849,154370,suyu spreyi var Onu sıkacağım sonra C
yG60YmSa_tw,154370,156890,vitamini sürüp bakım yağıyla yüzüme
yG60YmSa_tw,156890,159200,masaj yapacağım ölür olurla falan tabi
yG60YmSa_tw,159200,162099,fırın bozulmasın diye Saçım tutturuyorum
yG60YmSa_tw,162099,164599,cildiniz kururken yapıyorsunuz bunu
yG60YmSa_tw,164599,167030,Haftada iki kez uyguluyorum çok da
yG60YmSa_tw,167030,169609,bastırmaya çalışıyor çünkü sert tanecik
yG60YmSa_tw,169609,171709,yelekler yüzünü çizebiliyor zarar
yG60YmSa_tw,171709,176470,verebiliyor şu an nazikçe yapıyorum
yG60YmSa_tw,177130,179470,Evet şimdi yüzümü yıkayıp geliyorum Bir
yG60YmSa_tw,179470,182490,saniye kullandım Gülsüm arkası da bu
yG60YmSa_tw,182490,185260,bu kullanın ürünlerin bir linkini
yG60YmSa_tw,185260,187480,bırakırım Siz zaten şimdi nüfusun bakım
yG60YmSa_tw,187480,189700,yanına süreceğim masaj yapacağım
yG60YmSa_tw,189700,192660,[Müzik]
yG60YmSa_tw,192660,196510,disko topuna döndüm Şu an yani bakın
yG60YmSa_tw,196510,198550,bayağı parlıyor highlighter hiç gerek
yG60YmSa_tw,198550,200530,kalmıyor hemder olur kullanırsanız
yG60YmSa_tw,200530,202510,cildinize Daha iyi indirmiş olursunuz
yG60YmSa_tw,202510,205180,önce C vitamini sürekli unuttum ya artık
yG60YmSa_tw,205180,207210,üstüne sürelim
yG60YmSa_tw,207210,210700,C vitamini de bu Arkadaşlar şöyle krem
yG60YmSa_tw,210700,213760,gibi yapısı olan aldım daha çok azalınca
yG60YmSa_tw,213760,216700,bayağı yayılıyor ve C vitamini sürdükten
yG60YmSa_tw,216700,219010,sonra kesinlikle güneş kremi sürün leke
yG60YmSa_tw,219010,220960,bırakıyor Çünkü test ettim bilmiyorum
yG60YmSa_tw,220960,223150,ilk kullanmaya başladığımda ve güneşe
yG60YmSa_tw,223150,225100,falan bayağı unutturup çıkıyordum
yG60YmSa_tw,225100,227350,buralarda böyle kızarıklıklar yanıtlar
yG60YmSa_tw,227350,229330,gibi birşey oldu Sonuçta ama geçti ya
yG60YmSa_tw,229330,231160,Çok şükür kalıcı olacak diyordum koptu
yG60YmSa_tw,231160,233710,Çünkü şimdi ben elbisemi giydim en son
yG60YmSa_tw,233710,235960,hazırlanınca tamamen göstereceğim
yG60YmSa_tw,235960,238970,kombini a o farklıydı Çünkü ben farklı
yG60YmSa_tw,238970,241920,beceremiyorum
yG60YmSa_tw,241920,250569,[Müzik]
yG60YmSa_tw,253210,261870,[Müzik]
yG60YmSa_tw,262180,264890,Güneş kremimi sürdüm Arkadaşlar bunu
yG60YmSa_tw,264890,267350,kullanıyorum şimdi aylaynır verımor
yG60YmSa_tw,267350,269840,süreceğim ve makyajın bitecek tabi biraz
yG60YmSa_tw,269840,271510,oluşturduktan sonra
yG60YmSa_tw,271510,274160,Aydıntepe çektim arkadaşlar çok mutluyum
yG60YmSa_tw,274160,277000,Şimdi ben süreceğim
yG60YmSa_tw,277000,279919,şimdi elimde tamam Arkadaşlar şimdi ben
yG60YmSa_tw,279919,281780,bir Dudağımın süreyim ona bir bakayım
yG60YmSa_tw,281780,284030,büyük ihtimalle pembe sonlarında bir
yG60YmSa_tw,284030,286550,parlatıcı tercih edebilirim Ben farz
yG60YmSa_tw,286550,291668,insanıyım hemen birkaç vakti soracağım
yG60YmSa_tw,292540,294540,o
yG60YmSa_tw,297540,301560,şifremi veriyorum arkadaşlar
yG60YmSa_tw,302169,305020,Evet arkadaşlar şimdi vücudumuzda Bu yıl
yG60YmSa_tw,305020,307240,süreceği mi broşürden bu insan Cevizi
yG60YmSa_tw,307240,309939,kokulu Z insan Cevizi kokulu bunu yine
yG60YmSa_tw,309939,314189,parfüm var Onu ısıtacağım burada
yG60YmSa_tw,315150,316250,Evet
yG60YmSa_tw,316250,319200,şu bilekliği taktım şöyle yüzükler
yG60YmSa_tw,319200,321000,taktım manikürün de göstereyim French
yG60YmSa_tw,321000,323880,yaptırdım şu birazcık yan dönmüş Lan bir
yG60YmSa_tw,323880,325980,daha şöyle yeşil terlik aldım arkadaşlar
yG60YmSa_tw,325980,328440,yüksek topuklu olmasın hem dedim elbisem
yG60YmSa_tw,328440,330230,bu şekilde
yG60YmSa_tw,330230,331300,Ben
yG60YmSa_tw,331300,333920,de şimdi çıkıyorum zaten orada bulgur
yG60YmSa_tw,333920,336800,Halime çekim yaptıracağım geç kalmadan
yG60YmSa_tw,336800,339190,gidelim
yG60YmSa_tw,346240,349660,Evet video
yG60YmSa_tw,351730,355750,Salonda mı yüzyılda
yG60YmSa_tw,363100,369560,mutluyuz Bakalım burada Ahmet var mı
yG60YmSa_tw,390210,394729,o kadar yağmur buraya giriyorum
yG60YmSa_tw,395780,401460,Gelen geçen bir ev sallarsa o
yG60YmSa_tw,402040,405819,[Alkış]
yG60YmSa_tw,410410,418269,[Müzik]
yG60YmSa_tw,439660,442859,[Alkış]
yG60YmSa_tw,450220,452070,o o
yG60YmSa_tw,452070,455230,[Alkış]
yG60YmSa_tw,474450,478160,[Alkış]
yG60YmSa_tw,498820,501930,[Müzik]
yG60YmSa_tw,510230,512290,sen
yG60YmSa_tw,515440,519440,bana o
yG60YmSa_tw,531190,534479,[Alkış]
yG60YmSa_tw,558940,570209,[Müzik]
yG60YmSa_tw,570209,571680,Evet
yG60YmSa_tw,571680,589980,[Müzik]
yG60YmSa_tw,591280,593809,[Alkış]
yG60YmSa_tw,593809,597629,arkadaşlar ertesi gün için hazırlandım
yG60YmSa_tw,597629,599819,sefer mavi elbiseyi giydim Şimdi
yG60YmSa_tw,599819,602610,almıştım Çünkü bu da içinde kaldı Fakat
yG60YmSa_tw,602610,604829,gerçekten nazar değdirdim arkadaşlar
yG60YmSa_tw,604829,607350,Vücut yağı sürerken bütün elbiseyi
yG60YmSa_tw,607350,610110,bulaştırdım eteğim ucuna kadar çok katı
yG60YmSa_tw,610110,611790,dur Ama yapacak bir şey yok yani
yG60YmSa_tw,611790,614279,giyeceğim sefer makyajım kendim yaptım
yG60YmSa_tw,614279,617820,mavi far sürdüm şöyle
yG60YmSa_tw,617820,620100,O beyaz çantamı takacağım Bir de şöyle
yG60YmSa_tw,620100,623940,siteden aldığım ve yaz Terlik var şöyle
yG60YmSa_tw,623940,626430,gümüş bileklik taktım ve yeni aldım
yG60YmSa_tw,626430,629130,yılanlı halı taktım daha girmedi
yG60YmSa_tw,629130,631290,elbisenin bu şekilde mahvolması beni çok
yG60YmSa_tw,631290,632330,üzdü ama
yG60YmSa_tw,632330,645500,[Müzik]
yG60YmSa_tw,645500,649070,ama ama ama ama ama
yG60YmSa_tw,649070,651890,Allah
yG60YmSa_tw,651890,654290,razı olsun
yG60YmSa_tw,654290,657920,[Müzik]
yG60YmSa_tw,657920,660800,oğlum
yG60YmSa_tw,660800,663950,[Müzik]
yG60YmSa_tw,664760,668760,Allah o
yG60YmSa_tw,669460,677800,[Müzik]
yG60YmSa_tw,677800,679220,abone ol
yG60YmSa_tw,679220,701279,[Müzik]
yG60YmSa_tw,710600,721630,[Müzik]
yG60YmSa_tw,725030,731830,[Müzik]
yG60YmSa_tw,737810,738900,İyi
yG60YmSa_tw,738900,741850,[Kahkaha]
yG60YmSa_tw,741850,745608,[Müzik]
yG60YmSa_tw,745810,752230,diyelim iyi olsun aşkım var dağlar
yG60YmSa_tw,754420,757779,gelmez Gelmez
yG60YmSa_tw,760930,762460,bence
yG60YmSa_tw,762460,765430,yani açık
yG60YmSa_tw,765430,768710,olsun cevabı gel şey yazmıyor böyle
yG60YmSa_tw,768710,771200,duyularını artık ho ho ho ho ho ho ho ho
yG60YmSa_tw,771200,773260,ho
yG60YmSa_tw,777820,782380,masrafını kalıyor bak
