vid,start,end,text
-KkJW8p2hPA,740,8809,[Music]
-KkJW8p2hPA,8809,17190,it's me puppy and look at what it is  whoa it's a real ice cream truck and
-KkJW8p2hPA,17190,24370,today you and I are gonna learn about  ice cream trucks
-KkJW8p2hPA,24370,37130,[Music]
-KkJW8p2hPA,38310,44430,whoa all right now let's learn the parts  of this ice cream truck on the outside
-KkJW8p2hPA,44430,50380,whoa  it's so colorful oh look there's some
-KkJW8p2hPA,50380,55450,ice cream right here we have a  strawberry shortcake we have an ice
-KkJW8p2hPA,55450,65128,cream sandwich we have a drumstick and  we have a red white and blue ice cream
-KkJW8p2hPA,65640,72160,whoa look at these so cool they're pink
-KkJW8p2hPA,72160,82840,rims so then the ice cream truck can  drive around on the street sweet wheels
-KkJW8p2hPA,82840,87910,and tires whoo what's this oh it says
-KkJW8p2hPA,87910,100390,children slow crossing it looks like  there's lights let me show you all right
-KkJW8p2hPA,100390,106590,you see this red knob you pull it out  watch what happens
-KkJW8p2hPA,108750,113890,whoa  these lights flash orange and the sign
-KkJW8p2hPA,113890,121300,comes out from the ice-cream truck  so then you know not to get close to the  ice-cream truck or at least just be very
-KkJW8p2hPA,121300,130509,weary so then you don't get hurt so  we'll keep that out right now  let me show you something else whoo you
-KkJW8p2hPA,130509,136840,see this this is a switch for music
-KkJW8p2hPA,136840,146660,[Music]
-KkJW8p2hPA,149749,155129,you hear that music that means the ice  cream truck is coming to you so then you
-KkJW8p2hPA,155129,161340,can get some ice cream  woo and look at right here some social
-KkJW8p2hPA,161340,168930,media of this exact ice cream truck in  Las Vegas  mater sweet OH
-KkJW8p2hPA,168930,176639,then look right here look at all these  ice cream choices we have wool this one
-KkJW8p2hPA,176639,182129,has the color red orange green oh and
-KkJW8p2hPA,182129,192680,look at this one one of my two favorite  colors orange yum a ninja turtle Oh
-KkJW8p2hPA,192680,197900,spongebob squarepants and let's see here
-KkJW8p2hPA,197900,204049,remember this one yeah it's on the other  side too it's the Strawberry Shortcake
-KkJW8p2hPA,204049,209370,YUM oh look at this this is the window
-KkJW8p2hPA,209370,215879,that you walk up to and this is where
-KkJW8p2hPA,215879,222560,you order your ice cream from huh hello
-KkJW8p2hPA,222560,228500,hello wait a second no one's in here I
-KkJW8p2hPA,228500,235199,have an idea maybe you and I can go  inside and serve some people and ice
-KkJW8p2hPA,235199,238970,cream come on
-KkJW8p2hPA,241560,248849,alright now let's hop in the back and  serve some ice cream but first we need  to turn on the generator this is what
-KkJW8p2hPA,248849,259090,provides power to the freezer let's turn  it on  oh it's like a mini engine that produces
-KkJW8p2hPA,259090,266289,power to keep the freezer really cold  but the freezer is already cold so we
-KkJW8p2hPA,266289,273300,can turn it off  alright let's hop in the back and serve
-KkJW8p2hPA,273300,280979,some icecream  whoa the inside of an ice cream truck
-KkJW8p2hPA,280979,298350,oh this is where the driver of the ice
-KkJW8p2hPA,298350,304430,cream truck sits it's just like a normal  vehicle a steering wheel a shifter knob
-KkJW8p2hPA,304430,312500,set of keys but we're not here for  driving we're here for ice cream
-KkJW8p2hPA,312560,321830,whoa this big white thing right here  this is the freezer let's open it up
-KkJW8p2hPA,323780,332630,look at all this ice cream all right  let's pick out five ice cream bars ready
-KkJW8p2hPA,334520,340940,all right okay got one one
-KkJW8p2hPA,350930,359959,[Music]
-KkJW8p2hPA,371200,383100,[Music]  all right here we go all right five all
-KkJW8p2hPA,383100,390380,right five let's shut this to keep them  nice and cold so right here we have five
-KkJW8p2hPA,390380,397919,one two three four five five ice cream
-KkJW8p2hPA,397919,409440,bar but now we need three snacks hmm  okay how about some popcorn one how
-KkJW8p2hPA,409440,421590,about um some chips  two snacks Oh what else oh yeah all
-KkJW8p2hPA,421590,427229,right  three three snacks so we have five ice
-KkJW8p2hPA,427229,436620,cream bars and three snacks five plus  three is one two three four five six
-KkJW8p2hPA,436620,442560,seven eight  YUM oh all right now we need to let
-KkJW8p2hPA,442560,448700,everyone know on Twitter and Instagram  where we are all right
-KkJW8p2hPA,449720,465629,[Music]
-KkJW8p2hPA,468010,474800,hey we have some ice cream here let's  pass it out alright first we have cotton
-KkJW8p2hPA,474800,483070,candy  who wants cotton candy go you're welcome
-KkJW8p2hPA,483070,489110,okay we have an Ice Cream Sandwich YUM
-KkJW8p2hPA,489110,494330,you're welcome and a Hello Kitty yeah  you're welcome
-KkJW8p2hPA,494330,499810,alright enjoy the ice cream thank you
-KkJW8p2hPA,502670,510140,[Music]  that was so much fun learning about this  ice cream truck with you well this is
-KkJW8p2hPA,510140,516590,the perfect time for the fun ice cream
-KkJW8p2hPA,516590,543350,[Music]  ice cream ice cream ice cream with
-KkJW8p2hPA,543350,550190,chocolate sauce warm and gooey nuts and  cherries on top make some ice cream with
-KkJW8p2hPA,550190,555670,chocolate sauce let's make some ice  cream
-KkJW8p2hPA,555670,561100,but make some ice cream with gummy were  not some dumb green red and yellow yummy
-KkJW8p2hPA,561100,566920,were not enough make some ice cream with  gummy worm time now this makes a bunny
-KkJW8p2hPA,566920,574029,fun body screams make some ice cream  nuts yummy yum let's make some ice cream
-KkJW8p2hPA,574029,580310,bunny fun  make some eyes before tommy-toms
-KkJW8p2hPA,581190,587399,ice cream let's make some ice cream  that's yummy yum-yum let's make some ice
-KkJW8p2hPA,587399,594130,cream that's funny fun  boats make some ice cream bar Tommy Tom
-KkJW8p2hPA,594130,600069,Bonnie but ice cream YUM woohoo look at
-KkJW8p2hPA,600069,606940,what I have this is some toy clay and  I'm acting like it's ice cream but it's
-KkJW8p2hPA,606940,612970,actually a toy so be sure not to eat it  alright see this is like vanilla ice
-KkJW8p2hPA,612970,618930,cream  yum and this is like chocolate ice cream
-KkJW8p2hPA,618930,624100,woo look we have some ingredients glue  like this
-KkJW8p2hPA,624100,631140,yes I'm strawberry syrup okay  let's take off the cap and here we go
-KkJW8p2hPA,631140,634240,[Music]
-KkJW8p2hPA,636990,647740,no ruin look at this one it's like  chocolate syrup oh let's put some over
-KkJW8p2hPA,647740,651990,here again alright
-KkJW8p2hPA,654460,663380,YUM that looks tasty and what we can put  over on the chocolate ice cream is maybe
-KkJW8p2hPA,663380,669340,some whipped cream YUM here we go
-KkJW8p2hPA,670200,678610,[Music]  oh that looks tasty ooh look at what we
-KkJW8p2hPA,678610,686950,have over here some muy it's a more toy  molding clay I think this deserves us a
-KkJW8p2hPA,686950,693550,cherry on top okay let's take some off  right there and then squish it squish
-KkJW8p2hPA,693550,699670,push push push push  and let's roll it up oh that looks like
-KkJW8p2hPA,699670,709630,a cute cherry let's put a little dimple  up top yeah all right let's put it right
-KkJW8p2hPA,709630,717579,on the chocolate ice cream yum that  looks tasty but like I said be sure not
-KkJW8p2hPA,717579,725350,to eat it and this one looks like we  have some blue and some orange blue and
-KkJW8p2hPA,725350,733779,orange  my two favorite colors let's make some  gummy worms all right let's take half of
-KkJW8p2hPA,733779,741190,this orange roll it out okay mmm look at
-KkJW8p2hPA,741190,751769,that orange gummy worm put it right on  top right here then let's take the blue
-KkJW8p2hPA,751769,760589,and we'll make another gummy worm you  put it right there all right roll it out
-KkJW8p2hPA,762149,772240,mmm look at that gummy worm let's lay it  right there and there we have two tasty
-KkJW8p2hPA,772240,781800,looking toy ice cream  yo well this is the end of this video it
-KkJW8p2hPA,781800,788420,was so much fun learning about the ice  cream truck with you and listening
-KkJW8p2hPA,788420,794130,dancing and do them funny fun ice cream
-KkJW8p2hPA,794130,799440,song well if you want to watch more of  my videos all you have to do is search
-KkJW8p2hPA,799440,810660,for my name will you spell my name with  me ready BL i PP I flippy alright see
-KkJW8p2hPA,810660,827820,you again hey grownups I think it would
-KkJW8p2hPA,827820,833400,be a great idea if you liked my Facebook  page  live show information behind the scenes
-KkJW8p2hPA,833400,839329,special discounts even free giveaways  see you there
-KkJW8p2hPA,839970,857960,[Music]
-KkJW8p2hPA,857960,865890,hey my name's flippy and look at what's  behind me whoa there's a lot of colorful
-KkJW8p2hPA,865890,872220,boxes back there and it looks like  there's ten boxes whoa
-KkJW8p2hPA,872220,882600,let's go learn our numbers one all right
-KkJW8p2hPA,882600,888440,look at this red box wait a second
-KkJW8p2hPA,892290,897530,[Music]
-KkJW8p2hPA,897530,911820,another wrong box that's the number nine  oh here's a box look we found it the
-KkJW8p2hPA,911820,918230,number one I wonder what's inside let's
-KkJW8p2hPA,918230,921709,open it up
-KkJW8p2hPA,927430,934550,look at what it is there's one police
-KkJW8p2hPA,934550,946700,car whoa this is the perfect time for
-KkJW8p2hPA,946700,953210,the flippy police car song  [Music]  [Applause]
-KkJW8p2hPA,953210,960290,[Music]  these cars
-KkJW8p2hPA,960480,973460,these car  [Music]  these cars fast through the town
-KkJW8p2hPA,973460,981160,[Music]  and oh my god  their sirens are so
-KkJW8p2hPA,981850,987069,can you see the red and
-KkJW8p2hPA,989210,994810,letting everybody know to let them buy
-KkJW8p2hPA,996740,1003300,all these cars these car
-KkJW8p2hPA,1005390,1011490,[Music]
-KkJW8p2hPA,1011490,1014740,[Laughter]
-KkJW8p2hPA,1016690,1029180,well one police car let's go find number  two come on okay here is another box see
-KkJW8p2hPA,1029180,1036290,this is the number two's wool I wonder
-KkJW8p2hPA,1036290,1053770,what's inside gotta open it up to shoes
-KkJW8p2hPA,1053770,1061310,wait a second look my shoes were in the
-KkJW8p2hPA,1061310,1066950,box  okay I gotta put on these shoes one two
-KkJW8p2hPA,1066950,1073840,all right one shoe shoe shoe got a time
-KkJW8p2hPA,1073840,1078710,okay  [Music]
-KkJW8p2hPA,1078940,1084510,yeah these two shoes are perfect for  dancing
-KkJW8p2hPA,1084510,1093399,[Music]
-KkJW8p2hPA,1093399,1104090,one two all right now let's find the  next number one two I know
-KkJW8p2hPA,1104090,1110739,[Music]  the paper was telling us to go here
-KkJW8p2hPA,1110739,1118249,another box whoa  this box has the number three on it
-KkJW8p2hPA,1118249,1132369,one two three let's open it up oh okay
-KkJW8p2hPA,1132369,1145879,here we go  look three balls one two three huh I
-KkJW8p2hPA,1145879,1153278,wonder what I can do with three balls oh  I can juggle
-KkJW8p2hPA,1155929,1162610,I love juggling all right let's go find  number four
-KkJW8p2hPA,1162610,1171710,[Music]  another box and this has the number four
-KkJW8p2hPA,1171710,1176750,on it one two three four let's open it
-KkJW8p2hPA,1176750,1185270,up oh this is so tiring I am so thirsty
-KkJW8p2hPA,1185270,1205360,Oh juice boxes one two three all right
-KkJW8p2hPA,1207880,1220070,here we go  yeah we'll buy juice whoa okay last one
-KkJW8p2hPA,1220070,1229040,oh okay now I'm all hydrated and we
-KkJW8p2hPA,1229040,1235540,learned numbers one two three and four  let's go find the next number
-KkJW8p2hPA,1235540,1241120,[Music]
-KkJW8p2hPA,1241120,1247040,look here it is another box and look at
-KkJW8p2hPA,1247040,1257540,what this says this has the number five  on it one two three four five I wonder
-KkJW8p2hPA,1257540,1264520,what's inside  [Music]
-KkJW8p2hPA,1264520,1272480,balloons five water balloons okay we
-KkJW8p2hPA,1272480,1289910,have one two three three can you do with
-KkJW8p2hPA,1289910,1295450,water balloons I have an idea hey didi
-KkJW8p2hPA,1295450,1304130,didi come here oh good hey I had a
-KkJW8p2hPA,1304130,1308950,question do you want to have a water  balloon fight
-KkJW8p2hPA,1311650,1339980,you get zero all right are you ready all
-KkJW8p2hPA,1339980,1348410,right now that we learn numbers 1 2 3 4  5 let's go find the next number look
-KkJW8p2hPA,1348410,1354860,that box back there  yellow box
-KkJW8p2hPA,1354860,1359970,oh wait a second that's not the next  number
-KkJW8p2hPA,1359970,1365530,let's get to this one later huh here's
-KkJW8p2hPA,1365530,1370840,another box yeah we found a box but wait
-KkJW8p2hPA,1370840,1381190,a second  do you see that that's not the next  number must be another one oh here's one
-KkJW8p2hPA,1381190,1387430,yeah we found a box look that is number
-KkJW8p2hPA,1387430,1395620,six one two three four five six alright
-KkJW8p2hPA,1395620,1415059,let's open it up and see what's inside I
-KkJW8p2hPA,1415059,1421020,love dinosaurs  okay let's see what ones we have a t-rex
-KkJW8p2hPA,1421020,1426640,that's number one  one ooh
-KkJW8p2hPA,1426640,1435420,a triceratops that's number two oh who a
-KkJW8p2hPA,1435420,1445210,Stegosaurus  whoa number three ooh Brachiosaurus or a
-KkJW8p2hPA,1445210,1451500,brontosaurus that's number four
-KkJW8p2hPA,1451630,1460720,well into little ones yeah so we have
-KkJW8p2hPA,1460720,1467440,one two three four five six dinosaurs  Wow
-KkJW8p2hPA,1467440,1476299,this is the perfect time for the blippi  dinosaur song  [Music]
-KkJW8p2hPA,1482530,1489649,dinosaur  prehistoric  so
-KkJW8p2hPA,1493090,1500030,stegosauruses were bigger than elephants  but their brains were the size of a
-KkJW8p2hPA,1500030,1505610,peppermint Triceratops had three oars on  their head
-KkJW8p2hPA,1505610,1513240,they ever needed  Ben  thesaurus had a really long neck it at
-KkJW8p2hPA,1513240,1518810,the end was a 50/50 head Tara
-KkJW8p2hPA,1518810,1523359,[Music]
-KkJW8p2hPA,1524919,1531789,it's  street  yes
-KkJW8p2hPA,1533850,1539510,dad  Oh
-KkJW8p2hPA,1540250,1551540,[Music]  [Applause]  oh geez I love dinosaurs
-KkJW8p2hPA,1551540,1560750,all right we've learned numbers one two  three four five six let's go find the
-KkJW8p2hPA,1560750,1565429,next number  [Music]
-KkJW8p2hPA,1566840,1574279,yeah I remember this one was the box  that came after the next one because we
-KkJW8p2hPA,1574279,1579970,already saw the number number settle  [Music]
-KkJW8p2hPA,1579970,1585049,what's inside I don't know let's open it
-KkJW8p2hPA,1585049,1598850,up it's a water filter huh it's not that
-KkJW8p2hPA,1598850,1603490,interesting maybe something's in here
-KkJW8p2hPA,1607840,1615110,construction toys that's way more cool  check them out a bulldozer
-KkJW8p2hPA,1615110,1620289,a dump truck a backhoe an excavator
-KkJW8p2hPA,1620289,1625929,another bulldozer whoa let's count them
-KkJW8p2hPA,1625929,1634450,one two three
-KkJW8p2hPA,1636559,1647830,five six seven oh I love construction
-KkJW8p2hPA,1647830,1653040,vehicles all right let's watch some in  the action
-KkJW8p2hPA,1653040,1694669,[Music]
-KkJW8p2hPA,1705990,1713130,oh I love construction vehicles they're
-KkJW8p2hPA,1713130,1720690,so cool how they can push things out of  its way and then also dig mmm
-KkJW8p2hPA,1720690,1728159,giant holes and dump stuff out of the  back haha alright so we have learned
-KkJW8p2hPA,1728159,1734190,numbers one two three four five six and
-KkJW8p2hPA,1734190,1742760,seven let's go find the next number oh  yeah we saw this number earlier remember
-KkJW8p2hPA,1742760,1750270,yeah the big yellow box whoa this one's
-KkJW8p2hPA,1750270,1758190,really heavy okay one two three four
-KkJW8p2hPA,1758190,1768980,five six seven eight and must be eight  things inside huh I wonder what's inside
-KkJW8p2hPA,1779260,1785570,awesome there's tools okay we have a
-KkJW8p2hPA,1785570,1790640,hammer we have a level whoo
-KkJW8p2hPA,1790640,1800320,pair of pliers move some allen wrenches  oh it's real
-KkJW8p2hPA,1800320,1810970,whoo that one was Wireless this has a  cord a paintbrush and a chalk line whoa
-KkJW8p2hPA,1810970,1822340,all right let's count them okay let's  see here we have one tool we have a
-KkJW8p2hPA,1822340,1830270,second tool which is a hammer so we have  a ham a hammer a drill another drill
-KkJW8p2hPA,1830270,1835330,which is number three one two three
-KkJW8p2hPA,1835330,1841360,chalk line four whoo allen wrenches five
-KkJW8p2hPA,1841360,1847280,pliers six a level whoa
-KkJW8p2hPA,1847280,1856670,seven and a paintbrush oh this is the
-KkJW8p2hPA,1856670,1863450,perfect time for the flippy tool song  when you're working with tools working
-KkJW8p2hPA,1863450,1871309,with tone  you hear all kinds of things when you're  working with tools working with tools
-KkJW8p2hPA,1871309,1879860,you hear all kinds of things the wrench  tightens pipes go in clang clang hammer
-KkJW8p2hPA,1879860,1886940,hits a nail go and bang bang bang a  drills making holes going when you're
-KkJW8p2hPA,1886940,1891970,working with tools you hear all kinds of  things when you're working with tools
-KkJW8p2hPA,1891970,1899350,working with tools you hear all kinds of  things when you're working with tools
-KkJW8p2hPA,1899350,1904570,working with toys  you hear all kinds of things
-KkJW8p2hPA,1904570,1910720,you hear thuds and squeaks klaxon rings  when you're working with tools you hear
-KkJW8p2hPA,1910720,1916510,all kinds of things you your bangs and  booms clangs and things when you're
-KkJW8p2hPA,1916510,1928000,working with tools you hear all kinds of  things  oh I love tools one two three four five
-KkJW8p2hPA,1928000,1933880,six seven eight oh  what's the next number all right you
-KkJW8p2hPA,1933880,1949420,gotta go find it oh oh I see the box way  over there run with me is the number
-KkJW8p2hPA,1949420,1957370,nine all right  wonder what's inside I bet there's nine
-KkJW8p2hPA,1957370,1965800,things of these whatever it is let me
-KkJW8p2hPA,1965800,1972700,glasses all right there's nine of them  you know what we have to do we have to
-KkJW8p2hPA,1972700,1977370,try them on so one
-KkJW8p2hPA,1978720,2030499,[Music]  three all right now we need to find the
-KkJW8p2hPA,2030499,2045740,next number I see the last package let's  go yeah last package whoa
-KkJW8p2hPA,2045740,2053839,I am so excited to see what's inside and  it has the number 10 on it all right
-KkJW8p2hPA,2053839,2061128,let's open it up package what's the
-KkJW8p2hPA,2061128,2071349,number 10 on it huh I wonder what's  inside  I'm so excited open up the blue package
-KkJW8p2hPA,2071349,2079638,whoa look at that  I'm bunch of markers oh hey and there's
-KkJW8p2hPA,2079638,2092919,ten markers okay one two three four five
-KkJW8p2hPA,2092919,2102390,six  seven eight nine ten
-KkJW8p2hPA,2102390,2111060,whoa ten colorful markers so it's a
-KkJW8p2hPA,2111060,2116720,blippi coloring book I think we should  color a page let's color the tenth page
-KkJW8p2hPA,2116720,2124590,okay all right  looks like the tenth page is blippi me
-KkJW8p2hPA,2124590,2131190,spraying water on a house with a fire  truck to save it all right let's make
-KkJW8p2hPA,2131190,2136770,the fire truck red okay nice red fire
-KkJW8p2hPA,2136770,2142859,truck there we go oh okay nice red fire
-KkJW8p2hPA,2142859,2155250,truck and then ooh my shirt can be the  color blue okay my hat can be blue yeah
-KkJW8p2hPA,2155250,2161000,and my suspenders and hat is also orange
-KkJW8p2hPA,2161960,2170580,perfect look it's me spraying water on  this house that it's caught on fire okay
-KkJW8p2hPA,2170580,2178050,fire is the color red  so let's color the fire whoa and we need
-KkJW8p2hPA,2178050,2191940,to save it with the water spraying so  let's color it with blue all right let's
-KkJW8p2hPA,2191940,2201890,color the house real quick whoa Brown  it's a brown house how about that
-KkJW8p2hPA,2204440,2214170,beautiful one last thing to color nice  lush plant right there okay that's the
-KkJW8p2hPA,2214170,2224520,color green perfect  wow what a masterpiece alright well this
-KkJW8p2hPA,2224520,2230990,was so much fun learning numbers 1  through 10 with you let's recite them
-KkJW8p2hPA,2230990,2239960,one two three four five six seven eight
-KkJW8p2hPA,2239960,2245609,nine ten whoa will you recite them again
-KkJW8p2hPA,2245609,2253290,with me okay this time let's do it a  little faster one two three four five
-KkJW8p2hPA,2253290,2261990,six seven eight nine ten alright well
-KkJW8p2hPA,2261990,2269640,this is the end of this video but if you  want to see more of my videos all you  have to do is search for my name will
-KkJW8p2hPA,2269640,2276210,you spell my name with me ready BL i PP
-KkJW8p2hPA,2276210,2279920,I flippy
-KkJW8p2hPA,2283440,2294980,[Music]
-KkJW8p2hPA,2294980,2302849,hey grownups do you have Instagram  awesome you and I should become friends
-KkJW8p2hPA,2302849,2314910,at blippi official Point Defiance Zoo
-KkJW8p2hPA,2314910,2320910,and Aquarium in Tacoma Washington and  today we are gonna see some awesome
-KkJW8p2hPA,2320910,2324470,animals let's go
-KkJW8p2hPA,2325990,2329920,got my members card
-KkJW8p2hPA,2331260,2340019,[Music]
-KkJW8p2hPA,2340019,2356060,here we go  [Music]
-KkJW8p2hPA,2356060,2363660,hey this is Cindy and what do we have  here Cindy that is a Pacific herring
-KkJW8p2hPA,2363660,2369070,whoa and we are about to go feed some  penguins  [Music]  [Applause]
-KkJW8p2hPA,2369070,2379320,[Music]
-KkJW8p2hPA,2379320,2385150,did you see how we walked up really low  you got to stay low so then they don't
-KkJW8p2hPA,2385150,2394200,get scared  so what trained the Penguins are these
-KkJW8p2hPA,2406400,2411440,[Music]  Argentina and Chile so they love the
-KkJW8p2hPA,2411440,2419180,swim it looks like huh they do these  guys spent all winter out at sea and  they can swim really fast and they have
-KkJW8p2hPA,2419180,2427080,to swim really fast so they can change  the pitch which is what they  like
-KkJW8p2hPA,2428880,2439509,[Music]
-KkJW8p2hPA,2443140,2450670,whoa look at what it is its employer and
-KkJW8p2hPA,2450670,2461840,polar bears are the color white that  polar bear yeah his name is Boris and
-KkJW8p2hPA,2461840,2469369,he's 31 years old Boris was rescued from
-KkJW8p2hPA,2469369,2476630,a circus a traveling circus in Mexico  and it's really important to have ice so
-KkJW8p2hPA,2476630,2483830,polar bears can hunt often and get get  seals in the Arctic so we should be
-KkJW8p2hPA,2483830,2489780,really aware of what we do to our planet  so polar bears can have a lot of ice
-KkJW8p2hPA,2489780,2498040,[Music]
-KkJW8p2hPA,2498040,2507930,Horace is so pretty  [Music]
-KkJW8p2hPA,2507930,2510980,[Applause]
-KkJW8p2hPA,2520800,2529680,do you see what that is yeah that's a  tiger that's a really big kitty cat
-KkJW8p2hPA,2529680,2536200,that's actually a Samara tiger to be  exact and there's only about 300 left on
-KkJW8p2hPA,2536200,2542410,this entire planet in the wild so here  at Point Defiance Zoo and Aquarium this
-KkJW8p2hPA,2542410,2559010,Tiger is an ambassador  [Music]
-KkJW8p2hPA,2559010,2565890,so this is Sarah hi and Sarah what do we  have here  this is gonzo and Pete is a
-KkJW8p2hPA,2565890,2571980,tree-climbing  anteater and here at pointed Lions do an  aquarium  we're training him to be part of our
-KkJW8p2hPA,2571980,2578280,wild wanders outdoors to get our show  that's brand new this summer so so what
-KkJW8p2hPA,2578280,2585660,are we gonna yeah what are we gonna be  doing right now you're gonna help me  train  gonzo to eat vanilla yogurt from a tube
-KkJW8p2hPA,2585660,2591090,okay also this is something that he  loved to do he'll go right up to his
-KkJW8p2hPA,2591090,2600450,little nose okay here we go to slurp out  with his super long time whoa well
-KkJW8p2hPA,2600450,2609540,gurgaon says tongue it's so long and he
-KkJW8p2hPA,2609540,2614790,has really big claws that he can use to  break open ants nests and termite mounds
-KkJW8p2hPA,2614790,2622680,and then he had uses long tongue to slip  those bugs right up whoo yum that looks  pretty tasty yeah so gonzo has been
-KkJW8p2hPA,2622680,2629970,around people his whole entire life and  when he first came here we started  training him to be part of the show so
-KkJW8p2hPA,2629970,2637870,that's why he's so comfortable hanging  out with us out here yeah he seems like  really great and fun anteater
-KkJW8p2hPA,2637870,2644260,[Music]
-KkJW8p2hPA,2644260,2649550,[Applause]  [Music]  oh pretty good what are you doing I'm
-KkJW8p2hPA,2649550,2655280,making some diamonds for the meerkats  meerkats I love meerkats what else are
-KkJW8p2hPA,2655280,2661730,you gonna do today well you know what I  was gonna do some enrichment you want to  help me yeah excellent
-KkJW8p2hPA,2661730,2667790,okay what's enrichment enrichment is  giving our animals choices things to do
-KkJW8p2hPA,2667790,2673490,things to play with kind of like kids on  a playground that's so much fun  I like playing so let's give them some
-KkJW8p2hPA,2673490,2679490,choices put these little balls and the  blue pool on exhibit okay
-KkJW8p2hPA,2679490,2690590,all right with the balls blue pool got  it this place this is the exhibit from
-KkJW8p2hPA,2690590,2696080,the habitat of where meerkats play okay
-KkJW8p2hPA,2696080,2700330,anywho back to it right
-KkJW8p2hPA,2709840,2722660,[Music]  hey hey go see what else she wants us to
-KkJW8p2hPA,2722660,2728360,do hey here you go thank you  what else do some more fun toys let's
-KkJW8p2hPA,2728360,2735050,put these out on the exhibit that's  right where should I put these wherever  you want this is gonna be fun where
-KkJW8p2hPA,2735050,2741010,should we put these here come on hey  let's see
-KkJW8p2hPA,2741560,2749320,see I think the yellow should go oh do  you see this let's put it right there
-KkJW8p2hPA,2749320,2755570,and then come back here let's put the
-KkJW8p2hPA,2755570,2760700,pink one right let's do this one right
