vid,start,end,text
ANatR1xnb_A,80,7120,we're playing minecraft in 24 hours no  we're not we're playing it for 24 hours  we are playing minecraft for 24 hours in
ANatR1xnb_A,7120,12240,virtual reality we're gonna put these on  and not take them off for 24 hours  that's right we're only allowed to eat
ANatR1xnb_A,12240,18800,real life if we eat in minecraft if we  eat watermelon then we have to eat a  watermelon if you want to eat raw beef  you have to eat raw beef if we need to
ANatR1xnb_A,18800,24880,go for poo-poos or pee-pees we take  these off and put these on these  wireless vr headsets what happens if you
ANatR1xnb_A,24880,32160,die in minecraft you get tased  okay there's the timer you know it's  real here we go ready
ANatR1xnb_A,33520,40399,all right hey oh don't hit me just  remember a couple of rules it is getting  late which means we have to make a house
ANatR1xnb_A,40399,46480,and we have to make a bed because if we  don't make a better minecraft we can't  sleep in real life no you can't sleep in  real life if you don't have a bed
ANatR1xnb_A,46480,52320,because we are going to sleep tonight by  the way with our headsets on at some  point we will fall asleep but we cannot  do it unless we have a minecraft bed i
ANatR1xnb_A,52320,57440,want some wings tonight come here  all right  wait do i need to make a crafting table
ANatR1xnb_A,57440,63359,first yes i made  oak uh  uh i don't know how to
ANatR1xnb_A,63359,71360,how to what don't say that oh  how do you what [ __ ] how do you [ __ ] in  minecraft molly i made a crafting table
ANatR1xnb_A,71360,76400,first time i've ever made a crafting  table in minecraft molly where are you
ANatR1xnb_A,76400,81600,i'm here turn around  turn around where are you  turn around
ANatR1xnb_A,81600,86799,oh there you are this is so cute  oh my god  me bro
ANatR1xnb_A,86799,92799,it feels it feels so weird when your  hand on my oh this is going great  there's gonna be a breeze lana how long
ANatR1xnb_A,92799,99759,have we spent in here five minutes  oh my god this is gonna be a nightmare  can we build a house how do i build a
ANatR1xnb_A,99759,106479,sword dude you ever seen what there's  like this little six-year-old kid and  all they do is ask you like why is the  grass green why is the sky blue how do i
ANatR1xnb_A,106479,112960,build a sword you're not even listening  oh the sun's going down  i don't know what i'm doing man where
ANatR1xnb_A,112960,118719,are you molly i'm over at my crop my  thing you're making me  where are you you're making me panic i
ANatR1xnb_A,118719,124399,say we build like a little house okay  look  look ready
ANatR1xnb_A,125360,130720,five wide by five look at this it's  beautiful in it that's kind of gay
ANatR1xnb_A,130720,136800,what do you mean you do realize that  when that sun goes down if we get  attacked by skeletons you will get tased  yeah what
ANatR1xnb_A,136800,142560,no don't you can hear it go go go go  yeah  oh don't touch me i forget we're playing
ANatR1xnb_A,142560,149440,survival and we actually do need to eat  food and game to um not die can you  build a crafting table in the corner i
ANatR1xnb_A,149440,157760,have a crafting table look are you proud  i built that myself bro if i die right  now bro we'll be so [ __ ] mad
ANatR1xnb_A,157760,163360,they're skeletons i heard them where are  you i heard them what the [ __ ] i got a  camera out what the what am i supposed
ANatR1xnb_A,163360,169120,to do with this good thing are you okay  molly you freaking out we need lights  it's getting dark
ANatR1xnb_A,169120,174160,all right i'm panicking what the [ __ ]  are you building you didn't supposed to  be like you've been like a jail or some
ANatR1xnb_A,174160,180560,[ __ ] how many would you just relax  i've farted like twice just in there's
ANatR1xnb_A,180560,185920,holes in the wall dude they're gonna  shoot arrows through it they're windows  oh there's a creeper coming where right
ANatR1xnb_A,185920,191680,there out the window he's right there  can he blow us up no he can't look he's  harmless
ANatR1xnb_A,191840,199840,don't do that what's a minecraft day  cycle like 20 minutes yes we're gonna  spend like a full year in minecraft
ANatR1xnb_A,202800,207840,they're like gingers come out here  little skeleton  oh
ANatR1xnb_A,207840,213519,you've done it i've got a sword and then  two sticks down oh  yep
ANatR1xnb_A,213519,220720,yep i told you man i am learning so much  right now oh yeah enough yeah
ANatR1xnb_A,223680,228720,i love this game bro what's this thing  no that's the thing don't go oh that's  the cow i'm going to come over this way
ANatR1xnb_A,228720,233200,no come this  which way molly
ANatR1xnb_A,233840,241599,they're coming oh my god the skeleton  right there there's like three cravings  run around the house idiot i don't want  to get tased molly let me end my
ANatR1xnb_A,241599,248159,eyes close the door  oh [ __ ] this thing  through the door through the window i
ANatR1xnb_A,248159,254480,told you  i told you this was gonna happen i told  you this was gonna happen
ANatR1xnb_A,254480,259519,alana can you put my shoes on for me oh  you smacked me in the head sorry molly i
ANatR1xnb_A,259519,267240,can see you through the window are you  doing something weird no it's putting my  shoes on oh my god this the spot is  climbing
ANatR1xnb_A,270650,277919,[Applause]  could climb walls now that i say it out  loud it seems really obvious
ANatR1xnb_A,278000,284400,all right day three i'm hungry oh my god  you sound like christy i stood your  chicken
ANatR1xnb_A,284400,289680,why turn it back on  you need more in it bro you're the one  that took the chicken out let it cook
ANatR1xnb_A,289680,294840,you don't get to eat right mate there's  a chicken right up there i'm gonna go  kill him come here chicky boy i'm
ANatR1xnb_A,294840,302160,hungry whoa [ __ ] i heard that did you  hear that listen to this  i'm up here killing people up here bruh
ANatR1xnb_A,302160,307360,what's up  wait can i just draw your attention to  that
ANatR1xnb_A,307360,313919,hole in the mountain that's seeping  liquid out of it doesn't that look like  a girl's [ __ ] after you've ma look
ANatR1xnb_A,313919,320639,nice look at that hole over there in the  in the mountain it looks like a  waterfall it's been like 10 o'clock at  night and i'm in minecraft in our office
ANatR1xnb_A,320639,327840,we rented  we're doing some gay challenge for a gay  video and i'm cutting holes in the  ground in minecraft trying to find coal
ANatR1xnb_A,327840,333520,i found coal i am underappreciated in  this group dude honestly i'm [ __ ]  undervalued
ANatR1xnb_A,333520,340320,i'm finding so much coal  i love minecraft dude  i'm bipolar look at all the cold down
ANatR1xnb_A,340320,347440,there bro oh [ __ ] sorry oh there's like  a whole thing  what the [ __ ] did you do that for
ANatR1xnb_A,347440,353120,oh  i can hear him coming miley why did you  do that  i'm sorry i just i'm gonna get a taste
ANatR1xnb_A,353120,357759,you [ __ ] idiot i just had the urge to  do it i'm sorry
ANatR1xnb_A,359440,366400,lana how many hours have we been in here  for almost one  ah  i ate chicken in game can i please have
ANatR1xnb_A,366400,372319,a piece of chicken in real life i didn't  bring the chicken they only bought the  steak oh damn it we haven't found any
ANatR1xnb_A,372319,377919,cows in game of three socks in minecraft  i'll give you the chicken back if you  give me some steak oh this is yummy yum
ANatR1xnb_A,377919,384880,yum yum thank you  are you lying to me this isn't steak  this is lamb close enough
ANatR1xnb_A,384880,391440,no you can't give me my food i i ate my  [ __ ] in games  he can't have a steak in real life  because he ate lamb not cow are you
ANatR1xnb_A,391440,396479,serious we have to go out and find cow  [ __ ] ah
ANatR1xnb_A,397039,402479,goddamn cows mates  mother cows look is there really no
ANatR1xnb_A,402479,407280,where look  yes this
ANatR1xnb_A,407600,414319,all right is got an option here we can  eat the raw beef nope no look this is  iron oh
ANatR1xnb_A,414319,419840,look he's so excited i'm sorry  so far
ANatR1xnb_A,419840,426000,minecraft vr  wild success here's my beef look it is  my steak
ANatR1xnb_A,426000,432560,bang there's mine done  that is so good that was worth it that
ANatR1xnb_A,432560,437680,actually tastes fantastic god you sound  disgusting wow this is so immersive all
ANatR1xnb_A,437680,444400,right i'm going to eat it in game  and i want it in my mouth as i eat it
ANatR1xnb_A,445520,451039,oh this isn't massive this minecraft  steak is flushing
ANatR1xnb_A,451440,456479,can you take my can  god it's like having two children thank  you
ANatR1xnb_A,456479,462840,that is our [ __ ] goal it's not to  find the diamonds  it's to find the
ANatR1xnb_A,462840,470400,cake listen to me what everyone goes  into minecraft  and they get diamonds everyone does
ANatR1xnb_A,470400,476319,didn't they yeah yeah i'm making wine  dude  what do you want if we find a cake in
ANatR1xnb_A,476319,481680,minecraft how do we get the cake i don't  know my quest for the cake begins wish
ANatR1xnb_A,481680,486879,me luck molly  you scared me yeah it was a creepy just  blew up as soon as i went to go on my
ANatR1xnb_A,486879,492199,cake adventure i feel like i'm  like
ANatR1xnb_A,492319,498080,ah i found redstone  will i find diamonds first or will you
ANatR1xnb_A,498080,504000,find cake first yeah is it possible to  be too deep like  like drugs and
ANatR1xnb_A,504000,510000,no like to find diamonds oh  maybe i'm waiting for uh daytime to come
ANatR1xnb_A,510000,517120,around  what just touched me i found a cow oh  and i found a horse
ANatR1xnb_A,517120,522800,i'm cutting down a tree  just say it like that i'm actually  holding off
ANatR1xnb_A,522800,528160,on eating my chicken in-game just so i  can eat in real life and experience the  full minecraft virtual reality
ANatR1xnb_A,528160,534320,experience i just did a fart  me me me me  i don't know what level diamonds are so
ANatR1xnb_A,534320,541279,i'm just digging man like  chicken's ready  oh
ANatR1xnb_A,542720,548880,i just ate chicken in minecraft  mmm bones
ANatR1xnb_A,548880,554800,hmm god it is so weird hearing someone  eat  i'm sydney eating me chickens foreign
ANatR1xnb_A,554800,561120,music started playing bro what the [ __ ]  oh my god a real cool minecraft cooking  what's that mean
ANatR1xnb_A,561120,567040,ah  josh stop eating what's the horror music  mean butter yeah
ANatR1xnb_A,570000,577000,what would you give minecraft chicken  out of sam it was probably an eight i  would have been better without bones
ANatR1xnb_A,579680,584959,stop swinging stop swinging around did  that scare you bro sorry oh don't touch  me
ANatR1xnb_A,584959,591279,did you find a cake yet no but i did  find a potato
ANatR1xnb_A,591279,596880,ah oh my god that's [ __ ] disgusting  wait are you eating a potato in real  life right now that's how it works molly
ANatR1xnb_A,596880,602200,that's how this works come on little guy  please lay an egg before i get killed  why is that horror music playing to
ANatR1xnb_A,602200,607920,minecraft maybe that's oh  you will die  yes
ANatR1xnb_A,607920,616000,i found diamonds  i found diamonds bro okay okay oh bro
ANatR1xnb_A,616000,621680,yes diamonds  i'm [ __ ] lit  i'm the best at this game i told you
ANatR1xnb_A,621680,627360,well it took me two and a half hours to  find some this has brought me greater  joy than the time i paid my mom's house  off all right i'm gonna have a bit of
ANatR1xnb_A,627360,632920,potato i'll cook this potato in game i  think i earned it
ANatR1xnb_A,632959,638880,oh my  god minecraft food  tastes just like real food in vr look
ANatR1xnb_A,638880,644959,what  diamond sword diamond sword dinosaur
ANatR1xnb_A,644959,650160,yes oh do you want baked potato  yeah okay all right put the sword away
ANatR1xnb_A,650160,655200,or i'm not coming over there before you  have your teddy i'm gonna have your  carrot mate i'm just gonna try and
ANatR1xnb_A,655200,663200,this is so gay molly oh sorry i'm sorry  first virtual reality carrot
ANatR1xnb_A,664079,670480,all right don't lifting out rice  there it is all right  is that in your yummy
ANatR1xnb_A,670480,675600,is that in the yummy no  um
ANatR1xnb_A,675600,681759,my favorite  does it taste like a real carrot that's  fantastic
ANatR1xnb_A,682640,688880,did you have some yeah okay give me  potato you know what let me just say  this
ANatR1xnb_A,688880,694480,i was expecting like a big girthy carrot  i'm gonna eat the potato in minecraft  and you're gonna put the potato on my
ANatR1xnb_A,694480,702399,mouth in real life i understand ready  this is so [ __ ] weird how does
ANatR1xnb_A,702399,708079,minecraft chips taste  cold  what the [ __ ] is that a carrot carrot on
ANatR1xnb_A,708079,714160,a stick you ready  why do you have a carrot on a stick bro  you guys want to see what it's like
ANatR1xnb_A,714160,719680,ah  wait what's in here nothing you're
ANatR1xnb_A,719680,725200,telling me we came all the way up here  for nothing we didn't come up here for  nothing mate look at the view look at
ANatR1xnb_A,725200,730519,the view ah  [ __ ]
ANatR1xnb_A,740399,745920,i'm never dying in minecraft again  oh god
ANatR1xnb_A,745920,751440,damn it what happened i died again no  way  oh
ANatR1xnb_A,751440,757240,god damn it minecraft milk  oh
ANatR1xnb_A,758800,764560,dude i found like a temple what the [ __ ]  i don't know if this is gonna be bad but  i'm gonna go down here and have a look
ANatR1xnb_A,764560,770160,dude there's treasure down here oh  what enchanted golden apple i'm gonna
ANatR1xnb_A,770160,775680,eat the golden apple  what happened to you you just got purple  [ __ ] flying out of you
ANatR1xnb_A,775680,779600,oh my god what's that  i don't know
ANatR1xnb_A,780870,786800,[Music]  oh my [ __ ] god i had half a heart  left
ANatR1xnb_A,786800,794480,i had half a heart left bright almost  [ __ ] died  yeah screamed so high pitched
ANatR1xnb_A,794480,799320,i'm sorry  god that ted
ANatR1xnb_A,802639,808000,good morning molly good morning how many  hours in are we three hours 41 minutes
ANatR1xnb_A,808000,813040,so we've been about four hours in molly  i think it's about time  that we learned how to fish now it's all
ANatR1xnb_A,813040,818639,in the wrist okay  no  oh oh
ANatR1xnb_A,818639,824800,do you see that you see me catch the  fish um you see my fish see the fish  molly you see that yeah all right we're
ANatR1xnb_A,824800,831440,fishing together you want to see  something dude yeah  look  oh look at him
ANatR1xnb_A,831440,836959,i just ate fish in minecraft  this is so weird did i drop some fish on
ANatR1xnb_A,836959,843040,the ground yes i did and i think  get off get your head in the [ __ ]  game  what's that noise
ANatR1xnb_A,843040,848480,it's the [ __ ] enderman  oh my god
ANatR1xnb_A,849279,855639,what the [ __ ] can you get him can i have  some fish  now
ANatR1xnb_A,856000,864000,i'm a good cook dude that's a good  minecraft fish alana yeah can you take  me to the toilet yeah yes yes i need to
ANatR1xnb_A,864000,867560,pee okay
ANatR1xnb_A,870000,876320,all right i cannot see anything you have  to sit down pee  oh yeah [ __ ] i do have to sit down to
ANatR1xnb_A,876320,882079,pee i'm so sorry i'm 28 and you need to  take me to the toilet oh sorry alone
ANatR1xnb_A,882079,889040,where am i going it's the men's toilet  doorway all right can you buy the toilet  yes
ANatR1xnb_A,894000,899839,josh what i went to the toilet man  thanks
ANatR1xnb_A,901040,906480,all right i'm in bed where's my bedding  in real life can you please um
ANatR1xnb_A,906480,911680,uh  like get me some cake when i'm laying  down and then come get me yeah all right
ANatR1xnb_A,911680,917279,thank you what the [ __ ] do you call this  like a little camping match you know  what this is actually somewhat peaceful
ANatR1xnb_A,917279,922639,there's a torch burning above my head  right now kind of actually really cool  i'm just glad that you're having a good
ANatR1xnb_A,922639,929600,day i can hear opening that chest down  there can you stop it i'm trying to i'm  trying to have a nap sorry are you gonna  come to bed with me
ANatR1xnb_A,929600,934880,we're gonna have a little sleepy time  together all right what's the  ingredients for a cake you're gonna need  wheat
ANatR1xnb_A,934880,941199,you're gonna need eggs  give me a little kiss
ANatR1xnb_A,951920,957040,i made the cake but i was too late
ANatR1xnb_A,963040,969040,what the [ __ ] was that  cake little cake  i'm scared i haven't even seen the cake
ANatR1xnb_A,969040,974530,in vr yet how are those even cake we'll  come downstairs and i'll have a look no  god i'm stuck
ANatR1xnb_A,974530,983160,[Music]  why are you moaning weird  hard your sister's feeding you cake
ANatR1xnb_A,985040,991759,do you want some cake molly  no  you don't want cake  i don't want none of your [ __ ] cake i
ANatR1xnb_A,991759,1000600,stayed up all [ __ ] night making you  this minecraft cake  and you didn't even eat it
ANatR1xnb_A,1011360,1017040,molly what  oh what the [ __ ] is this
ANatR1xnb_A,1017040,1023279,oh you why did you burn the house down  because you didn't eat my [ __ ] cake
ANatR1xnb_A,1024880,1029918,wait molly let me explain to you what  happened shut up for a second let me  explain to you what happened i was
ANatR1xnb_A,1029918,1034959,snoozing right  then i hear this noise and josh goes
ANatR1xnb_A,1034959,1041199,molly  wake up and i wake up and i'm on fire do  you have the taser in your hand
ANatR1xnb_A,1041199,1047760,take them  you know what you can't tase me again if
ANatR1xnb_A,1047760,1053600,i don't respawn that you're coming you  have to respawn no i don't yes you do oh
ANatR1xnb_A,1053600,1059039,you want to get it again  uh-huh what did you say  right you want to get it again all right
ANatR1xnb_A,1059039,1067039,i have something to admit lana i died as  well did you really yeah i did oh i did  not know that
ANatR1xnb_A,1067039,1072320,just hurry up just  no  wait no i'm sorry
ANatR1xnb_A,1072320,1079240,i don't feel safe endless fear into him  instill fear into him
ANatR1xnb_A,1079780,1087360,[Laughter]  you are having more fun than us if you  come to a house that i am sleeping in
ANatR1xnb_A,1087360,1094720,again and burn it down to kill me and  you let all my hearts go down and then  you said molly wake up man
ANatR1xnb_A,1094720,1099919,look we can talk about this in the  morning okay i spent all [ __ ] day  making a cake i turn around i come
ANatR1xnb_A,1099919,1105679,upstairs and then you are snoring your  little [ __ ] titties off yeah cause  i'm tired turn the heat up just a tad
ANatR1xnb_A,1105679,1111520,too much on the thermostat and you start  getting a whingie is that why you've  been spending like two hours trying to
ANatR1xnb_A,1111520,1118640,find more flint  no and i need to pee  you realise that don't you what's that i
ANatR1xnb_A,1118640,1124080,said i would have done the same to you  lana can you help me i don't know what's
ANatR1xnb_A,1124080,1130320,happening can i just say before you go  to the toilet yeah it is so terrifying  sitting here not being able to figure
ANatR1xnb_A,1130320,1138640,out what's going on  and your sister is standing there  just do you have a taser yes oh no
ANatR1xnb_A,1138640,1145679,this is a really [ __ ] up thing to do  to somebody  why couldn't we just go with the bucket  idea
ANatR1xnb_A,1146880,1150840,that's the doorway to the toilet
ANatR1xnb_A,1152880,1155200,hello
ANatR1xnb_A,1159840,1164960,i peed by myself  i'm half expecting to come back and
ANatR1xnb_A,1164960,1170960,molly just isn't wearing the headset and  just smacks me in the face with a like  a pen or something i don't know why you
ANatR1xnb_A,1170960,1177440,guys walk so slow though lana look this  might be all funny games for you with  your [ __ ] taser and [ __ ]
ANatR1xnb_A,1177440,1182880,but it isn't for us okay okay that's  good  okay
ANatR1xnb_A,1182880,1188640,i peed molly yeah nice yeah  it's [ __ ] terrifying
ANatR1xnb_A,1188640,1195840,oh  that was a nightmare i am never pissing  again anyway love you good night
ANatR1xnb_A,1199520,1205919,oh just be quiet oh this is nice  i was hoping to have a nice  minecraft session with you now i'm
ANatR1xnb_A,1205919,1211919,sleeping in a [ __ ] cave so oh you're  in a cave i'm sleeping in a cave molly  i'm not like
ANatR1xnb_A,1211919,1218240,out to get revenge as far as i'm  concerned we have turned over a new leaf  this is exactly what like blind people
ANatR1xnb_A,1218240,1223919,go through every day molly  i don't know if i want to be blind
ANatR1xnb_A,1223919,1229799,it's not ideal  it isn't is it
ANatR1xnb_A,1234480,1239440,oh no i need to go toilet there you go  toilet
ANatR1xnb_A,1241440,1249799,off we go  no  where's the door
ANatR1xnb_A,1253200,1259840,good job  thank you  you know how many times i woke up to  like my headset digging into my [ __ ]
ANatR1xnb_A,1259840,1266320,cheekbones and i just wanted to rip it  off now we just all sound sick what the  [ __ ] is going on i don't want to step on
ANatR1xnb_A,1266320,1272679,josh nighttime in minecraft which means  we get to go back to sleep thank you  lana
ANatR1xnb_A,1285679,1294080,i know just so weird to wake up in vr  the nightmare is real can you make bacon  and eggs and minecraft
ANatR1xnb_A,1295919,1301760,it's  bro this is [ __ ] [ __ ] there has  been a spider
ANatR1xnb_A,1301760,1307039,screaming at the front of my cave  for the past [ __ ] three hours dude
ANatR1xnb_A,1307039,1314960,i'm gonna kill this [ __ ]  would you shut up  god that sleep actually wasn't too bad
ANatR1xnb_A,1314960,1319640,it wasn't but i feel sick now
ANatR1xnb_A,1320240,1326480,burning houses down again area i thought  you were i thought you were asleep in  one of these houses hey you came to burn
ANatR1xnb_A,1326480,1331919,my [ __ ] house down again you  [ __ ] get the [ __ ] away from me  you thought i was asleep in one of these
ANatR1xnb_A,1331919,1337840,houses and you're coming to burn them  down i see  you're a [ __ ] dog you know that
ANatR1xnb_A,1337840,1344480,get the [ __ ] away from me man you should  not have a flint and still bro put the  flint steel away and i won't kill you
ANatR1xnb_A,1344480,1350480,what is this [ __ ]  okay stop stop stop stop back up back up
ANatR1xnb_A,1350480,1356640,back up i just woke up you just woke up  and you kind of go in the house is down  because you thought i was in a house  look at the house over there that was
ANatR1xnb_A,1356640,1362640,jim's house don't don't put the arrows  down  no
ANatR1xnb_A,1362720,1369440,a lot of please do what must be done  you get me the same place every time
ANatR1xnb_A,1369440,1375919,okay can we have a truce now well you  just tried to chase me down i literally  have nothing okay come here okay let's
ANatR1xnb_A,1375919,1383120,give him a cuddle don't don't  accidentally hit me though because i  don't know  all right all right there we go all  right truce yes you've been tased twice
ANatR1xnb_A,1383120,1390320,we have a truth we're starting this day  as as the day you're being born confused  and being electrocuted i dug for three
ANatR1xnb_A,1390320,1395679,hours last night to get diamonds can i  have that back i will not kill you i  will no i don't trust you we have a
ANatR1xnb_A,1395679,1401600,truce now no i no i don't trust you at  least give me my [ __ ] diamond sword  back no i'm holding this because i'm the
ANatR1xnb_A,1401600,1408000,more responsible one of us this is all  for protection for me against you all  right whatever alana how many hours are
ANatR1xnb_A,1408000,1414000,left five hours and 21 minutes so we had  a good nap we had a good sleep but now  we have to do five more hours of this
ANatR1xnb_A,1414000,1420159,goddamn nightmare i'll show you where i  hid alana yeah if i die again can you  taste the other arm because this one's
ANatR1xnb_A,1420159,1423600,really sore still from last night
ANatR1xnb_A,1427840,1433120,what do you think  it's fantastic but you were so you were  hiding last night i was hiding dude and
ANatR1xnb_A,1433120,1442399,then you woke up i was trying to shoot  the houses with flaming arrows  oh you [ __ ] [ __ ] come here okay
ANatR1xnb_A,1442480,1447600,oh  let's try and not get tased for the rest
ANatR1xnb_A,1447600,1452640,of us all right we know that there's  been too much chasing if she has to  start recharging it i can't believe you
ANatR1xnb_A,1452640,1458159,in that cave all day you really are  [ __ ] golem 8.
ANatR1xnb_A,1458159,1464640,i honestly just want this to be over now  the first thing i'm going to do when i  get home is take a [ __ ] i wonder if  anything's changed in the outside world
ANatR1xnb_A,1464640,1470480,trump is president again  where's the [ __ ] chicken  cause i i'm hungry alana can you order
ANatR1xnb_A,1470480,1476240,some chicken that's not wings we have  old chicken no lamb  no no chicken steak
ANatR1xnb_A,1476240,1482240,no i want chicken what kind of chicken  just like chicken nuggets or something  okay
ANatR1xnb_A,1482240,1488080,dipping sauce  ah barbecue please  is that barbecue sauce from minecraft
ANatR1xnb_A,1488080,1491120,oh okay no sauce
ANatR1xnb_A,1493120,1498720,bro  i didn't do that  anyway let's go now i'm serious when i  say this i'm actually starting to feel
ANatR1xnb_A,1498720,1505120,like this is normal waking up in it and  this is all i've known since my last  time i've like lost consciousness
ANatR1xnb_A,1505120,1511440,this is normal oh chicken  oh you really want that chicken today  don't you you want there's no
ANatR1xnb_A,1511440,1517600,all right now i need to find a fire wait  you need to get a chicken now i only got  one chicken yeah chicky chicky
ANatR1xnb_A,1517600,1523120,okay we're going to look for a new  village to overrun i mean settle in
