vid,start,end,text
ANatR1xnb_A,1523120,1528799,oh jesus christ oh i need to look down  when i'm walking there's a big cave
ANatR1xnb_A,1528799,1534559,there's something about minecraft nature  i know what you're saying that is  beautiful like look at this dude look at
ANatR1xnb_A,1534559,1540000,the like the way the  mountain is and with the water and [ __ ]  it's looking so sick josh and malian
ANatR1xnb_A,1540000,1547120,another way wayward adventure oh what's  that over there yeah what is that thing  i don't know
ANatR1xnb_A,1547440,1553120,oh it was just some flowers next to some  sand oh it's like a giant mushroom  what the hell i never seen that [ __ ]
ANatR1xnb_A,1553120,1558400,before  well let's have a look at this what's it  give you  i think it's just a yeah what does it
ANatR1xnb_A,1558400,1565039,give you gives you nothing  you're probably going to trip balls  later though there's so many of them
ANatR1xnb_A,1565039,1570320,we're going to eat so many nuggets do  you realize this don't you oh me too  dude i'm starving look at the baby pig
ANatR1xnb_A,1570320,1575600,its head is normal sized  oh my god
ANatR1xnb_A,1576159,1582159,you just don't dude that baby pig looked  like a pop vinyl  what the hell is that
ANatR1xnb_A,1582159,1587600,jesus christ that is a massive it can be  village up ahead oh god this poor little
ANatR1xnb_A,1587600,1594000,village look they've even got like a  little  fence hello  hello everybody oh there's a cat they've
ANatR1xnb_A,1594000,1599360,got cat oh look at the little kitties  they're running away they're too smart  for this because they know exactly what
ANatR1xnb_A,1599360,1604640,you're about to kill i know this giant  iron golem is going to beat the [ __ ] out  of me cooked chicken i've got three
ANatR1xnb_A,1604640,1610240,cooked chickens are you cooking me some  potatoes and chicken  yes sir i have 12
ANatR1xnb_A,1610240,1617120,baked potatoes only in ethiopia is that  a flex okay just just relax is there a  bed in here i have a bed
ANatR1xnb_A,1617120,1625559,i'm putting my bed right here  sleepy molly was shot by josh dub his  sleepy molly went up in flames
ANatR1xnb_A,1628240,1634080,oh what the [ __ ] was that noise what was  that noise  oh look it's like a flying dragon thing
ANatR1xnb_A,1634080,1640960,oh sh  oh my god  that jesus what the [ __ ] what's that i
ANatR1xnb_A,1640960,1646399,thought this was a kid's game  nightmare material look as long as we  got the iron golem we're safe you're
ANatR1xnb_A,1646399,1651679,gonna die out there bro i'm watching you  from the door got him oh you got him big
ANatR1xnb_A,1651679,1657279,dude's gonna come up holy [ __ ] yeah two  hits good job mr gollum so you get
ANatR1xnb_A,1657279,1663600,flipped from gravel yeah shoveling it  yeah  shovel was like
ANatR1xnb_A,1664399,1669679,i'm good oh [ __ ] jesus oh god that  hurt ah you okay
ANatR1xnb_A,1669679,1675919,where are you  i'm good i had one and a half hearts  left  how far are the nuggies
ANatR1xnb_A,1675919,1683120,one minute away nice i'm gonna eat my  chicken as soon as it arrives hello  little gingy cat
ANatR1xnb_A,1683120,1688240,meow  all right should we find a cave to go  down him
ANatR1xnb_A,1690000,1695679,yo did the nuggets arrive yeah uh i'm  eating my chicken right now see everyone  witnessed this well careful run run run
ANatR1xnb_A,1695679,1702159,run run quick kill the skeleton i'm  [ __ ] killing it jesus  oh creeper creeper oh i was supposed to
ANatR1xnb_A,1702159,1708320,give you one eight or three of them my  bad you ate all the [ __ ] chicken yeah  sorry i forgot i had to give you one
ANatR1xnb_A,1708320,1713679,i was really looking forward to nuggets  no you get no  you get no nuggets
ANatR1xnb_A,1713679,1719520,i'm sorry bro i forgot i had to give you  one [ __ ] josh i have a whole box  of nuggets and guess what i ate all the
ANatR1xnb_A,1719520,1724559,chicken so you get none yeah i know you  have to remind me hmm these nuggets are
ANatR1xnb_A,1724559,1730159,delicious bro  and the man  josh behind the water don't look at it
ANatR1xnb_A,1730159,1737039,don't look at it there's [ __ ] anime  everywhere dude these nuggets are  delicious bro i wish you could have one
ANatR1xnb_A,1737120,1742159,okay  no need for that  [Music]  what the [ __ ] was that that sound like a
ANatR1xnb_A,1742159,1749279,witch hey what the [ __ ] was that oh that  is creepy i can't see it anywhere  curiosity killed the molly it's up there
ANatR1xnb_A,1749279,1755600,bro i swear i can [ __ ] hear it all  right well i think we should probably  get out of here now there's cave systems  not for us how many nuggets are left
ANatR1xnb_A,1755600,1760799,another 10 pack oh it's another 10 pack  nice so if i get a chicken and cook it  and eat it again i'll get those ones as
ANatR1xnb_A,1760799,1768158,well i can just leave you down here oh  that was accident that was accident with  10 nuggets remaining
ANatR1xnb_A,1769600,1775760,why do you keep saying you're gonna  leave me to stop we're not talking about  minecraft now this is real life i'm not  gonna steal your chicken nuggets bro i'm
ANatR1xnb_A,1775760,1781840,gonna find a chicken cookie and give it  to you if i don't have ten nuggies today  i don't know if i'm going to make it
ANatR1xnb_A,1781840,1785039,we need to find the village dude
ANatR1xnb_A,1788240,1794320,back in the hole that [ __ ] that we can't  go upstairs we can't go upstairs this is  where we're mold people now no this is
ANatR1xnb_A,1794320,1799919,not don't kill me this is not my problem  okay i'll give you the chicken chicken's  on the ground there you go you got it  you picked it up to send put the bow
ANatR1xnb_A,1799919,1804960,down  i gave you the chicken you get to eat
ANatR1xnb_A,1806880,1812720,i'm gonna eat my chicken  was that yummy good minecraft did you
ANatR1xnb_A,1812720,1818640,eat three pieces of chicken and eat ten  nuggets you eat all the nuggets dude  once you eat the chicken yeah that's not  how it works
ANatR1xnb_A,1818640,1827360,if you put all the nuggets together it  becomes the same size as the chicken  it's not one nugget per chicken [ __ ]
ANatR1xnb_A,1827360,1834039,just eat all the nuggies eat them all  shut up you sound like you need them
ANatR1xnb_A,1836000,1841440,i'm very very yummy  i don't really understand
ANatR1xnb_A,1841440,1847039,what the [ __ ] was that did you hear that  what it was like a weird noise i don't  know explain it just be a bit more
ANatR1xnb_A,1847039,1850039,specific
ANatR1xnb_A,1852640,1858159,he just popped up dude  kill him josh he's freaking out
ANatR1xnb_A,1859120,1865120,where'd he go i don't know what's  happening i don't know what's happening  i'm freaking out freaking out can you  hear those noises yes i can't wait with
ANatR1xnb_A,1865120,1870399,all the [ __ ] up noises in this game  man  i don't know i don't know
ANatR1xnb_A,1870399,1876480,bro i would love to see what the ender  dragon looks like in vr we'll go to the  nether if you want no
ANatR1xnb_A,1876480,1881760,okay  [Music]
ANatR1xnb_A,1881760,1887600,i could go for a nap right now oh oh  molly  slight problem we're under an ocean just
ANatR1xnb_A,1887600,1893120,be careful swimming  up right swim swim swim  oh what the [ __ ]
ANatR1xnb_A,1893120,1899600,you set us up run molly run run run just  run get in what are you doing
ANatR1xnb_A,1900640,1910000,hello all right looks like this is where  we're waiting for us tonight  my eyes are so sore hello piggy
ANatR1xnb_A,1912880,1920399,i just can't wait for there to be a time  where i'm not hearing constant  zombie groans in my ear
ANatR1xnb_A,1920399,1925919,oh there's a village over there where  right there it's the same village are  you sure yeah it is from we came from
ANatR1xnb_A,1925919,1933279,the other angle wait let's go have a  look it's been like three hours on the  ground popped back up with right back at  home damn that diamond shirt used all my
ANatR1xnb_A,1933279,1938399,diamonds i need a good toilet liner good  luck my friend
ANatR1xnb_A,1943679,1949398,this way  okay all right
ANatR1xnb_A,1950159,1956240,i feel like this is what it would be  like having like a  a creepy old grandpa chasing you
ANatR1xnb_A,1958320,1965760,are you ready  how long do we have left lana two hours  15 minutes 19 18 seconds oh we're almost
ANatR1xnb_A,1965760,1973760,at the two hour mark  we're actually gonna do it lana  what  how much longer do we have left
ANatR1xnb_A,1973760,1981440,one hour 54 minutes uh minecraft was a  mistake and this idea was [ __ ] i'm just
ANatR1xnb_A,1981440,1987440,cutting [ __ ] molly do you hear that yeah  one hour left one hour left  what's going on in the last hour what
ANatR1xnb_A,1987440,1992880,are we doing i'm currently mining  through the ground i don't know what  molly's doing molly what are you doing
ANatR1xnb_A,1992880,1998640,i'm digging  let me be myself someone die
ANatR1xnb_A,1998640,2003840,no  we are not giving you the satisfaction  of taser skin if i do kill you then it's
ANatR1xnb_A,2003840,2009120,still it's a fair taste you could say  it's a fair taste work  don't you [ __ ] dare
ANatR1xnb_A,2009120,2018000,i'm surviving this last now bro  i'm not gonna kill you you said if i  kill you that's a good day's tasen
ANatR1xnb_A,2018000,2024640,no i said that's a good tase work it was  a pun  you're never gonna follow me bro  i don't even know where i am oh i found
ANatR1xnb_A,2024640,2030480,your entrance  no you didn't are you being serious  right now i'm coming for you give it a  run
ANatR1xnb_A,2030480,2035919,i can hear you morning  i'm panicking i'm bad again how many
ANatR1xnb_A,2035919,2041120,times how much how much time do we have  left  38 minutes 38 minutes to hunt molly oh
ANatR1xnb_A,2041120,2046559,no  oh nice try with your little booby trap  what people trap yeah that's right i've
ANatR1xnb_A,2046559,2053040,found it now haven't i  no way dude how much did you block up  behind you a lot god you're really worth
ANatR1xnb_A,2053040,2059800,freaking out weren't you  i can't see your name play anywhere
ANatR1xnb_A,2062398,2069520,you're trying to throw me off i keep  finding the tunnel again molly  oh no
ANatR1xnb_A,2070398,2078320,i can see the nameplate i've just  can't believe i actually made it this  far and i found your other tunnel
ANatR1xnb_A,2078320,2085320,oh i'm cruising up on you now have i  lost your name play i can't see it  anymore
ANatR1xnb_A,2101280,2106800,can we do it coming up oh jesus  okay
ANatR1xnb_A,2106800,2115800,open up johnny wants to play  i'm panicking don't panic molly just  embrace the taser oh no
ANatR1xnb_A,2116560,2121839,stop it josh this is [ __ ] up  fine be that way i am so proud of myself
ANatR1xnb_A,2121839,2127200,that i actually caught you yeah well  don't kill me because i don't want to  get tased well look i found you
ANatR1xnb_A,2127200,2132720,i'm heading back to the castle  i'm just on the roof  uh
ANatR1xnb_A,2132720,2138880,how much time we got left lana  15 minutes oh my god don't worry you'll
ANatR1xnb_A,2138880,2144480,make it you're not getting tased again  till at least the next video  four
ANatR1xnb_A,2144480,2149119,three all right do it slowly mom  one
ANatR1xnb_A,2150240,2156079,what's it like out there my eyes are  stinging wait wait wait wait wait don't  tase
ANatR1xnb_A,2156079,2162160,don't  that's not the part of the [ __ ] rules  get out
ANatR1xnb_A,2162160,2169040,whoa look at your face  look at your face dude  man oh my god we did it
ANatR1xnb_A,2169040,2175359,reality is weird this feels really  strange i actually feel uncomfortable in  real reality now
ANatR1xnb_A,2175359,2182119,it puts it back on okay i'm done  i'm done  put the camera away
