vid,start,end,text
e94zWmu58ZY,2873760,2881040,sugarcane your specialty here his  speciality is more like agriculture but  cacao is like the biggest food on this
e94zWmu58ZY,2881040,2886160,area  [Music]  cuba used to be a sugar cane heaven
e94zWmu58ZY,2886160,2892559,once the biggest exporter in the world  until trade stopped with the us then  later subsidies from the soviet union
e94zWmu58ZY,2892559,2899440,stopped coming in around the early 90s  sugar prices crashed  nonetheless acel still continues a small
e94zWmu58ZY,2899440,2907200,operation here on his farm in other  places there's more sugarcane factory  but here what he has is a trapeze
e94zWmu58ZY,2907200,2912570,[Music]
e94zWmu58ZY,2912570,2919359,[Applause]  [Music]  this trapeze egg is from france but
e94zWmu58ZY,2919359,2926720,actually trapeze in general was  introduced to cuba by spanish people and  it was a way to generate serum out of
e94zWmu58ZY,2926720,2932400,the sugarcane and they use that for the  cacao for the chocolate alcohol also  comes from there ah
e94zWmu58ZY,2932400,2937599,this is basically the origin story of  for rum can you believe um he's an
e94zWmu58ZY,2937599,2942319,actual cuban he's never had rum no
e94zWmu58ZY,2943839,2950559,he doesn't drink that much either oh all  right that's not what i was looking for  after extracting the juice it's filtered
e94zWmu58ZY,2950559,2958240,to remove any unwanted bits cool it up  with a bit of ice and we're ready to  kick this refreshing drink back
e94zWmu58ZY,2958480,2965040,how often do you drink this  almost every day because he works in the  countryside he needs a way to hydrate
e94zWmu58ZY,2965040,2970160,himself in this case this is called  guarapo all right let's try it out
e94zWmu58ZY,2970160,2975280,oh yeah it's kind of thick you know it's  sweet but it's also a little bit earthy  i didn't expect that it's really good
e94zWmu58ZY,2975280,2981200,actually i used to love this when i was  a kid drinking with a lot of ice and  it's super refreshing sugarcane is no
e94zWmu58ZY,2981200,2987280,longer the golden crop it once was to  the point that cuba now imports sugar  from other countries
e94zWmu58ZY,2987280,2992400,still sugarcane is an important part of  cuban agriculture and an icon like cuban
e94zWmu58ZY,2992400,2998559,coffee and cuban tobacco  now with a belly full of fresh sugar
e94zWmu58ZY,2998559,3003759,cane juice oro and i are finally headed  to barucoa
e94zWmu58ZY,3004079,3011200,surrounded by mountains and situated  along the coast right now we've just  arrived at daisy's farm hi i mean hola
e94zWmu58ZY,3011200,3016960,hola como esta you sting  i know i ran out of spanish this lady
e94zWmu58ZY,3016960,3024400,single-handedly tends to this piece of  land all by herself from farming to  gathering to protecting her home today
e94zWmu58ZY,3024400,3029839,we're going to find out why the people  of this village call her the queen of  cacao what did you eat for breakfast
e94zWmu58ZY,3029839,3032079,today
e94zWmu58ZY,3037920,3044079,oh probably means sir she respects me  more than you  well she doesn't know you yet
e94zWmu58ZY,3044079,3049599,she's the lord of cacao the whole day  that's what you have what is so special  about the cacao where i'm from all i can
e94zWmu58ZY,3049599,3055350,think of is just chocolate they have a  traditional drink which called chorote  ah well i know chocolate
e94zWmu58ZY,3055350,3061599,[Applause]  when i was in middle school we sing a  song pate pate choco latte does that
e94zWmu58ZY,3061599,3068160,mean we mix the chocolate  and that is the end of my spanish  being in the highlands and covered in
e94zWmu58ZY,3068160,3074880,shade this environment is the perfect  place for cacao trees to thrive the seed  pods of this variety are ready to pick
e94zWmu58ZY,3074880,3083160,after they've turned red right here you  can see the bud would you call this a  buddha de cacao pero lo casino
e94zWmu58ZY,3086720,3094000,it takes five years for a cacao tree to  produce its first seed pods and you need  ten pots like this to make one pound of
e94zWmu58ZY,3094000,3100400,cocoa or is it cacao i don't know  eventually it's going to be chocolate  and that's what really matters here
e94zWmu58ZY,3100400,3105680,she chops the pod in half revealing tons  of cocoa seeds inside seeds get removed
e94zWmu58ZY,3105680,3111839,and placed on a bed of banana leaves  where they ferment for 11 days when the  moment is right it's time for these
e94zWmu58ZY,3111839,3117599,beans to roast cacao when it's very raw  it's very good for the heart to give you
e94zWmu58ZY,3117599,3123440,natural energy when the cacao has a lot  of bitterness it's very good for the  blood pressure it's super good i'm
e94zWmu58ZY,3123440,3128720,looking for something that's going to  help me be healthier look younger from  the inside out honestly look at me how
e94zWmu58ZY,3128720,3134960,old do you think i am  22.  yeah
e94zWmu58ZY,3134960,3140319,next the grinder transforming this cocoa  from beans to a thick cocoa paste this
e94zWmu58ZY,3140319,3146319,raw fresh cocoa can be used to cook any  number of dishes i just want to try this  before it goes on to the next stage
e94zWmu58ZY,3146319,3151760,cacao seed  it's super bitter you gonna taste the
e94zWmu58ZY,3151760,3158079,hints of chocolate like okay i can see  how that would taste like chocolate  eventually maybe i'm wrong it also  tastes a little bit like coffee that
e94zWmu58ZY,3158079,3164720,kind of roasted yeah nutty flavor the  chorote starts with water then freshly  ground cacao powder cinnamon leaf milk
e94zWmu58ZY,3164720,3171260,powder banana flour and sugar mixing and  boiling until it's ready and eso
e94zWmu58ZY,3171260,3176880,[Music]  from the queen of chocolate let's try it  out
e94zWmu58ZY,3176880,3183040,oh wow that's fantastic it's got like a  heartiness to it it's not like a milk  it's like a chocolatey puree it's so
e94zWmu58ZY,3183040,3188880,thick there's so much body to it she  said that this is the contrary energy  drink when you get all the nutrients for
e94zWmu58ZY,3188880,3195280,the banana and all the elements the  banana brings with the energy sands and  the heart opener of the cacao you get a
e94zWmu58ZY,3195280,3202480,drink that keeps the farmers strong and  working hard to help it like barack  obama red bull
e94zWmu58ZY,3203440,3210960,she says she's very thankful because  this is something that is very normal  like countryside can be boring but she's
e94zWmu58ZY,3210960,3218480,very pleased how much you have liked  these trips  thank you so much
e94zWmu58ZY,3219920,3226240,a short drive from daisy's farm we  finally make it to our final location  this is where the fiesta will go down in
e94zWmu58ZY,3226240,3231920,a matter of hours  algo one of the oldest most remote
e94zWmu58ZY,3231920,3238319,settlements in cuba  [Music]  here we are we've come here for what is
e94zWmu58ZY,3238319,3244880,called uh  the dance thing ah nanggong it sounds
e94zWmu58ZY,3244880,3251200,vietnamese a little bit but it's not  fiestas here happen almost weekly and  they're the only remaining community in
e94zWmu58ZY,3251200,3258079,cuba still doing a traditional dance  known as the gangnam and koreba this  kind of party they get together they put
e94zWmu58ZY,3258079,3263119,it all on food and share with each other  they this is actually that they do what
e94zWmu58ZY,3263119,3268650,what about rum they have rome all right  okay will you try some rum
e94zWmu58ZY,3268650,3273920,[Music]  here it's all about eating local
e94zWmu58ZY,3273920,3280400,including these coconuts used in almost  every dish also there's lechon
e94zWmu58ZY,3280880,3288079,in the west coast they cook the electron  mold marinated and they cook it with the  sauce in here they put the sauce after
e94zWmu58ZY,3288079,3294160,israeli so right now there's no  flavoring of any kind no it's just  natural  getting
e94zWmu58ZY,3294160,3301440,burnt getting burned that sounds like  great preparation you really are a food  expert i am cool sounds good
e94zWmu58ZY,3301440,3308400,i have more to say i don't know now we  can go  down preparation is already underway for
e94zWmu58ZY,3308400,3315200,lunch or shelby called it pre-fiesta  everything is served in guida  is a local plant but you can find it all
e94zWmu58ZY,3315200,3322480,over cuba this hard shell was very  important for them their first course  crab rice just a few steps away in a
e94zWmu58ZY,3322480,3328720,local home a husband and wife team put  their talents together to create this  dish she does the cooking while he
e94zWmu58ZY,3328720,3333730,performs the important task of showing  me around his homemade gym
e94zWmu58ZY,3333730,3339200,[Music]  it's a combo of crab meat rice tomatoes
e94zWmu58ZY,3339200,3345119,and other local ingredients the rice is  steamed until it's cooked through or  until your workout is complete all right
e94zWmu58ZY,3345119,3349838,i'm gonna try some of this here's crab  rice
e94zWmu58ZY,3351200,3358079,oh super good it's just a hint of earthy  crap by the way milky you know this is  spatulas they used to use it for vomit
e94zWmu58ZY,3358079,3364799,because they think that vomiting was a  way to freedom your spirit so they eat a  lot and the next day they use this it's
e94zWmu58ZY,3364799,3370000,real  fish  these golden fish get deep fried a
e94zWmu58ZY,3370000,3375280,little bit of onion and a smothering of  rich creamy coconut milk
e94zWmu58ZY,3375280,3383599,pretty good it's like very fried it's  like become a little leathery because  it's cooled down let's try it together  with this it's made out of bread fruit
e94zWmu58ZY,3384160,3390480,very good let's see i'm trying to try  this one it's kind of like their version  of a tamale this is kobakan the elements
e94zWmu58ZY,3390480,3397599,are like known like the tamale the  outside is made out of banana leaf  inside they scratch the coconut and
e94zWmu58ZY,3397599,3404400,plantain and they mix it with crab what  makes it orange right there you see  those red things it's called chote or
e94zWmu58ZY,3404400,3409680,behold and the seeds is what makes you  discolored
e94zWmu58ZY,3410559,3416079,oh yeah you taste the coconut right away  yeah i love the fact that they don't put  a lot of salt really light flavors a
e94zWmu58ZY,3416079,3426079,little bit sweet and then just tons of  coconut oil flavor  [Music]
e94zWmu58ZY,3426079,3432400,just in time the lachon has survived its  three hour journey through hell and  we're ready to see what it's really made
e94zWmu58ZY,3432400,3438960,of so right now they're taking out the  wood pole he's holding the head my man  over here pulling the stick all the way  out give it a flip
e94zWmu58ZY,3438960,3444559,and look at the stomach that's been sewn  up here i think he's about to cut that  open oh okay but next to this car he
e94zWmu58ZY,3444559,3450160,just made a new c-section scar  oh man i've never seen this before all
e94zWmu58ZY,3450160,3457280,the organs has been cooked inside inside  here yeah with rice you can just smell  like all the pig fat has just entered
e94zWmu58ZY,3457280,3463280,and saturated this rice there's bean  there's some liver on here too though i  feel like i'm in a gourmet autopsy oh
e94zWmu58ZY,3463280,3469040,let's try it out  [Music]  whoa that's delicious it doesn't have a
e94zWmu58ZY,3469040,3474079,ton of seasoning it's just soaked up all  that porky essence in there never throw  anything like this that's good yeah he's
e94zWmu58ZY,3474079,3480720,really good oh he's also got some pork  here for us i bet that other pig would  eat this pig  you ready oh
e94zWmu58ZY,3480720,3486359,so juicy it's very nice well actually  have you ever tried this
e94zWmu58ZY,3487160,3492480,[Music]  it's super crunchy huh which is good if
e94zWmu58ZY,3492480,3499119,you don't think about it from this point  they're going to get this ready break in  town cut it up and get it ready for our  feast tonight let's do it
e94zWmu58ZY,3499119,3505200,in this village they know the best cut  of meat comes from the inside i'm not  saying this pig only had a lot of heart
e94zWmu58ZY,3505200,3513680,but it had guts too guts that our local  chef turn into braids something i  definitely haven't seen before
e94zWmu58ZY,3513680,3521119,the larger bits of intestines are filled  with raw blood both are boiled cut into  pieces then cooked again in oil
e94zWmu58ZY,3521119,3527270,before the fiesta kicks off there's one  person we have to meet
e94zWmu58ZY,3527270,3536300,[Music]
e94zWmu58ZY,3542079,3547440,meet the man behind it all the fiesta  the food it doesn't happen without him
e94zWmu58ZY,3547440,3553920,he even donated his own land to create  the fiesta having area where this  community gathers most weekends but his
e94zWmu58ZY,3553920,3560480,contributions don't stop there to  complement all of today's bold and heavy  flavors antonio is bringing something
e94zWmu58ZY,3560480,3566369,sweet  [Music]
e94zWmu58ZY,3567119,3573760,this one that you see here that is  which is more soft
e94zWmu58ZY,3573760,3581119,this traditional dessert is made by  cooking down coconut water guava papaya  and sugar for four hours creating a
e94zWmu58ZY,3581119,3586200,concentrated sweetness as the water  evaporates
e94zWmu58ZY,3586530,3592260,[Music]
e94zWmu58ZY,3593040,3598240,oh surprise we have a winner actually i  wanted you to go all the way here that's
e94zWmu58ZY,3598240,3603520,right for this one have you had this  before yes man oh it's hard to explain  the flavor a little bit like the inside
e94zWmu58ZY,3603520,3610319,is like that super rich sweet coconutty  bit all kind of mashed together with  some fruity guava notes on top of that
e94zWmu58ZY,3610319,3618079,this is my favorite thing in the world  this is crazy this could be in like a  five-star restaurant as a dessert
e94zWmu58ZY,3618079,3625079,can i ask how old are you  [Music]  what is your secret to a long life
e94zWmu58ZY,3626810,3632219,[Music]
e94zWmu58ZY,3635320,3642680,[Music]  so when do you plan on retiring
e94zWmu58ZY,3642980,3648400,[Music]  antonio like many others i've met here
e94zWmu58ZY,3648400,3653599,finds joy in the simple things hard work  community and being grateful for what he
e94zWmu58ZY,3653599,3660079,has he's embodied the idea that  happiness isn't a specific destination  but something to be unlocked within
e94zWmu58ZY,3660079,3666799,ourselves at any time  this moment makes me happy being able to  interact talk to you and try this food
e94zWmu58ZY,3666799,3672720,it's mind-blowingly delicious that  hidden away in this small kitchen on the  eastern part of cuba is something that
e94zWmu58ZY,3672720,3678000,people around the world would die for so  it's an honor to try it out um
e94zWmu58ZY,3678000,3684440,can you repeat sorry  oh you look emotional  i am
e94zWmu58ZY,3686840,3693200,[Music]
e94zWmu58ZY,3693200,3698440,they are the mother of something called  song
e94zWmu58ZY,3698880,3705119,song is kind of like the father of salsa  and other popular rhythms it's one of  them like this
e94zWmu58ZY,3705119,3709680,uh  this is kind of like embarrassing
e94zWmu58ZY,3710400,3716319,this ancestral dance has been here for  over a century and people are doing  their best to keep the tradition alive
e94zWmu58ZY,3716319,3723200,oro on the other hand i think he's just  making it up as he goes the emotions  that they do is imitating what they do
e94zWmu58ZY,3723200,3729680,in the fields and it actually feels a  little bit like vowels you know what i  mean
e94zWmu58ZY,3731440,3740010,oh waltz walls  [Music]
e94zWmu58ZY,3741760,3749000,i got you this all right do you know  what that's for uh water  rum
e94zWmu58ZY,3751940,3757760,[Music]  does it feel weird at all having seen my  show so many times and then now being
e94zWmu58ZY,3757760,3764000,part of it i don't know man for other  people you are the guy out of the show  for me you're my friend you know before  when we're living together we always
e94zWmu58ZY,3764000,3771520,have this kind of conversation the  difference is when we had those  discussions i was drinking and you were  not yeah but today you're drinking and
e94zWmu58ZY,3771520,3776559,i'm actually i'll be drinking too  [Music]
e94zWmu58ZY,3776559,3782119,i'm not responsible for what happened  after this cheers
e94zWmu58ZY,3786240,3792400,did your dad drink a lot my dad doesn't  drink that makes sense  my mom
e94zWmu58ZY,3792400,3797839,they're coming out what the [ __ ] is  happening  here's what we need we need some food
e94zWmu58ZY,3797839,3803119,i'll be right back oh [ __ ] man this is  burning  [Music]
e94zWmu58ZY,3803119,3810559,this just made me want to laugh  this is working right quickly though
e94zWmu58ZY,3810559,3816000,all right what are you guys talking  about i didn't say anything  are you drunk
e94zWmu58ZY,3816000,3823440,you want somebody  or you want somebody  is it my sister he's pretty
e94zWmu58ZY,3823440,3828480,give lonely  half a shot  listen  we're about to finish things out here i
e94zWmu58ZY,3828480,3834000,got this because this is a great  combination of the unique dishes here  that they're making in this area
e94zWmu58ZY,3834000,3839440,including two things we're going to try  that i know it's going to be out of your  comfort zone okay the first one is this
e94zWmu58ZY,3839440,3846000,grab that okay no it's not that it's an  intestine braid have you ever had pork  intestine i did not this way
e94zWmu58ZY,3846000,3851680,[Music]  that's good it's not bad dude that is  drinking food if i've ever had drinking
e94zWmu58ZY,3851680,3858079,food i understand why people think  alcohol and eat this  exactly it's like fatty and porky super
e94zWmu58ZY,3858079,3864960,simple but man putting it together in  that way creates this awesome chewy  texture i like that a lot  the last thing this one i love because
e94zWmu58ZY,3864960,3870700,this is like the most simple way i've  ever seen blood sausage made yeah they  just poured blood into the intestine
e94zWmu58ZY,3870700,3876799,[Music]  oh it's so medium it kind of tastes like  organ meat it's like halfway between
e94zWmu58ZY,3876799,3882400,heart and liver yeah if you give me like  this by itself and i squish and i taste  it i would think i'm eating a heart and
e94zWmu58ZY,3882400,3889359,you'd be okay with that fair enough  [Music]
e94zWmu58ZY,3889359,3896160,at this point oro and i have driven  completely across the country of cuba in  just a few days sampling the country's
e94zWmu58ZY,3896160,3903839,most idazzled tongue-tingling cuisine i  got the opportunity not just hang out  with you but hang out with very humble
e94zWmu58ZY,3903839,3910480,people from my country coming here is  more about this is what we got and we  need to make it work and also find a way
e94zWmu58ZY,3910480,3918558,to be happy so for me that is very  courageous my brother  for real though i'm glad we did
e94zWmu58ZY,3918720,3925680,[Music]  our grand finale takes place in the  country's capital havana where we'll get
e94zWmu58ZY,3925680,3934720,to taste the cuba of the future  [Music]
e94zWmu58ZY,3934720,3940640,where are my sunglasses  here we are we're in havana coast on my  left buildings on my right i'm in the
e94zWmu58ZY,3940640,3947599,back of a convertible over decades a  history of economic restriction and a  u.s embargo banning trade with cuba
e94zWmu58ZY,3947599,3953680,meant tough times here for any potential  business owners in cuba it's very  important to pay attention to the limits
e94zWmu58ZY,3953680,3960240,those limits can change the kind of food  that you're making we'll witness how a  country riddled with hardships and
e94zWmu58ZY,3960240,3966000,struggle has developed a culture of  innovation  adaptation and entrepreneurship
e94zWmu58ZY,3966000,3972720,excellent she said if you don't say so  she will kill you  from a michelin rated chef it's like
e94zWmu58ZY,3972720,3979920,have you ever been interviewed in your  own show  to a giant pizza oven that's completely
e94zWmu58ZY,3979920,3986960,homemade normally people buy these in  other countries but they made these  french fries did you draw a blueprint
e94zWmu58ZY,3986960,3994240,this is the story of how cuban people  overcame the odds to bring delicious  food to the masses
e94zWmu58ZY,3995119,4001440,why is your arm so close to mine  for me coming to havana it's like coming
e94zWmu58ZY,4001440,4006559,to a car show why there's so many old  cars here it comes from the 40s and 50s
e94zWmu58ZY,4006559,4013920,a lot of car companies came and tested  the car here and just a year ago when  the burger started we got stuck in
e94zWmu58ZY,4013920,4020160,laguna volvo with those old cars about  five times a day i'll see somebody bent  over the hood of their car yeah
e94zWmu58ZY,4020160,4025280,wrenching on something trying to make it  work again how are people still able to  fix these things that's the thing if you
e94zWmu58ZY,4025280,4032710,live in cuba and you have any tech you  need to know how to fix it  anything a computer a car
e94zWmu58ZY,4032710,4038280,[Music]
e94zWmu58ZY,4038319,4044319,our first location right here every day  from 9 a.m to 6 p.m el cafe is offering
e94zWmu58ZY,4044319,4051520,locals and tourists a warm fusion of  cuban and international food  behind every satisfied customer is the
e94zWmu58ZY,4051520,4057359,man who spent six years in london  mastering his craft not just cooking but  learning how to run a restaurant at the
e94zWmu58ZY,4057359,4063359,same time  his name is nelson nelson huge pleasure  meeting you nice to meet you man you
e94zWmu58ZY,4063359,4070240,lived outside of cuba for some time why  did you decide to come back well  what problem in my life i need to come
e94zWmu58ZY,4070240,4075920,back to cuba to look after my dad in  that moment cuba was developed about the
e94zWmu58ZY,4075920,4082720,private business up yeah we come here  and decide to open our own cafe  the cuba of today is a lot different
e94zWmu58ZY,4082720,4088559,than the cuba of a couple decades ago  when government-owned and operated  restaurants was the norm there was a lot
e94zWmu58ZY,4088559,4095760,of restrictions in the beginning so the  possibilities for owners to own their  own businesses it took a long time of
e94zWmu58ZY,4095760,4102719,course in a government-owned restaurant  with no owner with no vision there was  also no incentive for workers to perform
e94zWmu58ZY,4102719,4109040,at a high level  these days as the government relaxes  more regulations more and more private
e94zWmu58ZY,4109040,4115838,business owners are stepping up and when  you're pouring your heart and soul into  your own company the quality shows
e94zWmu58ZY,4115838,4123040,dude do you call omelets tortillas  yes  really where does that come from spain
e94zWmu58ZY,4123040,4128159,i've seen a lot of things in the omelet  never banana in cuba there is a big
e94zWmu58ZY,4128159,4133679,relationship between banana and kids  moms used to put bananas on the omelette
e94zWmu58ZY,4133679,4139838,to give it a little bit of sweet flavor  and sometimes they even sprinkle sugar
e94zWmu58ZY,4139838,4147400,on top of it like this did you  experience that too yeah sorry i need to  check if this is
e94zWmu58ZY,4147600,4154238,it's weird but i don't hate it it's  something very unique you're an  entrepreneur you had an idea and it  worked i'm sure you've built momentum
e94zWmu58ZY,4154238,4159679,over time but right now what are the  challenges for entrepreneurs in cuba
e94zWmu58ZY,4159679,4165520,the supply the supply so you need to  work for one two hours all day shop
e94zWmu58ZY,4165520,4171120,around the area to get just butter or  milk  being a restaurant owner in any part of
e94zWmu58ZY,4171120,4176560,the world is an unenviable challenge in  cuba  even more so
e94zWmu58ZY,4176560,4182238,she has an idea of the whole day she  prepared everything for the menu and  when she's running out of resources she
e94zWmu58ZY,4182238,4188400,started to wipe out every piece of  element that she doesn't have until she  run out of everything restaurants in
e94zWmu58ZY,4188400,4194880,general can have hundreds of items they  need to stock regularly from  distributors cooking oil dish soap meat
e94zWmu58ZY,4194880,4202080,napkins receipt paper  in cuba breakdowns in this supply chain
e94zWmu58ZY,4202080,4208400,are still common so even something we  may take for granted like butter may be  easily found today and nowhere to be
e94zWmu58ZY,4208400,4215600,found  tomorrow  meet lizzy born and raised in cuba but
e94zWmu58ZY,4215600,4221679,she lived in italy for 14 years she  returned to cuba and opened this  restaurant two and a half years ago
e94zWmu58ZY,4221679,4226800,bringing her italian experience and  fusing it with cuban flavors and  ingredients what are the most
e94zWmu58ZY,4226800,4234320,challenging ingredients for you to find  first of all she has a mother
e94zWmu58ZY,4234320,4240800,spirit  so she brought that spirit to the  restaurant  where she needs to think ahead because
e94zWmu58ZY,4240800,4247199,your kids if they don't have anything to  eat you can be like oh i'm sorry no you  need to feed right as a mom so that's
e94zWmu58ZY,4247199,4252480,why she choose to make it simple not  just for the palette of people but also
e94zWmu58ZY,4252480,4258560,for her to find ingredients  the case of finding ingredients in
e94zWmu58ZY,4258560,4264880,season especially like cheese because  she uses mozzarella cheese it can be  hard to find or can just disappear but
e94zWmu58ZY,4264880,4270560,she found a local supplier that made it  so they don't rely on the government to
e94zWmu58ZY,4270560,4276000,create that they relay in the  connections that they make with each  other that's what keeps business like
e94zWmu58ZY,4276000,4283760,this alive wow  lizzy is serving up one of her favorite  creations pico la escuena it's basically
e94zWmu58ZY,4283760,4289840,a cuban calzone placed cheese rope vieja  a mix of beef and pork then fried sweet
