vid,start,end,text
e94zWmu58ZY,1446559,1452159,his honor in the year 2000  this is kind of baffling considering the
e94zWmu58ZY,1452159,1458400,beatles music was banned in cuba when  the band was most popular a decade prior
e94zWmu58ZY,1458400,1465360,these days a more culturally liberal  cuba blasts music of all kinds from this  park luring in locals who might throw
e94zWmu58ZY,1465360,1469960,back a drink or grab some food
e94zWmu58ZY,1476080,1482720,what do we have right here so right here  we have ancon croqueta which means pan  is bread croquetta it comes from french
e94zWmu58ZY,1482720,1488080,from crockett that's the croquette right  it's like seasoned fried mashed potatoes  basically that's very nice and then this
e94zWmu58ZY,1488080,1494960,is the same thing but in a sandwich yeah  the same thing due to its simplicity and  practicality it can fill a lot of space
e94zWmu58ZY,1494960,1501200,this used to be cuba's go-to sandwich  especially in the 90s bread fried  croquette and a little bit of ketchup
e94zWmu58ZY,1501200,1507520,that's all you need here for a good time  in your mouth  i like it there's not much to say about
e94zWmu58ZY,1507520,1514080,it it's simple straightforward soft  bread fried potato a little bit of  ketchup in there a little bit of tomato  kick at the end it's not potato it's
e94zWmu58ZY,1514080,1520000,made out of flour meat potato not potato  it tastes potato way to me
e94zWmu58ZY,1520000,1528278,i'm so sorry but man this is filling it  is filling all right let's get some  beers i saw someone with beer over there  let's check that out
e94zWmu58ZY,1528410,1534240,[Music]
e94zWmu58ZY,1534240,1539520,until just a few years ago private  restaurants in cuba were illegal
e94zWmu58ZY,1539520,1545360,then due to an economic crisis the  government made some reforms
e94zWmu58ZY,1546320,1552880,and that's how polidars were born they  are family or privately owned  restaurants originally they were run
e94zWmu58ZY,1552880,1559120,from people's homes and many still are  today  like here hidden away in the suburbs of
e94zWmu58ZY,1559120,1566480,havana right in front of the polidar  owner's home her home is right there  sits cafeteria a la barbecue a place
e94zWmu58ZY,1566480,1571760,where filmmakers and artists share ideas  and grab some grub this is cuban diner
e94zWmu58ZY,1571760,1578480,food served fast making the most of what  they have  like their hamburger pan
e94zWmu58ZY,1578480,1584159,bread with hamburger since beef is  scarce  their burger patty is made with pork i'm
e94zWmu58ZY,1584159,1590559,gonna try that right now  [Applause]  i like it a lot i don't know if i've  ever had like a pork patty for a burger
e94zWmu58ZY,1590559,1596400,but it's really good very juicy this  seems like cuban fast food yeah but with  good quality can she talk about how she
e94zWmu58ZY,1596400,1602400,prepares for the service  what is how she prepares her team to act
e94zWmu58ZY,1602400,1608480,fast everything is prepared today  because her goal is to keep everything  fresh right what do you got there what i
e94zWmu58ZY,1608480,1614000,have here we call masas de puerto this  dish epitomizes cuban cuisine at least
e94zWmu58ZY,1614000,1620480,in oro's eyes this is something that my  mom used to make when i was a kid simple  yet colorful and seductive
e94zWmu58ZY,1620480,1625520,a huge portion of rice grilled pork  chops and in season locally grown
e94zWmu58ZY,1625520,1632400,veggies and sides this is a pork chop  and you know usually pork chop to me can  be a little dry but this is so good
e94zWmu58ZY,1632400,1637760,actually yeah but the way they make it  here is super oily but she has a balance
e94zWmu58ZY,1637760,1643440,between that making not too dry but i  feel not too oily which i love to finish
e94zWmu58ZY,1643440,1650080,dessert made inside a reused soda can  right here the thing that you're  drinking here they got it they put all
e94zWmu58ZY,1650080,1656720,the ingredients they boil it when they  cool down it becomes that thing that  you're eating right there
e94zWmu58ZY,1656720,1662799,that's really good very sweet and  velvety soft on my tongue perfect way to  end lunch
e94zWmu58ZY,1665919,1671600,cuba is a place of creation expression  and fierce entrepreneurship waiting to
e94zWmu58ZY,1671600,1677039,unleash its innovation  in this city one hardly known polidar is
e94zWmu58ZY,1677039,1683760,delivering seafood in a way completely  unique to cuba check it out we're doing  an interview in an inconvenient location
e94zWmu58ZY,1683760,1690240,but it looks great it works it's okay  satisfied satisfied sir what is the name  of your restaurant
e94zWmu58ZY,1690240,1695279,and you are none other than julio  himself did you live here before it was  converted into a place where people
e94zWmu58ZY,1695279,1701279,could come and eat  familia this was his family's house  seven years ago they decided to convert
e94zWmu58ZY,1701279,1706960,into a restaurant because you can see it  has a beautiful view my understanding is  that this is how the paladar started yes
e94zWmu58ZY,1706960,1712720,right now there is people owning  restaurants but back then that was  impossible so the first step was that
e94zWmu58ZY,1712720,1718640,family owned concert it was like a test  can you tell me about what makes your  restaurant so special
e94zWmu58ZY,1718640,1725279,that when we get into the home we don't  feel like we are getting to a restaurant  he's inviting us to his house he just
e94zWmu58ZY,1725279,1732080,want us to be welcome and what we're  eating is what he will cook for his  family sir thank you so much thank you
e94zWmu58ZY,1732080,1735880,and wide shots
e94zWmu58ZY,1738080,1744080,joining us at the table mr julio and his  wife it's a beautiful evening i know we  missed the sunset but it still looks
e94zWmu58ZY,1744080,1750159,beautiful here all the seafood cooked  here comes right from the ocean no not  the far away ocean i'm talking about the
e94zWmu58ZY,1750159,1755600,patch of ocean in front of his home the  owner either catches it himself
e94zWmu58ZY,1755600,1761679,or has local fishermen do the deed  reeling in fresh fish like this tuna
e94zWmu58ZY,1761679,1768480,his daughter and also our head chef  mashes it up then combines it with  onions and mayonnaise to create a
e94zWmu58ZY,1768480,1773520,filling for these plantain cups slices  of plantain are shaped and fried until
e94zWmu58ZY,1773520,1779600,crisp and filled with creamy tuna  goodness  this is from a plantain and then inside
e94zWmu58ZY,1779600,1784799,they put this wonderful tuna and  mayonnaise get it
e94zWmu58ZY,1786880,1793600,mango simple delicious crunchy and then  nice rich tuna salad you're recording  you got a cross section this is made
e94zWmu58ZY,1793600,1798799,with cgi you will put a laser so you can  see how is inside is it is a joke
e94zWmu58ZY,1798799,1804159,happening right now  next on our menu bite-sized sections of
e94zWmu58ZY,1804159,1810320,lobster tail cooked in a secret tomato  chili sauce let's try this out
e94zWmu58ZY,1811600,1817120,thick robust delicious lobster tail this  is a tradition to put sweet potato with
e94zWmu58ZY,1817120,1823919,any seafood oh really the sweetness of  the seed potato with the sourness and  the saltiness of the seafood let's get
e94zWmu58ZY,1823919,1829600,some tomato on there too  yes thank you okay i'm gonna try it out
e94zWmu58ZY,1829600,1837159,i like that and it kind of draws out the  experience too usually i just kind of  down the whole lobster tail in two  seconds
e94zWmu58ZY,1837279,1842559,but i like that our final dish garbanzo  bean seafood soup this thing is stuffed
e94zWmu58ZY,1842559,1848640,with seafood there's so much seafood in  here julio tried it in spain during a  holiday and has been cooking it ever
e94zWmu58ZY,1848640,1855679,since but with his own twist he's  replaced unavailable ingredients like  spanish ham with seafood he caught in
e94zWmu58ZY,1855679,1862720,his backyard  they cook it all in a big pot with a  secret blend of spices garbanzo beans
e94zWmu58ZY,1862720,1869600,beer tomato sauce and garlic paste okay  hold on i guess it's not really secret  after all
e94zWmu58ZY,1871279,1876880,i gotta dislodge some of this so i can  get down to the broth for you bro you're  not pretending me to eat that whole
e94zWmu58ZY,1876880,1882240,thing right this is for you man you're  the gust of honor i mean the the the  hand how you call the crab the head yeah
e94zWmu58ZY,1882240,1888320,we just call it crab hands  no he called crime hand well the crab  hand how you how do you eat the crab
e94zWmu58ZY,1888320,1893440,hand all right see right here oh you see  tech we got technology right here here
e94zWmu58ZY,1893440,1898480,we go  [Music]  oh  that right there best meat in the whole
e94zWmu58ZY,1898480,1904880,pebble try it out  [Music]
e94zWmu58ZY,1904880,1910080,you got it  [Music]  i've never seen a dish that has more
e94zWmu58ZY,1910080,1915200,seafood and more variety like every bite  is a little different flavor different  texture there's just so much in there
e94zWmu58ZY,1915200,1920480,can i ask how much that costs because i  know in the us if you got that at a  decent restaurant like i don't know and
e94zWmu58ZY,1920480,1927120,you just probably like twenty five  thirty dollars  it costs six dollars that's ridiculous
e94zWmu58ZY,1927120,1932640,he said that he's a hook there right  hook yeah he's proud of it i love that
e94zWmu58ZY,1932640,1938398,this is so fun so just want to say one  more time mucho gracias
e94zWmu58ZY,1941519,1947200,adapt and overcome  this is the ethos felt around havana
e94zWmu58ZY,1947200,1953760,from pizza to five-star seafood what  really makes cuba work isn't the  ingredients
e94zWmu58ZY,1953760,1959600,it's heart  [Music]  today we're leaving the country's
e94zWmu58ZY,1959600,1967519,capital havana and heading east to the  city of  um  the city of
e94zWmu58ZY,1967679,1974240,cochino's playa larga  it's not that hard to say here we're  taking on a food rare even in cuba you
e94zWmu58ZY,1974240,1979600,cannot try this dish anywhere else it's  not even allowed but there's one small  problem
e94zWmu58ZY,1979600,1985919,before we can take a bite we have to  catch our dinner we all know and hope it  doesn't take a bite out of us oh no
e94zWmu58ZY,1985919,1992320,there's another one behind it first my  plan is to see if we can kind of work  around their usual rules and
e94zWmu58ZY,1992320,1998880,restrictions and have oro catch a  crocodile  [Music]  crocodile
e94zWmu58ZY,1998880,2005559,no  why do you mean crocodile i touch them  like be cloned
e94zWmu58ZY,2011919,2020960,someone gonna help me out of this boat  [Music]
e94zWmu58ZY,2020960,2028240,in cuba business owners and locals wake  up early to pick up fresh ingredients  from small local markets like this
e94zWmu58ZY,2028240,2034159,today we accompany crocodile cooking  specialist alexis we are with the  crocodile cooker himself what is your
e94zWmu58ZY,2034159,2041360,full-time role is that all you do is  cook crocodiles no no no he's more like  a seafood cook but crocodile is one of
e94zWmu58ZY,2041360,2049599,his specialities at his restaurant he'll  be whipping up a one-of-a-kind crocodile  spread how do you say crocodile coco
e94zWmu58ZY,2049839,2057118,is it cocodrilo seafood  he said that he has three flavors before  cooking he can taste like chicken or
e94zWmu58ZY,2057118,2063679,pork but after cooking it tastes more  like fish so he's tasted it raw no it's  not recommended he's like nobody does
e94zWmu58ZY,2063679,2070079,that but i i do it  [Music]
e94zWmu58ZY,2070079,2076158,right now we're off to a crocodile farm  where he's gonna actually catch a  crocodile hold on a second me or we i
e94zWmu58ZY,2076158,2081839,need to like tell the camera guys what  to do i hear that from you before why  you don't do it because i'm too fat when
e94zWmu58ZY,2081839,2088960,we weren't trying to jump no i don't  wanna do it man jump  oh bunchy chumps
e94zWmu58ZY,2088960,2095679,yeah four years ago oro and i made a  concept for a show called the year of  fear i encouraged oro to bungee jump
e94zWmu58ZY,2095679,2100880,which he wasn't happy about  unfortunately i wasn't allowed to bungee  jump because i surpassed the weight
e94zWmu58ZY,2100880,2105920,limit man now i'm encouraging oro to  catch a giant reptile which he's also
e94zWmu58ZY,2105920,2113560,not happy about did you tell him that  you're going to catch it  in position
e94zWmu58ZY,2117119,2123040,right now he's just cutting right  through oro's hopes and dreams crushing  his spirit  you hate to see it folks you hate to see
e94zWmu58ZY,2123040,2128720,it can you translate that he's like no  way you can catch that only people who  has born here can do it it's very
e94zWmu58ZY,2128720,2134320,dangerous but he can try what's the  worst that can happen  thank you we'll be back you'll see all
e94zWmu58ZY,2134320,2140160,of me and you might only see part of oro  i can see alexis has shaken oro's
e94zWmu58ZY,2140160,2146400,confidence so before we go face to face  with the crocodiles oro and i are going  to carve up at a back alley factory
e94zWmu58ZY,2146400,2152960,where they're kicking out one of cuba's  most unique foods i brought you to a  place where they produce cassave cassave
e94zWmu58ZY,2152960,2159200,yeah casabe is the most authentic cuban  food that we conserve today casabe is
e94zWmu58ZY,2159200,2165119,cuban flatbread a staple dish in this  region inherited straight from the  indigenous arawak people it played a
e94zWmu58ZY,2165119,2172480,significant role throughout cuban  history because it required only one  single ingredient cassava flour
e94zWmu58ZY,2172480,2180320,[Music]
e94zWmu58ZY,2180320,2187838,after they've created the powder we come  over here and then my man just kind of  cooks it a bit
e94zWmu58ZY,2188560,2194800,all right let's try it out  that's fascinating it reminds me of
e94zWmu58ZY,2194800,2201520,eating like some kind of cereal that you  would mix with milk and sugar obviously  not really any flavor because this is  just an ingredient for something more i
e94zWmu58ZY,2201520,2208070,think you are not extracting your  palette because i can feel flavors let's  take another bite and let's dip into it
e94zWmu58ZY,2208070,2214000,[Music]  very airy  very light  and it seems like perfect for soaking up
e94zWmu58ZY,2214000,2220320,some sauce and some other flavors  actually this is made to be in company  all the flavors yeah i don't think about
e94zWmu58ZY,2220320,2225839,that we are like timon improvement you  know timon and pumbaa yeah i've heard we  are like that i just repeat what you say
e94zWmu58ZY,2225839,2231920,and i said it like it was my idea that's  a good documentary but very sad not  really yeah he was a documentary
e94zWmu58ZY,2231920,2237180,yeah  i'm getting educated right here
e94zWmu58ZY,2237180,2243280,[Music]  in just a moment my dude or i was
e94zWmu58ZY,2243280,2249040,looking for a stick we'll face his  biggest fear  too much
e94zWmu58ZY,2249040,2255760,but before that  we're stopping here el escopao where  we'll finally be able to try the casaba
e94zWmu58ZY,2255760,2262800,in the way it's meant to be eaten  [Music]
e94zWmu58ZY,2262800,2268079,i wish those guys at the factory could  see us now because we looked pretty  silly eating this raw but now we have
e94zWmu58ZY,2268079,2276079,the final dish accompanied by a soft  drink our sponsor tucola are you sick of  one cola this is two cola you shouldn't
e94zWmu58ZY,2276079,2281599,sponsor this  government oh is this government yeah  are we allowed to drink it when visiting
e94zWmu58ZY,2281599,2287920,cuba american tourists are prohibited  from spending money at any cuban  government-owned businesses from hotels
e94zWmu58ZY,2287920,2293599,to restaurants as far as  government-owned fizzy drinks i think  that's still a defensible gray area oh
e94zWmu58ZY,2293599,2299359,[ __ ] did i just [ __ ] up my life  i just drank it  you are on your own holy crap dude what
e94zWmu58ZY,2299359,2304720,if i get arrested in the u.s for  drinking a government-owned soda  although i gotta say quite tasty yeah
e94zWmu58ZY,2304720,2310960,because it's hot caramel that's why  let's try this out  [Music]
e94zWmu58ZY,2310960,2316480,the outside is super chewy so huh you  need to be really tender with it the  sausage is delicious super interesting
e94zWmu58ZY,2316480,2322090,texture if you gave this to me and you  asked me what it was made from i never  would have guessed cassava so very cool
e94zWmu58ZY,2322090,2327520,[Music]  time to catch a crocodile and the place
e94zWmu58ZY,2327520,2334000,to do that in cuba is here creadero de  cocodrillos a crocodile breeding  facility that's been protecting human
e94zWmu58ZY,2334000,2340240,crocodiles for more than 59 years sir  first of all thank you for joining us  today welcome it's a pleasure meet at
e94zWmu58ZY,2340240,2345520,diet he's been studying crocodiles here  for 17 years today he's giving us a vip
e94zWmu58ZY,2345520,2351280,tour which ends with a very hands-on  experience  considering this is a place for
e94zWmu58ZY,2351280,2358400,conservation why is it okay for us to  eat crocodile meat well well well uh is  a good question we have four thousand
e94zWmu58ZY,2358400,2363520,animal here we can use 100 per year for  sale the meat and the leather i mean we
e94zWmu58ZY,2363520,2370560,use all the money for conservation of  course this is super expensive to have  like 4 000 crocodiles and they're not  eating corn they're eating like
e94zWmu58ZY,2370560,2377680,meat  yeah  but before we catch the crocodile we  must understand the crocodile so at the
e94zWmu58ZY,2377680,2383680,end is showing us more so this is the  reproduction area yes it's for  reproduction but also for study so
e94zWmu58ZY,2383680,2390240,you're watching them reproduce oh  is that what you're trying to tell me  you're making it sound very scientific
e94zWmu58ZY,2390240,2396640,it sounds weird but maybe they need soft  music maybe they need like a magazine
e94zWmu58ZY,2396640,2403280,these are the world's strongest  terrestrial crocodiles that means they  feel equally at home on land as they do
e94zWmu58ZY,2403280,2409280,in the water despite their modest size  they can be highly dangerous to humans  have you ever been bit
e94zWmu58ZY,2409280,2414640,yeah what what should i do  you bop it on the nose huh yeah it's a
e94zWmu58ZY,2414640,2421040,weakness oh really bopping them on the  nose is there a weakness you can kill  them if you hitting hard in the nose ah
e94zWmu58ZY,2421040,2426880,don't give your back don't get my back  not a problem come over here put your  back on mine okay all right
e94zWmu58ZY,2426880,2432800,right now i think we're fine  finally with valuable background  knowledge in mind we're ready to go face
e94zWmu58ZY,2432800,2438480,to face with the crocs all right listen  you have to approach these there was a  reasonable reason to
e94zWmu58ZY,2438480,2445280,talk to build courage i may have a  history of pushing oro into situations  he's not totally comfortable with holy
e94zWmu58ZY,2445280,2450800,no i don't want other women but that's  because oro is my brother and that's  what brothers do they push each other if
e94zWmu58ZY,2450800,2456079,he gets bit we can definitely put this  in the thumbnail oh whoa  hey dude you don't have to do any more
e94zWmu58ZY,2456079,2464000,acting i'm not acting to be afraid dude  what are you talking about
e94zWmu58ZY,2464160,2469680,oh i feel your nipple  as oro's younger bigger brother i feel
e94zWmu58ZY,2469680,2475040,it's my duty to lead by example okay i  think i'm going to get this one right  here
e94zWmu58ZY,2475040,2482720,oh no  i'm just going to pretend like i don't  even want to catch any crocodiles
e94zWmu58ZY,2483180,2488960,[Music]  i got one i'm going to reel it in come
e94zWmu58ZY,2488960,2494560,on buddy  can we involve oro oro said he wants to  get over here
e94zWmu58ZY,2494560,2502560,hold the neck ah i i do that yes you're  gonna do that  okay you gotta trust me man okay
e94zWmu58ZY,2503119,2509838,hold the tail don't worry okay  you got this man commit when you do it  100
e94zWmu58ZY,2510480,2517200,ah  yeah you got it i got it oro  you did it i did it i'm proud of you man
e94zWmu58ZY,2517200,2526079,that was pretty epic dude i did it  brother  [Music]
e94zWmu58ZY,2526079,2531839,the croc is dispatched and the  processing begins the skin can be sold  to further help fund the efforts at this
e94zWmu58ZY,2531839,2537839,center the meat is headed to the  restaurant where alexis is waiting for  us
e94zWmu58ZY,2540160,2546000,do you know how we got this crocodile  uh-huh  my man oro caught this by hand
e94zWmu58ZY,2546000,2553599,yeah  this  is  you remember he said impossible right i
e94zWmu58ZY,2553599,2559520,went and did it i captured it i smoked  it he's got you there it is small all  right have you been able to speak
e94zWmu58ZY,2559520,2563400,english this uh whole time
e94zWmu58ZY,2564800,2571280,alexis communicates beautifully through  his words but even more beautifully  through his food around these parts he's
e94zWmu58ZY,2571280,2578480,known as a master crocodile chef and  today he'll be preparing us three unique  crocodile dishes
e94zWmu58ZY,2578480,2585520,first punta punta crocodile tail steak  tips with veggies now right away before  he puts it on it smells fishy but as he
e94zWmu58ZY,2585520,2590839,cooks it's changing the smell it becomes  what more porky more chickeny more
e94zWmu58ZY,2590839,2597599,grungy crunchy  [Music]
e94zWmu58ZY,2597599,2601789,let's try it out  [Music]
e94zWmu58ZY,2603200,2608480,i like that oh my god it does taste a  little porky it's a little bit of  everything but you know what it looks  like
e94zWmu58ZY,2608480,2615320,and meat has glass the meat of the one  percent  [Music]
e94zWmu58ZY,2616240,2624960,while the grill is still hot alexis  throws on the butterfly tail meat for a  dish i call pork chops all the crocodile
e94zWmu58ZY,2626800,2634079,i'm going to try this right here if you  just gave this to me i would say this is  a big pork chop yeah apparently it looks  a little bit like pork with a big fish
e94zWmu58ZY,2634079,2637599,texture i'm going to try it out right  now
e94zWmu58ZY,2639119,2644880,this one is closer to chicken but not  exactly it's like it's a whole new  texture it's a texture that's kind of
e94zWmu58ZY,2644880,2651440,between chicken and fish is it cheese  it's a dish  next enchilada
e94zWmu58ZY,2651440,2657440,starting with their in-house tomato  chili sauce then the crocs neck and  thymine season with black pepper and
e94zWmu58ZY,2657440,2662950,simmered until cooked through  finished with the greens and veggies  from the market this morning
e94zWmu58ZY,2662950,2670379,[Music]
e94zWmu58ZY,2671440,2677920,if you didn't know that this is  crocodile would you say that this is  three different meats yeah i would say  that pork chop that might be some kind
e94zWmu58ZY,2677920,2685520,of fish and that might be chicken it's  all over the place actually after  chewing it it gives me a little bit of  potato flavor so it can be the potato of
e94zWmu58ZY,2685520,2691000,the seed or the potato of the swamp  right
e94zWmu58ZY,2691040,2696720,how long have you had this restaurant  seven years he crushed it yeah  oh i'm really impressed sure you killed
e94zWmu58ZY,2696720,2703000,it thank you my friend actually oro  helped kill it but you did well with the  cooking
e94zWmu58ZY,2703090,2709760,[Music]  our cross-country cuba journey continues  as we head to cuba's east coast to the
e94zWmu58ZY,2709760,2714800,city of baracoa  welcome to baracoa we are here we have
e94zWmu58ZY,2714800,2719838,made it to our final destination in the  middle of
e94zWmu58ZY,2721680,2727200,we are also  due to its isolation this region
e94zWmu58ZY,2727200,2732319,surrounded by mountains is a side of  cuba few outsiders have seen before it
e94zWmu58ZY,2732319,2739040,has a completely different feeling from  the metropolitan vibes that you get from  havana coming out here it's countryside
e94zWmu58ZY,2739040,2744400,a land that gave birth to a lot of our  culture
e94zWmu58ZY,2745599,2752480,unlike cuba's more temperate west coast  ideal for growing tobacco and coffee  varacoa is bringing the tropical heat
e94zWmu58ZY,2752480,2758000,cacao  not being used for chocolate but used as  an ingredient to season other more
e94zWmu58ZY,2758000,2763200,savory dishes there is a fish that they  cook with the cat
e94zWmu58ZY,2766000,2771838,today is all about the fiesta oh is that  a pig it's like a pig pet
e94zWmu58ZY,2772160,2778319,are we eating that  combining the best flavors of cuba's  east coast into one spectacular meal
e94zWmu58ZY,2778319,2784160,have you ever had pork intestine i did  not this way  so brush up on your eighth grade spanish
e94zWmu58ZY,2784160,2790480,because this episode is about to be  fuego perhaps it'll be my first time  here in cuba trying a local cerveza or
e94zWmu58ZY,2790480,2793720,even better
e94zWmu58ZY,2804960,2812559,oh  [Music]
e94zWmu58ZY,2815890,2826110,[Music]
e94zWmu58ZY,2826110,2831450,[Applause]  [Music]
e94zWmu58ZY,2833440,2840840,country life  where's oro  shouldn't oro be helping
e94zWmu58ZY,2840840,2847760,[Music]  my friend hurt himself dancing yesterday
e94zWmu58ZY,2847760,2853280,the only way to get him here through  these kind of rocky roads this uneven  path was to put him on a horse on our
e94zWmu58ZY,2853280,2860800,way to baracoa orwe and i are making a  pit stop to visit a man by the name of  asel a farmer a community leader a
e94zWmu58ZY,2860800,2868079,hard-working dude to get to his home you  can take the arduous journey through  rocks mud and water by foot or you can
e94zWmu58ZY,2868079,2873760,go in style can you tell me how long you  and your family have been here he's 53  years of life he has been in is
