vid,start,end,text
GxBH93e-FwM,5300,5620,[Music]
GxBH93e-FwM,5620,8690,[Applause]
GxBH93e-FwM,10160,15280,[Music]
GxBH93e-FwM,15280,18560,it's me and me as you already know we
GxBH93e-FwM,18560,20960,are here as the fashion representatives
GxBH93e-FwM,20960,22240,of the world
GxBH93e-FwM,22240,24720,um to talk about the
GxBH93e-FwM,24720,28160,f the met gala fashion and i think we're
GxBH93e-FwM,28160,30400,like the first people
GxBH93e-FwM,30400,31920,in the world to do that everyone talked
GxBH93e-FwM,31920,33040,about it right everyone's doing fashion
GxBH93e-FwM,33040,34559,reviews on tick tock and everything
GxBH93e-FwM,34559,35840,that's why ours is coming out now
GxBH93e-FwM,35840,37680,because we had to wait for the chatter
GxBH93e-FwM,37680,39760,to dissipate participate and then the
GxBH93e-FwM,39760,40800,real
GxBH93e-FwM,40800,42320,okay here's the real takes here's the
GxBH93e-FwM,42320,44239,real takes and your guys opinions were
GxBH93e-FwM,44239,46559,cute they're really cute but
GxBH93e-FwM,46559,48879,just make way for the for the fashion
GxBH93e-FwM,48879,51440,yeah big big boys we and we are the
GxBH93e-FwM,51440,54399,fashion big boys if you cannot tell by
GxBH93e-FwM,54399,56800,our outfits
GxBH93e-FwM,56800,58640,gonna start off with the disclaimer
GxBH93e-FwM,58640,61199,nothing to do with the celebrities okay
GxBH93e-FwM,61199,63199,we love everyone yeah it could be anyone
GxBH93e-FwM,63199,64320,wearing these clothes we don't give a
GxBH93e-FwM,64320,66000,[ __ ] and so what was the theme this year
GxBH93e-FwM,66000,68799,the theme this year was guilded guild
GxBH93e-FwM,68799,71119,so what is that that means like uh like
GxBH93e-FwM,71119,73200,smelly things were like guilded the sort
GxBH93e-FwM,73200,75840,of umbrellas and fans and peacoats and
GxBH93e-FwM,75840,77680,um people's like main gripes about
GxBH93e-FwM,77680,78880,everyone's fashion this year is that no
GxBH93e-FwM,78880,80240,one stuck to theme
GxBH93e-FwM,80240,82080,right or not enough people stuck to
GxBH93e-FwM,82080,83920,theme okay so this here we have blake
GxBH93e-FwM,83920,85520,lively and ryan reynolds i don't know
GxBH93e-FwM,85520,87360,why this is why did it start with this
GxBH93e-FwM,87360,90479,one it's this one's boring to me oh no
GxBH93e-FwM,90479,93280,i am so excited to talk about that why
GxBH93e-FwM,93280,97600,so her dress is so beautiful and she
GxBH93e-FwM,97600,100720,started out okay she wanted to like do a
GxBH93e-FwM,100720,102000,um
GxBH93e-FwM,102000,102960,you know
GxBH93e-FwM,102960,104000,and
GxBH93e-FwM,104000,105600,she wanted to
GxBH93e-FwM,105600,106720,can't think of
GxBH93e-FwM,106720,110079,yes to new york city the city that
GxBH93e-FwM,110079,111600,never sleeps i believe it's called yes
GxBH93e-FwM,111600,114320,and the big the biggest of all apples
GxBH93e-FwM,114320,116880,she wanted her dress to patina and
GxBH93e-FwM,116880,119759,patina means when something is like
GxBH93e-FwM,119759,123439,copper okay and it oxidizes oh cool and
GxBH93e-FwM,123439,126719,it turns oh yeah yeah so like the statue
GxBH93e-FwM,126719,129039,of liberty yeah usually is made out of
GxBH93e-FwM,129039,131120,copper yeah and it turned into that blue
GxBH93e-FwM,131120,133360,we have that happening on our place yes
GxBH93e-FwM,133360,135599,exactly so she started out and this was
GxBH93e-FwM,135599,138160,all wrapped up uh-huh and she had like
GxBH93e-FwM,138160,140000,copper gloves on okay and then she
GxBH93e-FwM,140000,141440,started walking up the stairs and she
GxBH93e-FwM,141440,143360,stopped and then they unraveled her
GxBH93e-FwM,143360,145040,dress and it like patinaed on the red
GxBH93e-FwM,145040,147599,carpet it patinaed on the right yes it
GxBH93e-FwM,147599,149200,really is like awesome like i was
GxBH93e-FwM,149200,150720,watching her talk about it and i was
GxBH93e-FwM,150720,153760,like jesus every single detail
GxBH93e-FwM,153760,155440,she thought about
GxBH93e-FwM,155440,156959,and i really respect that and i think
GxBH93e-FwM,156959,159040,she looks [ __ ] yeah okay beautiful
GxBH93e-FwM,159040,161120,okay i got it i like it and i love it
GxBH93e-FwM,161120,161840,and
GxBH93e-FwM,161840,163280,i've been waiting to tell you about that
GxBH93e-FwM,163280,166319,okay mindy kaling
GxBH93e-FwM,166319,168879,um this dress is like not a met gala
GxBH93e-FwM,168879,171440,dress is it not no it's like a prom
GxBH93e-FwM,171440,174720,dress oh okay or like any award show
GxBH93e-FwM,174720,176720,ever i just i want to flip back to our
GxBH93e-FwM,176720,178720,reference image here this is the gold
GxBH93e-FwM,178720,180800,this is the gilded age right here this
GxBH93e-FwM,180800,182400,is it's supposed to have like a lot like
GxBH93e-FwM,182400,183760,it's supposed to look like curtains
GxBH93e-FwM,183760,185519,right and if i were to flip back to this
GxBH93e-FwM,185519,188560,it just right i mean i yeah i just don't
GxBH93e-FwM,188560,190239,think this looks like a metallic dress i
GxBH93e-FwM,190239,192080,feel like one person is required to wear
GxBH93e-FwM,192080,194000,this dress on the carpet of every single
GxBH93e-FwM,194000,196239,award show yeah it just looks like any
GxBH93e-FwM,196239,197840,other dress in the world like it's just
GxBH93e-FwM,197840,199760,it's not the time oh
GxBH93e-FwM,199760,202159,megan stallion
GxBH93e-FwM,202159,204319,this is sick although it's like it's
GxBH93e-FwM,204319,207920,it's uh giving like greek it's kind of
GxBH93e-FwM,207920,210799,like greek greece greek greek
GxBH93e-FwM,210799,213280,grecian yeah is it oh like a grecian
GxBH93e-FwM,213280,214959,like you know like the
GxBH93e-FwM,214959,217599,the wings on the true or like just like
GxBH93e-FwM,217599,218799,a dragon
GxBH93e-FwM,218799,220640,yeah yeah yeah
GxBH93e-FwM,220640,222560,yep do you like dragons
GxBH93e-FwM,222560,224720,no
GxBH93e-FwM,225040,227360,dragging these nuts on your face all
GxBH93e-FwM,227360,229040,right let's move on to the next one ky
GxBH93e-FwM,229040,231760,gerber and austin butler there was a lot
GxBH93e-FwM,231760,233840,of overlap of x's here at the met gal
GxBH93e-FwM,233840,235599,let me tell you that much
GxBH93e-FwM,235599,237439,austin butler vanessa hudgins kaia
GxBH93e-FwM,237439,239599,gerber jacob lordy there are other
GxBH93e-FwM,239599,242319,people in the world you know no i know
GxBH93e-FwM,242319,244560,celebs just they just it's like incest
GxBH93e-FwM,244560,245920,you know yeah but there are like there's
GxBH93e-FwM,245920,247519,tons of other people but you can [ __ ]
GxBH93e-FwM,247519,249120,like they're all in the same like social
GxBH93e-FwM,249120,251280,circle like it's like our friends like
GxBH93e-FwM,251280,252640,yeah i guess we have like friends who
GxBH93e-FwM,252640,254159,like meet and hook up and then you know
GxBH93e-FwM,254159,255280,it's like
GxBH93e-FwM,255280,256959,i really like her
GxBH93e-FwM,256959,261040,her vibe i like her hair curly
GxBH93e-FwM,261040,263280,and i actually like his i like his hair
GxBH93e-FwM,263280,265520,a lot his hair's sick yeah he looks
GxBH93e-FwM,265520,268240,great she looks great uh is it gilded i
GxBH93e-FwM,268240,270560,would say hers is pretty gilded sort of
GxBH93e-FwM,270560,272880,it's like modern gilded tommy dorfman i
GxBH93e-FwM,272880,275040,don't really get it like i feel like is
GxBH93e-FwM,275040,278320,it latex it looks a little like um
GxBH93e-FwM,278320,281040,pleathery like tarp oh maybe it's a slip
GxBH93e-FwM,281040,282400,and slide
GxBH93e-FwM,282400,285360,maybe that's the oh my god tommy yeah
GxBH93e-FwM,285360,287360,she like slides down the carpet that's
GxBH93e-FwM,287360,288960,what i'm saying like yeah you know my
GxBH93e-FwM,288960,290560,agent told me like i had to show up at
GxBH93e-FwM,290560,292800,seven to walk the carpet but what about
GxBH93e-FwM,292800,294560,if i wanted to slide that would be sick
GxBH93e-FwM,294560,296320,could you like busts out a bottle of
GxBH93e-FwM,296320,297680,dish soap and just starts like squirting
GxBH93e-FwM,297680,299360,and they're like what are you doing
GxBH93e-FwM,299360,302320,who's got a hose lube music
GxBH93e-FwM,302320,303759,i don't know
GxBH93e-FwM,303759,305840,okay so kim kardashian you've obviously
GxBH93e-FwM,305840,307120,heard about this
GxBH93e-FwM,307120,311280,what's what's the famous woman's name
GxBH93e-FwM,311280,313759,i'm gonna get it okay she's the this one
GxBH93e-FwM,313759,316320,the skirt
GxBH93e-FwM,316880,318120,nicki minaj now
GxBH93e-FwM,318120,320000,[Music]
GxBH93e-FwM,320000,321759,with the skirt with that thing no i
GxBH93e-FwM,321759,326400,blonde you want me to tell you no no um
GxBH93e-FwM,326880,329199,megan monroe morgan monroe
GxBH93e-FwM,329199,330960,mogan monroe
GxBH93e-FwM,330960,332639,yes so kim kardashian wear morgan
GxBH93e-FwM,332639,336520,monroe's dress mac marilyn monroe wow
GxBH93e-FwM,336520,338080,[Music]
GxBH93e-FwM,338080,340080,okay marilyn monroe yes kim kardashian
GxBH93e-FwM,340080,342160,wore the dress at marilyn monroe war
GxBH93e-FwM,342160,343600,when she's saying happy birthday to
GxBH93e-FwM,343600,346320,president john f kennedy but again
GxBH93e-FwM,346320,349039,not gilded at all apparently she just
GxBH93e-FwM,349039,350560,wore this dress
GxBH93e-FwM,350560,351919,on the carpet then she took it off and
GxBH93e-FwM,351919,354160,wore a replica inside yeah it's a piece
GxBH93e-FwM,354160,355520,of history right yeah it's piece of
GxBH93e-FwM,355520,358400,history yeah it's very cool she looks
GxBH93e-FwM,358400,360400,great i mean i think that she was like
GxBH93e-FwM,360400,362080,it would be really cool first like it
GxBH93e-FwM,362080,364960,would be like a huge moment for someone
GxBH93e-FwM,364960,366400,to wear this dress and i want that
GxBH93e-FwM,366400,368319,person to meet me okay okay
GxBH93e-FwM,368319,370639,joe jonas and sophie turner i think this
GxBH93e-FwM,370639,373199,is cool i think there is something like
GxBH93e-FwM,373199,375919,old age about it definitely gilded i
GxBH93e-FwM,375919,378080,don't i'm getting gilded energy they
GxBH93e-FwM,378080,380639,kind of look like the addams family
GxBH93e-FwM,380639,383280,yeah they do like night out yeah yeah i
GxBH93e-FwM,383280,385520,think it's cool and congrats on the new
GxBH93e-FwM,385520,387360,babe i don't really understand this i
GxBH93e-FwM,387360,388960,think it's just part of his jacket yeah
GxBH93e-FwM,388960,392000,i think any time like a guy takes a risk
GxBH93e-FwM,392000,393840,like that i usually really like it yeah
GxBH93e-FwM,393840,395919,that's true that's a must-grade like
GxBH93e-FwM,395919,397120,what the [ __ ]
GxBH93e-FwM,397120,398319,you know
GxBH93e-FwM,398319,399680,it looks like that's like what my car
GxBH93e-FwM,399680,401039,looks like when i leave it outside
GxBH93e-FwM,401039,402960,parked out front a raccoon walks across
GxBH93e-FwM,402960,404160,it at night it's like when your teacher
GxBH93e-FwM,404160,406319,wears on halloween
GxBH93e-FwM,406319,409360,i mean like listen no it's fireworks it
GxBH93e-FwM,409360,411440,is fireworks it is is that what it is i
GxBH93e-FwM,411440,412639,just thought it was i don't know maybe
GxBH93e-FwM,412639,414720,it's just a design but then like they do
GxBH93e-FwM,414720,416479,make a good point it has the gloves it
GxBH93e-FwM,416479,418000,has like the little bustle in the back
GxBH93e-FwM,418000,420960,like it's it's got this thing the fan
GxBH93e-FwM,420960,423199,yeah it is going with the theme but with
GxBH93e-FwM,423199,424560,like a different twist on it so we
GxBH93e-FwM,424560,426560,really can't hate on it too much i don't
GxBH93e-FwM,426560,430080,like this yeah i think it sucks
GxBH93e-FwM,430080,432800,okay so
GxBH93e-FwM,433120,435440,um
GxBH93e-FwM,435440,436630,so
GxBH93e-FwM,436630,441360,[Music]
GxBH93e-FwM,441360,443759,you saw her immediately went okay so
GxBH93e-FwM,443759,444800,i was going to tell the story about how
GxBH93e-FwM,444800,446240,he saw her at the hotel that's what i
GxBH93e-FwM,446240,448400,was going to say and and i was saving
GxBH93e-FwM,448400,449680,this for this video but i thought it was
GxBH93e-FwM,449680,451520,a funny moment because we were sitting
GxBH93e-FwM,451520,454080,in the bar and she came into the lobby
GxBH93e-FwM,454080,455680,yeah this was the night before the met
GxBH93e-FwM,455680,457440,gal yeah so she was wearing something i
GxBH93e-FwM,457440,458319,don't know what she was doing she was
GxBH93e-FwM,458319,460080,going somewhere and had like an equally
GxBH93e-FwM,460080,461599,she was going to like the pre-med gala
GxBH93e-FwM,461599,463599,party so she had like a she was all like
GxBH93e-FwM,463599,465440,done up right yeah and she was about to
GxBH93e-FwM,465440,467759,walk outside in front of the paparazzi
GxBH93e-FwM,467759,469840,and she like looked in the window to
GxBH93e-FwM,469840,471759,adjust her outfit but all she was seeing
GxBH93e-FwM,471759,473440,was her reflection but all of us could
GxBH93e-FwM,473440,474879,see staring at her
GxBH93e-FwM,474879,476560,like it was really weird it was really
GxBH93e-FwM,476560,477759,[ __ ] bizarre because she's standing
GxBH93e-FwM,477759,480000,there like
GxBH93e-FwM,480000,481520,like checking herself out and we're all
GxBH93e-FwM,481520,483599,kind of like uh does she know that we
GxBH93e-FwM,483599,485280,can see her yeah and then she took some
GxBH93e-FwM,485280,487199,pics she looks really good though and we
GxBH93e-FwM,487199,488400,were laughing because we were like what
GxBH93e-FwM,488400,489120,if
GxBH93e-FwM,489120,490960,she thought the met gal was on sunday
GxBH93e-FwM,490960,492639,yeah yeah so we were like she like got
GxBH93e-FwM,492639,494639,all ready and was like oh [ __ ]
GxBH93e-FwM,494639,495919,anyway you guys must have had to be
GxBH93e-FwM,495919,497120,there for that one like she gets in the
GxBH93e-FwM,497120,498639,uber and she's like to the mat and she
GxBH93e-FwM,498639,500479,pulls up and like the door opens and
GxBH93e-FwM,500479,502879,it's just like dudes setting up the
GxBH93e-FwM,502879,505840,oh yeah people just at the museum yeah
GxBH93e-FwM,505840,508240,who the [ __ ] are these nobodies um no i
GxBH93e-FwM,508240,511120,mean she looks pretty i like the sleeves
GxBH93e-FwM,511120,512229,pretty naked
GxBH93e-FwM,512229,513440,[Applause]
GxBH93e-FwM,513440,514640,you know let's just flip back to the
GxBH93e-FwM,514640,516320,gilded here not a lot of skin showing
GxBH93e-FwM,516320,517919,right so i kind of like the fact that
GxBH93e-FwM,517919,519599,she's like oh let's modernize it let's
GxBH93e-FwM,519599,521839,let's show my underwear at the same time
GxBH93e-FwM,521839,524480,yeah no she looks beautiful i like this
GxBH93e-FwM,524480,526640,yeah me too i don't know why but i like
GxBH93e-FwM,526640,528320,it i like this
GxBH93e-FwM,528320,530160,have we ever seen that before i feel
GxBH93e-FwM,530160,531360,like she always kind of does an
GxBH93e-FwM,531360,533600,interesting like head it's cool
GxBH93e-FwM,533600,536240,i like the matching wrist cuffs
GxBH93e-FwM,536240,537760,okay no
GxBH93e-FwM,537760,540800,like absolutely not okay like this and
GxBH93e-FwM,540800,543680,this pisses me off for some reason why
GxBH93e-FwM,543680,546720,like i like listen you guys i've like i
GxBH93e-FwM,546720,548080,know a lot of people are like no one's
GxBH93e-FwM,548080,549519,stuck to a theme and like we're trying
GxBH93e-FwM,549519,550480,to talk about the theme but like it
GxBH93e-FwM,550480,552560,really doesn't matter that much to me i
GxBH93e-FwM,552560,555200,don't know what the [ __ ] are you doing
GxBH93e-FwM,555200,557200,like you really just like didn't give
GxBH93e-FwM,557200,559360,them that much of a [ __ ] well i thought
GxBH93e-FwM,559360,561120,the theme was bubblegum i thought the
GxBH93e-FwM,561120,565839,theme was grammy's 2015. wow roasted so
GxBH93e-FwM,565839,567120,are they saying that like this is like
GxBH93e-FwM,567120,569040,gilded age in the future because i heard
GxBH93e-FwM,569040,570480,of some people doing that too and i
GxBH93e-FwM,570480,572640,liked that but this just like doesn't do
GxBH93e-FwM,572640,575519,anything for me this one's bad as well
GxBH93e-FwM,575519,577680,okay i'm so sorry you guys i'm not being
GxBH93e-FwM,577680,581120,nice at the moment but this
GxBH93e-FwM,581360,584080,what it's really funny okay because
GxBH93e-FwM,584080,587040,she's in emily in paris okay and this
GxBH93e-FwM,587040,589440,just looks like something that
GxBH93e-FwM,589440,591600,someone in emily and paris
GxBH93e-FwM,591600,594000,would wear like on the show okay i don't
GxBH93e-FwM,594000,595600,know it just like reminds me of the show
GxBH93e-FwM,595600,597279,so maybe that's what she was going for
GxBH93e-FwM,597279,599040,it looks like she's like riding an
GxBH93e-FwM,599040,601760,ostrich which is which is kind of gilded
GxBH93e-FwM,601760,603440,to me i don't know why i picture these
GxBH93e-FwM,603440,605440,people like came to this party on austin
GxBH93e-FwM,605440,609120,yes and like i i the top part of it the
GxBH93e-FwM,609120,611920,her dress i can almost see it but it's
GxBH93e-FwM,611920,614560,just there's way too much going on i
GxBH93e-FwM,614560,616079,don't like the shoes with it i don't
GxBH93e-FwM,616079,618480,think they go at all personally oh no no
GxBH93e-FwM,618480,621200,i don't like them either i just
GxBH93e-FwM,621200,625040,anderson park this is sick
GxBH93e-FwM,625519,629120,i [ __ ] love it no i know it's so sick
GxBH93e-FwM,629120,630560,i mean i don't know if it's in theme but
GxBH93e-FwM,630560,632640,i don't give a [ __ ] that's cool i just
GxBH93e-FwM,632640,634160,wish we could get over the bowl cut
GxBH93e-FwM,634160,636959,thing but that's no it's cool i know i
GxBH93e-FwM,636959,638160,love it i feel like you'd wear that
GxBH93e-FwM,638160,641440,anywhere i i mean the jacket that to me
GxBH93e-FwM,641440,643360,it sets it apart yeah like that's a
GxBH93e-FwM,643360,645920,pretty special jacket i love this i
GxBH93e-FwM,645920,647760,think this is so beautiful
GxBH93e-FwM,647760,650880,i think the coat is like so glamorous
GxBH93e-FwM,650880,653279,she looks very like chic and on theme i
GxBH93e-FwM,653279,655120,think she looks great i love like the
GxBH93e-FwM,655120,656240,corset
GxBH93e-FwM,656240,657519,top yeah
GxBH93e-FwM,657519,659200,that's very on theme
GxBH93e-FwM,659200,661040,i like the little cutout on the legs
GxBH93e-FwM,661040,663200,it's kind of like a sexy version of the
GxBH93e-FwM,663200,665519,corset with the big skirt which is like
GxBH93e-FwM,665519,667120,all of those girls are wearing in that
GxBH93e-FwM,667120,668560,picture that you keep referencing i
GxBH93e-FwM,668560,669839,think i just think she like really
GxBH93e-FwM,669839,671839,knocked out of the park yeah and she
GxBH93e-FwM,671839,673760,brought her flute and she was oh that's
GxBH93e-FwM,673760,675360,that's cool but she can play the flute
GxBH93e-FwM,675360,677120,yeah that's sick yeah she used to like
GxBH93e-FwM,677120,678399,play it all the time in her show shawn
GxBH93e-FwM,678399,682640,mendes he looks like he looks like
GxBH93e-FwM,682640,685680,dracula no he looks beautiful like he
GxBH93e-FwM,685680,687680,looks like radiant and beautiful he
GxBH93e-FwM,687680,689839,really really does but he also looks
GxBH93e-FwM,689839,692160,like this is what i'm picturing okay
GxBH93e-FwM,692160,694399,like a rom-com maybe that one that
GxBH93e-FwM,694399,696720,amanda bynes was in where like they're
GxBH93e-FwM,696720,698399,in like london or something and she's
GxBH93e-FwM,698399,700560,just like a classic like american girl
GxBH93e-FwM,700560,702800,like she meets like a prince oh okay and
GxBH93e-FwM,702800,706160,he like falls in love with yes this like
GxBH93e-FwM,706160,708320,ditsy american girl yeah like spills
GxBH93e-FwM,708320,710800,things on her shirt yeah and he's like
GxBH93e-FwM,710800,712959,perfect the prince i mean he looks so
GxBH93e-FwM,712959,714800,beautiful but he just looks like a
GxBH93e-FwM,714800,717279,british royalty kind of he looks yeah he
GxBH93e-FwM,717279,719600,does look like he's straight out of a
GxBH93e-FwM,719600,721920,cartoon like a disney cartoon yeah he
GxBH93e-FwM,721920,723600,looks like a prince he like but like not
GxBH93e-FwM,723600,725519,even a real human no it looks like he's
GxBH93e-FwM,725519,727120,animated it's boring no i get it though
GxBH93e-FwM,727120,728560,it doesn't look like met gala he just
GxBH93e-FwM,728560,730399,looks like a little like disney prince i
GxBH93e-FwM,730399,731839,definitely see him in my mind like
GxBH93e-FwM,731839,733600,getting out of a carriage which is kind
GxBH93e-FwM,733600,735440,of gilded like cinderella was like
GxBH93e-FwM,735440,737200,wearing gilded [ __ ] i see him like
GxBH93e-FwM,737200,739040,showing up like a polo match
GxBH93e-FwM,739040,742160,holy [ __ ] i love this this one got like
GxBH93e-FwM,742160,744000,a little bit of mixed review no it's
GxBH93e-FwM,744000,745920,sick it's sick she walks out of the
GxBH93e-FwM,745920,748480,hotel and she was just wearing
GxBH93e-FwM,748480,751519,the like latex pop and pants yeah
GxBH93e-FwM,751519,753600,and everyone was like man even without
GxBH93e-FwM,753600,755839,the the coat i was like it's kind of a
GxBH93e-FwM,755839,757600,cool take because you still have that
GxBH93e-FwM,757600,759200,like corset
GxBH93e-FwM,759200,760639,and it's got like that texture on it
GxBH93e-FwM,760639,763279,that looks old age you know what i mean
GxBH93e-FwM,763279,765040,but then the latex
GxBH93e-FwM,765040,766480,kind of is like
GxBH93e-FwM,766480,767839,the dark side of it there were a lot of
GxBH93e-FwM,767839,769440,people wearing like leather and stuff i
GxBH93e-FwM,769440,770639,think that's indeed we need to talk
GxBH93e-FwM,770639,772639,about like the sex workers of the gilded
GxBH93e-FwM,772639,774240,age and there was like different takes
GxBH93e-FwM,774240,775200,that people had which were very
GxBH93e-FwM,775200,776240,interesting and so i thought that this
GxBH93e-FwM,776240,777360,was an interesting take of like a
GxBH93e-FwM,777360,779279,mixture but then
GxBH93e-FwM,779279,781600,she put that damn jacket on and she
GxBH93e-FwM,781600,783920,looks [ __ ] awesome she also also kind
GxBH93e-FwM,783920,785519,of looks like a slinky she does kind of
GxBH93e-FwM,785519,787519,like a slinky she looks like some sort
GxBH93e-FwM,787519,789200,of like i don't know children's toy but
GxBH93e-FwM,789200,791279,i love it and i feel like
GxBH93e-FwM,791279,793680,i mean i want the jackets
GxBH93e-FwM,793680,795120,i wonder like what it's like to like lay
GxBH93e-FwM,795120,798320,on it yeah and
GxBH93e-FwM,798800,800399,i like it i don't know i think this is
GxBH93e-FwM,800399,803279,cool it's this is the guy to me i love
GxBH93e-FwM,803279,805200,the hat totally it looks like 19th
GxBH93e-FwM,805200,807360,century with the top hat and like those
GxBH93e-FwM,807360,810320,pointy shoes and stuff normani
GxBH93e-FwM,810320,812000,i mean like does she like legitimately
GxBH93e-FwM,812000,813440,like her body looks
GxBH93e-FwM,813440,816560,phenomenal yeah but like this is such a
GxBH93e-FwM,816560,818560,cool take on the whole thing like a hot
GxBH93e-FwM,818560,821360,21st century take on the old 19th
GxBH93e-FwM,821360,823920,century gilded big skirts
GxBH93e-FwM,823920,825920,puffy sleeves yeah you know what i mean
GxBH93e-FwM,825920,829279,yep it's i mean it's just
GxBH93e-FwM,829279,832240,love it this is so cool like it's so on
GxBH93e-FwM,832240,834399,theme and so cool for a guy to do i love
GxBH93e-FwM,834399,836240,the jacket i love this thing i just
GxBH93e-FwM,836240,838000,think it's all like awesome yeah i mean
GxBH93e-FwM,838000,839760,i just hate how he just can pull
GxBH93e-FwM,839760,842480,anything off pisses me off you know i
GxBH93e-FwM,842480,843680,really like him
GxBH93e-FwM,843680,845279,but it makes me mad it's like he's a
GxBH93e-FwM,845279,847120,really good skateboarder he's [ __ ] is
GxBH93e-FwM,847120,848639,it like looks good in anything he just
GxBH93e-FwM,848639,849920,walked down the red carpet like this
GxBH93e-FwM,849920,851199,he's like [ __ ] leave something for
GxBH93e-FwM,851199,852880,the rest of us you know
GxBH93e-FwM,852880,859040,sjp and cgr cjr and cjr and this is nfm
GxBH93e-FwM,859040,861199,not for me
GxBH93e-FwM,861199,863920,and this h is v
GxBH93e-FwM,863920,864959,s
GxBH93e-FwM,864959,867839,and the d
GxBH93e-FwM,867839,870839,c
GxBH93e-FwM,875839,877920,i'm not
GxBH93e-FwM,877920,880399,[ __ ] feeling it feeling it yeah kind
GxBH93e-FwM,880399,884399,of like bed bath and beyond um like bed
GxBH93e-FwM,884399,885680,like this is like
GxBH93e-FwM,885680,888320,beyond like a normal quilt this is like
GxBH93e-FwM,888320,890079,a college it's like your very first
GxBH93e-FwM,890079,891600,quilt that you buy yes and you know when
GxBH93e-FwM,891600,893199,you walk duvet cover sorry when you know
GxBH93e-FwM,893199,894320,when you walk through bed bath and
GxBH93e-FwM,894320,896000,beyond and they have like the
GxBH93e-FwM,896000,898959,setups of the bag yeah like this looks
GxBH93e-FwM,898959,900639,like one of the yeah like this would be
GxBH93e-FwM,900639,902560,the quilt they'd put like a pop of color
GxBH93e-FwM,902560,906560,pillow on it katy peasy
GxBH93e-FwM,907519,910240,don't like it curly claws so karlie
GxBH93e-FwM,910240,913279,kloss what the h she got a lot of flack
GxBH93e-FwM,913279,916959,for her hamp outfit what was that theme
GxBH93e-FwM,916959,918800,was camp it was just this like little
GxBH93e-FwM,918800,920720,dress and gloves and like no one really
GxBH93e-FwM,920720,922959,liked it okay and so
GxBH93e-FwM,922959,926639,she she decided to go even worse oh i
GxBH93e-FwM,926639,929600,love rosalia i love rosalia more and
