vid,start,end,text
IklnuCABIGo,0,5250,zonder een woord  [Muziek]
IklnuCABIGo,9330,17960,[Muziek]
IklnuCABIGo,17960,23510,de kom  geen  [Muziek]
IklnuCABIGo,23510,30040,het is een cool  [Muziek]  rood
IklnuCABIGo,30330,38860,[Muziek]
IklnuCABIGo,39230,46710,mam pap boek hoe kunnen  we dat nou doen
IklnuCABIGo,46710,52620,en  nou ja  goedemorgen jongens trokken weer deze
IklnuCABIGo,52620,59489,nieuwe vlog wij zijn de bally gas  familie vloggers en ik heb een liedje  mijn hoofd goedemorgen luxy
IklnuCABIGo,59489,66360,is ook een van de partijen gaan zo even  lekker ontbijten  maar voordat we gaan ontbijten  zijn er zijn een konijn entclips zijn de
IklnuCABIGo,66360,72330,kinderen de konijnen weer lekker aan te  knuffelen goedemorgen voedsel pip hier  nu naar buiten
IklnuCABIGo,72330,78570,dus wil ik meer  zonnetje breekt door  nee moet niet ook een geneest genoeg
IklnuCABIGo,78570,83880,doet  ja en de hobby 3 staat dat dit maar  jongens hier we hebben zeven nummers
IklnuCABIGo,83880,90390,gegeven de robot  grasmaaiers en nu dus ook eentje hier in
IklnuCABIGo,90390,97410,de voortuin superhandig hoeft daar nou  niet maar dit met de hand te doen kijk  dat is dus robbie 3 zeg maar voortuin
IklnuCABIGo,97410,102990,twee en hier nog eentje  nou hoe ze moet dit even lekker naar  buiten hierop is echt lekker weer
IklnuCABIGo,102990,108800,vandaag  ga eens even kijken hoe het is met de  konijntjes
IklnuCABIGo,108800,114270,en waarom je hier een hele grote popcorn  bak in de gang staat mijn sisters
IklnuCABIGo,114270,121250,onrechte bit kunnen zien in de vlog maar  de kinderen weet weten nog niet waarom  hij zo cool jongen
IklnuCABIGo,122510,130100,dat er onder weg  was die camouflage  kijk dan even op kokkie ook even bij die
IklnuCABIGo,130100,136090,macht er wel gewoon bij als wij erbij  zijn  maar kopie die springt autorijlessen
IklnuCABIGo,136090,141260,nieuwe dan dat we weg gaan doen wel weer  doen we wel in de audi a8
IklnuCABIGo,141260,147230,ja dan zit die de achter ik hij gaat om  economie 18 kasten zitten dus dus niet  handig zit namelijk op een kabels
IklnuCABIGo,147230,154790,dus als die eruit springt dan moet-ie  weer eens een koor je kokkie  een kerel geslapen dus het flesje niet
IklnuCABIGo,154790,160940,jouw flesje halen wat lekkers  witlof  het is wel hoe groot is het roept alle
IklnuCABIGo,160940,166100,ik in pak je die lekker te eten  die zitten lekker te eten
IklnuCABIGo,166100,171230,heer  heb het eten hier bovenop je dan een zit
IklnuCABIGo,171230,179030,eigenlijk het het zonnetje student maar  een wortels is op dit moment ook wel erg  van  jullie zijn heel erg lekker en kijk dan
IklnuCABIGo,179030,185030,kokkie daar zo schattig oh ja baby en  kokkie  ja cookies daar heel lief tegen zijn
IklnuCABIGo,185030,190550,baby's  ja hoor je bent er al aan gewend keten  contract weer eentje uit
IklnuCABIGo,190550,197590,we buigen snuffelen  happy-house  heb je komt het te bekijken
IklnuCABIGo,197780,203040,weer cent voeren  en het knuffelen ja zullen echt
IklnuCABIGo,203040,208319,knuffeltjes app  spel  een doosje gevoerd
IklnuCABIGo,208319,213420,wat een luxe  en hier plekje hier dus enige die we
IklnuCABIGo,213420,218640,alle namen gegeven om onze zwart is  maakt het niet uit of het een jongen of  een meisje is maar de rest die krijgen
IklnuCABIGo,218640,224579,nog name op als we weten wat het  geslacht is het geslacht het weten nog  eens naar de kinderen die weet en
IklnuCABIGo,224579,231030,nergens van  alleen maar je zegt dat een verrassing  hebben maar papa wel ja en jullie niet
IklnuCABIGo,231030,235790,dat is het leuke aan verrassing en het  je niet
IklnuCABIGo,236909,243060,konijn u weet het ook niet nee ik heb er  op die verschil voelen maar goed hij  weet het ook niet kijk dan
IklnuCABIGo,243060,247760,zodat er zitten ze met het waterbakje  afwijking
IklnuCABIGo,248400,254700,ooit iemand hier om  ja computer moet worden zit er iemand in
IklnuCABIGo,254700,260639,een ja en die kan blootleggen  kijk dat niet schattig jongens het is
IklnuCABIGo,260639,266010,toch eten geen ogen zijn schatting 6 kia
IklnuCABIGo,266010,273130,ja goed leuk en zijn drie vier vijf  zes
IklnuCABIGo,273130,281049,[Muziek]  dit hij daarin ja ja  [Muziek]
IklnuCABIGo,281270,286919,dat is zo  high peak je natuurlijk een worteltje te
IklnuCABIGo,286919,293340,pakken  stengeltje te nou jongens we gaan ook  lekker ontbijten want we gaan straks
IklnuCABIGo,293340,298919,eens even kijken waarom er een hele  grote pop kon doden een ingang staat
IklnuCABIGo,298919,305069,ja dus lekkere visjes  nou even lekker ontbijten
IklnuCABIGo,305069,311990,goedemorgen papa  we zitten aan het ontbijt  we gaan vandaag iets leuks doen
IklnuCABIGo,311990,320240,maar de kinderen weten nog niet wat  tv thuis laten zien van mango mango
IklnuCABIGo,322979,327730,de alto  [Muziek]
IklnuCABIGo,340880,347050,oh  [Muziek]
IklnuCABIGo,348910,355660,lips meer trekken en boekje aan het  lezen belangrijk is
IklnuCABIGo,355660,363700,oh oh dat is thiessen erg  oud liedje gemaakt hoi
IklnuCABIGo,363700,371510,[Muziek]
IklnuCABIGo,373650,399548,ja  [Muziek]
IklnuCABIGo,399900,406990,nou ja dat is niet zo'n hele handige  plek  graaf zou het dak op nou oké het is
IklnuCABIGo,406990,412290,moeilijk om uit  hoe mooi
IklnuCABIGo,412290,417910,hij is het is een mijn land op het dak  oh nee nee hoor kijk bij moeten biedt
IklnuCABIGo,417910,424110,verder daarheen want de man ik daar als  ik hier gestaan heeft me voor je lemon  groene hoe vies
IklnuCABIGo,424110,429550,ja we gaan wil ik af wat moet ze kijken  daar waar de plank je nou hier zit
IklnuCABIGo,429550,437820,proberen  we weer thuis niet na  kijk daar is de bal
IklnuCABIGo,437940,443190,zo veel gerekend en te zien  nou wij gaan samen
IklnuCABIGo,443190,448800,en zijn  het wel leek net
IklnuCABIGo,449280,452850,nu snel de vanaf
IklnuCABIGo,458039,465599,nou we de bouwers witte richting moest  gaan maar ergens anders in hun broertjes  spelen zo terwijl de kitsune even lekker  buiten spelen zijn en het zingen zijn
IklnuCABIGo,465599,470969,over mango's kokosnoten en papaja's ga  ik even geen koken nachts geven maar en
IklnuCABIGo,470969,477770,watermeloen jongens dit ziet er altijd  zo heerlijk uit nu heb ik dus heel tijd  dat liedje in rouge
IklnuCABIGo,477770,484889,coco nog bepalen wat de kinderen niet  weten  is dat het een kleine hint is naar
IklnuCABIGo,484889,490289,vanmiddag  middag gaan we iets heel leuks doen wij  zijn vandaag dus uitgenodigd jongens
IklnuCABIGo,490289,496740,niet horen door deutsch mrs houden en  chumpon tour en dat is een
IklnuCABIGo,496740,503159,speelgoedwinkel ben in zakelijk de hele  land in de spullen winkels bezoeken en  een superleuke toegegeven
IklnuCABIGo,503159,509699,waaronder andere  allemaal leuke activiteiten zijn voor de  kinderen maar ook leuke mythe grtz zijn
IklnuCABIGo,509699,516268,en wij zijn vandaag dus uitgenodigd in  deze nieuwe speelgoed winkel die de in  zwolle is dus wil ons te uiten kijk maar
IklnuCABIGo,516268,522268,als heb gewoond die een halfuurtje  vandaan om daar vandaag te komen spelen
IklnuCABIGo,522268,528899,en  k3 de meeting rieten weten de kinderen  nog niet een beetje in de stemming te
IklnuCABIGo,528899,535560,komen heb ik hier die lekkere  watermeloen ik had geen coke en oud  kokosnoot ook geen mango
IklnuCABIGo,535560,542040,maar het vinden we doen eigenlijk dan  net zo lekker ogen tropische fruit gaan  we eerst even lekker meloen eten en dan
IklnuCABIGo,542040,550199,was het op hebben dat op hebben  staat er een hele grote aan  popkoor bak in onze gang moet jullie net
IklnuCABIGo,550199,557160,hebben gezien maar eerst gaan we even  deze lekker en water op  wat het is heerlijk weer buiten als ze
IklnuCABIGo,557160,563629,zijn leuk maar een spelen met de bal met  de fietsjes in de staafjes deluxe i  bestek aantekende buiten de lusjes die
IklnuCABIGo,563629,570649,de trouwens een slaag je  daario zitten en betalingen die plat  eva eventjes een lekker mango wou ik
IklnuCABIGo,570649,577449,zeggen de stukje manier eten wij  benieuwd of ze meteen kunnen raden wat  we gaan doen vandaag
IklnuCABIGo,577910,583489,zo kijk dit is die grote  op cor bakker  maar eerst wat vindt en vragen of ze zin
IklnuCABIGo,583489,589669,hebben in  praten maar doen eerst een lekkere  watermeloen
IklnuCABIGo,589669,594680,ja  oh mooi  geheel
IklnuCABIGo,594680,602390,selecta laat hem doen  en ik hoor een muziekje citroensap  lippen liggen hebben ze op ik kijk dan
IklnuCABIGo,602390,608820,digitaal te pingelen  dus niks zien we  water doen
IklnuCABIGo,608820,615990,[Muziek]  ja dan ga je zeker mag je er nog niet
IklnuCABIGo,615990,621029,dat ze willen ze wel lekker dat snoepen  gezond snoep zeggen we dan kijk de
IklnuCABIGo,621029,626190,nieuwe annie heeft hier een hele mooie  gitaar  maar hoe kom je eraan jongen
IklnuCABIGo,626190,632100,nou en jullie weten misschien olie wel  dat ik op gitaarlessen en de juffrouw
IklnuCABIGo,632100,639269,voor mij van de muziekcommissie van  carla der dus en te helpen en de  waarheid gekocht en toen had ik het nog
IklnuCABIGo,639269,645089,een keer afgelost zo zit ook een bij al  verdiend en half klusjes gedaan
IklnuCABIGo,645089,651120,en toen mocht ik deze  en hij die heb sinds gister en dat het  was zijn schuld of ik heb eigenlijk had
IklnuCABIGo,651120,657269,je altijd een elektrische nu naar maar  dat nou ik heb je gitaar
IklnuCABIGo,657269,663019,omdat dit zijn  plastic de snaren minder pijn aan
IklnuCABIGo,663019,671399,je vingers china en het geluid is ook  luider ja daar ligt het aan
IklnuCABIGo,671399,678350,hoeft niet altijd zo hele grote speaker  meet je nemen  ja daarbij voor gekozen en ik had er
IklnuCABIGo,678350,684470,waren drie delen eraan hij mocht zijn  luier dus naar maar de minder scherp en
IklnuCABIGo,684470,691700,nog een ding  dat ik even geen echte beter op oefenen  voor les zij ook de je vrouwen ook
IklnuCABIGo,691700,698480,je hebt wel de elektrisch zich daar de  fiets op een heel vloer daling die hou  ik ook die ga ik echt niet verkopen op  marktplaats in met maar als ik ben beter
IklnuCABIGo,698480,705920,ik daar ben dan kan ik met de  elektrische gaan en om hem kattenkussens  dus een akoestische en elektrische ja
IklnuCABIGo,705920,710930,precies dus deze is echt goed voor jou  die les want jij ziek wordt dus dit is
IklnuCABIGo,710930,715970,de goede maat ja ik begonnen je vrouwen  iets beter lesgeven zijn zoon zal eerst
IklnuCABIGo,715970,721850,worden en daar  en kun je ook al wat een bepaald niet zo  veel of zo dat je denkt nou die kan ik
IklnuCABIGo,721850,727790,wel eens even laten horen  lees hier meer heel lekker neem er maar  nog een les voor man die situatie ja
IklnuCABIGo,727790,734690,laat hem een nieuw materieel mango nee  dat heb ik niet  ik snap wel waarom ze met het liedje
IklnuCABIGo,734690,741680,voor mango en coconoten' bananen dat  think lekker maar watermeloen  watermeloen daan dat zien die zo lekker
IklnuCABIGo,741680,749180,maar een nee ze wel heel lekker hoor  [Muziek]
IklnuCABIGo,749180,756630,wat heb je gemaakt met zeven  club seriële tijdschrift unieke andere
IklnuCABIGo,756630,764780,rood en liep de kom van poppenbedje  zeggen  ja ja ik ga mijn
IklnuCABIGo,764780,770610,lot  [Muziek]
IklnuCABIGo,770610,773709,[Applaus]
IklnuCABIGo,775670,781110,om in dat zijn engelse politicoloog olie  dippen ik heb een makkie heeft nu bij
IklnuCABIGo,781110,786649,mooi leven had je hoofd goed denken
IklnuCABIGo,789420,794840,lex ox  ja ik kom je er wel niet op  alleen
IklnuCABIGo,794840,801050,de tekst ik anders 003 om gewoon
IklnuCABIGo,801590,807150,zonder  het was net
IklnuCABIGo,807150,809810,dna
IklnuCABIGo,814880,822310,steek  nee nee ze schoten prix goed ging goed
IklnuCABIGo,822310,839429,echt waar ging heel goed  [Muziek]
IklnuCABIGo,841530,851480,[Muziek]
IklnuCABIGo,851480,857420,nu doen  [Muziek]
IklnuCABIGo,857420,867020,morgen  goed hoor heel mooi jonge  dat is wel ja maar als ik de man bij met
IklnuCABIGo,867020,873530,dan kan je zo een had zeker hoor maar  die echt niet bij de niets bij doen nee  dus allemaal in weergeven van gewoon
IklnuCABIGo,873530,879170,lekker spelen gaan lekker zonder tekst  gewoon ik negende prikkelen door huis is
IklnuCABIGo,879170,882880,lekker gaat spelen zonnetje schijnt
IklnuCABIGo,885140,891340,hbo schoener niet verkeerd om  banaan
IklnuCABIGo,891340,896980,een bananen frieten  baby
IklnuCABIGo,896980,902800,baby cyr sur mer  meehelpen dan
IklnuCABIGo,902800,909670,[Muziek]  ja mijn blog aan  [Muziek]
IklnuCABIGo,909670,915010,poppen waren die smeert ah
IklnuCABIGo,915010,921630,hier in nederland  [Muziek]  brengen ja en er is gewicht
IklnuCABIGo,921630,927410,tussen  ja dat we dat op een beetje  kijk
IklnuCABIGo,927410,935240,elkaar wel goed zien en twee popjes niet  mee  oh jeetje pap daar
IklnuCABIGo,936380,944100,is dat heel lekker aan de bar een  bammetje geheten voor de lunch en wel  lekker gegeven naar lucy dus ongemakken
IklnuCABIGo,944100,949560,onze slaap je o ja ik moet ook niet  vergeten de visjes te voeren op die moet
IklnuCABIGo,949560,955440,ook even lunchen altijd heel mooi zien  cape agulhas hadden gedaan is
IklnuCABIGo,955440,961220,kermissen genezen  jan doedel machines
IklnuCABIGo,965420,971070,[Muziek]
IklnuCABIGo,971070,976080,gister ook de huidige van komma  hier ergens anders nieuwe die ander
IklnuCABIGo,976080,982029,alweer gedaan  dat ik verdomme logisch is
IklnuCABIGo,986250,993589,[Muziek]
IklnuCABIGo,994060,1000430,[Applaus]  [Muziek]  en nu is het zulk mooi zaterdagmiddag
IklnuCABIGo,1000430,1007690,weer dat we toe zijn aan inflatie die  gister verbazing  bezorgdheid en mama dag van wat moeten
IklnuCABIGo,1007690,1016440,we daarmee evolutie de postbode kwam en  die had zo'n hele grote doos mee  gevangen en nu zie je dat de eerste
IklnuCABIGo,1016440,1023370,mag je grabbelen dit zien wat we moet  inzetten nou
IklnuCABIGo,1026839,1031938,op  [Muziek]  entreeprijzen
IklnuCABIGo,1031938,1037900,uitnodiging voor meeting the heat  dag gaan we luxy nog meer hadden laten
IklnuCABIGo,1037900,1042670,gaan we veranderen  de vorm alle
IklnuCABIGo,1046199,1049268,[Muziek]
IklnuCABIGo,1052580,1060530,van met k3  snel thuis worden k3 komt naar school
IklnuCABIGo,1060530,1064070,leren moeten sluiten
IklnuCABIGo,1070510,1078150,materiaal is je dat leuk  ja ja we gaan die leeft achterbank
IklnuCABIGo,1078390,1086890,heel lekker  ja papa ik doe de deur op slot  andere kit zit dan lekker naar mijn pc
IklnuCABIGo,1086890,1093490,even kijken kijk zet de airco man nam  volgens mij  want juist aan zou de sleutel zit er nog
IklnuCABIGo,1093490,1100350,meer nou lig hier en stoer  eén twee  drie dit is
IklnuCABIGo,1100350,1105640,dus de eerste keer dat wij ook lydia  gaan ontmoeten natuurlijk lk doe je wel
IklnuCABIGo,1105640,1113410,eens genoeg ontmoet met klaasje toen dit  is was mij al 3 jaar geleden dual  pluisje want zoals u zien welk geboren
IklnuCABIGo,1113410,1119440,was niks net geboren  maar met julia nog nooit zo bijzonder en
IklnuCABIGo,1119440,1125520,hier naar zegt van aanbrengen voor k3  echt heel leuk dat ze meteen
IklnuCABIGo,1126900,1133518,maar nu zijn ze allemaal  [Muziek]
IklnuCABIGo,1144330,1147390,[Muziek]
IklnuCABIGo,1151430,1157789,ja  ja
IklnuCABIGo,1157840,1163590,en  het nu is en er komen op de plek van
IklnuCABIGo,1163590,1172040,bestemming en onze in vannacht afgebeeld  ik ben parkeren omdat daarvoor dingen
IklnuCABIGo,1172060,1179490,[Muziek]  hier slapen want ja die mij zal morgen
IklnuCABIGo,1179490,1186770,norm mediator  busje van
IklnuCABIGo,1186950,1190070,het hotel
IklnuCABIGo,1192030,1201680,plus je vlot  [Muziek]
IklnuCABIGo,1203040,1208330,de bank wel bij  en natuurlijk zoek ik
IklnuCABIGo,1208330,1214020,[Muziek]  even een lekker drankje en luxe lekker  kleur
IklnuCABIGo,1214020,1223480,zou even lekker zitten wachten met een  tuintje receptie vervolg ik mijn  kinderen zie wel wat er hier aan de hand
IklnuCABIGo,1223480,1229820,dus hier kun  je komt aan  die 480
IklnuCABIGo,1229820,1239160,[Muziek]  china is oli's geapplaudisseerd
IklnuCABIGo,1239350,1245130,en we heel lang gereden  [Muziek]
IklnuCABIGo,1245130,1250650,vandaag  weg op zoom of verloor zijn heel lang
IklnuCABIGo,1250650,1255770,geen  hij meer dan drie uur in de auto gezeten
IklnuCABIGo,1255770,1262129,welkom zijn  siri  zich naar binnen misschien
IklnuCABIGo,1262129,1269700,gewoon de slag  [Muziek]  hallo oh sorry wat de patroon
IklnuCABIGo,1269700,1274840,deze natuur  gaan ze eerst even opfrissen wat drinken
IklnuCABIGo,1274840,1280480,en dan gaan we zo meteen dat ze vlog  zo reductie weerhuisje denk op
IklnuCABIGo,1280480,1285880,gelukkig hey wat er morgen eerste  speelgoedwinkel toch even gaan bekijken  en dan aan het eind als america 3
IklnuCABIGo,1285880,1292990,meisjes de fans op de foto te staan  hebben we als meeting 3 moment goed op  gewone stil de ding reductie gaan we
IklnuCABIGo,1292990,1297780,eens kijken naar de nieuwe winkel  kom er eens mee
IklnuCABIGo,1301620,1305669,naar binnen  ja
IklnuCABIGo,1308050,1313260,popstad niks  kijk
IklnuCABIGo,1313570,1321630,[Muziek]  door de keuring
IklnuCABIGo,1322680,1329440,dat is leuke  kennis  [Muziek]
IklnuCABIGo,1331540,1337380,dus  [Muziek]
IklnuCABIGo,1337380,1344130,haat keuzes kinderen  [Applaus]  dus een pec zwolle stadion
IklnuCABIGo,1344130,1349170,ja ik zat daar en mijn business club  waarbij de blauwe  tribune
IklnuCABIGo,1349170,1356270,conclusie  oh ja we lopen nu besef ik steeds naar  de winkel toe waarin ze allerlei
IklnuCABIGo,1356270,1364740,je kunt er spelen en alleman was  ontdekken en ja mag ik speel
IklnuCABIGo,1364740,1370010,aan wier zit lekker spelen goed hoewel  de allerlei
IklnuCABIGo,1371490,1377020,ja onder de tribune van het  voetbalstadion
IklnuCABIGo,1377020,1385179,[Muziek]  mango waren coca cola ja
IklnuCABIGo,1386200,1392600,dat kan ook papier  wanneer ik hier mijn
IklnuCABIGo,1392600,1398370,baas is  hier weer een
IklnuCABIGo,1398370,1405039,instant  voeg je spier kijk dunste achterkant
IklnuCABIGo,1405039,1408238,komen we zo even de winkel winnen
IklnuCABIGo,1410169,1416169,iedereen staat te bereiken cabrito maar  weinigen  mochten dus even in de achterkant naar
IklnuCABIGo,1416169,1421299,de winkel triple te bekijken  wij maken die valt er aan doen al deze
IklnuCABIGo,1421299,1427350,mensen staan in de rij voor k3 komen de  baby jas aan hila ik denk
IklnuCABIGo,1427980,1433780,ik ben ik schreef hij zijn allemaal  krijgen maar wat een grote week alle
IklnuCABIGo,1433780,1440490, jongens  dit is echt nee ik ben nooit meest  winkel geweest
IklnuCABIGo,1446350,1453550,wie heeft het gevonden  wauw
IklnuCABIGo,1455559,1461820,2  hoi  hoi
IklnuCABIGo,1464300,1469840,zo  alles wilde bloemen zijn
IklnuCABIGo,1476110,1482260,dus  was leuk
IklnuCABIGo,1482730,1484970,ah
IklnuCABIGo,1488570,1494690,hallo  [Muziek]  leuke
IklnuCABIGo,1494690,1500210,winkel kinderen  wauw
IklnuCABIGo,1503120,1508929,[Applaus]  [Muziek]  oh
IklnuCABIGo,1510660,1516840,maar  uhm
IklnuCABIGo,1516840,1520110,heel leuk
IklnuCABIGo,1523389,1529469,want  [Muziek]
IklnuCABIGo,1532090,1537509,ryan ik niet  we zijn en meisjes naar meer belang
IklnuCABIGo,1537509,1545500,bij de poppen  de kun je ze weer aanwezig bij de vorige
IklnuCABIGo,1545500,1549690,meespelen door stenen
IklnuCABIGo,1551680,1559700,je had hem een nieuw filmpje  het ook en kan hier zo het kijken hoe de
IklnuCABIGo,1559700,1564849,tepel  hey  met je mee
IklnuCABIGo,1564999,1572169,beleef op de buiten kijf  patrick wegpolitie smet op het veilig
IklnuCABIGo,1572169,1577510,ja leuk  nou veel plezier vandaag hè  een mooie week hoor
IklnuCABIGo,1577510,1586190,[Muziek]  kijk dan  hier waar dit zijn mooie auto's kijk dan
IklnuCABIGo,1586190,1591209,is het goed  hier is die
IklnuCABIGo,1593130,1600750,ook tipsy heb ik wist niet de kleding  want goede dating horn oh nee
IklnuCABIGo,1600750,1605950,en lange kom naast enkel verkleden  smaken en nou hier vries allemaal kopen  maar ik het nog nooit
IklnuCABIGo,1605950,1612980,doen  is de  ja of niet niet goed
IklnuCABIGo,1612980,1616639,te veel voor jou
IklnuCABIGo,1622070,1625179,ja en
IklnuCABIGo,1627470,1629559,ah
IklnuCABIGo,1642860,1647870,jongens je moet je leven dat deed en wat  er echt gaande was  iedereen komt natuurlijk toch voor de
IklnuCABIGo,1647870,1653179,mythen greet' met k3  zo over hij eigenlijk om met k3 de foto
IklnuCABIGo,1653179,1659600,te gaan  dat is dus de tour these doen mee aan  zodra wij binnenkwamen lopen en de  mensen zagen dat waar de kwamen
IklnuCABIGo,1659600,1667280,want het hè k3  dus ja we konden niet echt op een hele  rustige manier door de winkel lopen want
IklnuCABIGo,1667280,1673040,ja hij iedereen wilde met ons op de foto  wat ik heb me nu erg is wat we ook kwam  het allerliefste hebben gedaan maar ja
IklnuCABIGo,1673040,1679309,we konden dingen echt met k3 jezelf op  de foto dus wat we nu gaan doen  plan b is als eerst even een
IklnuCABIGo,1679309,1686059,voetbalstadion willen kijken en hij  vierde macht en wachtte even tot k3 met
IklnuCABIGo,1686059,1692299,iedereen op de foto is geweest dat ze  straks terug gegaan naar het hotel  waarbij het er straks ook waren en en  hopelijk hebben ze dan nog een momentje
IklnuCABIGo,1692299,1697520,om even met onze kinderen op de foto te  gaan  ja want voor ons tussen die te die tegen
IklnuCABIGo,1697520,1703280,doen en daar ook in dieet raast avond  misschien nummers en de grap was  eventjes als je denk wat waren we voor
IklnuCABIGo,1703280,1709040,gekke beelden wat we net zagen  kon niet echt heel makkelijk filmen en  de winkel goed laten zien omdat gewoon
IklnuCABIGo,1709040,1714230,super druk is maar dit vriendin er ook  leuk  kijk we zijn dus in het stadion
IklnuCABIGo,1714230,1720950,als jullie denken waarom zijn jullie in  stadion de winkel  doortje is bij het voetbalstadion met
IklnuCABIGo,1720950,1727430,zwolle bij pec zwolle en er is gewoon  een hele grote speelgoedwinkel ik had  hem ze gooit speelgoedwinkel gezien  nederland eindelijk
IklnuCABIGo,1727430,1735890,maar die is hier dus vandaar dat wij  achter de schermen pack steeds naar  binnen konden  en west door dit door dit door deze
IklnuCABIGo,1735890,1741680,grote arena konden lopen en we hier nu  dus backstage zijn nu wel nu zullen vind
IklnuCABIGo,1741680,1746720,hem geweldig en luxe en jurgis had  voetbalwedstrijden  wij gaan eigenlijk door de
IklnuCABIGo,1746720,1753130,voetbalwedstrijden  alleen daar neer op die gaat wel eens  mee wilde duiven naar boven
IklnuCABIGo,1753130,1758300,naar een totaal bent  eigenaar van total bed te gaan daniel
IklnuCABIGo,1758300,1765200,heeft daar aos een keer mee geweest en  met de vader van vriendinnetje van die  cellen haar klas met jong was met yilmaz
IklnuCABIGo,1765200,1771170,daniel die is wel eens vaker je geweest  alleen wij en ik een kinderen vinden dit
IklnuCABIGo,1771170,1778360,mooie mis  is wel een hoop zo
IklnuCABIGo,1778360,1786040,dat was een hele klim zo heel mooi  kunnen zingen
IklnuCABIGo,1788120,1793570,hij drie jongens  de voetbalstadion helemaal leeg
IklnuCABIGo,1793570,1799320,zonder toevallig zonder publiek dat zo  mooi
IklnuCABIGo,1799660,1807580,wij zijn publiek  was je de voetballers  nu gaan balletje trappen weet niet hoor
IklnuCABIGo,1807580,1813240,we lopen weer ging een oog naar beneden  toe  [Muziek]
IklnuCABIGo,1813240,1818620,en mijn dat kunnen wel zeggen hebben  niet van voetbalstadium gezien of ik ga
IklnuCABIGo,1818620,1824370,erin vandaag nog te zien krijgen is nog  vragen  maar
IklnuCABIGo,1824370,1831820,dat was in mijn geval 5  [Muziek]  gooien zien wat zeg je
IklnuCABIGo,1831820,1837100,ja we moesten daardoor het daar achter  langs achter die tribune zijn nu aan de
IklnuCABIGo,1837100,1842920,andere kant voetbalstadion  moeten we hier ergens naar binnen toe
IklnuCABIGo,1842920,1851000,door de keuken van restaurant geweest  vroeger ging ook weer hier doorheen
IklnuCABIGo,1851000,1856270,ja dan hier langs  ja
IklnuCABIGo,1856330,1862409,heer barry  hier  o ik dacht een wilt bij echt iemand god
IklnuCABIGo,1862409,1867809,ik schrok even hebben ooghoeken  en dat noemen we dan een
IklnuCABIGo,1867809,1874830,goede deur  ja en dan zou hij hier
IklnuCABIGo,1874830,1882600,[Muziek]  die kans  ja zo kom je nog eens ergens
IklnuCABIGo,1882980,1889690,[Muziek]  nou en dan gewichten beginnen in voor je  van het hotel
IklnuCABIGo,1889690,1897179,waarom geeft lekker rustig aan wachten  tot kapen die uit gefotografeerd is moet  alle  mythen grtz die daar in de rij stonden
IklnuCABIGo,1897179,1902950,en hopelijk hebben ze straks nog even  wat energie over om ook onze ons kids
IklnuCABIGo,1902950,1910630,liegen wat meeting pieten want die hebt  ook wel heel erg op verheugd maar goed  te gaan we even lekker rustig hier  wachten en luxueus leven plassen dat kan
IklnuCABIGo,1910630,1916539,hier  en dan hoop ik dat het hier straks nog  even kunnen om nou terwijl hun dieren
IklnuCABIGo,1916539,1922360,vlekken daar zitten dit het de meisjes  aan de bar europa wil iets gekregen om
IklnuCABIGo,1922360,1928389,te tekenen  da's leuk dat zijn tasjes  dat is mooi er zijn weer creatief bezig
IklnuCABIGo,1928389,1936190,hier  ja  oh is ook allemaal puzzeltjes ook
IklnuCABIGo,1936190,1943309,wat is leuk  dus je een heel naar  en dan zitten ze gewoon samen aan de bar
IklnuCABIGo,1943309,1950169,hij zit hier nu al wel een paar hij kan  toch niet rappen met een biertje petitie
IklnuCABIGo,1950169,1955880,om een gebaar aan lea pro studie kon  daaraan kijkers pilletjes
IklnuCABIGo,1955880,1962780,we beginnen doen  hey heb je het gevonden via fluitje  gevonden mediant opeten zo te zien
IklnuCABIGo,1962780,1969409,nee ik heb ik heb je wat in de mond  niemand is open dus je modi ja hij heeft  wat in de mond dus open
IklnuCABIGo,1969409,1977690,ja kijk  je kan je toch niet opeten met je mee
IklnuCABIGo,1977690,1983270,la  kom hier mama heeft een soepstengel voor  jou  oké vind ik uit mijn soepstengels  gegeven
