vid,start,end,text
IklnuCABIGo,1983270,1989090,zit ik al een flyer je op te eten dat is  niet de bedoeling  jij bent hier een lekker drankje nog
IklnuCABIGo,1989090,1995990,geboden haar  oog aan ebf wat eten
IklnuCABIGo,1995990,2001840,de balie zwol en deze fiat flyer pak was  in opeten
IklnuCABIGo,2001840,2005070,[Muziek]
IklnuCABIGo,2007149,2013740,is  dus dat ik vanuit  mijn naar een  dat ik een foutje
IklnuCABIGo,2013740,2019720,en champagne erbij  te zoomen
IklnuCABIGo,2019720,2025309,die mag je opeten  een leuke man aan je
IklnuCABIGo,2026570,2033210,roos op carado wel leuk eruit komen ja  als het goed is karma hier belang
IklnuCABIGo,2033210,2040080,waarschijnlijk wel moe was hebben dan  100 foto's kan draaien gaat nog gebeuren  weten hoe het is zo we willen de vlag om
IklnuCABIGo,2040080,2046440,mensen ervan dat hij nu wel het vlot  moment je maar 2 neem een ze vroeg ons  je mij nu wachters laatst naast
IklnuCABIGo,2046440,2052500,achteraan open zee de laatsten zullen de  eersten zijn de ging zouden gaan  barbecuen elkaar oma
IklnuCABIGo,2052500,2057830,dus je we heel je echt dat er iets laten  komen de komende om 3 uur waarom vijf  uur
IklnuCABIGo,2058950,2064460,ik zeggen dat gaat  smaken
IklnuCABIGo,2064460,2069898,corstiaan ziet er ook wanneer alle  hoe heette die super dorst eer maar eens
IklnuCABIGo,2069898,2077370,buiten super  lekker aan het slapen  meisjes en daar wil en het jaar kletsen
IklnuCABIGo,2077370,2085230,zijde succes in burgh spelen zingen  neerdalen  moeten nog even wachten ja k3 je
IklnuCABIGo,2085230,2091860,calorieën heeft nog steeds meet and  greets ze zijn nog niet afgelopen lopen  een beetje uit excel van willen jullie
IklnuCABIGo,2091860,2098130,echt een kader is ie dus verwachten want  het allerlaatste maar die momentjes  wilders nog een ik snap ik ook wel de
IklnuCABIGo,2098130,2105750,beelden op verheugt super zou eigenlijk  op de opa en oma gaan barbecuen maar  kijk wat met die belt even met oma doen
IklnuCABIGo,2105750,2110850,een andere keer onder te gaan we nieuwe  redden vandaag en ik koop er drie komt  zullen nog wel even langs
IklnuCABIGo,2110850,2117210,we zitten hier in het hotel waar ze ook  overnachten  morgen hebben zie je weer een mier en  greet' echt gesprek adrie van liefde
IklnuCABIGo,2117210,2122460,crisis altijd heel intens beter wij heel  moe uit eigen ervaring dus die of slapen
IklnuCABIGo,2122460,2127650,hier zoons goed is komen ze straks op  hier even langs  en hopelijk zijn ze dan niet te doen dat
IklnuCABIGo,2127650,2133779,zo nog even hallo' tegen ons kunnen  zeggen  maar dan overnachten zie hier al hebben  ze morgen weer een lied een gebied dat
IklnuCABIGo,2133779,2137109,niet helemaal
IklnuCABIGo,2139700,2145849,ja dan blijft jullie staan  ja als je artiest moet je dan niet ja ik
IklnuCABIGo,2145849,2151400,denk dat het wel leuk is ja je bent in  het echt te ontmoeten
IklnuCABIGo,2151400,2156410,alleen ik weet niet of die de week en  in die week en denken in de zoveel tijd
IklnuCABIGo,2156410,2161630,is niet ik wel leuk we hebben ook al een  mythe buurt meer gedaan met onze fans
IklnuCABIGo,2161630,2166880,zo proberen we moeten ja naam is dat wel  jullie om was altijd heel leuk met de
IklnuCABIGo,2166880,2171979,woonkamers tent oh ja met 10 festival  gaan weg je na tienen verschijnt
IklnuCABIGo,2171979,2178849,nee papa nog niet weet je nog weten voor  jullie vraagt regelen 2023 of twee
IklnuCABIGo,2178849,2182049,dit jaar als naar een lone wolf
IklnuCABIGo,2184249,2190640,dus we hebben nog geen met iets mccain  in dit jaar misschien wel misschien niet  nu al niet wil dadelijk wel heel graag
IklnuCABIGo,2190640,2198319,optreden beschikken wordt creatine  verzinnen  hoeveel mensen hoeveel tieners achter
IklnuCABIGo,2198319,2204559,nee tien jaar schillen  denkt u kiest mijn ja tina festival is
IklnuCABIGo,2204559,2210019,het  team wat naar negerin tiener als je veel
IklnuCABIGo,2210019,2217880,naar  nooit tiener tiener 10 tienen is de tina  voor tieners dit gesprek leidt nergens
IklnuCABIGo,2217880,2224150,met u jongens ja kijk flesjes die ligt  lekker te slapen heer deze kant heerlijk
IklnuCABIGo,2224150,2230810,lekker in de kinderwagen  terwijl wij hier weet je en de chillen
IklnuCABIGo,2230810,2236600,gameten avondje  wachtend op  kader
IklnuCABIGo,2236600,2243080,gaan ze doelen te leggen onze  gaan we gaan het zien geen ideeën ons  wel tegen deze vlog ook gaat brengen wat
IklnuCABIGo,2243080,2248210,is een beetje in gedachten van de alle  gaan k3 ontmoet maar misschien ontmoeten  we kade helemaal niet
IklnuCABIGo,2248210,2255020,onze teams hebben begrepen ja want we  weten want islam heb ze hebben nu 300  fans ontmoet of lopen 300 kaarten waren
IklnuCABIGo,2255020,2260090,er 300 foto's  nou hadden alle fans die kunnen om leuke  cadeautjes meegenomen als super leuk
IklnuCABIGo,2260090,2268280,aandacht we hebben dus we begrijpen dat  dat heel erg lange  rode voel de laatste blijf je gewoon erg
IklnuCABIGo,2268280,2274400,lekker achter hem nog te wachten waarom  stuur je 100 zijn neem er lekker wat  drinken
IklnuCABIGo,2274400,2280280,we zullen even gereedgemaakt  jaloezie en vermaken ons prima met de  lekker wat drinken gekregen met beleg in
IklnuCABIGo,2280280,2286720,eten gekregen we hebben open oh mijn de  barbecue wel afgebeld  jullie de volgende keer
IklnuCABIGo,2286720,2293329,maar hebben wel het stadion gezien  maak die allemaal vanuit je krijgt zien
IklnuCABIGo,2293329,2298430,hoe  mooi  nou een eindje en de plek aan de spelen
IklnuCABIGo,2298430,2305619,zo ziet het er uit als je vier uur lang  het wachten is op kwaad
IklnuCABIGo,2307880,2313039,de meisjes zijn dat het spelen  op bali gitaar droog zijn de veel tegen
IklnuCABIGo,2313039,2318499,michelle uit in gelukjes wil maar naar  huis gaan jongens misschien komt er al  weer een andere keer dat de cavity  kunnen ontmoeten
IklnuCABIGo,2318499,2326239,het is zijdes zullen nee nee nee wacht  ik wil niet naar huis we gewoon wachten
IklnuCABIGo,2326239,2332089,dus  ja de andere meisje met wie jullie een  van dacht waren die zijn wel naar huis
IklnuCABIGo,2332089,2337759,gegaan  maar jij bent nou toch al opa en oma  afgezegd moet de barbecues dat kan ook
IklnuCABIGo,2337759,2343059,al niet meer en het is nu altijd tussen  6:00 nieuw laat zien vanaf 6
IklnuCABIGo,2343059,2348619,hele kubus puzzel ja super lekker oké
IklnuCABIGo,2348619,2353890,maar ik wens u zult  jij mag mijn koekje van de koffie
IklnuCABIGo,2358839,2364609,je mag van papa dat mijn web papa wil  jij ook nog drie nog niet meewerken
IklnuCABIGo,2364609,2370089,gewoon lekker zwaait april zoals een  mooie medisch productie je
IklnuCABIGo,2373810,2379250,maar goed jongens nee we hopen dat het  we hopen dat is het wachten waard is dan
IklnuCABIGo,2379250,2386240,voor kinderen straks in de blij zijn dat  ze alsnog k3 hebben ontmoet symbolen oh  ja als ik er nog over hebben
IklnuCABIGo,2386240,2394730,speel de liedjes zingen van mango mango  opgenomen bij jou oké  hoewel het is ook nog doen met k3 weet
IklnuCABIGo,2394730,2399400,niet of ster de gevaren maar goed kunnen  dan vandaan
IklnuCABIGo,2400220,2403220,hallo
IklnuCABIGo,2406930,2412030,ja we dachten wij op het moment
IklnuCABIGo,2413270,2416380,[Muziek]
IklnuCABIGo,2420270,2427440,een andere stier tem het  in de kleur hallo
IklnuCABIGo,2432510,2440440,en ik dacht dit is was van de muziek ook  nog  [Muziek]
IklnuCABIGo,2445810,2450040,of ben ik hoorde mesjes
IklnuCABIGo,2456780,2462990,[Muziek]  precies en dat is mijn
IklnuCABIGo,2463350,2468869,meisje  [Muziek]  met
IklnuCABIGo,2468869,2475599,hij scheurde zijn haar  hier nam op en toch een leuks mee te  kijken
IklnuCABIGo,2475599,2480180,natuurlijk  nog meer zien
IklnuCABIGo,2482999,2488579,drie  maanden aan welke
IklnuCABIGo,2488579,2498599,mijn god mijn god je bent  mijn dat mijn welke ga je
IklnuCABIGo,2499450,2503549,[Muziek]  na
IklnuCABIGo,2507839,2515820,na na  na na na  [Muziek]
IklnuCABIGo,2519740,2525220,kijk  [Applaus]  mijn dat
IklnuCABIGo,2525220,2533140,mijn wil mijn welke  mijn dat mijn boeken
IklnuCABIGo,2533140,2539769,en mijn kunnen na na
IklnuCABIGo,2540670,2546640,na na  na na na
IklnuCABIGo,2546640,2549640,na
IklnuCABIGo,2556590,2563370,ja  jou
IklnuCABIGo,2587190,2590190,wachtebeke
IklnuCABIGo,2594960,2601480,een  [Muziek]
IklnuCABIGo,2601480,2607330,en  [Muziek]
IklnuCABIGo,2607330,2615600,ijssalon  deze opstanden  bent en gewoon tijd ging snel voorbij
IklnuCABIGo,2615600,2618139,[Muziek]
