vid,start,end,text
Ugpb_nA6wKw,718220,721040,remix không làm nổi Tôi biết bị bán đi
Ugpb_nA6wKw,721040,723170,dù thứ đồ thành lý tương lai sẽ đầy khó
Ugpb_nA6wKw,723170,724610,khăn tôi sẽ cạnh tranh với những cái tên
Ugpb_nA6wKw,724610,727250,như since were killed chất Alice Walton
Ugpb_nA6wKw,727250,729110,này hay tải game có lối chơi và chủ đề
Ugpb_nA6wKw,729110,731060,rất tương tự sắp được tung là khả năng
Ugpb_nA6wKw,731060,732500,cao là những Avengers shop bại
Ugpb_nA6wKw,732500,735260,unassemble trong thế giới game ok Cái đó
Ugpb_nA6wKw,735260,736700,là cốt truyện của Marvel Avengers
Ugpb_nA6wKw,736700,738440,endgame từ bom tấn được mong đợi sẽ làm
Ugpb_nA6wKw,738440,740210,tất bà Thảo mạnh mặt chuyên môn lẫn dân
Ugpb_nA6wKw,740210,741860,số của rồi và là nguyên nhân trực tiếp
Ugpb_nA6wKw,741860,743600,thi công ty Nhật Bản này phải bán một
Ugpb_nA6wKw,743600,745520,lạc như siro của mình tại phương tây đến
Ugpb_nA6wKw,745520,747050,đây tìm video không hết thôi nếu tao
Ugpb_nA6wKw,747050,749670,viên vị trí từ một này sẽ cũng như nói
Ugpb_nA6wKw,749670,751649,cần thế mà lỡ bất kì video tiếp theo tôi
Ugpb_nA6wKw,751649,754520,nói một mình xin chào và gặp lại
Ugpb_nA6wKw,754520,757429,[âm nhạc]
Ugpb_nA6wKw,757429,760529,vì theo mình đó quên bao đêm dài em vào
Ugpb_nA6wKw,760529,765240,đêm Nguyễn Minh để Trinh subi3bie
