vid,start,end,text
Ugpb_nA6wKw,0,3060,hai nước giới hạn quà năm 2017 Hiếu Vũ
Ugpb_nA6wKw,3060,4710,Trụ rảnh mà vừa ra đỉnh cao của đàn bà
Ugpb_nA6wKw,4710,6990,trò chơi mang mật dành aventures de
Ugpb_nA6wKw,6990,8670,coriolis nhanh chóng nhận được sự chú ý
Ugpb_nA6wKw,8670,10349,của làng game tôi nhanh lên cuối năm
Ugpb_nA6wKw,10349,13469,2020 yosuke Maria sieu công ty này cho
Ugpb_nA6wKw,13469,15330,biết Marvel Avengers là khi công ty họ
Ugpb_nA6wKw,15330,17670,thì hại đến hơn 105 triệu đô Chuyện gì
Ugpb_nA6wKw,17670,19560,đã xảy ra vì sao dự án tưởng chừng như
Ugpb_nA6wKw,19560,21150,cực kỳ án cuối cùng là trở thành một
Ugpb_nA6wKw,21150,23460,thất bại thảm hại trong video này hãy
Ugpb_nA6wKw,23460,24990,cùng tôi tìm hiểu về cách mà Marvel
Ugpb_nA6wKw,24990,26730,venture Dock ethernet phải bán Tống bán
Ugpb_nA6wKw,26730,28349,tháo Một loạt xe đua của mình hèn nhát
Ugpb_nA6wKw,28349,32070,không Bây giờ thì bắt đầu ra rằng à
Ugpb_nA6wKw,32070,35130,[âm nhạc]
Ugpb_nA6wKw,35480,38090,khi video này lại đương ta chờ bởi vì
Ugpb_nA6wKw,38090,40070,phần mềm chơi game bản quyền với giá
Ugpb_nA6wKw,40070,42500,siêu hạt dẻ lại là tôi minh quảng cáo
Ugpb_nA6wKw,42500,45170,đây đổi thay đổi mà xăng hơn 30.000 đêm
Ugpb_nA6wKw,45170,46579,thì một triệu tám tiên mua game bản
Ugpb_nA6wKw,46579,48199,quyền với nhiều người là cái gì đó xa
Ugpb_nA6wKw,48199,50510,xôi lắm Nhã Nếu bạn nghĩ như thế thì bạn
Ugpb_nA6wKw,50510,52550,đến đúng chỗ rồi đấy Cái gì Con chỉ bạn
Ugpb_nA6wKw,52550,53629,có thể chơi nhiều tựa game bản quyền
Ugpb_nA6wKw,53629,55730,miễn phí tư vấn viên là những tựa game
Ugpb_nA6wKw,55730,57530,luôn chuyển ngẫu nhiên cả tuần Dĩ nhiên
Ugpb_nA6wKw,57530,59210,là với chi phí nhỏ hơn nhiều so với mua
Ugpb_nA6wKw,59210,61640,game trên steam 4 năm vận hành và phát
Ugpb_nA6wKw,61640,63559,triển liên quân chi đã có hơn 200 ngàn
Ugpb_nA6wKw,63559,65360,thành viên trung cấp hơn một triệu hai
Ugpb_nA6wKw,65360,67340,trăm nghìn giờ chơi nên tải game bản
Ugpb_nA6wKw,67340,69289,quyền giá rẻ uy tín cho người Việt và
Ugpb_nA6wKw,69289,70850,các bạn đã xem những game đang hót hòn
Ugpb_nA6wKw,70850,72530,họt như Vinasun cũng có trong việc phân
Ugpb_nA6wKw,72530,75170,kì plastar và được miễn phí Và Biển cho
Ugpb_nA6wKw,75170,76850,các bạn thoải mái mà chả nghiệp trước
Ugpb_nA6wKw,76850,79369,khi xem sport với Liberty các bạn thể
Ugpb_nA6wKw,79369,81110,chơi game bản quyền này xem phiên bản
Ugpb_nA6wKw,81110,83450,quyền này những game miễn phí này là con
Ugpb_nA6wKw,83450,84619,đang được thử nghiệm các tính năng dịch
Ugpb_nA6wKw,84619,86479,game thời gian thực với con chân chơi gì
Ugpb_nA6wKw,86479,88009,nữa Hãy nhanh lúc ta đứng lên nghe dưới
Ugpb_nA6wKw,88009,89509,tầng một ạ để đăng ký miễn phí cho mình
Ugpb_nA6wKw,89509,90590,một tài khoản bị bệnh gì ngay ngày hôm
Ugpb_nA6wKw,90590,95490,nay câu bây giờ quay lại với vô nào ạ
Ugpb_nA6wKw,95490,96860,Tải
Ugpb_nA6wKw,96860,99329,game Siêu Anh Hùng vốn là lĩnh vực được
Ugpb_nA6wKw,99329,101250,cảm ơn và xin tham gia từ lâu từ
Ugpb_nA6wKw,101250,104189,Spiderman macaulay năm 1982 chứa những
Ugpb_nA6wKw,104189,105780,trải nghiệm đậm chất điện ảnh Như bắt ma
Ugpb_nA6wKw,105780,108600,nào sao Spiderman 2018 Tuy nhiên ngoài
Ugpb_nA6wKw,108600,110220,trường cho em ra tra thẻ tướng liên tục
Ugpb_nA6wKw,110220,112200,này Nhưng mai tui tui người chơi chưa có
Ugpb_nA6wKw,112200,113430,cơ hội tập hợp những siêu anh hùng của
Ugpb_nA6wKw,113430,115560,marvel chung với một tựa game và vì vậy
Ugpb_nA6wKw,115560,117570,khi duran trợ đỗ xe của Sunny đường hay
Ugpb_nA6wKw,117570,119280,lộ thể nói đây là thử được nhiều qua
Ugpb_nA6wKw,119280,121530,mong chờ từ rất lâu dự án nước đảm nhận
Ugpb_nA6wKw,121530,123810,sản xuất blacklisted studio với hơn 20
Ugpb_nA6wKw,123810,125039,năm kinh nghiệm thực hiện series Tomb
Ugpb_nA6wKw,125039,127049,Raider cộng thêm nhân converter splendid
Ugpb_nA6wKw,127049,129179,Marvel chợ huyện Chợ làm siêu phẩm Chip
Ugpb_nA6wKw,129179,132480,Còi chất lượng đỉnh cao vào năm 2019 khi
Ugpb_nA6wKw,132480,133890,đoạn trailer của nó được tung ra tại hội
Ugpb_nA6wKw,133890,135930,chợ bà càng khiến người ta sôi sục hơn
Ugpb_nA6wKw,135930,137790,với độ hoành tráng không khác dù phim
Ugpb_nA6wKw,137790,139860,bom tấn Marvel trên trời mà chức năng có
Ugpb_nA6wKw,139860,141540,bốn người đi mua đặc điểm nội được xây
Ugpb_nA6wKw,141540,143549,nên nhiều lần nhấn mạnh là việc nó không
Ugpb_nA6wKw,143549,145890,hiểu máu theo công ty này game sẽ không
Ugpb_nA6wKw,145890,147540,Lúc đó thế bất kỳ chưa chọn Vitamin nào
Ugpb_nA6wKw,147540,149700,cả những gì vẫn có một số fan cảm thấy
Ugpb_nA6wKw,149700,151350,không hài lòng với tạo hình nhân vật giá
Ugpb_nA6wKw,151350,152970,nhà nước lắc video được quý nhân vật
Ugpb_nA6wKw,152970,155160,trong phim sex con cắt lần marica thì
Ugpb_nA6wKw,155160,158050,trong như em mặc áo chống đạn baby không
Ugpb_nA6wKw,158050,159910,có bản quyền của mặt diễn viên Christmas
Ugpb_nA6wKw,159910,161530,bản thiết kế nhân vật của mình hơi giống
Ugpb_nA6wKw,161530,163390,nhưng lại không được phép giống phiên
Ugpb_nA6wKw,163390,165250,bản trong phim Khi nha như cảm thấy nó
Ugpb_nA6wKw,165250,167920,hơi pha ke và cực kỳ lạ chân không khác
Ugpb_nA6wKw,167920,169180,gì kỹ xảo phim truyền hình Trung Quốc
Ugpb_nA6wKw,169180,171490,Nước May là chỉ sau đó một tháng ta là
Ugpb_nA6wKw,171490,172870,những nhân vật Marvel này được chỉnh sửa
Ugpb_nA6wKw,172870,174940,lại cái thì mới đỡ nhức mắt hơn một chút
Ugpb_nA6wKw,174940,176830,trong bài phỏng vấn của ADN sau đó
Ugpb_nA6wKw,176830,178840,restore đã biết cho biết rằng game sẽ có
Ugpb_nA6wKw,178840,180760,chức năng nạp tiền nhưng với nó mà chưa
Ugpb_nA6wKw,180760,182050,thấy Mua những trang phục ở bên cạnh yêu
Ugpb_nA6wKw,182050,183640,thích của mình mà thôi không hơn không
Ugpb_nA6wKw,183640,185890,kém với tính khác tốt của siro đã từng
Ugpb_nA6wKw,185890,187900,hiện sẽ đi tuner những lo lắng về việc
Ugpb_nA6wKw,187900,190060,game cú máu hay không Tạm thời được lắng
Ugpb_nA6wKw,190060,192520,xuống từ gì tính nào sau vào tháng 9
Ugpb_nA6wKw,192520,194800,2019 chiếu bản demo của marvel chợ bắt
Ugpb_nA6wKw,194800,196300,đầu được những nhà báo và clip trải
Ugpb_nA6wKw,196300,198130,nghiệm remix đã đối mặt với một cơn đau
Ugpb_nA6wKw,198130,200020,đầu khác bán chạy thử của tựa game này
Ugpb_nA6wKw,200020,202240,thì đánh giá là nhạt nhòa không đã tay
Ugpb_nA6wKw,202240,204010,bởi vì nó quá ôm đồm Những Siêu Anh Hùng
Ugpb_nA6wKw,204010,206050,có rất ít đất diễn và thế là chiêu trò
Ugpb_nA6wKw,206050,208780,cũ kisame tiếp tục với hẹn gặp bác hoàn
Ugpb_nA6wKw,208780,211000,thiện của game sẽ mở trái ngược hoàn
Ugpb_nA6wKw,211000,212770,toàn với phần demo gần như là cầm tay
Ugpb_nA6wKw,212770,214630,chỉ việc bởi vì toàn là những pha What
Ugpb_nA6wKw,214630,217250,time is it em yêu ngày mang bầu vẫn chờ
Ugpb_nA6wKw,217250,219409,bây giờ là từ đầu tháng 5 20 20 sang
Ugpb_nA6wKw,219409,221299,tháng 9 này còn 70 nhưng mà các bạn biết
Ugpb_nA6wKw,221299,223069,gì không những nó nói tôi Bà bầu nên trả
Ugpb_nA6wKw,223069,224930,trước thì nó mắc chưa dừng lại đó vào
Ugpb_nA6wKw,224930,227000,ngày 3 tháng 8 này khỏi 11 tháng trước
Ugpb_nA6wKw,227000,228650,khi mở bảng Sony tiếng gọi nhưng
Ugpb_nA6wKw,228650,230120,Spiderman sẽ độc quyền về máy
Ugpb_nA6wKw,230120,232370,PlayStation trong khi Kris tôi đã biết
Ugpb_nA6wKw,232370,233900,cho rằng với số lượng khổng lồ của thử
Ugpb_nA6wKw,233900,235700,xem Hồng Thu tụ điện ảnh mà bộ Phi Tiêu
Ugpb_nA6wKw,235700,237620,Môn nhân vật sẽ không có ảnh hưởng Tuy
Ugpb_nA6wKw,237620,239420,nhiên người chơi tôi cá là một trăm phần
Ugpb_nA6wKw,239420,241160,trăm game thủ Audition và bốc đều cây
Ugpb_nA6wKw,241160,243590,qua và Cl cho cảm giác bị đẩy xuống đấy
Ugpb_nA6wKw,243590,245780,xã hội gương mặt lên trời cao thấy mấy
Ugpb_nA6wKw,245780,247730,đứa Lysine đang router lướt qua lướt lại
Ugpb_nA6wKw,247730,250430,đâu quá chưa hết anh chàng Người Nhện
Ugpb_nA6wKw,250430,251629,thân thiện không phải là thứ duy nhất
Ugpb_nA6wKw,251629,253730,trong hoạt động giữa Sonic và Sony những
Ugpb_nA6wKw,253730,255470,người dùng licensed còn được một số do1
Ugpb_nA6wKw,255470,257359,phẩm ingame Nuskin đặc biệt hoàn toàn
Ugpb_nA6wKw,257359,259760,miễn phí game đa nền tảng nhưng nội dung
Ugpb_nA6wKw,259760,261949,nhân vật trong đêm thì không đa nền bạn
Ugpb_nA6wKw,261949,263870,đúng là một bước đi tập chiều đưa anh
Ugpb_nA6wKw,263870,266410,trở về lòng đất
Ugpb_nA6wKw,267550,271010,ngày 4 tháng 9 năm 2010 Marvel Avengers
Ugpb_nA6wKw,271010,272750,chính thức được ra mắt từ ghép nhận được
Ugpb_nA6wKw,272750,274340,bản hồ ban đầu không tải phim hoặc
Ugpb_nA6wKw,274340,276930,restoring biết để tạo thế em về mặt thị
Ugpb_nA6wKw,276930,278460,giác cũng như gameplay góc nhìn thứ 3
Ugpb_nA6wKw,278460,280470,rất thú vị kết hợp với nhau trong câu
Ugpb_nA6wKw,280470,283440,chuyện đầy thú vị của thế giới Marvel nó
Ugpb_nA6wKw,283440,285750,"bàn tay cho đến 8,5 điểm đồng thời nhấn"
Ugpb_nA6wKw,285750,287190,mạnh mua độ đã tay khi điều khiển như
Ugpb_nA6wKw,287190,288870,xuyên Hùng với đồ họa đầy màu sắc trong
Ugpb_nA6wKw,288870,291569,game sport Model venture 7 trên 10 điểm
Ugpb_nA6wKw,291569,293490,khi người khả năng tùy biến nhân vật và
Ugpb_nA6wKw,293490,294810,các chiêu thức cũng như khả năng chơi
Ugpb_nA6wKw,294810,296849,phối hợp cùng bạn bè đi đâu đó vẫn còn
Ugpb_nA6wKw,296849,299520,Bấp lỗi vặt nhưng cũng không Quá tệ hại
Ugpb_nA6wKw,299520,301860,về mặt Tổng đoàn người chơi mở tận hưởng
Ugpb_nA6wKw,301860,304410,tựa game này khi từng căng mập trôi qua
Ugpb_nA6wKw,304410,306780,cũng là lúc mà những vấn đề độ là nói
Ugpb_nA6wKw,306780,308520,nào ngày xưa biết đã thiết kế và quảng
Ugpb_nA6wKw,308520,310860,cáo Marvel chờ nhiều game Xmas có nghĩa
Ugpb_nA6wKw,310860,312569,là nội dung như các siêu lùn thử thách
Ugpb_nA6wKw,312569,314250,và màn chơi sẽ được thêm vào game liên
Ugpb_nA6wKw,314250,316440,tục sau khi ra mắt phân câu chuyện trên
Ugpb_nA6wKw,316440,318419,Gogle kết thúc sau hơn 10 tiếng Trời Và
Ugpb_nA6wKw,318419,320520,đây là lúc nhược điểm của nó lộ rõ tôi
Ugpb_nA6wKw,320520,321870,giúp người chơi phải làm sau khi phá đảo
Ugpb_nA6wKw,321870,323430,game là chơi đi chơi lại những nhiệm vụ
Ugpb_nA6wKw,323430,325259,quá ngắn đúng nói những cái được lặp đi
Ugpb_nA6wKw,325259,327030,lặp lại những hành lang giống nhau y hệt
Ugpb_nA6wKw,327030,329250,cái baby không mua được bản quyền toàn
Ugpb_nA6wKw,329250,331590,bộ nên thay vì rất nhiều siêu phản diện
Ugpb_nA6wKw,331590,332880,trong thế giới màu Từ ghép là chinh phục
Ugpb_nA6wKw,332880,334889,vụ game thủ 2 món gì nhất đây là phát
Ugpb_nA6wKw,334889,337420,poster A malaysian không có những nhân
Ugpb_nA6wKw,337420,340410,vật phản diện Uzbekistan especial lum
Ugpb_nA6wKw,340410,343120,nửa tháng sau khi ra mắt mua bán bác chứ
Ugpb_nA6wKw,343120,345280,tao khổng lồ dassidirect Tùng đã sửa đến
Ugpb_nA6wKw,345280,347260,hơn 1.000 công thức nghe thì kinh đấy
Ugpb_nA6wKw,347260,349840,nhưng vì bạn sửa lỗi quá lần được dac là
Ugpb_nA6wKw,349840,351520,phiên bản net trên của game bị trì hoãn
Ugpb_nA6wKw,351520,353980,như tôi nói trên lỗ chứ đâu phần nhỏ
Ugpb_nA6wKw,353980,355540,trong số những vấn đề của marvel chợ mà
Ugpb_nA6wKw,355540,357070,thôi việc không có đi o c và nội dung
Ugpb_nA6wKw,357070,359530,mới không có anh game thú vị có thể nói
Ugpb_nA6wKw,359530,360850,nếu có ăn tự đối với những game là
Ugpb_nA6wKw,360850,363070,Switch game thủ lần lượt từ bỏ tựa game
Ugpb_nA6wKw,363070,364930,này khi phần chơi đơn kết thúc khi số
Ugpb_nA6wKw,364930,366400,lượng người chơi cùng lúc đó tuột dốc
Ugpb_nA6wKw,366400,368740,không phanh Justin Bieber từ số người
Ugpb_nA6wKw,368740,370570,chơi hơn 30.000 chút là mắt phía sau 1
Ugpb_nA6wKw,370570,373180,tháng còn lại 3.000 và đến tháng 11 năm
Ugpb_nA6wKw,373180,375190,đó Tưởng là hai tháng sau khi là mất chỉ
Ugpb_nA6wKw,375190,377620,còn là vỏn vẹn 3 chữ số mà thôi nhiều
Ugpb_nA6wKw,377620,379900,bạn sẽ bảo nó kìa Người Ta Không chơi
Ugpb_nA6wKw,379900,381880,thì thôi mặc kệ đời mình thích là được
Ugpb_nA6wKw,381880,384640,cái bàn thiệp thiệp ngay cái tượng đấy
Ugpb_nA6wKw,384640,386110,tôi khi sử dụng giảm người chơi này
Ugpb_nA6wKw,386110,387880,khiến cho vấn đề về ghép Trần nổi lên
Ugpb_nA6wKw,387880,390100,các bạn còn nhớ Bà nhảy tôi đó là toilet
Ugpb_nA6wKw,390100,391990,quảng cáo rằng nuôi chứ tao học cách tối
Ugpb_nA6wKw,391990,393370,đa cùng ba người khác trong một đêm
Ugpb_nA6wKw,393370,396770,không nói chung trò chơi bốn người cùng
Ugpb_nA6wKw,396770,398810,lúc Nhưng mà khi số người cho la giảm
Ugpb_nA6wKw,398810,400850,xuống thời gian cũng như độ khó của việc
Ugpb_nA6wKw,400850,403070,tìm cận sẽ tăng lên và phương pháp chữa
Ugpb_nA6wKw,403070,405260,cháy crucial đã biết thì đó là tung vào
Ugpb_nA6wKw,405260,407390,trận đấu những con boss III đến Lấp vào
Ugpb_nA6wKw,407390,409760,khoảng trống không có người trời mod thì
Ugpb_nA6wKw,409760,411350,các bạn biết rồi đấy chúng chẳng bao giờ
Ugpb_nA6wKw,411350,412910,bằng được người thật tôi là trong những
Ugpb_nA6wKw,412910,414650,Listen and nghèo khó người trước mắt đã
Ugpb_nA6wKw,414650,416540,mệt là con phải bỏ công bảo vệ những đứa
Ugpb_nA6wKw,416540,419090,đồng nội vừa ngu vừa liều ta là họ chọn
Ugpb_nA6wKw,419090,420950,cách tự giải thoát Bản Thân Xóa cái
Ugpb_nA6wKw,420950,423620,không chơi nữa quá ngọt của marvel chở
Ugpb_nA6wKw,423620,425570,đến nhanh không tưởng tái báo cáo kinh
Ugpb_nA6wKw,425570,426920,doanh 2 tháng sau khi từ bên này nắng
Ugpb_nA6wKw,426920,429380,rồi đi cho biết công ty này lỗ đến 48
Ugpb_nA6wKw,429380,431720,triệu đô giai đoạn nửa năm gần nhất theo
Ugpb_nA6wKw,431720,433400,Phân tích chi phí ước khoái từ điểm này
Ugpb_nA6wKw,433400,435590,gần 200 triệu và chỉ đã đưa Sống phần
Ugpb_nA6wKw,435590,436880,trăm mục tiêu doanh số đề ra
Ugpb_nA6wKw,436880,440530,[âm nhạc]
Ugpb_nA6wKw,440530,443390,mắt có kết quả không mấy tốt đẹp Sonic
Ugpb_nA6wKw,443390,444700,vẫn tiếp tục lên kế hoạch của mình
Ugpb_nA6wKw,444700,448250,operation Kata shop zechariah am là bán
Ugpb_nA6wKw,448250,449750,mở rộng đầu tiên của game đưa công ty
Ugpb_nA6wKw,449750,452060,này tung ra vào tháng 12 2000 theo sau
Ugpb_nA6wKw,452060,454370,nó là hai điều trị lớn có tên gọi là
Ugpb_nA6wKw,454370,457560,operation or Cai A Perfect võ operation
Ugpb_nA6wKw,457560,460259,Black panther War wakanda mua bán cách
Ugpb_nA6wKw,460259,462150,nhau vài tháng nó vậy đấy các bạn thấy
Ugpb_nA6wKw,462150,464310,rằng vào thời điểm đó mà vỏ bên chợ vẫn
Ugpb_nA6wKw,464310,466590,được đầu tư mặt trên số ảnh động tưởng
Ugpb_nA6wKw,466590,468210,chừng như với sự tin tưởng đó quyết
Ugpb_nA6wKw,468210,470009,Ceramic sẽ dần dần biết game này thành
Ugpb_nA6wKw,470009,472800,một game đáng trời chứ không đầu tư một
Ugpb_nA6wKw,472800,474990,thì họ lại phát Bạn cứ lúc người chơi
Ugpb_nA6wKw,474990,477210,đang rời bỏ kèm tùy vào tháng 3 năm 2014
Ugpb_nA6wKw,477210,480030,Christmas tung ra bản bát để làm chậm
Ugpb_nA6wKw,480030,482550,quá trình lên cấp của họ ban tử tù Xem
Ugpb_nA6wKw,482550,484380,người dùng đang tăng tiền đằng sau khi
Ugpb_nA6wKw,484380,485819,hết phần cốt truyện chị không có gì để
Ugpb_nA6wKw,485819,487500,chơi ngoài những nhiệm vụ lập đi lập lại
Ugpb_nA6wKw,487500,490020,Nhưng thay vì thêm vào chùm mới nhân vật
Ugpb_nA6wKw,490020,492479,mới restore remix là chọn cách biến thứ
Ugpb_nA6wKw,492479,494639,bị kia là nhàm chán đó thành thứ nhàm
Ugpb_nA6wKw,494639,496650,chán hơn nước đi này đuổi người chơi hay
Ugpb_nA6wKw,496650,498900,đấy nhưng các bạn biết điều gì làm tôi
Ugpb_nA6wKw,498900,500310,buồn cười không Đây là lời giải thích
Ugpb_nA6wKw,500310,501990,của Krystal remix cho việc điều chỉnh
Ugpb_nA6wKw,501990,504810,này cho họ chứ Đây Người chơi có thể lên
Ugpb_nA6wKw,504810,507449,cấp quá nhanh và có quá nhiều Suboi là
Ugpb_nA6wKw,507449,509759,mọi nhựa và mất phương hướng vì vậy sao
Ugpb_nA6wKw,509759,511800,đến kinh nghiệm cần có từ level 25 trả
Ugpb_nA6wKw,511800,513719,lời sẽ được tăng lên càng lên cao thì
Ugpb_nA6wKw,513719,516729,tăng càng nhiều điều vô lý với ở chỗ tư
Ugpb_nA6wKw,516729,518979,cấp 25 trả lời thì không còn người chơi
Ugpb_nA6wKw,518979,520900,mới nữa việc lên cấp nhanh đâu có làm họ
Ugpb_nA6wKw,520900,522880,nộp đâu đối với những người chơi mới tôi
Ugpb_nA6wKw,522880,525100,là từ cấp 20 trở xuống Tí tốc độ lên lại
Ugpb_nA6wKw,525100,526810,còn được tăng lên Tức là theo restore
Ugpb_nA6wKw,526810,528940,remix những người chơi trên cấp 25 là
Ugpb_nA6wKw,528940,530830,những người mới có những người dưới cho
Ugpb_nA6wKw,530830,532870,hai lần là những người chơi dày dặn kinh
Ugpb_nA6wKw,532870,535930,nghiệm thông minh đấy hoa dây hiệu khi
Ugpb_nA6wKw,535930,537250,cái hình này khiến người chơi Marvel lên
Ugpb_nA6wKw,537250,540010,trời bất ngờ ở nhà ngơ ngác và bật ngửa
Ugpb_nA6wKw,540010,542140,một bình luận cho nó biết đã chỉ rõ ra
Ugpb_nA6wKw,542140,544450,lần này cho quả cầu Đây là một bước đi
Ugpb_nA6wKw,544450,546910,tồi tệ việc lên cấp chưa giờ là một vấn
Ugpb_nA6wKw,546910,550060,đề tilkin tên mới là vấn đề đấy một
Ugpb_nA6wKw,550060,552010,người còn chỉ ra được vấn đề của em Thế
Ugpb_nA6wKw,552010,553870,mà mấy ngàn người chrysalid không thì
Ugpb_nA6wKw,553870,556090,được vấn đề của game chỉ rõ nhiều game
Ugpb_nA6wKw,556090,557620,thủ thắc mắc rằng ta sau một quyết định
Ugpb_nA6wKw,557620,560020,của Lý nó bị phản đối như vậy mà suýt
Ugpb_nA6wKw,560020,562210,vẫn tiếp tục tiến hành người chưa thắc
Ugpb_nA6wKw,562210,564910,mắc sẽ đi trả lời sau nửa năm khi vào
Ugpb_nA6wKw,564910,566950,tháng 10 năm 2011 dốc thế này trúng đâu
Ugpb_nA6wKw,566950,568840,thực phẩm mới bạn là em game trước đó
Ugpb_nA6wKw,568840,570340,người chơi chứ thể nạp tiền vào game để
Ugpb_nA6wKw,570340,572680,mua sim imel và những vật phẩm trang trí
Ugpb_nA6wKw,572680,574660,các tương tự mà thôi Nói chung là không
Ugpb_nA6wKw,574660,576709,hẹn hưởng đến nhịp những vật phẩm được
Ugpb_nA6wKw,576709,578570,Thêm vào lần này thì khác hẳn đối với
Ugpb_nA6wKw,578570,580490,người chơi lên cấp nhanh hơn và cách nạp
Ugpb_nA6wKw,580490,583070,phiền tới lúc này thì mua đồ đạc quá rồi
Ugpb_nA6wKw,583070,585680,đầu tiên hoặc giảm tốc độ lên cấp sau đó
Ugpb_nA6wKw,585680,587779,có bán mỹ phẩm tăng tốc độ lên cấp cho
Ugpb_nA6wKw,587779,590240,người chơi một phiên tục quá ơi là ngu
Ugpb_nA6wKw,590240,591889,ngốc không những việc làm này thể hiện
Ugpb_nA6wKw,591889,593480,sự tham làm biến một tựa game trước
Ugpb_nA6wKw,593480,595370,ngoài giá 60 độ là một tựa game mobile
Ugpb_nA6wKw,595370,597889,freetoplay nhưng bà Thuyên nó làm niềm
Ugpb_nA6wKw,597889,599690,tin người chơi và Krystal đã biết bị đổ
Ugpb_nA6wKw,599690,602209,vỡ hoàn toàn trước khi ghi là bắt video
Ugpb_nA6wKw,602209,604100,này nhấn mạnh rằng nạp tiền chứ ai giúp
Ugpb_nA6wKw,604100,605779,bạn có thêm Kim và đồ trang trí mà thôi
Ugpb_nA6wKw,605779,607880,Còn nhiên tức bay Tuyên sẽ không tồn tại
Ugpb_nA6wKw,607880,609560,trong tựa game này với nhưng sau một năm
Ugpb_nA6wKw,609560,611810,thì chúng lại lùn siêu thị không khó để
Ugpb_nA6wKw,611810,613820,đánh được như trước mà bên chợ tức giận
Ugpb_nA6wKw,613820,615920,và 6 tháng đấu tranh của game thủ cuối
Ugpb_nA6wKw,615920,618110,cùng vẫn ngày 3 tháng 11 năm 2011 tôi
Ugpb_nA6wKw,618110,620089,nick phải đầu hàng và tuyên bố sẽ xóa bỏ
Ugpb_nA6wKw,620089,623290,vật phẩm tăng kinh nghiệm à
Ugpb_nA6wKw,623290,627190,[âm nhạc]
Ugpb_nA6wKw,627190,629950,anh Võ năm 2019 sau khi mạnh nhất thử
Ugpb_nA6wKw,629950,631810,tải bà trong bài phỏng vấn nó chẳng lên
Ugpb_nA6wKw,631810,634240,cho biết siêu cứu Sonic nói rằng cái sọt
Ugpb_nA6wKw,634240,635980,like và một sự lựa chọn rất phù hợp để
Ugpb_nA6wKw,635980,637930,phát triển ma vỏ bên chờ bởi vì họ có
Ugpb_nA6wKw,637930,639760,kinh nghiệm phát triển như phiêu lưu anh
Ugpb_nA6wKw,639760,642430,đọc tới nào chị hai năm sau đó trong bản
Ugpb_nA6wKw,642430,644410,báo cáo tự nhiên của mình ông này cho
Ugpb_nA6wKw,644410,645790,biết là kết quả kinh doanh của mang bầu
Ugpb_nA6wKw,645790,647680,quen trợ không đạt kỳ vọng Nguyên nhân
Ugpb_nA6wKw,647680,649540,là vị trí game chưa phù hợp với đặc điểm
Ugpb_nA6wKw,649540,652120,của đội ngũ phát triển cái gì đây tới
Ugpb_nA6wKw,652120,653530,người cũ của tôi không đặt mặt như thế
Ugpb_nA6wKw,653530,656320,lúc giao gì thì bảo là phù hợp làm xong
Ugpb_nA6wKw,656320,658000,kết quả không tốt thì đổ cho không phù
Ugpb_nA6wKw,658000,660700,hợp đó là những biểu hiện của sự lươn
Ugpb_nA6wKw,660700,663130,lẹo dù là lỗi của ai kết quả cuối cùng
Ugpb_nA6wKw,663130,665350,cũng là lần đó theo tuần quay ngôi nhà
Ugpb_nA6wKw,665350,667510,phân tích ma van chờ và các em đúng Bác
Ugpb_nA6wKw,667510,669760,hàng ngày sau đó ra đèn đỏ và canxi đăng
Ugpb_nA6wKw,669760,671530,ký hai bên Nhật Bản thua lỗ đến 200
Ugpb_nA6wKw,671530,673690,triệu đồng trong một bước đi đầy bất ngờ
Ugpb_nA6wKw,673690,676390,cứ tháng năm 2022 xử lý đã tuyên bố bán
Ugpb_nA6wKw,676390,678610,nước hydro đã thực thì chúng Lisa Damage
Ugpb_nA6wKw,678610,682030,và is more friends với giá trị mômen 300
Ugpb_nA6wKw,682030,683860,Hero qua tăng kem và bánh quy ngon lại
Ugpb_nA6wKw,683860,685750,những thương hiệu như Chris Jones order
Ugpb_nA6wKw,685750,688400,cheap Galaxy A anh cũng như là giận
Ugpb_nA6wKw,688400,689720,trong tương lai như tai game tục những
Ugpb_nA6wKw,689720,692060,siro này tôi muốn này đúng là bán hàng
Ugpb_nA6wKw,692060,694160,thành lý các bạn Quyết vì sao không để
Ugpb_nA6wKw,694160,696080,tiện So sánh thì em this group đã phải
Ugpb_nA6wKw,696080,698630,"trả đến 1,3 tỷ đô để mugi-box trước đó"
Ugpb_nA6wKw,698630,701570,"bạn bè 15 Sony Mobile gì em mới giá 3,6"
Ugpb_nA6wKw,701570,704030,tỷ đô còn là Yamazaki nutty sân bây giờ
Ugpb_nA6wKw,704030,706490,với giá 69 tỷ trong khi suýt bán gạch
Ugpb_nA6wKw,706490,708950,Ceramic và is almost chiều với giá không
Ugpb_nA6wKw,708950,711860,phải 3 tỷ sau khi được cập nhật bổ sung
Ugpb_nA6wKw,711860,714290,Kha kể từ 25 hoạt động nhưng để Marvel
Ugpb_nA6wKw,714290,716330,ôm Chở ra một game hấp dẫn luôn kéo được
Ugpb_nA6wKw,716330,718220,người chơi bỏ tiền ra màu đỏ thì có lẽ
