vid,start,end,text
xu-WuJtOl0c,995440,997839,day to begin the discipline of putting
xu-WuJtOl0c,997839,1000560,that idea into action
xu-WuJtOl0c,1000560,1003360,set this day up as a long busy exciting
xu-WuJtOl0c,1003360,1005519,start for your new life
xu-WuJtOl0c,1005519,1008079,get your first book for your new library
xu-WuJtOl0c,1008079,1009279,today
xu-WuJtOl0c,1009279,1011920,begin your new practice of setting goals
xu-WuJtOl0c,1011920,1013120,today
xu-WuJtOl0c,1013120,1014959,start clearing out a drawer of your new
xu-WuJtOl0c,1014959,1017360,orderly desk today
xu-WuJtOl0c,1017360,1019199,start eating an apple a day on your new
xu-WuJtOl0c,1019199,1020560,health plan
xu-WuJtOl0c,1020560,1021759,today
xu-WuJtOl0c,1021759,1023519,put some money in your new investment
xu-WuJtOl0c,1023519,1025120,for fortune account
xu-WuJtOl0c,1025120,1026079,today
xu-WuJtOl0c,1026079,1027918,start reading with intensity for your
xu-WuJtOl0c,1027918,1031199,new wealth of mind plan today
xu-WuJtOl0c,1031199,1033678,write a post letter today
xu-WuJtOl0c,1033678,1035839,make a delayed telephone call
xu-WuJtOl0c,1035839,1037038,today
xu-WuJtOl0c,1037038,1039120,pick up your camera and take a picture
xu-WuJtOl0c,1039120,1041199,of something to start your new treasury
xu-WuJtOl0c,1041199,1043678,of photographs today
xu-WuJtOl0c,1043678,1045918,get some momentum going on your new
xu-WuJtOl0c,1045918,1047760,commitment to the better life
xu-WuJtOl0c,1047760,1049840,see how many activities you can pile on
xu-WuJtOl0c,1049840,1051440,in this first day
xu-WuJtOl0c,1051440,1053919,go all out break away from the negative
xu-WuJtOl0c,1053919,1056080,downward pull of gravity
xu-WuJtOl0c,1056080,1058559,start the thrusters going
xu-WuJtOl0c,1058559,1060960,prove to yourself that waiting is over
xu-WuJtOl0c,1060960,1062559,hoping is past
xu-WuJtOl0c,1062559,1064840,and that faith and action have now taken
xu-WuJtOl0c,1064840,1067840,charge it's a new day a new beginning
xu-WuJtOl0c,1067840,1069679,for your new life
xu-WuJtOl0c,1069679,1072000,with discipline you can't believe the
xu-WuJtOl0c,1072000,1074480,list of positive moves you can make in
xu-WuJtOl0c,1074480,1079320,the first day of your new beginning
